[
  {
    "question": "Paano natutulungan ng dokumento ang pamilya ni Namwran?",
    "ground_truth": "Inilayos ng dokumento ang utang sa pamilya ni Namwran, kaya't sila ay nakaligtas sa isang malaking kabubutihan.",
    "metadata": {
      "cultural_golden_answer": "Natutulungan sila ng dokumento at nagsilbi itong patunay ng pag-ibig ng kapangyarihan ng mga katutubong lider sa panahon ng pre-kolonyal. Sa kasalukuyan, ang kultura sa Pilipinas ay mayroong layunin na mapansin ang kalayaan at hustisya para sa lahat.",
      "language": "filipino",
      "cultural_relevance": 0.9,
      "chunk_index": 0,
      "ground_truth_context": "1. THE ISLANDS BEFORE THE CROSS: PRE-1521 “Hail! In the Saka-year 822 [900 C. E.], in the month of March-April, according to the astronomer, the 4 th day of the dark half of the moon, on Monday, At that time, Lady Angkatan, to gether with her relative, Bukah, the child of His Honor Namwran, was given, as a special favor, a document of full acquittal by the chief and commander of Tundun, the for mer Leader of Pailah, Jayadewa, to the effect that His Honor Namwran through the Honorable Scribe, was to tally cleared of a debt to the amount of 1 kati and 8 suwarna, in the presence of His Honor, the Leader of Puliran, Kasumuran; His Honor, the Leader of Pailah, namely Ganasakti,; and His Honor, the Leader of Binwagan, Bisruta. And His Honor Namwran with his whole family on or ders of the Chief of Dewata representing the Chief of Mdang, because of his loyalty as a subject of the Chief, the refore all descendants of His Honor Namwran have been cleared of the whole debt that His Honor owed the Chief of Dewata. This document is issued in case there is someone, whosoever, some time in the future who will state that the debt is not yet acquitted of His Honor …” —The Laguna Copperplate Inscription, translated by Antoon Postma, quoted in E. P. Patanñe, The Philippines in the Sixth to the Sixteenth Centuries T HE FULL STORY BEHIND THE L AGUNA C OPPERPLATE I NSCRIPTION (LCI) may never be known. Discovered in 1989 buried in a riverbank in Laguna Province, south of Manila, the LCI was drawn up in 900 C. E., the equivalent of the Sanskrit calendar date in scribed on it—more than five hundred years before the barangay (village or settlement) of Maynila turned into a Muslim community, and more than six centuries before the Europeans first learned of the archipelago’s existence. The in scription—the oldest known document of pre-Hispanic times in the Philippine archipelago—is vital to understanding how people in the islands, at least in certain parts, lived and what kind of society or societies they might have constructed. The LCI writing bears remarkable similarities to the ancient Kawi script of Indonesia. Analyses by experts in both ancient Philippine and Indonesian scripts reveal a language that contained not only Sanskrit but also old Javanese, old Malay, and old Tagalog words. It antedates baybayin, the native script in use when the Spanish came calling in the sixteenth century, one that, with variations in alphabet according to the region, essentially consisted of twenty letters. The LCI script, no longer extant, lingered on in the baybayin’s for mative in fluences such as Sanskrit and Arabic. With the advent of the Spanish, and the in tervention primarily of the friars, the Castilian alphabet replaced the native scripts, but those communities in the in terior that managed to steer clear of Spanish rule and the new faith kept their old systems of writing. A form of baybayin can still be seen, for in stance, in the script of the Hanunoo Mangyan of Mindoro Island, off the southwestern coast of Luzon, a tribe that continues to in scribe on bamboo a form of its poetry known as the ambahan, with seven-syllable lines meant primarily to be chanted. The copperplate ment ions place names that still exist in latter-day Bulacan, a province abutting the northern edge of Tondo, another ancient settlement that faced Maynila across the Pasig River delta. More significantly, it persuasively at tests to the Hindu in fluence of the Sumatra-based Srivijaya empire, which had spread beyond the central part of the Philippine archipelago—and to which the colonists had affixed the name “Visayas”—to the strategically located barangays of Tondo and Maynila, where the river empties out onto a magnificent bay and the South China Sea. Through the two barangays, which would have controlled river traffic, some form of Hindu in fluence would have spread to other areas in Luzon where the Tagalogs (the principal tribe of Tondo and Maynila) were also dominant. Indeed, modern-day Tagalog possesses words that are Sanskrit in or igin: budhi (conscience), mukha (face), guro (teacher), tala (star), dukha (needy), diwata (muse, goddess), among them. Perhaps most tellingly, the LCI in dicates the crucial role that slavery played in barangay pre-colonial life. Lady Angkatan, Bukah, son of Namwran, and members of their immediate family were almost certainly debt slaves, and this document would have given them a tremendous sense of relief. We will never know whether Lady Angkatan was Namwran’s widow, aunt, mother, or sister; nor what the Honorable Namwran did to acquit the family of this debt. Had he distinguished himself in battle, giving up his life for the sake of his chief? Or was it Bukah who bore arms bravely? It seems clear that this was a seemingly well-born family that through misfortune or Namwran’s misguided business dealings found itself unable to pay back a substantial loan. Now, they could hold their heads high once more. In a sense, they were for tunate to have been in debted to the paramount chief of their clan. It would have been worse had they been abducted by their clan enemies or by tattooed raiders from the Visayas, the cluster of islands in the archipelago’s center, whom the Spanish called pintados, or painted ones. The number and in tricacy of a Visayan warrior’s tattoos signaled to friend and foe alike his strength and abilities as a warrior. More than land or goods, slaves were a sure sign of one’s wealth and status, especially slaves captured in raiding parties on other barangays. As war booty, not only were they tangible proof of a datu’s leadership and martial prowess (more so than homegrown, as it were, slaves), they were more likely to be treated as disposable property, sometimes put to death when the master moved on to the next world. Another basis of slavery was as punishment for crimes. These in cluded bearing false witness against someone; the transgression of taboo customs, such as, according to the sixteenth-century account of the Jesuit Pedro Chirino, “failure to preserve silence for the dead” or “happening to pass in front of a chief who was bathing”; murder; adultery; or failing to do one’s duty (during war, for in stance) when the chief, or datu, asked for it. Such crimes could be for given if the transgressor could pay the proper fee of goods or gold to the aggrieved party. Colonial rule under the Spanish, which lasted for 333 years, from 1565 to 1898, eliminated certain aspects of barangay life, such as slavery, though modern-day critics might assert that slavery persists in disguised forms in to day’s highly in equitable society; in troduced Christianity and Western concepts such as bureaucratic state rule and private property; and modified, if not strengthened, some features of pre-colonial ways of living, e. g., the melding of the private and public spheres of life"
    },
    "model_answer": "Walang sapat na impormasyon sa mga dokumentong ito tungkol sa pamilya ni Namwran.",
    "contexts": []
  },
  {
    "question": "What is unique about the Philippines' geographical location?",
    "ground_truth": "The Philippines lies on the northeastern rim of Southeast Asia, a necklace of 7,107 islands that also happens to be situated between the vast Pacific Ocean to the east and the gentler South China Sea to the west.",
    "metadata": {
      "cultural_golden_answer": "This archipelagic society is significant in Filipino culture because it has shaped the country's history and hierarchy. The geography has contributed to the development of unique cultural practices, such as the importance of community living due to the isolated nature of many island communities.",
      "language": "english",
      "cultural_relevance": 0.9,
      "chunk_index": 1,
      "ground_truth_context": ". As war booty, not only were they tangible proof of a datu’s leadership and martial prowess (more so than homegrown, as it were, slaves), they were more likely to be treated as disposable property, sometimes put to death when the master moved on to the next world. Another basis of slavery was as punishment for crimes. These in cluded bearing false witness against someone; the transgression of taboo customs, such as, according to the sixteenth-century account of the Jesuit Pedro Chirino, “failure to preserve silence for the dead” or “happening to pass in front of a chief who was bathing”; murder; adultery; or failing to do one’s duty (during war, for in stance) when the chief, or datu, asked for it. Such crimes could be for given if the transgressor could pay the proper fee of goods or gold to the aggrieved party. Colonial rule under the Spanish, which lasted for 333 years, from 1565 to 1898, eliminated certain aspects of barangay life, such as slavery, though modern-day critics might assert that slavery persists in disguised forms in to day’s highly in equitable society; in troduced Christianity and Western concepts such as bureaucratic state rule and private property; and modified, if not strengthened, some features of pre-colonial ways of living, e. g., the melding of the private and public spheres of life. In the archipelago, the Iberians had come upon different societies, at once static and dynamic, with well-defined frameworks within which the world made sense. To the Spanish, of course, in fected with an overbearing sense of racial superiority and entitlement, the native way of life was savage and the refore had to be supplanted with the European notion of civilization. The conquistador Miguel de Legazpi, who led the 1565 expedition that successfully brought most of the islands under the dominion of the Spanish Crown, after grudgingly noting that the island men treated and loved their wives well, summed up rather succinctly what he and most of his compatriots really thought: “They are all barbarians and have no manners or politeness.” What kind of archipelagic societies did the Spanish first encounter? What were the various island communities like before the advent of the West? How did the pre-Hispanic Filipinos relate to the rest of Southeast Asia? To draw a portrait, which must of necessity be for ever in complete since history is a never- ending process of revisions and counter-revisions, one needs to begin with geography, for geography helps shape destiny. It is a major element in determining how history and hierarchy in the islands evolved. The archipelago known to day as the Republic of the Philippines lies on the northeastern rim of Southeast Asia, a necklace of 7,107 isles strung from north to south over 1,152 miles, situated between the vast and mighty Pacific Ocean to the east and the gentler, lesser South China Sea to the west. The islands cover a to tal area of 115,831 square miles, roughly the same size as Italy. Only 2,773 of the islands bear names, with elongated Luzon in the north the largest, and Mindanao to the south the next in size. These two islands constitute two-thirds of the country’s land mass. Between them are the Visayan Islands, consisting mainly of Samar, Leyte, Cebu, Negros, Bohol, and Panay. The western edge of the country is taken up by the mini-archipelago of Palawan Province, made up of the island of Palawan and 1,700 satellite isles. This semi-tropical island chain has only two—but very distinct—seasons: dry and wet. The northern and eastern regions lie within the typhoon belt: areas directly affected by storms that come raging out of the Pacific during the latter half of the year. On the average, typhoons maul the eastern Visayas and Luzon twenty times annually, at one time prompting a frustrated lawmaker to propose a bill outlawing them. In the Cordilleras of Northern Luzon the weather can be downright chilly, when winds from as far north as Siberia, along with migratory birds, travel south. With the typhoons breaking against the eastern flanks of mountain ranges, there is less of a pronounced dry season on the Pacific side. Hence, more people and businesses reside in the western part of the country, rendering the west more in dustrialized and economically developed. Island geography owes much of its ruggedness to being part of the Pacific Rim of Fire, a line of volcanic for mations that extend, in the northern hemisphere, from Alaska and the Aleutian Islands to Japan, the Philippines, and Indonesia. The Philippines contains thirty-seven volcanoes, the majority thankfully dormant, though one volcano blowing its top is always a reminder that others could follow suit. Such was the case with Mt. Pinatubo which, six hundred years after its last awakening, erupted in 1991 with such ferocity over five days that gaseous plumes ascended to as high up as twenty-four miles and spewed out seven cubic kilometers of ash and rock—the worst such eruption in the country’s history and possibly of the twentieth century. On the other hand, volcanic deposits are one reason the land is fertile, generating life where once it buried it. East of the archipelago, off the coast of northeastern Luzon south to Halmahera Island in Indonesia, the Philippine Deep, also known as the Mindanao Trench, stretches for close to a thousand miles, measuring roughly nineteen miles across. At its deepest it extends 34,850 feet below sea level— deeper than Mt. Everest is tall. The Philippine Deep rests on the Eurasian and Philippine Sea tectonic plates, which constantly shift and grind against each other. As an entity that gained political in dependence only in 1946, the nation is quite young, a little more than six decades old. Geologically, however, it is a different story. Large swaths of Luzon and Mindanao are more than 25 million years old, while the age of the rest of the country varies, from 100,000 to 10 million years old. During the late Pleistocene era, some islands were linked to the Asian mainland; among these were Palawan, Mindoro, and Panay. Palawan, having once been part of Borneo, has flora and fauna not found in the rest of the country. Evolution and the for mation of a rather isolated archipelago has resulted in an astonishing biodiversity over a landmass of 30 million hectares, or 66 million acres, with a number of endemic species, e. g., 70 percent of its reptiles and 44 percent of its avian creatures are not to be found anywhere else. However, the rate of population growth is quite high. In 2008, with a population of 90 million, it was 2 percent a year, in large part due to an exceedingly in fluential and conservative Catholic hierarchy that rails against government-sponsored family planning. (In contrast, the 2008 rate for the United States was less than 1 percent.) This, along with a depressed economy, has resulted, perhaps most critically, in an environment continually under siege"
    },
    "model_answer": "The Philippines is an archipelago of 7,107 islands strung from north to south over 1,152 miles, situated between the Pacific Ocean to the east and the South China Sea to the west.  [Sources: A History Of The Philippines, p. 16; Culture And Customs Of The Philippines, p. 28]",
    "contexts": [
      "Page 3 freedom to pick and choose from other cultures have helped to produce the very unique amalgam that is the Philippines. The archipelago is made up of over 7,100 islands of which only 460 are more than one square mile in area. The rest of the islands are uninhabitable and some disappear at high tide. The country’s major islands in clude, first and for emost, the main island of Luzon that stretches from the far north to Manila and beyond to the southeast via a long arm for ming the Bicol region",
      "It is a major element in determining how history and hierarchy in the islands evolved. The archipelago known to day as the Republic of the Philippines lies on the northeastern rim of Southeast Asia, a necklace of 7,107 isles strung from north to south over 1,152 miles, situated between the vast and mighty Pacific Ocean to the east and the gentler, lesser South China Sea to the west. The islands cover a to tal area of 115,831 square miles, roughly the same size as Italy"
    ]
  },
  {
    "question": "Saang taon natuklasan ang pinakamatandang kalansay ng tao sa Pilipinas?",
    "ground_truth": "Natuklasan ang pinakamatandang kalansay ng tao sa Pilipinas noong 47,000 taon na ang nakalilipas.",
    "metadata": {
      "cultural_golden_answer": "Mula noon pa, noong 50,000 taon na ang nakalilipas, ay nagkaroon ng mga tao sa Pilipinas, at ito ay isang mahahalagang bahagi ng kasaysayan ng Pilipinas bilang isang matatag na kultura.",
      "language": "filipino",
      "cultural_relevance": 0.9,
      "chunk_index": 2,
      "ground_truth_context": ". As an entity that gained political in dependence only in 1946, the nation is quite young, a little more than six decades old. Geologically, however, it is a different story. Large swaths of Luzon and Mindanao are more than 25 million years old, while the age of the rest of the country varies, from 100,000 to 10 million years old. During the late Pleistocene era, some islands were linked to the Asian mainland; among these were Palawan, Mindoro, and Panay. Palawan, having once been part of Borneo, has flora and fauna not found in the rest of the country. Evolution and the for mation of a rather isolated archipelago has resulted in an astonishing biodiversity over a landmass of 30 million hectares, or 66 million acres, with a number of endemic species, e. g., 70 percent of its reptiles and 44 percent of its avian creatures are not to be found anywhere else. However, the rate of population growth is quite high. In 2008, with a population of 90 million, it was 2 percent a year, in large part due to an exceedingly in fluential and conservative Catholic hierarchy that rails against government-sponsored family planning. (In contrast, the 2008 rate for the United States was less than 1 percent.) This, along with a depressed economy, has resulted, perhaps most critically, in an environment continually under siege. Many species have a tenuous hold on life, as they require primary-for est habitats. Such is the case with the Philippine Eagle, more popularly known as the monkey-eating eagle—a large and magnificent avian predator with a wingspan of nearly seven feet. A pair needs approximately twenty-five to fifty square miles of for est to sustain the mselves and to propagate. A S W E W ERE: P RE -C OLONIAL B ARANGAY S OCIETY It was long held as common wisdom that populations in the archipelago were the result of migrations that took place in neat, successive waves, between 30,000 B. C. E. and 200 B. C. E.—the last wave composed of Malays from the south who had more advanced forms of metallurgy and crafts, such as the weaving of cloth and the manufacture of glass or naments. This the ory’s biggest proponent was the late American anthropologist H. Otley Beyer, at one time head of the anthropology department at the University of the Philippines, who based his conclusions on pioneering fieldwork done from the 1920 s to the early 1940 s. While the artifacts recovered from the field were in deed valuable, his the ory has since fallen out of favor. According to linguists, various languages were already being spoken throughout the archipelago thousands of years ago. Too, archaeological evidence reveals that trade was flourishing in the region in the first millennium B. C. E., probably even earlier—both pointing to the fact that groups of people of different or igins came and stayed or went, sometimes in larger numbers, sometimes in smaller, but never so methodically as envisioned in Beyer’s grand the ory. There seem to have been at least two discrete movements of people that, over time, dispersed through in sular Southeast Asia: the Australoids, characterized by dark pigmentation, and the Austronesians, or brown-skinned peoples, who started to arrive about six millennia ago, from the south via Borneo and Indonesia, and the north from southern China and Taiwan. Later migrations in cluded people from Champa, a Hinduized kingdom of seafarers and traders in southern and central Vietnam that flourished from the seventh century to the fifteenth century C. E. It wasn’t just one way, apparently. The eminent archaeologist Wilhelm G. Solheim II adds another layer to this diffusion when he suggests that the cultures of the natives of Southeast Asia, whom he calls Nusantao, and their descendants, had their beginnings in, or at the very least were in fluenced by, maritime- or iented tribes of in sular Southeast Asia, dating to 5000 B. C. E. or even earlier. Islanders came and went, as did the coastal dwellers of mainland eastern Asia, the twain meeting—and mating—repeatedly over the course of millennia. According to Solheim, long-distance seafaring vessels known as balangay and outfitted with in novative bamboo outriggers may have been devised about 4000 B. C. E., in itiating major outmigrations by water. The buoyant outriggers helped balance the shallow-draft vessel while at the same time enabling it to navigate smoothly and speedily over the water—a feature remarked upon in later accounts of European navigators used to bulkier and slower ships. The larger ones, equipped with sails, could be used in war as well, with rowers on each side. These war vessels, known variously as karakoas and prahus, had platforms above the outriggers upon which as many as a hundred warriors could stand. By the third millennium B. C. E., these migrations had resulted in settlements in both the Indonesian and Philippine archipelagos. By the second millennium B. C. E., they had gone as far west as Madagascar, off the eastern coast of Africa. Human settlements known as barangays, after the outriggered boats, were thus firmly in place in the Philippines well before the Spanish arrived, with a number of larger barangays trading with for eign ships that plied Southeast Asian waters. While archaeological evidence at tests to human presence in the archipelago as far back as 250,000 years ago, the earliest known human settlements were in caves on the southern reaches of long, dagger-shaped Palawan Island. Evidence suggests that the caves were continuously in habited from 50,000 years ago, during the Pleistocene Age, until 9,000 B. C. E.—one vanguard of the seafaring peoples who for med the main matrix of contemporary populations. Known as the Tabon Caves and set into ocean-facing cliffs, they would have afforded a clear view of waterborne visitors and provided easy access to the waters the mselves. Possibly the oldest Homo sapiens fossil in Southeast Asia, nicknamed the Tabon Man, was unearthed here, carbon-dated to 47,000 years ago. But the Tabon Man was more than one in dividual, the finds in cluding a skullcap, jawbones, teeth, and bone fragments, with one tibia being the oldest fossil. The Tabon Man appears to have had Negritoid characteristics— strengthening the argument that the islands were or iginally in habited by the Australoids, ancestors of the modern-day Negritos, otherwise known as the Agta, Aeta, or Ati. Food gatherers and hunters, the Tabon men and women, devising necessary strategies of survival, progressed from basic flake to ols to in struments such as adzes and axes. Like the Tabon Cave dwellers, most of the islanders lived by or close to water, whether ocean, river, or lake—sources of abundant food. Water was obviously the only transportation route to other islands, and these dwellers by the water engaged in brisk trade not just with nearby isles, but with ports as disparate as those on the southern coast of China and the Straits of Malacca"
    },
    "model_answer": "Walang sapat na impormasyon sa mga dokumentong ito tungkol sa taon kung kailan natuklasan ang pinakamatandang kalansay ng tao sa Pilipinas.",
    "contexts": []
  },
  {
    "question": "When did pre-colonial Philippine ports like Butuan form part of a major trading world?",
    "ground_truth": "The eleventh century.",
    "metadata": {
      "cultural_golden_answer": "During this period, the Philippines was already an integral part of a vast trade network that connected Southeast Asia with China and the Middle East. This highlights the country's long history of cultural exchange and trade, which laid the foundation for its unique identity as a melting pot of various cultures.",
      "language": "english",
      "cultural_relevance": 0.9,
      "chunk_index": 3,
      "ground_truth_context": ". C. E.—one vanguard of the seafaring peoples who for med the main matrix of contemporary populations. Known as the Tabon Caves and set into ocean-facing cliffs, they would have afforded a clear view of waterborne visitors and provided easy access to the waters the mselves. Possibly the oldest Homo sapiens fossil in Southeast Asia, nicknamed the Tabon Man, was unearthed here, carbon-dated to 47,000 years ago. But the Tabon Man was more than one in dividual, the finds in cluding a skullcap, jawbones, teeth, and bone fragments, with one tibia being the oldest fossil. The Tabon Man appears to have had Negritoid characteristics— strengthening the argument that the islands were or iginally in habited by the Australoids, ancestors of the modern-day Negritos, otherwise known as the Agta, Aeta, or Ati. Food gatherers and hunters, the Tabon men and women, devising necessary strategies of survival, progressed from basic flake to ols to in struments such as adzes and axes. Like the Tabon Cave dwellers, most of the islanders lived by or close to water, whether ocean, river, or lake—sources of abundant food. Water was obviously the only transportation route to other islands, and these dwellers by the water engaged in brisk trade not just with nearby isles, but with ports as disparate as those on the southern coast of China and the Straits of Malacca. Larger population centers sprung up due to trade and, in some areas, most notably in Mindanao, the in sistent call of Islam. But there were no fiercely ambitious warlords, no Tokugawa or Genghis Khan, who set out to unify many fiefdoms. Until the Spanish appeared on the horizon, no nation-state existed, only a far-flung collection of islands untroubled by the notion of a center. Trade The archipelago for med the outer edges of an established trade circle, one that extended from the Persian Gulf in the Middle East to Southern China, thus encompassing Southeast Asia. It was at its most active from the seventh to the ninth century C. E., and antedated European in vasion in the sixteenth century. Chinese records from 671 contain references to Persian ships. Later accounts, in cluding Japanese ones, ment ion not just the Persians but Indians and Malays as well, all trading at Canton. By 851, this trade route was well-established, with ships making calls at India’s Malabar Coast, the Nicobar Islands, the Malay Peninsula, passing through the Straits of Malacca, with more calls at Cambodia and Vietnam, before heading to Canton. According to historian Janet Abu- Lughod, in her book Before European Hegemony, “The easternmost circuit was Chinese ‘space,’ the sea that joined the east coast of Indochina and the northern shore of Java with the great ports of South China being under the hegemony of the Sung and Yuan navies. This … was the domain par excellence of what scholars have called the tribute trade.” Of the pre-colonial Philippine ports that for med part of this trading world, Butuan was one of the most active, probably the center of trade and commerce in the islands during the eleventh century. Situated on the northwestern coast of Mindanao by the Agusan River, Butuan was a putative city-state by October 1003, the first pre-Hispanic Philippine barangay known to for mally deal with Imperial China when it sent two envoys by the names of Lihiyan and Jiaminan (the names suggest Sinicization) to Beijing, to recognize the Divine Son of Heaven as undisputed sovereign, and, not coincidentally, to petition for the right to trade. The Butuan traders likely would have brought tropical hardwoods, beeswax, cinnamon, civet cats, cowry shells, abaca, and gold. Some of these would have been gifts for the royal court. Butuan also traded with the kingdom of Champa. Between 900 and 1200 C. E., in addition to Butuan, the Champa established trading outposts in Sulu. By the fifteenth century, 400 to 500 junks from Cambodia, Champa, and southern China were visiting the islands annually. Yet, while situated strategically between the Persian Gulf and China, thus ensuing their value as transit points, Southeast Asian pre-colonial entrepots were not the region’s dominant players. They acted mostly as sources for raw materials, or as transshipment centers, of which the most valuable was the port of Malacca. (Malacca was also a major slave market, where slave raiders brought their human cargo, abducted from various coastal to wns in Southeast Asia, to be sold to customers as varied as merchants looking for laborers and ship captains wanting to supplement their crews.) It had four harbormasters for ships or iginating from as near as Sumatra and Java, as far west as Persia, and as far north as the Ryu Kyu Islands and China. Commercial traffic along the Straits of Malacca thus helped shape the burgeoning global trade, especially during the thirteenth and fourteenth centuries. According to William Henry Scott, in Barangay: Sixteenth Century Philippine Culture and Society, “It was in Malacca that Europeans”— specifically, the Portuguese—“first met Filipinos,” a decade before the Spanish expedition led by the Portuguese navigator Ferdinand Magellan came across the archipelago in 1521. These pre-Hispanic Filipinos were called “Luzones,” from the island whence they had come. The Luzones were known not only as merchants and traders but also as fierce mercenaries active in various military campaigns in the region, employed, for in stance, by the Achenese and the Burmese kings, or crewing on pirate ships. West of Malacca, on the coast, was a community of 500 Tagalogs, while in Malacca itself, according to Scott, “they had their own shops and in cluded a number of prominent businessmen.” The Portuguese took over Malacca in 1511, with Magellan as part of the conquering force. It was in Malacca that he purchased a young Malay slave he had christened Enrique, who would prove to be an in valuable asset when, ten years later, the Spanish exploratory fleet Magellan headed came across the islands later to be called the Philippines. It is the refore not unreasonable to assume that even before 1521, Magellan and the Portuguese knew of the Philippine archipelago, east and northeast of the Malay Peninsula. The region was rich in natural resources, from minerals to spices to for est and maritime products, and this, coupled with rising demand from countries outside the region, ensured an almost perfect fit among supplier, manufacturer, and consumer. In short, as Abu-Lughod points out, Malacca was ideally located as a comprador site, just as Hong Kong and Singapore are now. In this trade world, the Chinese were active, if not dominant, players. At one time the Middle Kingdom commanded an enormous fleet—the so-called Treasure Fleet, under the command of a seven-foot-tall eunuch, Cheng Ho. On its in itial voyage in 1405, the fleet was made up of 27,800 men and 1,500 vessels, dwarfing any of the European fleets then"
    },
    "model_answer": "Pre-colonial Philippine ports like Butuan were part of a major trading world during the eleventh century.  [Source: A History Of The Philippines, p. 20]",
    "contexts": [
      "This … was the domain par excellence of what scholars have called the tribute trade.” Of the pre-colonial Philippine ports that for med part of this trading world, Butuan was one of the most active, probably the center of trade and commerce in the islands during the eleventh century"
    ]
  },
  {
    "question": "Ano ang kahalagahang papel ng Malacca sa kalakalan?",
    "ground_truth": "Ang papel ng Malacca sa kalakalan ay nagsisilbing isang lugar na may mahusay na lokasyon, tulad ng Hong Kong at Singapore, dahil sa kanyang posisyon bilang isang comprador site.",
    "metadata": {
      "cultural_golden_answer": "Ang papel ng Malacca sa kalakalan ay napakaimportanteng tulong sa pagpapaunlad ng ekonomiya ng mga isla ng Pilipinas, na naging sentro ng karaterya at komersiyal na aktibidad noong panahon ng pananalapi ng kastila.",
      "language": "filipino",
      "cultural_relevance": 0.9,
      "chunk_index": 4,
      "ground_truth_context": ". It was in Malacca that he purchased a young Malay slave he had christened Enrique, who would prove to be an in valuable asset when, ten years later, the Spanish exploratory fleet Magellan headed came across the islands later to be called the Philippines. It is the refore not unreasonable to assume that even before 1521, Magellan and the Portuguese knew of the Philippine archipelago, east and northeast of the Malay Peninsula. The region was rich in natural resources, from minerals to spices to for est and maritime products, and this, coupled with rising demand from countries outside the region, ensured an almost perfect fit among supplier, manufacturer, and consumer. In short, as Abu-Lughod points out, Malacca was ideally located as a comprador site, just as Hong Kong and Singapore are now. In this trade world, the Chinese were active, if not dominant, players. At one time the Middle Kingdom commanded an enormous fleet—the so-called Treasure Fleet, under the command of a seven-foot-tall eunuch, Cheng Ho. On its in itial voyage in 1405, the fleet was made up of 27,800 men and 1,500 vessels, dwarfing any of the European fleets then. The Chinese had as their sole aim for ging trade relations with their Asian neighbors. On several voyages, the Chinese fleet sailed to Africa and the Persian Gulf, and points between, setting up a trading network that built on previous outposts. Unlike the European expansionists later on, the Middle Kingdom had no imperialist ambitions, disdaining to rule over the non- Chinese, whom they dismissed as barbarians—except for the Koreans, the Japanese, and the Annamese. The dynamics of this trade system underwent a drastic change, however, when the Chinese shut down their ports to for eign ships, essentially abandoning their trading network and mothballing the kingdom’s powerful navy in the fifteenth century, during the Ming Dynasty. Until then, no one nation had at tempted to dominate the Asian trade. The sealanes were remarkably free, for the most part, from armed conflict and thus relatively peaceful. The with drawal of China’s powerful fleets resulted in a vacuum the Portuguese gladly filled in the early sixteenth century. The Portuguese and, later, other European powers, were thus accidental beneficiaries of the Middle Kingdom’s hermetic move. By the mid sixteenth century Spanish and Portuguese galleons and warships, along with pirates (who still plague the Straits to day), prowled the shipping lanes with out any challenge from the Chinese navy. Transactions with the Philippine archipelago, while profitable, did not constitute major business for for eign traders, as the islands were on the eastern edge of the trade routes. But in ternational commerce was extensive enough to generate a vital in ter-island trade that relied as much on for eign goods coming in —from, for in stance, China, Borneo, and Champa—as on local products. From China came porcelain, finished silk, musk, stoneware, in cense, artillery, and tin. Brass, steel blades, and woven mats were brought from Borneo, batik from Java, and precious stones from countries such as Burma. In exchange, for eign traders could purchase in a transshipping port like Cebu—smack in the middle of the archipelago—such items as pearls, beeswax, to rtoise shell, animal skins, cotton, and civet cats. The coastal dwellers traded as well with the hunter/gatherers who lived in the in terior and in the highlands, bartering, for in stance, salt for honey, and cloth for beeswax—for est products that could be retailed to for eign traders. (At times, lowlander and highlander were at each other’s throats, but never so habitually or bitterly as to prevent trading.) That water played a central role in the lives of the islanders can be further gleaned from the names of both places and tribes. For in stance, Mindanao has its etymological roots in danao, referring to a body of water. The same is true of Lanao, Maranao, and Maguindanao. Tausug, the name of the major ethnic tribe in the Sulu archipelago, means “people of the current,” with “Tau” a variant of “tao” or person. Tagalog, the name of the ethnic group predominant in Central Luzon and parts of Southern Luzon, means literally “from the river,” or Taga-ilog. And the city of Manila, located in the Tagalog region, is a shortened form of the or iginal Maynila, “place of water lilies.” Similar aquatic correlations at tend other place names, such as the province of Pampanga (“site of river banks”) in Luzon and, in Mindanao, the Agusan River, with “agusan” meaning “where the water flows,” rendering the English name linguistically redundant. Whether coastal, riverine, or hinterland, the different communities developed ways of living that—in fluenced by fertile soil, in frequent harsh weather, and a uniform ecology—were quite similar. As the Philippine historian Onofre D. Corpuz observed, “The generally benign tropical climate and the largely uniform flora and fauna favored similarities, not differences.” However, reflecting island geography, pre-colonial Philippine society was not an unbroken, homogenous entity. It is the refore more accurate to speak of “societies,” though there were enough similarities among these to in dicate common or igins and an archipelago- wide in teraction, from north to south, from west to east. Interestingly, according to William Henry Scott in Barangay, the similarities “also suggest that lowland Filipinos in the sixteenth century had more in common with highland minorities in the twentieth than with their own Christian descendants”—an in dication of how the in tervening centuries of Christian colonization of the lowlanders widened the heretofore in consequential gap between them and the highlanders. Hierarchy Native societies, as the Spanish found them, were, like Caesar’s Gaul, divided into three parts: the ruling elite, their peers and followers, and slaves. (It must be kept in mind that most descriptions and judgments of a pre-colonial Philippines are mainly derived from Spanish accounts, with all that that implies in terms of a priori notions stemming from the observers’ own Christian and European backgrounds.) The social structures that existed in both the Visayas and Luzon were remarkably similar, consisting of the datus and the maginoo at the top, the timawa and maharlika in the middle, and, occupying the bottom rungs, the alipin. The smallest politico-social unit was the barangay, which, as has been noted, or iginally referred to the seagoing vessel on which a family or clan traveled. Usage of the term for land-based settlements in dicated that the settlers favored a location by a body of water, be it river, lake, or ocean. Most barangays were small, consisting of only thirty to one hundred houses, with from one hundred to five hundred persons. Off the trade routes but still on the coast were even smaller settlements, probably no more than eight to ten houses. Still, there were some giant barangays"
    },
    "model_answer": "Walang sapat na impormasyon sa mga dokumentong ito tungkol sa kahalagahan ng papel ng Malacca sa kalakalan.",
    "contexts": []
  },
  {
    "question": "What was the smallest politico-social unit in pre-colonial Filipino society?",
    "ground_truth": "The barangay",
    "metadata": {
      "cultural_golden_answer": "The barangay, as described in the text passage, highlights the importance of communal living and shared responsibilities among its members. In Filipino culture, this concept of community and cooperation is reflected in the value of bayanihan (communal solidarity) that still exists today.",
      "language": "english",
      "cultural_relevance": 0.9,
      "chunk_index": 5,
      "ground_truth_context": ". Hierarchy Native societies, as the Spanish found them, were, like Caesar’s Gaul, divided into three parts: the ruling elite, their peers and followers, and slaves. (It must be kept in mind that most descriptions and judgments of a pre-colonial Philippines are mainly derived from Spanish accounts, with all that that implies in terms of a priori notions stemming from the observers’ own Christian and European backgrounds.) The social structures that existed in both the Visayas and Luzon were remarkably similar, consisting of the datus and the maginoo at the top, the timawa and maharlika in the middle, and, occupying the bottom rungs, the alipin. The smallest politico-social unit was the barangay, which, as has been noted, or iginally referred to the seagoing vessel on which a family or clan traveled. Usage of the term for land-based settlements in dicated that the settlers favored a location by a body of water, be it river, lake, or ocean. Most barangays were small, consisting of only thirty to one hundred houses, with from one hundred to five hundred persons. Off the trade routes but still on the coast were even smaller settlements, probably no more than eight to ten houses. Still, there were some giant barangays. Maynila, for in stance, had two thousand in habitants at the time of Spanish conquest, while Cebu and the sultanates in Sulu and Mindanao were comparable in size, if not larger. But these bigger barangays were the exceptions rather than the rule. A datu headed the barangay, with each barangay more or less self-contained, though there were occasionally alliances among various barangays. There were no for mal allegiances beyond the barangay, except in the Muslim settlements to the south. Relations within the barangay were largely in fluenced by kinship ties on both parents’ sides and by economic status. Members of the or iginal barangay, having traveled on the same boat, would have been part of the same clan. Blood ties were thus of the utmost importance, for they guaranteed fealty to the barangay. Alliances between two chiefs of different barangays would of ten be sealed through a blood compact, where each would drink wine mingled with the other’s blood—or suck the blood directly from a cut made on the arm of the other. Simulating blood ties, the rite was called sandugo (or “one blood”). To the Spanish, this barangay ritual must have been an eerie reminder of the Eucharist, the Christian sacrament based on a belief in transubstantion, the conversion of bread and wine into Christ’s body and blood, communicants becoming one with the Divine, one reason that the Spanish may have taken readily to this ritual. Hence, the barangay was essentially an extended family, a gathering of a particular clan. Well into the mid-eighteenth century, with the Spanish long entrenched, people for ced to resettle into new to wns (due to the colonial policy known as reducción ) still referred to the mselves as kabangka —from the “same boat,” bangka being another word for boat. One’s position within the barangay was affected less by birthright (though the position of datu could be in herited) than by acknowledged prowess both in leadership and in providing for the survival of the barangay—roughly identical to one’s worth in keeping the boat shipshape. There were then no claims to a divine imprimatur or special access to the heavens, no boasts about having a hotline to God. In any case, such claims to otherworldly connections would have been the province of the local shaman and seer, the katolonan in the Tagalog regions, and babaylan in the Visayas, who could be male (even a cross-dressing one) or female but was more of ten than not the latter. Since the barangay was not a political state as we know it, the datu could be more properly thought of as the head of a social unit, the paterfamilias, if you will. Consequently, a datu’s authority rested as much on his abilities in combat, especially raids that resulted in the capture of slaves, as on his wealth, the strength and depth of his followers, and his lineage. Thus, a datu could be oppressive or generous, broad-minded or narrow in outlook in the way he governed and adjudicated disputes within the barangay. He was expected to be his followers’ champion in battle. (With the Tagalogs, the class to which the datu belonged was that of the maginoo, or his peers, a term that could refer to either sex.) Members of a barangay reciprocated by contributing labor, such as helping to harvest his crops, and paying tribute for his household’s maintenance. The datu’s followers were the freemen, either the timawa or the maharlika — the distinction being made on the basis of service rendered to the datu. The timawa rendered the irs primarily in non-military ways, though they could bear arms if they so desired. The maharlika, on the other hand, functioned roughly as knights did for a king. To think of these freemen as commoners would be misleading, however. In a self-contained society that was the barangay, the timawa and the maharlika had a close relationship with the datu, albeit in varying degrees. In essence, they made up his court: close by at his feasts, alongside him in battle, whether on the field or in a ship, acting as his emissaries, etc. Since a settlement and its social structure arose out of barangay conditions, relations among the three groups were more fluid than can be accommodated by the idea of “class,” though there were societal divisions of labor, to be sure. But even such hierarchical relations could be and were of ten radically altered. A datu could be deposed, a maharlika reduced to dependence, and a debt-slave become free if he or she paid off his/her debts—or if, as in the case of the for tunate Namwran, those debts were for given. The barangay social or der being an extension of the family, the notion of private ownership of land was irrelevant. It made no sense to claim particular tracts permanently, given there was so much land available. Hence, in dividuals would not have thought of acquiring land, though they had the right of usufruct if they had cultivated a particular parcel. Every member of the barangay was a shareholder the or etically and could derive profit from land use. The datu, however, representing the apex of communal society, was in strumental in determining how such lands would be used. One could thus utilize the land but not hold title to it—the idea of “title,” of course, not coming into play. With fixed-site agriculture and fishing primarily for livelihood, barangay economies were tailored mostly to meet the barangay’s needs, and for possible barter with other barangays. As in any family or clan, the stress was on shared labor, whether this was in farming, say, or house building. The practice of bayanihan (literally, communal solidarity) in to day’s evolving, not to ment ion disappearing, rural society can be traced to this tradition of shared labor"
    },
    "model_answer": "The smallest politico-social unit in pre-colonial Filipino society was the **barangay**.  [Source: A History Of The Philippines, p. 23]",
    "contexts": [
      "The smallest politico-social unit was the barangay, which, as has been noted, or iginally referred to the seagoing vessel on which a family or clan traveled. Usage of the term for land-based settlements in dicated that the settlers favored a location by a body of water, be it river, lake, or ocean. Most barangays were small, consisting of only thirty to one hundred houses, with from one hundred to five hundred persons",
      "Marcos further legitimized his martial rule by embellishing his vision of the New Society with the romanticized iconography and evocations of precolonial society. Through the revivaland establishment of acountrywide network of barangays, the smallest local government unit in the Philippines, he was able to establish an efficient system of social control and regulation at the grassroots level"
    ]
  },
  {
    "question": "Paano ang pagiging ng mga aliping sagigilid sa panahong pre-kolonyal?",
    "ground_truth": "Ang mga aliping sagigilid ay naninirahan sa bahay ng kanilang amo at inaasahang maglilingkod araw-araw. Maaari silang ibenta, ngunit maaari ring kumain sa parehong talahanayan kasama ang kanilang amo at may pagkakataon na umakyat sa mas mataas na antas ng lipunan sa pamamagitan ng pagpapakasal o pagbili ng kanilang kalayaan kung kumikita sila nang sapat.",
    "metadata": {
      "cultural_golden_answer": "Ang pagiging aliping sagigilid ay isang bahagi ng sosyal na sistema noong panahong pre-kolonyal, kung saan may mga gradasyon ng status. Ang mga namamahay ay may higit na kalayaan at maaaring kumilos bilang praktikadong may-ari kapag hindi kinakailangan maglingkod sa kanilang master. Sa kabilang banda, ang mga sagigilid ay naglilingkod tuwing araw at may posibilidad ng pagbili ng kanilang kalayaan. Ang sistemang ito ay isang halimbawa ng kaalaman na ang pakikibaka laban sa kapwa ay isang mahalagang bahagi ng pamayanang Filipino.",
      "language": "filipino",
      "cultural_relevance": 0.9,
      "chunk_index": 6,
      "ground_truth_context": ". A datu could be deposed, a maharlika reduced to dependence, and a debt-slave become free if he or she paid off his/her debts—or if, as in the case of the for tunate Namwran, those debts were for given. The barangay social or der being an extension of the family, the notion of private ownership of land was irrelevant. It made no sense to claim particular tracts permanently, given there was so much land available. Hence, in dividuals would not have thought of acquiring land, though they had the right of usufruct if they had cultivated a particular parcel. Every member of the barangay was a shareholder the or etically and could derive profit from land use. The datu, however, representing the apex of communal society, was in strumental in determining how such lands would be used. One could thus utilize the land but not hold title to it—the idea of “title,” of course, not coming into play. With fixed-site agriculture and fishing primarily for livelihood, barangay economies were tailored mostly to meet the barangay’s needs, and for possible barter with other barangays. As in any family or clan, the stress was on shared labor, whether this was in farming, say, or house building. The practice of bayanihan (literally, communal solidarity) in to day’s evolving, not to ment ion disappearing, rural society can be traced to this tradition of shared labor. Producers owned their means of production, and any surplus from a bountiful harvest was stored against a rainy day or for barter, rather than for purely speculative purposes. In a word, the archipelagic barangay was not only pre-colonial but also pre-capitalist. Probably the most spectacular and awe-in spiring in stance of enduring bayanihan are the rice terraces of Northern Luzon, high up in the Cordillera Mountain Range. In continuous use since they were built two millennia ago by the Ifugao (one of several tribes based in the Cordilleras), these magnificent embankments were carved out of stubborn and treacherous mountainsides. Organizing the labor, building up the paddies, and devising the placement of rocks and irrigation canals were daunting challenges that required a tight, cohesive, and efficient social structure. Made up of kinship ties, the barangay did not constitute a system in dependent from its in habitants—it had no existence as a legal fiction, unlike a modern-day to wnship. Thus, a barangay had no public buildings for government or community affairs, no castles or town halls. The datu’s residence would have been the largest building and the center of the barangay. The idea of what passed for “public” was really the private world writ larger. (However, the highlander tribes in Northern Luzon, or Igorot, as they are collectively known, had and still have what is known as the dap-ay, an open-air community space, like a table in the round, where the elders gather to discuss pressing issues.) Nonetheless, some barangays developed supra-barangay affinities, such as the Muslim sultanates. The earliest one, the Sultanate of Sulu, established in the fifteenth century, a century before the advent of the Spanish, arose in Jolo in the Sulu archipelago, southwest of Mindanao and in close proximity to Borneo and the Indonesian archipelago. The second, later sultanate emerged in Maguindanao, with tradition holding that a certain Sharif Muhammad Kabungsuwan moved north to Mindanao from Malacca, after the Portuguese took over that port city in 1511. Three other large barangays were the aforementioned Butuan in northwestern Mindanao; the principal Visayan trading port of Cebu, in the center of the islands; and Maynila in Luzon. By the sixteenth century, however, Butuan had declined as a trading center. Maynila, which the Spanish would make the seat of power in the islands in the late sixteenth century and shorten its name to “Manila,” constituted the preeminent settlement in Luzon, since it, with links to Muslim communities in Mindanao and Borneo, had a higher stage of political development. Its burgeoning status as a sultanate was however for ever disrupted when the Spanish razed Maynila in 1571, for cing the ruling datu and his people to flee. The year after, the Spanish started to erect the Walled City of Intramuros on the ashes of what could have been the Sultanate of Maynila. As noted, pre-colonial society was also marked by slavery, which, while it had several gradations, fell generally under two types of alipin: those who had their own houses and tended their own fields, and those who dwelt with their master. The for mer were known as namamahay (literally, one who keeps house), while the latter were referred to as sagigilid (literally, on the edge or periphery, i. e., living in the master’s household but of marginal status). The namamahay had more freedom than the sagigilid, and were practically freemen when not called upon to serve the master—which was not too of ten. In contrast, the sagigilid, usually unmarried and being part of their master’s household, were expected to render service on a daily basis. They also faced the possibility of being sold. But even they could eat at the same table as their master and had the prospect of moving up the social rung either through marriage—in cluding marriage into the master’s family—or, if they earned enough, through buying their freedom. The most common cause of slavery was the in ability to pay a debt, and the debtor had to remain in servitude, or his family (remember Namwran?) if the debtor had in the meantime passed away, until the debt was repaid with in terest. Since barangays at heart were kin-based, the hardships and conditions of bondage were relatively benign, compared, say, to the horrific conditions that African slaves endured when trafficked by Europeans to their colonies. Slaves, however, who were captured in battle or in raids on other barangays, being outside the clan, faced other potentially grim fates. They could be candidates for human sacrifice when the occasion demanded it, such as the death of a powerful datu. In his Relacíon de Las Islas Filipinas ( Account of the Philippine Islands ), published in 1604, a detailed and subjective portrait of sixteenth-century mores among the in digenous people, the Spanish Jesuit Pedro Chirino observed “it was easy to in crease the number of slaves. Consequently, they used to have, and still have, a very large number of slaves, which among them is the greatest of riches.” He also wrote, “In for mer times, they would not let them depart to the other world alone, but gave male and female slaves to accompany the dead. These slaves, having first eaten a hearty meal, were then immediately killed, that they might go with the dead man"
    },
    "model_answer": "Ang mga sagigilid ay uri ng alipin na nakatira sa paligid ng bahay ng kanilang amo, o \"namamahay.\" Sila ay naglilingkod sa kanilang amo at ginagawa ang mga gawain na ibinibigay sa kanila. [Source: Kasaysayan ng Pilipinas (900–1521) (Wikipedia, accessed October 06, 2021)]",
    "contexts": [
      "Alipin Ang mga alipin ang mababang antas ng tao na hindi likas sa mga Tagalog. Dalawa ang uri ng mga alipin sa katagalugan noong unang panahon ang sagigilid at namamahay na ikinapit ng mga dayuhan sa mga bisayang alipin o bug-os. Ang alipin ay galing salitang or ipun ng mga bisaya na pinatingkad sa antas na bug-os o lubos na alipin na lumaganap lamang sa Katagalugan bago pa dumating ang mga taga Europa dito sa Luzon o pulo ng ginto",
      "Alipin. In pre-colonial Philippines, these were slaves occupying the bottom rung of the social structure, either as namamahay, house-owning slaves, or sagigilid, slaves who lived at the periphery of their master’s household. Ambahan. A form of poetry of the Hanunoo Mangyan tribe of Mindoro Island in scribed on bamboo in baybayin, the pre-Hispanic script. Anito. An idol to which pre-colonial shrines were of ten dedicated. Anting-anting. Amulets used to ward off misfortune, the evil eye, and demonic spirits",
      "Sila rin ang palaging kasama ng Datu sa mga digmaan, sila rin ang nagdadala ng mga sandata. Alipin Ang mga alipin ang mababang antas ng tao na hindi likas sa mga Tagalog. Dalawa ang uri ng mga alipin sa katagalugan noong unang panahon ang sagigilid at namamahay na ikinapit ng mga dayuhan sa mga bisayang alipin o bug-os"
    ]
  },
  {
    "question": "When did the Srivijaya empire extend its influence to parts of the Philippine archipelago?",
    "ground_truth": "The eighth century",
    "metadata": {
      "cultural_golden_answer": "During this period, the Srivijaya empire had a significant impact on the Philippines, as evidenced by the implantation of the distinctive name 'Visayas' on its central cluster of islands. This event highlights the cultural exchange and influence that occurred between Southeast Asia and the Philippines during this time.",
      "language": "english",
      "cultural_relevance": 0.9,
      "chunk_index": 7,
      "ground_truth_context": ". The most common cause of slavery was the in ability to pay a debt, and the debtor had to remain in servitude, or his family (remember Namwran?) if the debtor had in the meantime passed away, until the debt was repaid with in terest. Since barangays at heart were kin-based, the hardships and conditions of bondage were relatively benign, compared, say, to the horrific conditions that African slaves endured when trafficked by Europeans to their colonies. Slaves, however, who were captured in battle or in raids on other barangays, being outside the clan, faced other potentially grim fates. They could be candidates for human sacrifice when the occasion demanded it, such as the death of a powerful datu. In his Relacíon de Las Islas Filipinas ( Account of the Philippine Islands ), published in 1604, a detailed and subjective portrait of sixteenth-century mores among the in digenous people, the Spanish Jesuit Pedro Chirino observed “it was easy to in crease the number of slaves. Consequently, they used to have, and still have, a very large number of slaves, which among them is the greatest of riches.” He also wrote, “In for mer times, they would not let them depart to the other world alone, but gave male and female slaves to accompany the dead. These slaves, having first eaten a hearty meal, were then immediately killed, that they might go with the dead man. It once happened that they buried with a chief a vessel manned by many rowers, who were to serve him in his voyages to the other world.” Nevertheless, social status in native society appeared to be quite fluid, malleable due to the possibilities of upward mobility through reducing one’s in debtedness and correspondingly in creasing one’s social prestige. The idea of an immutable hierarchy, as in the Hindu caste system, was notably absent. According to historian Vicente Rafael, in his Contracting Colonialism, “Village society owed its apparent mobility to the displaceability of obligations. Status reflected in debtedness, not the person…. Indeed, the possibility of shifting from one rank to another—as evidenced by the fine gradations of servitude—bespoke the tendency to dissociate status from person.” P EOPLE T RAVEL AND S O D O I DEAS Ports by nature are in teractive sites, as true millennia ago as it is now. Merchants, seamen, travelers, and emissaries from various culture zones not only traded goods but stories and ideas as well. Along with commerce, ideas made their way between the Mediterranean and the Middle East and the South China Sea, a globalization anticipating that of contemporary times. Traders, in short, brought the mselves and not just their goods. They were in dividuals with specific worldviews and beliefs that of ten were new to a port. Thus, Islam migrated via the Indian Ocean into Indonesia and the Malay Peninsula in just such a manner. However, this mix of religious, social, political, and cultural elements resists facile categorizing that would have the flow of in fluences only one way, from the “greater” to the “lesser,” as Abu-Lughod points out. The long unquestioned assumption has been that China and India were major in fluences on Southeast Asia, whose smaller states or communities were perceived as beneficiaries of supposedly more sophisticated continental cultures. But the reality was, as it is now, more complex than that. Interactions among different cultural agents were more layered and diverse than is conventionally presented. In fact, according to Solheim, archaeological excavations in Thailand in dicate that domestication of plants there began as early as 10,000 B. C. E. The excavations turned up an imprint of a grain of rice carbon dated to about 3,500 B. C. E., a thousand years before its presence was detected in India or China. According to Solheim, Thai metallurgy began in about 4,000 B. C. E., and fine quality bronze was already being produced by the third millennium, some 500 years before it was found in India and 1,000 years before China. Because of the development of the long-distance outrigger boats, trading in the Indian Ocean and South China Sea was underway by the first millennium B. C. E., enabling the two-way flow, as much from the lesser to the greater as vice versa. Nevertheless, while Southeast Asia was a more in teractive player in cultural matters than is usually envisioned, by the first millennium C. E., it was subject to major in fluences such as Buddhism and Hinduism, coming from China and India. In the tenth and eleventh centuries, with new powers in Asia coming to the fore—e. g., the Cholas, the Khmers, and the Burmese—diverse sets of relationships came about among realms that were not yet politically or culturally unified entities. And by the late thirteenth century, the Srivijaya empire had declined even as the Java-based kingdom of Majapahit was gaining power and Islam was taking root in Indonesia and the Malay Peninsula, shouldering aside the Hindu in fluence of the Srivijaya—though it has remained firmly rooted in the kingdom of Bali. The in fluence of the Srivijaya empire extended to parts of the Philippine archipelago, with Srivijaya colonists, as pointed out earlier, implanting the distinctive name of “Visayas” on its central cluster of islands. By the end of the eighth century, the empire in cluded all of the Malay Peninsula, a large portion of Sumatra, parts of Siam, and central Java. It had four substates—Bandjarmasin, Sukadara, Southern Sarawak, and Brunei. From Bandjarmasin settlers went to Sulu and west-central Visayas; the Borneans sailed to Panay, Palawan, Mindoro, and southern Luzon. Very likely the Laguna Copperplate Inscription is the cultural residue of such migration. Spanish documents from the sixteenth century record the existence of diverse crafts, such as shipbuilding—an absolute must in the archipelago—metallurgy, pottery, and weaving. They noted native weapons of the time as in cluding the lantaka (bronze cannons that were of ten mounted on swivels), lances and daggers tipped with iron, as well as bronze culverins. Metallurgy had long been practiced in the islands, along with dry agriculture, weaving, boat-building, and the construction of elevated lightweight houses with thatched roofs. In Palawan, the Manunggul Cave—part of the Tabon Cave complex—yielded iron objects and the extraordinary Manunggul Jar, described by the late American anthropologist Robert Fox as “perhaps unrivalled in Southeast Asia,” when compared to artifacts of the same era, providing “a clear example of a cultural link between the archaeological past and the ethnographic present.” This remarkable burial jar is made of clay with finely in cised motifs, and dates to the late Neolithic period, or about 710 B. C. E. The jar’s cover depicts two figures on a boat, a rower ferrying the dead person to the next realm, with its implicit belief in the soul and the afterlife. This type of jar was most likely in troduced by the Hakka migrating from southern China’s Fukien region"
    },
    "model_answer": "By the end of the eighth century, the Srivijaya empire had extended its influence to parts of the Philippine archipelago.  [Source: A History Of The Philippines, p. 29]",
    "contexts": [
      "The in fluence of the Srivijaya empire extended to parts of the Philippine archipelago, with Srivijaya colonists, as pointed out earlier, implanting the distinctive name of “Visayas” on its central cluster of islands. By the end of the eighth century, the empire in cluded all of the Malay Peninsula, a large portion of Sumatra, parts of Siam, and central Java. It had four substates—Bandjarmasin, Sukadara, Southern Sarawak, and Brunei"
    ]
  },
  {
    "question": "Ano ang mga halimbawa ng alahas sa pre-kolonyal na Pilipinas?",
    "ground_truth": "Kasama sa mga halimbawa ang golden sashes, earrings, diadems, funerary masks, body ornaments, and ritual containers.",
    "metadata": {
      "cultural_golden_answer": "Ang paggawa ng alahas ay isang mahusay na tradisyon sa ating bansa, mula noong unang panahon. Ang mga sinaunang Pilipino ay kilala para sa kanilang karismadong pagseseta ng metal at ginto. Sa kasalukuyan, ang alahas ay isa sa mga pinakasikat na mga produkto ng ating industriya ng hilaga.",
      "language": "filipino",
      "cultural_relevance": 0.9,
      "chunk_index": 8,
      "ground_truth_context": ". Very likely the Laguna Copperplate Inscription is the cultural residue of such migration. Spanish documents from the sixteenth century record the existence of diverse crafts, such as shipbuilding—an absolute must in the archipelago—metallurgy, pottery, and weaving. They noted native weapons of the time as in cluding the lantaka (bronze cannons that were of ten mounted on swivels), lances and daggers tipped with iron, as well as bronze culverins. Metallurgy had long been practiced in the islands, along with dry agriculture, weaving, boat-building, and the construction of elevated lightweight houses with thatched roofs. In Palawan, the Manunggul Cave—part of the Tabon Cave complex—yielded iron objects and the extraordinary Manunggul Jar, described by the late American anthropologist Robert Fox as “perhaps unrivalled in Southeast Asia,” when compared to artifacts of the same era, providing “a clear example of a cultural link between the archaeological past and the ethnographic present.” This remarkable burial jar is made of clay with finely in cised motifs, and dates to the late Neolithic period, or about 710 B. C. E. The jar’s cover depicts two figures on a boat, a rower ferrying the dead person to the next realm, with its implicit belief in the soul and the afterlife. This type of jar was most likely in troduced by the Hakka migrating from southern China’s Fukien region. Metallurgy was also evidenced in fine goldsmithing, with gold jewelry and or naments widespread throughout the archipelago, an in dication of the mineral’s abundance. The Spanish noted the delicacy and high degree of craftsmanship of gold work in the islands, particularly in the Visayas and in certain parts of Mindanao. Fervent capitalists, they complained that the mines were being worked only as needed and never at their maximum. The observant Chirino writes, “The islands are numerous and thickly in habited by a people who, though not rich, were accustomed to wear cotton and silk garments, and gold pieces (not merely of thin plate) and brooches to fasten them; and rich necklaces, pendants, earrings, finger-rings, ankle rings, for the neck, ears, hands, and feet—the men as well as the women. They even used to, and do yet, in sert gold between their teeth as an or nament.” Earlier, in 1521, the Venetian chronicler of the Magellan expedition that had come across the archipelago, Antonio Pigafetta, had noted the existence in some of the islands of “mines of gold, which is found by digging from the earth large pieces as large as walnuts and eggs.” Discoveries in the 1970 s in Surigao, northeastern Mindanao, of more than a thousand gold artifacts dating to the tenth to thirteenth centuries C. E., reflect sophisticated artistry and unusual craftsmanship. Acknowledging outside in fluences, experts on the subject nonetheless have concluded that pre-colonial Philippine techniques and motifs were unique to the islands. Among other items the cache in cluded golden sashes, earrings, diadems, funerary masks, body or naments, and ritual containers. One piece is particularly impressive: a gold halter of nearly four kilograms, quite possibly representing the Sacred Thread, a mark of the Brahmin caste in Hinduism. The halter and other objects with similar motifs clearly reflect Hindu in fluences—cultural reverberations from the Srivijaya empire—underscoring the presence of yet another layer in the archipelago’s diverse and complex pre-Hispanic culture. L IFE, L ANGUAGE, AND L OVE Being home to a diverse array of ethnicities, the islands possess close to 170 languages and dialects, with many on the verge of extinction. Nevertheless, the Austronesian language tree is the dominant source of the Philippines’ eight major to ngues—Cebuano, Tagalog, Hiligaynon, Waray, Ilocano, Pangasinan, Bicolano, and Kapampangan. Evidence in dicates that Austronesian languages came to the Philippine archipelago earlier than they did, say, to the Malay Peninsula. By the sixteenth century, to day’s languages were well established, evolving from their Austronesian roots to their distinct for mations as a result of the conditions peculiar to the islands. Tagalog, the lingua franca of historic Manila, capital of colonial times (both of Spain and the United States), forms the basis of the national language, Pilipino—much to the dismay of Cebuano speakers who outnumber native Tagalog speakers, and who remind anyone who listens that Cebu was where the Spanish first set up a settlement. In terms of script, at least ten syllabaries are known to have been used in pre- colonial Philippines, though literacy was not widespread, even if a number of Spanish accounts like Chirino’s say so. Tagalog script probably in fluenced the development of writing among the Visayans, whose pre-1565 culture stressed singing and chanting, relying on oral history for the transmission of tradition. Such practices occasioned socializing, and reinforced a barangay’s joie de vivre —antedating by several hundred years that contemporary and widely popular and communal form, the karaoke songfest. In Maynila, its datus wrote in the Kawi script, which seems to have disappeared by the time of Spanish conquest. They now wrote in a Malay or Arabic script called baybayin, as ment ioned earlier, since they corresponded with the Sultan of Borneo—an in dication of Islamic conversion up north, not only in Maynila but in other areas such as Batangas in the southern Tagalog region. Historian Corpuz believes that “the presence of writing and the making of written laws in the Manila area placed Manila ahead of other native communities in political development at the time of the Spanish contact, with the exception only of the Sulu and Maguindanao areas.” Unlike the sudden impact of the Spanish, extra-in sular cultural in fluences seeped in gradually, with none of the in tensity of other cultural encounters elsewhere in Southeast Asia, where Buddhism and Hinduism led the charge. Not surprising, as the more than 7,000 islands were on the northeastern edge of Southeast Asia. As noted earlier, pre-Hispanic Filipinos proved to be as peripatetic as anyone else, with small settlements in Malacca, Brunei, and Timor. They even fought as mercenaries in the employ of the Burmese kingdom. Given the abundance of and easy access to water, and the warm climate, the islanders were at tentive to matters of personal hygiene, especially to bathing— impressing both Pigafetta and Chirino. Chirino wrote admiringly: Both men and women swim like fishes, even from childhood, and have no need of bridges to pass over rivers. They bathe the mselves at all hours, for cleanliness and recreation; and the women after childbirth do not refrain from the bath, and children just born are bathed in the rivers and springs of cold water. When leaving the bath, they anoint the head with ajonjoli [i. e., oil of sesame] mixed with civet…"
    },
    "model_answer": "Walang sapat na impormasyon sa mga dokumentong ito tungkol sa mga halimbawa ng alahas sa pre-kolonyal na Pilipinas.",
    "contexts": []
  },
  {
    "question": "What is notable about the personal hygiene practices of pre-Hispanic Filipinos?",
    "ground_truth": "They were attentive to matters of personal hygiene, especially bathing.",
    "metadata": {
      "cultural_golden_answer": "Their emphasis on cleanliness and bathing reflects the importance of physical and spiritual purification in Filipino culture, which continues to influence modern-day attitudes towards hygiene and self-care.",
      "language": "english",
      "cultural_relevance": 0.9,
      "chunk_index": 9,
      "ground_truth_context": ". Not surprising, as the more than 7,000 islands were on the northeastern edge of Southeast Asia. As noted earlier, pre-Hispanic Filipinos proved to be as peripatetic as anyone else, with small settlements in Malacca, Brunei, and Timor. They even fought as mercenaries in the employ of the Burmese kingdom. Given the abundance of and easy access to water, and the warm climate, the islanders were at tentive to matters of personal hygiene, especially to bathing— impressing both Pigafetta and Chirino. Chirino wrote admiringly: Both men and women swim like fishes, even from childhood, and have no need of bridges to pass over rivers. They bathe the mselves at all hours, for cleanliness and recreation; and the women after childbirth do not refrain from the bath, and children just born are bathed in the rivers and springs of cold water. When leaving the bath, they anoint the head with ajonjoli [i. e., oil of sesame] mixed with civet…. Through modesty, they bathe with their bodies drawn up and almost in a sitting posture, taking the greatest care not to be seen, although no one may be near to see them [except perhaps for the odd priest]. The most general hour for bathing is at the setting of the sun, because at that time they have finished their labors, and bathe in the river to rest and refresh the mselves; on the way, they usually carry some vessel for bearing water to use in their domestic duties. Visayans used citrus in laundering their garments, for the pleasant odor it imparted. They were fastidious, Scott notes, in their personal hygiene, using swabs to clean their ears and “vegetable husk for cleaning and polishing the teeth.” Unlike Legazpi, Chirino was impressed by the civility, courteousness, and upbringing of the Tagalogs, particularly in the use of the third person when addressing someone. Chirino was less taken by the Visayans, who “are more rustic and less civil in manners, just as their language is harsher and less polished.” On the other hand, Pigafetta commends the Visayans for their hospitality, graciousness, love of feasting, and music. It could very well have been a matter of in dividual temperament—Pigafetta more at tuned to worldliness than the priest—or Chirino having a bad day in his in teraction with the Visayans. Not surprisingly, both Pigafetta and the good Jesuit noted the relaxed at titude to wards sex, especially among the women. The pious cleric disapproved heartily of island hedonism. He believed that the devil had convinced women that their salvation was in the hands of men, “that a woman, whether married or single, could not be saved, who did not have some lover…. Consequently, virginity was not recognized or esteemed among them; rather, women considered it as a misfortune and humiliation. Married women, moreover, were not constrained by honor to remain faithful to their husbands, although the latter would resent the adultery, and hold it as just cause for repudiating the wife.” Pigafetta, no stranger to his shipmates’ earlier bacchanals in South America, gave a more detailed, at times, clinical, description of the islanders’ sexual mores, leading one to in fer that, being a scrupulous observer, he had witnessed Cebuanos in actual coitus and perhaps he had availed himself of the charms of the unmarried nubile women, whose beauty he remarked on: “These girls were very beautiful, and almost white and tall as ours. They were naked, except that from the waist to the knees they wore a garment … covering their nature.” Sexual pleasure, it seemed, was seen as a mutual goal—women were as important as men in this regard—rather than simply for the gratification of male desire and the propagation of the species. To that end, to please their partners, according to Pigafetta, men “have their penis pierced from one side to the other near the head, with a gold or tin bolt as large as a goose quill…. Some have what resembles a spur, with points upon the ends; others are like the head of a cart nail.” He goes on: “When the men wish to have communication with their women, the latter the mselves take the penis not in the regular way and commence very gently to in troduce it, with the spur on top first, and then the other part. When it is in side, it takes its regular position; and thus the penis always stays in side until it gets soft, for otherwise they could not pull it out.” Two lovers could thus remain locked in passion for hours, even a whole day. In this context, virginity was neither prized nor desirable, and polygamy was accepted—both of which practices the zealously Catholic Spanish at tempted to and did for the most part wipe out. To the macho Spanish, a sexually in dependent woman was in to lerable. One account described island women as “generally depraved … given to abominable lustful habits.” The fact that female desire was given equal weight profoundly disturbed the repressed and repressive Spanish patriarchs. Gender equality was evident in a language such as Tagalog with its nongendered nominative pronouns and in the prevalent creation myth that had man and woman as emerging from bamboo at the same time, both fully for med. In contrast to the biblical story of the creation of Adam and Eve, this one held the implicit promise of nonsexist gender treatment, as manifest in the sexual at titudes that titillated and shocked the Europeans. Variations on the creation myth in cluded both sexes arising from green coconuts, or as the result of an argument between primeval sky and water. The Tagalogs, Visayans, and the Igorots expressed belief in a supreme deity, as of course did the Muslims in the south. To the Tagalogs this god was known as Bathala May Kapal (“Bathala” is likely derived from the Sanskrit word for noble lord, Batthara ); to the Visayans, Laon; and to the Igorots, Kabunian. They also believed in lesser deities, such as those ruling over seas and rivers. The crocodile, once plentiful in the archipelago’s waterways, was revered, with of ferings to ssed on the water to placate its ravenous appetite. The Visayans termed the lower-ranked powers diwata (from the Sanskrit deva ), among them Magwayen, who ferried the dead to the afterlife; Makabosog, a Bacchus-like deity who in spired humans to prodigious bouts of eating and drinking; and a mischievous trio of expert poisoners—Naginid, Arapayan, and Makbarubak. Inhabiting the netherworld were frightful creatures such as the aswang, flesh eaters, and the manananggal, literally a fly-by-night ghoul that would leave half of its body in a secret place, while the other, upper half would move through the dark sky in search of a victim, preferably the fetus of an expectant mother, which it would then suck out, with its long, needle-like to ngue. Acting as in termediary between this world and the unseen one was the babaylan ( katalonan to the Tagalogs, mumbaki to the highlanders of Luzon)"
    },
    "model_answer": "Pre-Hispanic Filipinos were attentive to personal hygiene, particularly bathing. This impressed both Pigafetta and Chirino.  [Source: A History Of The Philippines, p. 31]",
    "contexts": [
      "Not surprising, as the more than 7,000 islands were on the northeastern edge of Southeast Asia. As noted earlier, pre-Hispanic Filipinos proved to be as peripatetic as anyone else, with small settlements in Malacca, Brunei, and Timor. They even fought as mercenaries in the employ of the Burmese kingdom. Given the abundance of and easy access to water, and the warm climate, the islanders were at tentive to matters of personal hygiene, especially to bathing— impressing both Pigafetta and Chirino"
    ]
  },
  {
    "question": "Ano ang pangalan ng diyos sa pananampalataya ng mga Tagalog?",
    "ground_truth": "Bathala May Kapal",
    "metadata": {
      "cultural_golden_answer": "Ang pangunahing pananampalataya ay naglalayon sa isang mahal na tagapagligtas, at ito ang batayan ng kanilang mga pagdiriwang at tradisyon.",
      "language": "filipino",
      "cultural_relevance": 0.9,
      "chunk_index": 10,
      "ground_truth_context": ". The Tagalogs, Visayans, and the Igorots expressed belief in a supreme deity, as of course did the Muslims in the south. To the Tagalogs this god was known as Bathala May Kapal (“Bathala” is likely derived from the Sanskrit word for noble lord, Batthara ); to the Visayans, Laon; and to the Igorots, Kabunian. They also believed in lesser deities, such as those ruling over seas and rivers. The crocodile, once plentiful in the archipelago’s waterways, was revered, with of ferings to ssed on the water to placate its ravenous appetite. The Visayans termed the lower-ranked powers diwata (from the Sanskrit deva ), among them Magwayen, who ferried the dead to the afterlife; Makabosog, a Bacchus-like deity who in spired humans to prodigious bouts of eating and drinking; and a mischievous trio of expert poisoners—Naginid, Arapayan, and Makbarubak. Inhabiting the netherworld were frightful creatures such as the aswang, flesh eaters, and the manananggal, literally a fly-by-night ghoul that would leave half of its body in a secret place, while the other, upper half would move through the dark sky in search of a victim, preferably the fetus of an expectant mother, which it would then suck out, with its long, needle-like to ngue. Acting as in termediary between this world and the unseen one was the babaylan ( katalonan to the Tagalogs, mumbaki to the highlanders of Luzon). This in dividual could be of either sex but was more of ten female, though the male babaylan were known for cross-dressing. The babaylan’s most common function was a diviner of fate. In a public ritual common to both lowlander and highlander, a sacrificial swine, preferably reddish in color, was killed by a quick, unerring thrust to its heart by the babaylan/katolonan/mumbaki who had gone into a trance. The pig’s entrails would be read, then consumed, with certain parts reserved for the seer. As a medium for spirits and practitioner of sacred rites, the babaylan occupied an important, and lucrative, position in the barangay. S/he acted also as medicine wo/man, midwife, dispenser of herbs and potions that healed the physical wounds, or of charms and in cantations if a person’s illness, or bad for tune, were thought to be the result of a hex put upon him or her—possibly by another babaylan more at tuned to black than white magic. As with the Spanish and their Southeast Asian neighbors, the pre-Hispanic populations believed in an afterlife, recognized the existence of in visible spirits, and feared demons, all of which were thought to significantly affect their lives. Many of their beliefs were animistic, at tributing supernatural power to elements of Nature. One basis for their sense of the otherworldly was the need to honor and respect their ancestors, whom they would sometimes elevate to deity status. Thus, they reverenced stones, the wind, headlands of water, and trees. To cut down an old tree, for example, was considered a sacrilege. Or to fail to ask permission to pass in front of an ant mound in a field was tantamount to in viting retribution (usually in the form of a mischievous trick) from the mound’s resident spirit, to which the Spanish word duende was affixed, though the meaning was closer to that of leprechaun than of creative spirit. Often, beside a house, would be a much smaller one, that contained some to ols and handicrafts but was also dedicated to an anito, or a local deity—similar to the shrines for the penates, household gods of the Romans, and the spirit houses of the Thais. The Ifugao carved wooden icons they called the bulul, a guardian deity of in determinate sex that stood guard over their warehouses of rice and was even thought to in crease the supply of stored grain. As exemplified by the Manunggul Jar, shuffling off this mortal coil meant a journey of the spirit to the next realm. Upon a person’s death, the corpse was prepared in different ways in anticipation of its voyage. In the Tagalog regions, the body was decorated and dressed in finery. In the highlands of northern Luzon, depending on the tribe, burial rites ranged from the placement of coffins in the vaulted ceilings of caves to mummification. In one region, the corpse was cleaned, dressed, set upright on and bound to a chair as members of the clan gathered around to mourn the person’s demise. There was no cemetery as such, and the dead could be buried in the ground underneath the house, usually elevated on hardwood posts, or in the fields. On occasion, with the death of someone of high status, such as a datu, slaves captured in raids were in terred as well. The manner of death may have differed —sometimes speared to death while tied to crosses, sometimes crushed by a boat that would roll over their prostrate bodies—but the in tent was the same: for the dead slaves to accompany the master on the new voyage, as they had when he was among the living. The soul or spirit of the deceased person wandered in another realm but could return, in which case those left behind made preparations to welcome that spirit. In a practical vein, the family would try to put that spirit to use in divining what the future might hold and otherwise putting in a good word, or in tervening, to assure the bestowal of good, and the avoidance of ill, for tune. At the wake, if the family could afford it, professional mourners would sing songs, eulogizing the deceased and relating, according to Chirino, “the fabulous genealogies and vain deeds of their gods.” T HE C RESCENT B EFORE THE C ROSS Islam predated the arrival of Christianity by at least a century and a half. Towards the end of the fourteenth century, Muslim missionaries from the by then mostly Islamicized Malaysia and Indonesia brought the word of the Messenger concerning Allah to the southern Philippines, even reaching Palawan, Mindoro, and the east coast of Luzon, notably Maynila. With ulamas, or Muslim communities, taking root, two large sultanates were subsequently established: in Sulu in the fifteenth century, under Sharif ul-Hashim, and in Maguindanao, near Cotabato City in the early sixteenth century, under Sharif Muhammad Kabungsuan, who had left Malacca for Maguindanao. Thence, Islam spread to Maranao territory (around Lake Danao), in explicably skipped the Visayas for the most part, and sailed north to Mindoro Island and Maynila and Batangas in Luzon, and west to southern Palawan. Converted in digenous tribes such as the Tausug, Maranaoans, and Maguindanaoans could look to the older ulamas farther south. Certainly there were other outside in fluences, mainly from China and India, and their legacies can be seen in such diverse areas as language, art, cuisine, and kinship groupings, but Islam acted as a catalyst for in tra-settlement alliances and the beginnings of a civil state. This feature, which distinguished the Muslim communities from the non-Muslim ones, proved essential in resisting Spanish efforts at colonizing southern Mindanao"
    },
    "model_answer": "Ang pangalang diyos sa pananampalataya ng mga Tagalog ay Bathala.  [Source: Bathala (Wikipedia, accessed December 27, 2021)]",
    "contexts": [
      "Sila ay Mula sa at iba pang mga anito. Sa lahat ng ito, si Bathala ang punong diyos o pinaka-ama ng lahat ng mga diyos. Kilala rin siya bilang Bathalang Maykapal. Siya ang makapangyarihang diyos, pinaniniwalaan ng mga sinaunang Tagalog at hari ng mga Diwata. Lahat ng mga paniniwalang ito ay naipluensya ng mga Kastila. Pinalitan nila ang lumang pananampalataya ng mga lumang Tagalog sa Kristiyanismo",
      "Siya ang makapangyarihang diyos, pinaniniwalaan ng mga sinaunang Tagalog at hari ng mga Diwata. Lahat ng mga paniniwalang ito ay naipluensya ng mga Kastila. Pinalitan nila ang lumang pananampalataya ng mga lumang Tagalog sa Kristiyanismo. Si Bathala ay in uugnay sa Diyos ng rehiliyong Kristiyanismo, at ang ibang diyos-diyosan ay pinalitan ng mga santo. Kaya, sa panahong ngayon, ang salitang Bathala ay tinatawag sa Diyos ng Rehiliyong Kristiyanismo ng mga Pilipino ngayon. Mga sanggunian Tingnan din",
      "While known by a variety of names, the islands’ in habitants generally believed in the dominance of a single powerful deity supplemented by a pantheon of lesser gods and an active spirit world. One of the earliest Spanish priest chroniclers wrote that the Tagalogs spoke of Bathala as their principle god, while other peoples around the archipelago had other terms for this same concept of an all­powerful deity",
      "The Tagalogs, Visayans, and the Igorots expressed belief in a supreme deity, as of course did the Muslims in the south. To the Tagalogs this god was known as Bathala May Kapal (“Bathala” is likely derived from the Sanskrit word for noble lord, Batthara); to the Visayans, Laon; and to the Igorots, Kabunian. They also believed in lesser deities, such as those ruling over seas and rivers",
      "One of the earliest Spanish priest chroniclers wrote that the Tagalogs spoke of Bathala as their principle god, while other peoples around the archipelago had other terms for this same concept of an all­powerful deity. Since this supreme god was remote and in accessible, his powers and presence was complemented by lesser deities to whom Filipinos made of ferings and prayers to gain immediate benefits. The most common of these lesser deities were the anitos, who were usually good if properly appropriated"
    ]
  },
  {
    "question": "When did Muslim missionaries from Malaysia and Indonesia reach the southern Philippines?",
    "ground_truth": "Towards the end of the fourteenth century",
    "metadata": {
      "cultural_golden_answer": "This marked a significant turning point in Philippine history, as Islam brought a new cultural and religious influence to the region, shaping the identity of various ethnic groups, including the Tausug, Maranaoans, and Maguindanaoans.",
      "language": "english",
      "cultural_relevance": 0.9,
      "chunk_index": 11,
      "ground_truth_context": ". Towards the end of the fourteenth century, Muslim missionaries from the by then mostly Islamicized Malaysia and Indonesia brought the word of the Messenger concerning Allah to the southern Philippines, even reaching Palawan, Mindoro, and the east coast of Luzon, notably Maynila. With ulamas, or Muslim communities, taking root, two large sultanates were subsequently established: in Sulu in the fifteenth century, under Sharif ul-Hashim, and in Maguindanao, near Cotabato City in the early sixteenth century, under Sharif Muhammad Kabungsuan, who had left Malacca for Maguindanao. Thence, Islam spread to Maranao territory (around Lake Danao), in explicably skipped the Visayas for the most part, and sailed north to Mindoro Island and Maynila and Batangas in Luzon, and west to southern Palawan. Converted in digenous tribes such as the Tausug, Maranaoans, and Maguindanaoans could look to the older ulamas farther south. Certainly there were other outside in fluences, mainly from China and India, and their legacies can be seen in such diverse areas as language, art, cuisine, and kinship groupings, but Islam acted as a catalyst for in tra-settlement alliances and the beginnings of a civil state. This feature, which distinguished the Muslim communities from the non-Muslim ones, proved essential in resisting Spanish efforts at colonizing southern Mindanao. Writing in 1603 to the Spanish king of the paramount Muslim datus of Mindanao—Umpi, Silonga, Buycan, and Rajaniora—Don Pedro de Acuña noted, “They have usually dissensions and controversies among the mselves, for he who has the most people and wealth seeks to be more esteemed than the others. But against the Spaniards and their other enemies, they confederate and unite, and or dinarily Silonga has the most power.” The sultanate had a centralized government similar to Islamic states in Borneo and Indonesia. Its head, the sultan, was owed allegiance by other datus. Though the latter governed their own followers, they occupied a subordinate position vis à vis the sultan, who alone could declare war, engage in dealings with other states, and otherwise decide on matters affecting the sultanate as a whole. The highly ceremonial courts in both Sulu and Maguindanao had Arabic speakers, religious scholars, and gentry with distinguished lineages. Clearly Muslim, still, these courts didn’t completely disavow pre-Islamic practices. As Scott puts it in Barangay, “Maguindanao ruled over a great many pagan people, and even the celebrated [Sultan] Kudarat was reported to have sacrificed three of his household slaves during a terrifying volcanic eruption.” With Islamicized communities spread strategically through the archipelago, from Luzon in the north, Sulu and Maguindanao in the south, and Palawan in the west, a persuasive argument can be and has been made that the archipelago would have evolved to wards an Islamic state or states, either as an in dependent nation, or part, say, of Indonesia or Malaysia, were it not for the Iberians. Spanish colonization meant the displacement of the crescent by the cross in most of the country. T HE C HINESE AND O THER M INORITIES As early at least as the tenth century, Chinese traders were regular visitors to the islands, going by the first ment ion of a Philippine island—Ma-Yi, current-day Mindoro—in extant Chinese records, which list 985, 1372, 1406, and 1410, as years of contact with the islands. Place names, such as Ma-Yi, Min-to-liang, Su- lu, and Lu-sung, in dicate recurring visits, with small Han communities springing up. In his accounts from the thirteenth century, Chao Ju-Kua, China’s Superintendent of Sea Trade from 1277 to 1287, referred to Ma-Yi (here taken to in dicate the Philippine archipelago), San-hsii (the Visayas) and Lin-hsing (Luzon). Imports from Southeast Asia, in cluding from the Philippines, in cluded cotton, yellow wax, coconuts, on ions and woven mats. But the steady and continuing in flux of the Chinese in larger numbers began only in earnest with the colonization of the archipelago by the Spanish, who needed the crafts and skills of Chinese artisans. To the Chinese traders—most if not all of whom were from the southern China coastal provinces such as Fujian, Amoy, and Guangdong—this meant a link to yet another trading network as well as access to sought-after Mexican silver, brought by the Spanish from Mexico. Both silver and new markets were accessible because of the profitable galleon trade between Manila and Acapulco, the transshipment point to Spain and the rest of Europe. (The galleon trade will be discussed in the next chapter.) The very nature of the archipelago, with more water than land, meant the existence of numerous tribal groups, other than the dominant ones—the Tagalogs, the Kapampangans, the Ilocanos, the Bicolanos, the Cebuanos, and other Visayans. Now known as cultural minorities, some sixty of them were and are to be found, still, throughout the country. Due to remoteness or effective resistance, they had limited contact with the Spanish. The Muslims of Mindanao, alert against Spanish encroachment, were the mselves composed mostly of three distinct tribes: the Maranaoans, the Maguindanaoans, and the Taosug, Islam being the religious glue that bound them, albeit loosely but never too loosely as to prevent unity (most of the time, anyway) against the Iberian foe. Other cultural minorities in Mindanao, especially those in the southern regions, such as the boat-dwelling Badjao, the Sama Laut, and the Yakan, were subject to pressure to convert to Islam. And for the most part they did. Tribes such as the T’Boli, the Mandaya, the Manobo, and the Bagobo, because they lived in the highlands, never converted wholesale to Islam. In Mindoro Island, off the western coast of Luzon, live the Mangyan in the rugged, mountainous in terior, whose Hanunoo branch was ment ioned earlier in connection with the use of baybayin, the pre-Hispanic script. Scattered along the western coast of Luzon, especially in its mountainous in terior, and found on some Visayan islands, are the Negritos (whom the Spanish also referred to as Negrillos ). Also known as Agta, Aeta, Ita, Ati, they are shorter than the average Filipino, of dark pigmentation and curly hair, and are related to the Australian Aborigines. There is an on going debate as to when they established the mselves in the archipelago, but their presence is believed to be older than that of the Austronesian migrations. They are thought to have used land bridges 30,000 years ago, most likely through the isthmus that once connected Palawan Island and Borneo. In the highlands of northern Luzon—the Cordilleras—live the previously ment ioned Igorot tribes, Igorot meaning “peoples of the mountain.” Among these are the Kalinga, the Bontoc, the Kankanay, the Ibaloi, and the Ifugao—the last named the builders of the magnificent rice terraces"
    },
    "model_answer": "Muslim missionaries from Malaysia and Indonesia reached the southern Philippines in the 15th century.  [Sources: Culture And Customs Of The Philippines, p. 20; A History Of The Philippines, p. 35]",
    "contexts": [
      "Towards the end of the fourteenth century, Muslim missionaries from the by then mostly Islamicized Malaysia and Indonesia brought the word of the Messenger concerning Allah to the southern Philippines, even reaching Palawan, Mindoro, and the east coast of Luzon, notably Maynila",
      "Page xix Chronology of the History of the Philippines 100,000–60,000 B. C. Australiod peoples in habit island Southeast Asia 22,000 B. C. Age of oldest skeletal remains found on Palawan Island 3,000–2,500 B. C. Modern Malay peoples in habit island Southeast Asia 10 th–14 th century Chinese traders establish routes to island Southeast Asia 15 th century Muslim missionaries reach the southern Philippines from Indonesia 1521 A. D"
    ]
  },
  {
    "question": "Saang lugar ay naninirahan ang mga Igorot?",
    "ground_truth": "Lupain ng Hilagang Luzon, katabing sa Cordilleras.",
    "metadata": {
      "cultural_golden_answer": "Ang lupain ng Hilagang Luzon, partikular na ang Cordilleras, ay tahanan ng mga Igorot at kilalang karagdagang pagpapakilos ng tradisyonal na pamumuhay, katutubong pamamahala at kultura.",
      "language": "filipino",
      "cultural_relevance": 0.9,
      "chunk_index": 12,
      "ground_truth_context": ". And for the most part they did. Tribes such as the T’Boli, the Mandaya, the Manobo, and the Bagobo, because they lived in the highlands, never converted wholesale to Islam. In Mindoro Island, off the western coast of Luzon, live the Mangyan in the rugged, mountainous in terior, whose Hanunoo branch was ment ioned earlier in connection with the use of baybayin, the pre-Hispanic script. Scattered along the western coast of Luzon, especially in its mountainous in terior, and found on some Visayan islands, are the Negritos (whom the Spanish also referred to as Negrillos ). Also known as Agta, Aeta, Ita, Ati, they are shorter than the average Filipino, of dark pigmentation and curly hair, and are related to the Australian Aborigines. There is an on going debate as to when they established the mselves in the archipelago, but their presence is believed to be older than that of the Austronesian migrations. They are thought to have used land bridges 30,000 years ago, most likely through the isthmus that once connected Palawan Island and Borneo. In the highlands of northern Luzon—the Cordilleras—live the previously ment ioned Igorot tribes, Igorot meaning “peoples of the mountain.” Among these are the Kalinga, the Bontoc, the Kankanay, the Ibaloi, and the Ifugao—the last named the builders of the magnificent rice terraces. Famed for their martial skills, bravery, and codes of honor and retribution (in cluding headhunting), the Igorots were too high up, too fierce, and the Spanish too sparse in number, for the few at tempts at spreading the Gospel to succeed. Only under United States colonial rule in the early twentieth century would Christianity gain a foothold in the mountains."
    },
    "model_answer": "Ang mga Igorot ay naninirahan sa Benguet.  [Source: Igorota (Wikipedia, accessed December 12, 2021)]",
    "contexts": [
      "Ito rin ang ginagamit ng mga Igorot upang tawagin ang kanilang sarili at may mga etnolohikal na kasulatan tungkol dito. Pisikal na Distinksiyon Ang nakararami ay mayroong mga matang bilugan ngunit magaganda at karamihan ay pandak. Malalaman mo agad na Igorot ang isang babae sa pamamagitan ng kanyang malalaking binti dahil sa pag akyat ng bundok pati na rin sa mga lalaki. Ang mga balat ng mga Igorot sa Benguet ay karaniwang mapuputi ngunit ang iba ay maitim dahil babad sa ilalim ng mainit na araw"
    ]
  },
  {
    "question": "Ano ang pangalan ng isla na unang tinangka ng ekspedisyon ni Magellan sa Pilipinas?",
    "ground_truth": "Homonhon",
    "metadata": {
      "cultural_golden_answer": "Sa pamamagitan ng pagdarating ni Ferdinand Magellan, nagtala ang Pilipinas sa kasaysayan bilang isang lugar na tinukoy ng mga dayuhang Kristiyano para sa kanilang mga misyon at kolonyalismo. Ang sandugo (pagbabantog) ay isang tradisyon na ginamit ng mga taga-Espanya upang makapangako ng pakikipagkapwa-kapwa at pagiging katulad ang loob, kaya't naging mahalaga ang pagdarating ni Magellan sa Pilipinas.",
      "language": "filipino",
      "cultural_relevance": 0.9,
      "chunk_index": 0,
      "ground_truth_context": "2. EXPEDITIONS, ENTRENCHMENT, AND SPANISH COLONIAL RULE, 1521-1862 “The method which they pursued was consistent with the practice of those nations in for ming a friendship—a method not altogether their own, as it was a custom among the most ancient heathen peoples, ment ion of which we find in serious authors. Those who made peace in the name of the rest, and established the pacts of perpetual friendship, pricked and wounded their own arms; the Indian sucking the blood of the Spaniard, and the Spaniard that of the Indian. In this wise they became as if of the same blood, and were closer than brothers. These are called sandugo, which means ‘consanguineous,’ or ‘of the same blood.’” —Pedro Chirino, S. J., Relación de las Islas Filipinas, 1604 I N 1517, AN INTREPID AND BATTLE-TESTED THIRTY-NINE-YEAR-OLD Portuguese navigator by the name of Ferdinand Magellan, out of favor with the crotchety Portuguese King Manuel, crossed the border into Spain and convinced its young, adventurous seventeen-year-old Hapsburg monarch, Charles, to finance an ambitious undertaking: He, Magellan, would discover a new route to the fabled Spice Islands by sailing west across the Atlantic, to South America, from where he could then sail to the desired destination with out running afoul of his countrymen, Spain’s fiercest rivals. Magellan assured the Spanish court that his voyage would observe the line of demarcation Pope Alexander VI had drawn, essentially dividing the planet between Catholic Spain and Catholic Portugal. Established on June 7, 1494, the demarcation was one hundred leagues west of the Azores and Cape Verde: All lands west were marked for Spain; east, for Portugal. However, if land in either half was already ruled by a Christian sovereign, it was to be left alone. Everything else was up for grabs. A simple enough agreement, yet the papal bull was constantly challenged to suit the agenda either of the Portuguese or the Spanish. This in terminable wrangling led to modifications through the 1506 Treaty of Tordesillas (a small town in northern Spain). The line was moved 370 miles west of Cape Verde, approximately in the middle of the Atlantic. The papal blessing provided Spain and Portugal with the ological cover for their voyages of conquest and the brutal but profitable undertaking of land expropriation and exploitation of in digenous peoples, otherwise known as colonization. Through the conquistadors and the civil and religious personnel that followed in lockstep, Rome extended its reach wherever these two European countries planted their flags—a perfect combination of economic enterprise, worldly power, and religious zeal. Magellan’s voyage was financed of ficially by the Casa de Contratacíon in Seville. If the venture succeeded, it would guarantee much needed revenue for the Spanish treasury. On August 10, 1519, the flagship Trinidad, the Victoria, San Antonio, C on cepcíon, Santiago, and 260 men under the command of Magellan slipped their berths at Seville and sailed down the Rio Guadalquivir and into the Atlantic. Accompanying the voyage was Antonio Pigafetta, a young and healthy Venetian nobleman eager for adventure, whose journals of the expedition constitute the main source of what we know to day about this precedent-setting expedition. After an epic voyage filled with extraordinary adventures, hardships, maritime disasters, and a mutiny that nearly succeeded, the fleet, reduced to three, discovered the straits, now bearing Magellan’s name, that lead to the Pacific Ocean—so christened by Magellan as his expedition happened upon that great body of water, when the storm season hadn’t yet begun. Entering the vast and calm ocean, the ships tacked their way across for more than three months with out being able to reprovision—causing untold hardships and deaths—before sighting the Marianas (present-day Guam) on March 6, 1521. Magellan and his men named it Isla de Ladrones (Isle of Thieves), for the in habitants’ light- fingered proclivities, though the in habitants, for ebears of latter-day Chamorros, had been generous with their food. (This could have simply been a case of cultural misunderstanding: what the Europeans considered theft, the islanders thought of as sharing.) In punishment, Magellan or dered his men to burn some of the natives’ homes, killing seven men as a result. According to Pigafetta’s account, crew members who were ill asked that the entrails of a dead man be brought to them, “for immediately they would be healed”—a request that suggests pre-Christian beliefs coexisting with Christian ones on board. Magellan and his men pushed on and, on March 16, 1521, came across Homonhon, an isle off the Pacific-facing coast of Samar, a much larger island in the archipelago yet to be named the Philippines. The ships had sailed into the eastern flank of the Visayas, the archipelago’s central region. That day being the feast day of a saint, Magellan christened the islands aptly enough the Archipelago of San Lazaro, as the for tuitous landfall meant a revival of their lives, if not their for tunes. The Visayans, whom the Iberians subsequently referred to as pintados, for the elaborate tattoos that marked them, proved hospitable. From Homonhon the expedition proceeded to the island of Limasawa south of Samar. There several large boats approached the ships, boats that Pigafetta noted were called balanghai and that on the average measured approximately eighteen meters long. Pigafetta, whose journals provide a fascinating, first-hand account of this historic voyage, loved to make lists, and in one, he enumerated words from the language of the islanders—words that are used to this day. In another, he itemized products and domestic animals he had come across, among them: rice, ginger, or anges, lemons, sugar cane, garlic, honey, bananas, corn, millet, citrus, wax, goats, chickens, dogs, cats, and pigs. In addition, there were cinnamon, pepper, nutmeg—all valuable spices—as well as, and more importantly, gold. He noted the practice of betel-nut chewing and cockfighting—both common in Southeast Asia. But of all the tropical produce that Pigafetta got to know, it was the coconut that so enchanted him he deemed it the near-perfect food. He was convinced two trees could sustain a family of ten for a hundred years. On Easter Sunday, in a portent of impending Christianity, the priest accompanying the expedition celebrated mass on Limasawa. Thence, guided by Limasawa’s datu (a lesser-ranked ally of the datu of Butuan, the much larger port in Mindanao, further south), the ships proceeded to the busy port city of Cebu, arriving on April 7. Acting as the translator and in terpreter was Magellan’s Christianized Malayan slave, Enrique de Malacca—Malacca being the port and slave market where Magellan had bought him. Malacca was Southeast Asia’s principal entrepot, a vital transshipping port in the trade routes that extended on one end from the Mediterranean to southern China, at the other"
    },
    "model_answer": "Ang unang isla na tinangka ng ekspedisyon ni Magellan sa Pilipinas ay ang Homonhon sa Samar.  [Source: \"Spanish Ship Isasabuhay Biyahe Ni Magellan\", March 11, 2021. Retrieved from https://www.abante.com.ph/spanish-ship-isasabuhay-biyahe-ni-magellan/] ; [Source: Sinu-sino ang mga nanakop sa pilipinas (Wikipedia, accessed July 05, 2013)]; [Source: A History Of The Philippines, p. 41] ; [Source: \"Ang Pagkakatuklas Ni Magellan Sa Pilipinas\", March 16, 2015. Retrieved from https://balita.net.ph/2015/03/16/ang-pagkakatuklas-ni-magellan-sa-pilipinas/]",
    "contexts": [
      "Ayon sa Fundación Elkano, Nobyembre 1520 nang simulant ni Magellan ang ekspedisyon sa Pasipiko sa loob ng 100 araw, nang walang nakikitang anumang senyales ng kalupaan. Hanggang sa makita umano ng kanilang grupo ang Mariana Islands noong Marso 6, 1521. Naglayag sila sa Pilipinas, na unang pinangalanan bilang Islas de San Lazaro, nang dumaong sa Homonhom sa Eastern Samar, sa parehong araw ng kapistahan ni Saint Lazarus of Bethany",
      "Dito sinubukan niyang pumunta kay Haring Carlos I. at magtanong dito. Pumayag si Carlos I. at pumirma noong Setyembre. Dumaong sina Magellan kasama ang limang barko. Mga Unang Ekspedisyon sa Pilipinas Unang nakarating ang mga Europeo sa Pilipinas sa pagdating ng expedisyon ng mga Español na pinamunuan ng, in angkin ito para sa Espanya, at binigyan ito ng pangalan na Islas de San Lazaro. Magiliw siyang nakipag-ugnayan sa ilang mga lokal na",
      "Magellan and his men pushed on and, on March 16, 1521, came across Homonhon, an isle off the Pacific-facing coast of Samar, a much larger island in the archipelago yet to be named the Philippines. The ships had sailed into the eastern flank of the Visayas, the archipelago’s central region. That day being the feast day of a saint, Magellan christened the islands aptly enough the Archipelago of San Lazaro, as the for tuitous landfall meant a revival of their lives, if not their for tunes",
      "Natuklasan niya ang isang lagusan (na kalaunang ipinangalan sa kanya bilang Strait of Magellan) sa dulong timog ng South America at naging unang European na tumawid ng Pacific Ocean. Dumating ang kanyang nalalabing mga barko sa isla ng Homonhon sa Samar noong Marso 16, 1521, pinangalanan iyon na Isla San Lazaro, nagtirik ng krus, at in angkin para sa Spain. Kalaunan, pinangalanan ang mga isla na Filipinas bilang parangal kay King Philip ng Spain"
    ]
  },
  {
    "question": "What was the name of Rajah Humabon's queen?",
    "ground_truth": "Juana",
    "metadata": {
      "cultural_golden_answer": "The remarkable Enrique de Malacca, who was likely from the central part of the archipelago and spoke the local language, thus becoming a testament to Filipino resilience and cultural adaptability.",
      "language": "english",
      "cultural_relevance": 0.9,
      "chunk_index": 1,
      "ground_truth_context": ". In another, he itemized products and domestic animals he had come across, among them: rice, ginger, or anges, lemons, sugar cane, garlic, honey, bananas, corn, millet, citrus, wax, goats, chickens, dogs, cats, and pigs. In addition, there were cinnamon, pepper, nutmeg—all valuable spices—as well as, and more importantly, gold. He noted the practice of betel-nut chewing and cockfighting—both common in Southeast Asia. But of all the tropical produce that Pigafetta got to know, it was the coconut that so enchanted him he deemed it the near-perfect food. He was convinced two trees could sustain a family of ten for a hundred years. On Easter Sunday, in a portent of impending Christianity, the priest accompanying the expedition celebrated mass on Limasawa. Thence, guided by Limasawa’s datu (a lesser-ranked ally of the datu of Butuan, the much larger port in Mindanao, further south), the ships proceeded to the busy port city of Cebu, arriving on April 7. Acting as the translator and in terpreter was Magellan’s Christianized Malayan slave, Enrique de Malacca—Malacca being the port and slave market where Magellan had bought him. Malacca was Southeast Asia’s principal entrepot, a vital transshipping port in the trade routes that extended on one end from the Mediterranean to southern China, at the other. Enrique may not necessarily have been from Malacca, or from the Moluccas. The young man, as it turned out, not only looked like these pre-colonial Filipinos, he also spoke their to ngue. He may very well have been from the central part of the archipelago. And in deed, if he were, this slave (whom Magellan in his will decreed be set free upon his death) would the refore have been the first known in dividual to have completed a circuit of the Earth before Sebastian Elcano and the few survivors of the Magellan expedition returned to Sevilla in 1522. Cebu was ruled by Rajah Humabon. After a short period of unease between the pragmatic native king and the imperious navigator—the for mer had in itially demanded tribute from the latter, as was traditionally expected from ships bringing goods—the two sides settled into what presumably was an amicable relationship. It helped that a Muslim trader from Siam, knowing something about the rather brutal history of conquistadors, had advised Humabon to come to some sort of accommodation with Magellan. Consequently, Rajah Humabon agreed to an alliance with Spain, wherein the rajah not only acknowledged Spanish sovereignty but also converted to the Catholic faith, along with his principal consort and his subjects. Humabon was baptized Carlos, after the Spanish monarch, and Humabon’s queen, Juana, after Carlos’s mother, Juana la Loca (Joanna the Mad, so named for her ment al in stability and her bizarre, fetishistic desire to keep the corpse of her husband Philip the Handsome close by her). Newly converted, Humabon complained to Magellan about a petty ruler from nearby Mactan Island—across the straits from Cebu—by the name of Lapu Lapu who would not bow to either the cross or the Spanish crown. Given the highly decentralized nature of Southeast Asian chiefdoms and competition for trade, Humabon may very well have enlisted the unsuspecting Magellan in a strategy to get rid of his rival. Despite the sage advice of his of ficers, who rightfully pointed out that they had no business in terfering in local affairs, and, more importantly, feared losing all their hard-earned gains, Magellan decided to teach Lapu Lapu a lesson, with only sixty men—all volunteers—in three long boats, and in the process impress his native ally no end. Magellan had by now been in fected with evangelical zeal, his head full of grandiose notions of lording it over the archipelago. Being viceroy of the islands would have made him and his family unbelievably rich and vindicated his defection to the Spanish court. Humabon of fered Magellan a contingent of his warriors, but Magellan disdained the of fer, boasting that one of his men, clad in body armor, was worth a hundred of the enemy. He had earlier arranged a display showing his armored men repelling blows. Besides, his ships’ cannon were larger and more powerful than the lantakas, or artillery, of the enemy. It was an empty boast: as dawn broke on April 27, 1521, Magellan and his armed party of sixty waded ashore on Mactan and there engaged Lapu Lapu and his men. Outnumbered and outmaneuvered—Lapu Lapu had tricked his enemies into coming in at low tide, so the Spanish ships were anchored too far out for their cannon to be effective— the to ugh, forty-one-year-old Magellan paid for his adventurism with his life, cut down on the beach as his companions, their ranks depleted, fled to the longboats. Pigafetta, who had fought that day, mourned Magellan’s death, calling him “our mirror, our light, our comfort, and our true guide.” The aftermath of the battle was bloody as well. Enrique, wounded at the battle on Mactan, had been humiliated by Duarte Barbosa, now one of the two leaders of the expedition (the other being João Serrão), who refused to give him his freedom, as promised in Magellan’s will. Enrique convinced Humabon to in vite the of ficers and crew to a banquet. There, in a scene worthy of Shakespeare, Humabon’s guards slaughtered twenty-six of them, in cluding Barbosa. Humabon was willing to have Serrão ransomed for the gifts the rajah had given Magellan, but João Carvalho, who had escaped the massacre and assumed command, refused. Serrão, according to Pigafetta, “prayed God that at the day of judgment he would demand his soul of his friend João Carvalho.” The survivors sailed off in the three ships, but scuttled one off the waters of Bohol Island, leaving only the Victoria and the Trinidad. And only the Victoria, of the or iginal five, completed the circumnavigation of the globe, limping into Sanlúcar de Barrameda in 1522, three years after the expedition set out. Just eighteen of the or iginal complement of 260 men survived. With Sebastian Elcano as the pilot, the crew was said to have been the first to circumnavigate the globe. But the slave Enrique de Malacca may have beaten them to the punch. The voyage had ended disastrously for Magellan and all the hardy souls who perished on that mind-blowing trip, but it prepared the way for four other Spanish expeditions. A FTER M AGELLAN, THE D ELUGE The first post-Magellanic expedition was headed by Francisco García Jofre de Loaísa, with Elcano as his second-in-command. Seven ships and 450 men set off in 1525 from Coruña, Spain. Unfortunately, it was a voyage marked, even more than Magellan’s, by disaster. By the time it had navigated its way through the Straits of Magellan, only two vessels were left. Subsequently, Loaísa and Elcano died within a few days of each other. Two more successors perished. The last, Hernando de la Torre, steered the ships to Mindanao and the nce to the Moluccas, where the crew was imprisoned by the Portuguese"
    },
    "model_answer": "Walang sapat na impormasyon sa mga dokumentong ito tungkol sa pangalan ng reyna ni Rajah Humabon.",
    "contexts": []
  },
  {
    "question": "Saang dalawang lugar nagtatag ng kanilang pananatili si Legazpi?",
    "ground_truth": "Cebu at Panay Island",
    "metadata": {
      "cultural_golden_answer": "Ang Cebu ay ang unang lungsod na kinubkob ng mga mananakop na Espanyol, at dito mismo sinimulan ng dating Gobernador-Heneral na si Miguel López de Legazpi ang pagtatatag ng kolonya sa Pilipinas. Ang lugar na ito ay pinapanigan ng kultura ng Pilipino at naging bahagi ng kasaysayan natin.",
      "language": "filipino",
      "cultural_relevance": 0.9,
      "chunk_index": 2,
      "ground_truth_context": ". And only the Victoria, of the or iginal five, completed the circumnavigation of the globe, limping into Sanlúcar de Barrameda in 1522, three years after the expedition set out. Just eighteen of the or iginal complement of 260 men survived. With Sebastian Elcano as the pilot, the crew was said to have been the first to circumnavigate the globe. But the slave Enrique de Malacca may have beaten them to the punch. The voyage had ended disastrously for Magellan and all the hardy souls who perished on that mind-blowing trip, but it prepared the way for four other Spanish expeditions. A FTER M AGELLAN, THE D ELUGE The first post-Magellanic expedition was headed by Francisco García Jofre de Loaísa, with Elcano as his second-in-command. Seven ships and 450 men set off in 1525 from Coruña, Spain. Unfortunately, it was a voyage marked, even more than Magellan’s, by disaster. By the time it had navigated its way through the Straits of Magellan, only two vessels were left. Subsequently, Loaísa and Elcano died within a few days of each other. Two more successors perished. The last, Hernando de la Torre, steered the ships to Mindanao and the nce to the Moluccas, where the crew was imprisoned by the Portuguese. Few survived, only eight returning to Spain in 1536, in cluding Andrés de Urdaneta, who would return with the Legazpi expedition. As directed and or ganized by Hernán Cortés, famed conqueror of the Aztec empire, the second expedition of three ships and 110 men, under the command of Alvaro de Saavedra, departed Mexico in 1527—the first Spanish voyage to Asia launched from the New World. Saavedra bore a royal letter for the ruler of Cebu, apologizing for Magellan’s conduct and at the same time seeking to ransom any Spanish prisoners the good rajah might be holding. But only one ship reached Mindanao. Unable to locate Cebu, Saavedra sailed to Tidore in the Moluccas, where, meeting the remnants of the Loaísa expedition, he and his men were taken captive by the Portuguese. Released, he set sail for Mexico, but died at sea. In the meantime, under the Treaty of Zaragoza of 1529—yet another renegotiation of the line of demarcation—Madrid gave up its claims to the Moluccas in return for 350,000 ducats from the Portuguese. Being west of this demarcation, the Philippines was the or etically within the ambit of Portugal, but Spanish at tempts to colonize the archipelago did not cease, nor did Portuguese harassment of the Spanish, until it became clear that the Spanish had successfully colonized the islands. The third expedition, made up of six ships and 300 men, set sail from Navidad, Mexico, on November 1, 1542, under Ruy López de Villalobos. After landfall in Palau and the Carolinas, the expedition arrived at the east coast of Mindanao in 1543. In Sarangani, the men started a colony, but lack of food for ced them to sail to Tidore, where, not surprisingly, the Portuguese held them captive, and where Villalobos expired, at tended to by the brilliant Jesuit missionary and future saint, Francis Xavier, later to head to Japan, the nce to China, on pioneering evangelical missions. It was the Villalobos expedition that christened the islands Filipinas, after Felipe, the son of Charles I. The final and most successful expedition was commanded by Miguel López de Legazpi, a Spanish Basque conquistador who had arrived in Mexico in 1530 and prospered. By the time of the Legazpi voyage, Crown Prince Felipe, or Philip II, had grown up and now occupied the Spanish throne. A zealous Catholic and partisan of Mary, Queen of Scots, claimant to England’s throne, he detested the English Protestant Queen Elizabeth. In 1588, Philip assembled a mighty fleet of warships, known simply as the Spanish Armada, consisting of 130 ships, with 8,000 sailors and 18,000 soldiers. Its purpose was to in vade England, but Philip’s much-vaunted armada was humiliated by the British navy in a series of engagements. The royal treasury had in curred tremendous expenses in assembling the Armada, and new sources of revenue, such as the Philippines promised, would be in valuable. Legazpi’s mission, as all the previous ones, was to secure a base in Southeast Asia and the nce establish a route back to Mexico, so that precious cargo could be transported sans in terference from the Portuguese. As with the other would-be conquistadors, Legazpi would be richly rewarded with money, trade concessions, and land. In the agreement between the Spanish monarch and the conquistadores, the Crown reserved certain rights in the colonies while the latter enjoyed the spoils of conquest. Thus, the desire for riches and prestige furnished powerful in centives for the men who undertook such dangerous expeditions, as they did for the royal court. Legazpi’s expedition left Navidad on November 21, 1564. Urdaneta, now a member of the Augustinian or der, was coaxed out of retirement from a monastery in Mexico to pilot successfully the fleet to Cebu. (On board were six other members of the Augustinian Order, the first to undertake the Christianization of the islands.) Urdaneta then returned to Mexico in 1565, charting the route to be used in the galleon trade between Manila and Mexico that would be the new colony’s financial lifeline for two centuries. Other key members of the Legazpi expedition were Martín De Goiti, Legazpi’s grandson Juan de Salcedo, and Miguel de Loarca, who was to write Relación de las Islas Filipinas, a detailed account of his stay in the Philippines. Legazpi and his men began a sustained and ultimately successful effort to colonize the islands, with the Spanish Basque becoming the first governor general of this latest addition to the Spanish Empire. Guided by Spanish colonial experience in both Americas and decrees from Madrid, Legazpi, as well as his successors, devised and enacted certain measures for the pacification and administrative control of the archipelago and to strengthen and protect Spanish sovereignty from enemies within and with out. The colonial apparatus set in place was in tended primarily to facilitate the exploitation, rather than the progressive development, of the islands for the benefit of the Crown and, in the process, enrich those who had claimed and ruled the territory on behalf of the monarch. From the outset the in digenous population was viewed through the prism of racism and a deeply held sense of cultural superiority. Unfortunately, having to deal with an in ferior race was the cost of doing business. Legazpi, like Magellan, in itially based himself in Cebu, which the Spanish christened Santissimo Nombre de Jesus or the Most Holy Name of Jesus after a statue of the Santo Niño, or Holy Infant, a gift from Magellan to Rajah Humabon’s Queen Juana, was found by a soldier in a hut. Harassed by the Portuguese, who believed that the islands fell within their side of the demarcation, Legazpi moved to nearby and more easily defended Panay Island"
    },
    "model_answer": "Walang sapat na impormasyon sa mga dokumentong ito tungkol sa dalawang lugar kung saan nagtatag ng kanilang pananatili si Legazpi.",
    "contexts": []
  },
  {
    "question": "What was the name of the city that became the seat of Spanish power in the islands after Suleiman's defeat?",
    "ground_truth": "Manila",
    "metadata": {
      "cultural_golden_answer": "Manila, which would become a significant cultural and historical hub for Filipinos, with its own unique blend of Spanish and indigenous influences.",
      "language": "english",
      "cultural_relevance": 0.9,
      "chunk_index": 3,
      "ground_truth_context": ". Guided by Spanish colonial experience in both Americas and decrees from Madrid, Legazpi, as well as his successors, devised and enacted certain measures for the pacification and administrative control of the archipelago and to strengthen and protect Spanish sovereignty from enemies within and with out. The colonial apparatus set in place was in tended primarily to facilitate the exploitation, rather than the progressive development, of the islands for the benefit of the Crown and, in the process, enrich those who had claimed and ruled the territory on behalf of the monarch. From the outset the in digenous population was viewed through the prism of racism and a deeply held sense of cultural superiority. Unfortunately, having to deal with an in ferior race was the cost of doing business. Legazpi, like Magellan, in itially based himself in Cebu, which the Spanish christened Santissimo Nombre de Jesus or the Most Holy Name of Jesus after a statue of the Santo Niño, or Holy Infant, a gift from Magellan to Rajah Humabon’s Queen Juana, was found by a soldier in a hut. Harassed by the Portuguese, who believed that the islands fell within their side of the demarcation, Legazpi moved to nearby and more easily defended Panay Island. Seeking, as Magellan did, to strengthen his alliance with local datus, Legazpi entered into a blood compact in March 1565 with two chiefs of Bohol Island, Datu Sikatuna and Datu Sigala. It was a move precipitated by the fact that two years earlier, in 1563, according to Legazpi’s account of the voyage, the Portuguese had, under the guise of friendship, plundered Bohol. The datus and their followers were the refore understandably wary of these strangers who resembled the Portuguese. Hearing of a larger settlement up north blessed with an excellent bay, on the island of Luzon, Legazpi sent an exploratory mission, under the command of Goiti and De Salcedo. That settlement was Maynila, at the mouth of the Pasig River, its ruler Rajah Suleiman. Maynila was a large, for tified port, with cannons for ged in foundries right by Suleiman’s royal compound. The Pasig was an important artery leading to the lush lands east and south of Maynila, as well as to the country’s largest freshwater lake, later named Laguna de Bay, and passage upriver required tribute paid to Maynila’s ruler. Prior to 1565, Muslim port communities had already established the mselves north of Mindanao, in Mindoro, and in Luzon, principally in the Maynila region and in what is now the province of Pampanga. The datus in Maynila and Tondo (across the river) were converts to the Muslim faith. Loarca noted that the river delta in habitants were Moros — the Spanish word for “Moors,” or Muslims—and that they had the art of writing, in dicative of the fact that pre-Hispanic Maynilans possessed not only their own script, but were aware of Bornean and Arabic writing. The Goiti mission made overtures to Rajah Suleiman, but suspicious of the Spanish, the rajah rejected these, and in evitably fighting broke out. Goiti emerged triumphant and Maynila was burned to the ground. On the departure of the Spanish for Panay, however, Suleiman and his men returned to rebuild the port. The next year, 1571, the Spanish returned, this time with Legazpi himself in command of a larger force that in cluded twenty-seven boats (most supplied by the Visayans), 280 Spaniards, and a contingent of pintados, or Visayan warriors. Rather than yield, Suleiman or dered Maynila razed once more. Later on Suleiman would assemble a coalition of like-minded datus from barangays in nearby Bulacan and Pampanga, but the native force was decisively defeated. With Suleiman’s defeat, on June 3, 1572, Maynila was designated the seat of Spanish power in the islands, its name streamlined to Manila. Strategically located and fronting a magnificent bay with a natural, deep- water harbor, Manila was granted a royal charter, which described it as the “distinguished and ever loyal city of Manila.” Inhabitants of the new city were to be limited to Spaniards. In the process of this gentrification-cum-segregation, the native residents—disparagingly called “Indios”—were for ced to resettle elsewhere. Manila was to become the capital of the newest colony, made up of Luzon, Visayas, and parts of Mindanao. While the colony was for mally named “El Nuevo Reyno de Castilla,” most preferred the easier-to-say Filipinas, and that is what stuck. Acquiring its own coat-of-arms, Manila was planned as a European-type city, with a grid of streets and a main plaza, around which were to be the cathedral and various important public edifices. Sites were designated for monasteries, schools, and hospitals, as well as for a fort (the extant Fort Santiago), which would have its own smaller plaza. By 1603, for midable stone walls and a moat encircled the city, hence the name of Intramuros. By then there were approximately 600 houses within, while another 600 houses were located with out. One estimate of the archipelago’s population at the time put it at close to a million—a low-population density (Sumatra alone had a population of 2,400,000). Probable causes of this were the agricultural labor expected of women, abortion, disease, and warfare. With Manila now in Spanish hands, and with smaller Spanish settlements in Cebu and Panay, Legazpi turned to the business of expanding and consolidating Spanish sovereignty. His in trepid grandson Juan De Salcedo headed an expeditionary force that traveled as far south as the Bicol Peninsula, along the way winning some 26,000 Tagalogs over to the Spanish Crown, in variably by persuading their local datus that it was in their in terest to be allies rather than foes. In Paracale, Bicol, they came across what every conquistador dreams of: gold mines. Subsequently, Legazpi or dered De Salcedo north, where, with the aid of Rajah Lakandula, ruler of Tondo and uncle of the impetuous Suleiman, he was no less successful, putting down resistance in the provinces of Zambales, Pangasinan, and the Ilocos region. During his sojourn in the tribal lands of the Ilocanos, Villa Fernandina (named in honor of Fernando, eldest son of Philip II) was founded. It is now the city of Vigan, capital of the province of Ilocos Sur. Though harried by the Portuguese, perhaps the greatest threat to early Spanish dominion came from the seagoing Chinese warlord Limahong, who appeared off Manila in late 1574, commanding a flotilla of sixty-two warships, 2,000 warriors, and as many seamen, along with artisans, farmers, and women. By this time, Legazpi had died of a heart at tack, succeeded by Guido de Lavezares. Confident that he could overwhelm the Spanish, Limahong sent an at tack force of 600 men, commanded by his Japanese lieutenant with the Sinicized name of Sioco. Working their way from the city’s southern environs, Sioco and his men laid waste to the to wns in their path, among them Malate, now a neighborhood of modern Manila"
    },
    "model_answer": "Maynila was designated the seat of Spanish power in the islands after Suleiman’s defeat on June 3, 1572.  [Source: A History Of The Philippines, p. 47]",
    "contexts": [
      "The earliest revolt came shortly after the Spanish had made Manila the seat of their still-shaky state, at a time when Limahong was threatening to destroy the city. As described earlier, Rajahs Lakandula and Suleiman (rulers respectively of Tondo and Maynila) felt their prerogatives had been slighted by the Spanish, but De Salcedo appeased them enough so that the two rulers added their for ces to the corps of Manila’s defenders. Limahong was thus defeated",
      "By the sixteenth century, however, Butuan had declined as a trading center. Maynila, which the Spanish would make the seat of power in the islands in the late sixteenth century and shorten its name to “Manila,” constituted the preeminent settlement in Luzon, since it, with links to Muslim communities in Mindanao and Borneo, had a higher stage of political development",
      "Rather than yield, Suleiman or dered Maynila razed once more. Later on Suleiman would assemble a coalition of like-minded datus from barangays in nearby Bulacan and Pampanga, but the native force was decisively defeated. With Suleiman’s defeat, on June 3, 1572, Maynila was designated the seat of Spanish power in the islands, its name streamlined to Manila",
      "With Suleiman’s defeat, on June 3, 1572, Maynila was designated the seat of Spanish power in the islands, its name streamlined to Manila. Strategically located and fronting a magnificent bay with a natural, deep- water harbor, Manila was granted a royal charter, which described it as the “distinguished and ever loyal city of Manila.” Inhabitants of the new city were to be limited to Spaniards"
    ]
  },
  {
    "question": "Saan napunta ang kapangyarian ni Limahong?",
    "ground_truth": "Pangasinan",
    "metadata": {
      "cultural_golden_answer": "Napunta ang kapangyaring ito sa Hilagang Luzon, kung saan may matinding labanan ang mga Kapampangan at iba pang Katutubong Pilipino na sumiklab laban sa pananakop ng mga Espanyol.",
      "language": "filipino",
      "cultural_relevance": 0.9,
      "chunk_index": 4,
      "ground_truth_context": ". In Paracale, Bicol, they came across what every conquistador dreams of: gold mines. Subsequently, Legazpi or dered De Salcedo north, where, with the aid of Rajah Lakandula, ruler of Tondo and uncle of the impetuous Suleiman, he was no less successful, putting down resistance in the provinces of Zambales, Pangasinan, and the Ilocos region. During his sojourn in the tribal lands of the Ilocanos, Villa Fernandina (named in honor of Fernando, eldest son of Philip II) was founded. It is now the city of Vigan, capital of the province of Ilocos Sur. Though harried by the Portuguese, perhaps the greatest threat to early Spanish dominion came from the seagoing Chinese warlord Limahong, who appeared off Manila in late 1574, commanding a flotilla of sixty-two warships, 2,000 warriors, and as many seamen, along with artisans, farmers, and women. By this time, Legazpi had died of a heart at tack, succeeded by Guido de Lavezares. Confident that he could overwhelm the Spanish, Limahong sent an at tack force of 600 men, commanded by his Japanese lieutenant with the Sinicized name of Sioco. Working their way from the city’s southern environs, Sioco and his men laid waste to the to wns in their path, among them Malate, now a neighborhood of modern Manila. In this in itial encounter, Martín Goiti was killed, but his and his men’s stubborn resistance gained time for Manila’s defenders. The Chinese force assaulted Manila but were repulsed by the garrison there. De Salcedo, who had in the meantime marched south from Vigan—or Villa Fernandina, which he had been granted as an encomienda or district over which an appointed Spaniard ruled—arrived to take over the defense of the city just before Limahong himself, still confident of victory, landed with the bulk of his men. Complicating matters was a revolt threatened by Rajah Lakandula and Rajah Suleiman, as the conflict with Limahong loomed. The two rulers felt their prerogatives as chiefs were being ignored by the Spanish. De Salcedo won them over by promises of reforms and concessions. Together with his Filipino allies, de Salcedo and the battle-tested Spanish soldiers beat Limahong’s army back to their ships. The Chinese warlord sailed up the northwestern coast to Pangasinan, perhaps thinking to settle there, but Salcedo and his by now larger force pursued and destroyed the Chinese fleet, though Limahong escaped. The Spanish weren’t the only ones desirous of seeing the corsair dead. The Chinese imperial government had sent over a high-ranking of ficial in 1575 to request the repatriation of Limahong, though that was no longer possible. But the Spanish, under the direction of Governor General de Lavezares used the occasion to send a delegation to China, to establish friendly relations and trade. Indeed, Beijing sent over an emissary in 1576, to conclude a commercial treaty, and immigration from the Middle Kingdom was encouraged as a source of skilled and cheap labor. While friendly relations with China ensured that the Iberians didn’t need to worry about threats from Beijing, Chinese immigration would periodically contribute to rising tensions between the Spanish settlers and the growing numbers of Chinese laborers and artisans. There were at tempts to restrict the in flux to no avail. In 1603, the Crown decreed that no more than 3,000 Sangleys (from the Chinese phrase for traders) be allowed to live in the colony, proposing that ships from China be sent back “full of people. In this way they can be removed and the country cleared of them, with more gentleness and kind treatment, as has already been done with many of them.” The tensions would sometimes lead to armed uprisings and the in evitable bloodbaths that followed. Governor Arandia in 1578 might have for eseen this when he at tempted to supplant the Chinese with mestizos and a larger in flux of Spanish. But Spain was too far, and China too near, for this to succeed. And the Chinese émigrés, with a presence then as now throughout Southeast Asia, had excellent survival as well as artisanal and trading skills to flourish in an environment that was to them far more conducive to growth than in China. By the end of the sixteenth century, more than 20,000 Chinese resided in the Parian district, just outside the walls of Intramuros, outnumbering the Spanish. The rapid growth of the Chinese immigrant community made the Spanish uneasy, and when a Chinese mission arrived in Manila in 1603, desirous of obtaining gold, the suspicions of the Spanish civil authorities were easily aroused. They in stituted precautionary measures that in turn in flamed the resident Chinese, who decided, under the leadership of Juan Bautista de Vera, a Chinese convert to Catholicism, to strike the first blow. Their assault on Intramuros was repulsed, however, and the rebels fled to the mountains of Laguna and Batangas, where they were defeated by the Spanish for ces—a combination of Spaniards, Filipinos, and even some Japanese. About 23,000 Chinese were killed as a result. There were other revolts by the Chinese, for in spite of restrictive measures against their immigration, their numbers in creased steadily. In 1639, in the town of Calamba, not far south of Manila, they took up arms against the local authorities and succeeded in destroying and plundering more than twenty to wns before the rebels were defeated. In 1662, following the example of Limahong almost a century earlier, Koxinga, a Chinese warlord who had conquered Formosa, threatened to in vade Manila unless the Spanish paid him tribute. The Spanish refused, to no consequence. The Chinese threat to the Spanish would be mainly from within, but the tensions would diminish as the Han immigrant communities set down roots even as they expanded. In addition to the Chinese, the Japanese also had small communities in the islands, for, as the Chinese, though not as numerous, the Japanese had been a presence even before the arrival of the Spaniards. There were Japanese communities in a neighborhood of Manila (present-day Paco) as well as in Bulacan, and in what was to become known as La Union, a coastal province up north. Salcedo had run-ins with Japanese ships off the coast of Pangasinan in 1572, and in 1583, a Spanish captain engaged the Japanese by the mouth of the Cagayan River. In 1591, Toyotomi Hideyoshi, unifier and shogun of Japan, demanded tribute and homage, but military expeditions in Korea the next year, through which he hoped to conquer China and, later, his death, for estalled any planned in vasion. Iyeyasu Tokugawa, the succeeding shogun, worried by the threat that Christianization might undermine his rule, closed off the island nation to the gaijin, and proceeded to ban Christianity and prosecute, to the point of executions, those who had converted. Some Japanese Christians sought and were given asylum in Manila, among them some lords such as Takayama Ukon"
    },
    "model_answer": "Walang sapat na impormasyon sa mga dokumentong ito tungkol sa kapangyarian ni Limahong.",
    "contexts": []
  },
  {
    "question": "By what year did Legazpi write to the King, expressing his conviction that the islands were worth holding onto?",
    "ground_truth": "1569",
    "metadata": {
      "cultural_golden_answer": "In this letter, Legazpi highlighted the economic potential of the Philippines, mentioning the prospect of acquiring gold, pearls, and other valuable resources. This illustrates the Spanish colonial mindset towards the archipelago, prioritizing economic gain over other considerations.",
      "language": "english",
      "cultural_relevance": 0.9,
      "chunk_index": 5,
      "ground_truth_context": ". The Spanish refused, to no consequence. The Chinese threat to the Spanish would be mainly from within, but the tensions would diminish as the Han immigrant communities set down roots even as they expanded. In addition to the Chinese, the Japanese also had small communities in the islands, for, as the Chinese, though not as numerous, the Japanese had been a presence even before the arrival of the Spaniards. There were Japanese communities in a neighborhood of Manila (present-day Paco) as well as in Bulacan, and in what was to become known as La Union, a coastal province up north. Salcedo had run-ins with Japanese ships off the coast of Pangasinan in 1572, and in 1583, a Spanish captain engaged the Japanese by the mouth of the Cagayan River. In 1591, Toyotomi Hideyoshi, unifier and shogun of Japan, demanded tribute and homage, but military expeditions in Korea the next year, through which he hoped to conquer China and, later, his death, for estalled any planned in vasion. Iyeyasu Tokugawa, the succeeding shogun, worried by the threat that Christianization might undermine his rule, closed off the island nation to the gaijin, and proceeded to ban Christianity and prosecute, to the point of executions, those who had converted. Some Japanese Christians sought and were given asylum in Manila, among them some lords such as Takayama Ukon. S EVENTEENTH C ENTURY: S ETTLEMENTS T HROUGHOUT THE A RCHIPELAGO By the beginning of the seventeenth century, largely through the foundational and level-headed leadership of Legazpi, the sword arms of de Salcedo and Goiti, alliances with regional datus, and the missions established by hardy friars, the Spanish exercised sovereignty, even if only in rudimentary form, in Luzon (except for the mountainous regions up north and the eastern coast) and in much of the Visayas. By no means did this mean the disappearance of threats from with out or within. All throughout Spanish rule, such threats existed, from small- and large-scale revolts, for eign in vasions, harassment out at sea, and the ever- present threat from the Muslim south. The Protestant Dutch constituted the most serious threat to Spanish hegemony. Dutch warships threatened Manila and its surrounding settlements at least on three occasions, between 1600 and 1647, but each time were repulsed by the Spanish and their Filipino conscripts. Early on, there was some discussion as to whether it was worth keeping the islands. Legazpi, writing to the King in 1569, was convinced that the islands were worth holding onto, that “if the land is settled and peopled by Spaniards we shall be able to get plenty of gold, pearls, and other valuable articles…. [T]hus partly through commerce and partly through the articles of commerce, the settlers will in crease the wealth of the land in a short time.” Madrid finally decided to stay put, persuaded as well by the friars that the archipelago could be a base for missionary for ays to mainland Asia, and by its own ambition of extending its empire throughout the East. Indeed, from time to time, Spanish ships sailed out of the islands on exploratory expeditions or to do battle in defense of their colony. Until the eighteenth century, the Philippines served mainly as a military outpost, subsidized by grants from Nueva España, or Mexico, the galleon trade, and tribute from the in digenous population. The new colony was ruled by the Spanish king, of course, but through the viceroyalty of Mexico. The archipelago’s Governor and Captain General was to be the King’s representative in the islands, enforcer of the Patronato Real (Royal Patronage) and overseer of the King’s in terests. The Patronato Real was essentially a Crown policy that set rules for the presence and behavior of the Catholic Church in the colonies, guaranteeing that this would be under the supervision of the throne and of the particular colonial government. In effect, the clergy became part of the government, bringing about a union of church and state. As it turned out, this marriage proved to be more felicitous for the for mer than for the latter. As a reward for his success in driving away the in fidel Moors to wards the end of the fifteenth century, the Catholic King Ferdinand had asked for and received from the pope the right of patronato real over all churches to be established in the territory of the reconquista. This was exactly what the Crown wanted, and Ferdinand skillfully maneuvered the reafter to secure from the papacy extensions of his patronato to all his overseas dominions on the ground that evangelizing the heathen, or Indios, was the same as recovering Granada for Christendom. Evangelical work in the new territory thus came under royal supervision. Since the colony was to be administered from Mexico, Rome had no direct contact with the clergy in the new lands. The Spanish monarch also had veto power over the promulgation of papal bulls and exercised through his viceroys close supervision over ecclesiastics in his dominions. The Crown energetically used this prerogative, thus precipitating constant conflicts between, on one hand, Madrid and its servants, and, on the other, Rome and its men of the cloth. The Patronato Real was the primary in strument by which Spain could recruit the Church, as a complement to its rising commercial ventures. To speak of the Church in the Philippines during the Spanish regime was thus to speak of the Spanish clergy and the Spanish empire, each serving the ends of the other. Even though spreading Christianity and converting the natives to the faith was the primary justification for the Spanish presence, the king as patron of the Church in the Philippines had the authority to determine the limits of the mission territories and approve the assignment of missionaries. He also had the duty to protect them as well as provide for their support. In addition to being representatives of Rome, the friars were in effect salaried employees of the Spanish court. The supreme authority in the administration of the colonies would lie in the hands of the Council of the Indies, created by Ferdinand and reorganized by Charles in 1524. On behalf of the throne, the Council enacted laws and decrees to govern the colonies—the compilation of which came to be known as Leyes de Indias. As with other Spanish colonies, Las Islas Filipinas was to have the Real Audiencia, a legislative-judicial body. There would be a full panoply of civil servants while a separate set of of ficials managed the Spanish king’s personal estate in Las Filipinas. In sum, this Asian colony was to be governed in a manner similar to Spain’s colonies in the Americas. Encomiendas and Tributes One mechanism by which control was exercised was through the encomienda"
    },
    "model_answer": "Walang sapat na impormasyon sa mga dokumentong ito tungkol sa  [topic].",
    "contexts": []
  },
  {
    "question": "Paano ginagovero ang Las Islas Filipinas noong panahon ng mga Espanyol?",
    "ground_truth": "\"Las Islas Filipinas was to be governed in a manner similar to Spain’s colonies in the Americas.”",
    "metadata": {
      "cultural_golden_answer": "Ang sistema ng pamamahala sa Las Islas Filipinas ay isinailalim sa pamumuno ng Espanya, na may utos mula sa Madrid. Ang mga encomiendero ang nagpapanatili ng kontrol sa mga kapapayapaan at paghaharap sa anumang kaguluhan.",
      "language": "filipino",
      "cultural_relevance": 0.9,
      "chunk_index": 6,
      "ground_truth_context": ". Even though spreading Christianity and converting the natives to the faith was the primary justification for the Spanish presence, the king as patron of the Church in the Philippines had the authority to determine the limits of the mission territories and approve the assignment of missionaries. He also had the duty to protect them as well as provide for their support. In addition to being representatives of Rome, the friars were in effect salaried employees of the Spanish court. The supreme authority in the administration of the colonies would lie in the hands of the Council of the Indies, created by Ferdinand and reorganized by Charles in 1524. On behalf of the throne, the Council enacted laws and decrees to govern the colonies—the compilation of which came to be known as Leyes de Indias. As with other Spanish colonies, Las Islas Filipinas was to have the Real Audiencia, a legislative-judicial body. There would be a full panoply of civil servants while a separate set of of ficials managed the Spanish king’s personal estate in Las Filipinas. In sum, this Asian colony was to be governed in a manner similar to Spain’s colonies in the Americas. Encomiendas and Tributes One mechanism by which control was exercised was through the encomienda. An encomienda was not a land grant, but rather a system—adapted in all the Spanish colonies—under which an encomendero (the term comes from the Spanish encomendar or “to entrust”) was charged with a number of natives living within a specific geographic area whom he was supposed to in struct in the Catholic faith and the Castilian to ngue. Natives living within the encomienda were deemed subject to Spanish sovereignty, with the encomendero taking on the role of petty king. He had the power to collect tribute, basically a tax, and to expect unpaid labor, or corvée, from the in habitants of the encomienda. The tribute furnished the revenue for such expenses as those of the missionaries imparting Christian doctrine and running the encomienda. It provided the encomendero and his family with their means of living. The encomienda was usually the reward for military men who had participated in the conquest and could be in herited for two, sometimes three, generations. After the limit had been reached, the land, or more accurately, control over it, reverted to the Crown. The movement of the natives was regulated to ensure a steady supply of labor and the systematic and prompt collection of the tribute. The encomendero was charged with ensuring the well-being of the Filipinos, a duty that in cluded a good Christian education. Unfortunately, the battle-tested encomenderos treated the natives more like delinquent military units than a community of human beings, abusing them by exacting both tribute and labor. The encomienda system also gave the encomenderos a pretext for seizing land from barangay in habitants. The system was finally abolished in 1720, though in the mid-nineteenth century, there still existed eleven encomiendas. The encomienda was an important tool in the early stages of Spanish colonization, rewarding those who had served the Spanish throne well. (Such was the case with Miguel de Loarca, an early chronicler of the Spanish conquest and member of the Legazpi expedition, given an encomienda on Panay island.) While the encomienda encompassed native settlements, it was not to be confused with a hacienda. The latter meant that ownership of the land resided with an in dividual, and those working the land were his tenants. He could dispose of the land freely, and his family in herited the land. In contrast, ownership of land within an encomienda remained with in dividuals and their families. Upon the death of a landowner, rights to the land passed on to his or her heirs. In the absence of heirs, ownership of the land passed to the barangay or town, which could then utilize that property to help pay for the town’s tributes. The encomenderos enjoyed their privileges fully but barely fulfilled their obligations. To them, Filipinos were little more than a resource to be exploited. Far from the administrative reach of Spain and even of Mexico, and with the colonial state apparatus stretched thinly, an encomendero was and usually did act like a petty tyrant. He in variably demanded that the Indios in his encomienda serve him and, if he didn’t get what he wanted, would punish them. According to the friar Martín de Rada’s account, “We have gone everywhere with the mailed hand; and we have required the people to be friends, and then to give us tribute. At times war has been declared against them, because they did not give as much as was demanded.” De Rada characterized the tribute demands as “excessive” and reported that the encomenderos “maintain stocks, in which they keep as prisoners the chiefs … who do not supply the amount of tribute.” Tribute was exacted from males between the ages of nineteen and sixty. Payment of tribute from slaves owned by the native nobility was required as well. If the slave was a sagigilid, then his or her master paid the tribute. A namamahay, on the other hand, living apart from the master, had to shoulder the tribute. (These conditions applied as well to the Spanish who did have slaves, though later they were for bidden to acquire them.) The encomendero kept a quarter of the tribute, a quarter, went to the friars, and the balance to the colonial government. In turn, the encomendero maintained peace and or der, helped the missionaries in their apostolic work and ensured the encomienda’s readiness to come to the defense of the colony, should this be required. In addition, the local population was obliged to render a certain amount of personal service to the Spanish, whether to the encomendero, the gobernadorcillo (“little governor” essentially the town mayor), or the parish priest. Men between the ages of sixteen and sixty were expected to donate their labor, known as polos y servicios, for forty days each year to so-called community projects. These services ranged from servant work and the supply of foodstuffs to shipbuilding and military service, which in turn could be anything from crewing on a warship to working in artillery units. The exaction of for ced labor—especially in the felling of trees and the building of ships—that continually disrupted livelihoods (such as working on one’s land), would be a constant irritant to the subject populace and perpetual in citement to rebellion. By the time of Legazpi’s death of a heart at tack in 1572, he had assigned 143 encomiendas to his men. Guido de Lavezares, his successor, not only assigned new encomiendas but reassigned those that fell vacant, thus disregarding explicit or ders that such vacancies revert to the Crown. Once an encomienda did fall under the jurisdiction of the Crown, it was looked after by an alcalde mayor, who collected the tributes and answered only to Manila"
    },
    "model_answer": "Noong panahon ng mga Espanyol, ang pamahalaan sa Las Islas Filipinas ay isang kolonyal na sistema na pinamumunuan ng isang Gobernador Heneral na kinakatawan ang hari ng Espanya. Ang Gobernador Heneral ay may ganap na kapangyarihan at responsable sa lahat ng aspeto ng pamahalaan, mula sa militar hanggang sa ekonomiya.  \n\nAng mga alkalde o pangalawang pinuno ay itinalaga sa iba't ibang lalawigan upang matulungan ang Gobernador Heneral sa pagpapatupad ng batas at pamamahala ng lokal na pamayanan.\n\n[Source: \"Bago naging Pilipinas ang Pilipinas\", June 22, 2011. Retrieved from https://data2.gmanews.tv/881/gno/story/224188]",
    "contexts": [
      "Ang iba ay tinawag itong Islas del Poniente, at mayroon ding tumawag na Islas del Oriente at Islas de Luzones. Taong 1543 nang marating ni Ruy López de Villalobos ang bahagi ng Samar/Leyte at tinawag niya itong “Filipenas,\" bilang handog sa hari ng Espanya na si King Philip II. Nang magsimula ang pananakop ng mga Kastila sa Pilipinas at magtayo ng kanilang balwarte sa Maynila, tinawag ni Miguel Lopez de Legazpi na Islas Filipinas ang buong bansa noong 1565"
    ]
  },
  {
    "question": "What was a significant impact of the Spanish colonization on Filipino society?",
    "ground_truth": "The local populations wound up impoverished and degraded—conditions they now had to endure regularly.",
    "metadata": {
      "cultural_golden_answer": "This phenomenon is reflective of the profound disruption caused by the encomienda system, which not only extracted labor and tributes but also eroded traditional social structures and the livelihoods of Filipinos. The experience of being 'impoverished and degraded' resonates with the historical narratives of Filipino resilience in the face of colonialism, where communities were forced to adapt and survive under oppressive conditions.",
      "language": "english",
      "cultural_relevance": 0.9,
      "chunk_index": 7,
      "ground_truth_context": ". In addition, the local population was obliged to render a certain amount of personal service to the Spanish, whether to the encomendero, the gobernadorcillo (“little governor” essentially the town mayor), or the parish priest. Men between the ages of sixteen and sixty were expected to donate their labor, known as polos y servicios, for forty days each year to so-called community projects. These services ranged from servant work and the supply of foodstuffs to shipbuilding and military service, which in turn could be anything from crewing on a warship to working in artillery units. The exaction of for ced labor—especially in the felling of trees and the building of ships—that continually disrupted livelihoods (such as working on one’s land), would be a constant irritant to the subject populace and perpetual in citement to rebellion. By the time of Legazpi’s death of a heart at tack in 1572, he had assigned 143 encomiendas to his men. Guido de Lavezares, his successor, not only assigned new encomiendas but reassigned those that fell vacant, thus disregarding explicit or ders that such vacancies revert to the Crown. Once an encomienda did fall under the jurisdiction of the Crown, it was looked after by an alcalde mayor, who collected the tributes and answered only to Manila. Such were the abuses and cruel exactions from the encomenderos, and later from the various government of ficials who would take over their functions, that the local populations wound up impoverished and degraded—conditions they now had to endure regularly and so very different from the lives they had led prior to Spanish rule. In many in stances, the conditions approached those of slavery, leading friars to complain—though, as the friars the mselves grew to be very much a part of the colonial establishment, these diminished as their own abusive behavior in creased. By midseventeenth century, as more and more administrative positions were taken over by the civil government, the number of private encomiendas dwindled with the corresponding in crease in Crown lands. Keeping the Filipinos in Line Combining the exactions of tribute and physical labor with the imperative of gaining converts to the Catholic faith demanded a framework for control. In practical terms, this meant in tegrating the or iginal barangay into such a framework. Given how few the Spaniards were, and how much larger the native population, how was this to be accomplished? Part of the answer lay in resettlement, or reducción, wherein a large number of barangays lost their autonomy and were consolidated to form pueblos, the agglomeration of which, in turn, constituted the provinces of the new dispensation. In Spain’s South American colonies, resettlement was implemented jointly by church and state. In the Philippines friars shouldered the lion’s share of the burden. It was only natural that there would be opposition to the resettlement program, for it meant whole villages being uprooted from areas where they had their fields and lived for generations. A number of techniques were employed by the clergy, and by the civil authorities as well, to convince the reluctant native to move, such as gifts of housing within the reducciónes. Barangay chiefs were given titles and awarded honors. Too, the the at ricality of church rites—from the saying of Mass to the administering of the sacraments—seemed to have been another at traction. Otherwise, backed by soldiers, the friars resorted to threats. Quite of ten, aware of the power of the friars, in habitants of barangays would elect resettlement under the charge of the religious to secure protection from the oppression and cruelty of the encomenderos. Some sort of compromise allowed those still reluctant to move into the reducción itself to live in nearby areas, giving rise to the poblacíon (town) and barrio (outlying district) system which continues to this day. The church in each poblacíon symbolized the power of the colonial state as much as the municipio, or town hall, the seat of civil authority, and served as the focal point of the cultural and social life of the town. Similar to that of Intramuros, the layout of each pueblo centered on a town plaza, around which were situated the church-convent, the municipio, and la escuela or schoolhouse, embodying the hierarchy in colonial society. Naturally, the homes of the town’s more prominent citizens—members of the principalia, or power-holders—were located at or near the plaza, a nod to their importance. As go-betweens for both the colonizer and the native population, the principalia identified and were identified with those above them, their in creasing wealth creating a gap separating them from the rest of their countrymen and leading to a class structure more pronounced than in pre-colonial days. More of ten than not, these of ficials were drawn from the ranks of the pre-Hispanic elite—ensuring the survival of a significant portion of the old ruling class. It was lucrative for for mer datus to be believers not only in the faith of the church but in that of the Spanish state as well. The highest position open to the Filipino was that of gobernadorcillo, the equivalent of town mayor. He was the colonial state’s point man, as it were, collecting tributes and mobilizing labor for government projects. Any shortfall he had to shoulder, otherwise he could be fined or, worse, imprisoned. The advantage of course was that the system could be gamed so that the position provided the of ficial a steady and relatively easy means of making money. The new settlement pattern was partly determined by the notion that every resident live abajo de las campanas, “under the bells,” or within hearing distance of the church. Being able to hear the bells meant being able duly and faithfully to at tend mass, and respond to a call to arms should the need arise. More importantly, it placed a majority of the town’s in habitants within the immediate or bit of the cleric, ensuring that the people had to be in a Spanish friar’s doctrina, or mission station, for their in struction in the faith. There were those who, desiring not to live too close to the town center, moved to the surrounding barrios where they straddled two worlds, that of their traditional ways and that of the colonizer and learned early on how to move easily between two cultures, in effect creating a third space. They lived in subordinate villages or barrios and in even smaller communities called sitios. There was a practical reason for this: many resisted moving far from their fields. The clergy adapted by constructing chapels in the larger villages and making periodic visits to say mass and teach the catechism, which practice came to be known as visita. Native life under the colonial regime acquired a complexity not heretofore known"
    },
    "model_answer": "Walang sapat na impormasyon sa mga dokumentong ito tungkol sa significant impact ng Spanish colonization on Filipino society.",
    "contexts": []
  },
  {
    "question": "Sino ang nagsabi na “Sovereignty and adjudication ‘by natural right belong to the Indios and neither the King nor the Pope can take it away from them…. the Indios are as free in their lands as the Spaniards are in theirs, and their liberty is not taken away by the King or by the Gospel” ?",
    "ground_truth": "Domingo de Salazar, ang unang Obispo ng Maynila,  sinabi ito sa isang konseho ng mga pari noong 1582.",
    "metadata": {
      "cultural_golden_answer": "Sa katunayan, may mas malalim na kakaibahan sa pagitan ng simbahan at pamahalaan noong panahon ng kolonyalismo sa Pilipinas, dahil ang mga prinsipyo ng relihiyon ay hindi naging ganap na sinamahan ng mga praktisasyon ng mga administrador ng kolonya. Ang paksa na ito ay isang mahalagang bahagi ng kasaysayan ng Pilipinas, kung saan ang mga tradisyong relihiyoso at sibil ay umiiral nang magkakasama.",
      "language": "filipino",
      "cultural_relevance": 0.9,
      "chunk_index": 8,
      "ground_truth_context": ". The new settlement pattern was partly determined by the notion that every resident live abajo de las campanas, “under the bells,” or within hearing distance of the church. Being able to hear the bells meant being able duly and faithfully to at tend mass, and respond to a call to arms should the need arise. More importantly, it placed a majority of the town’s in habitants within the immediate or bit of the cleric, ensuring that the people had to be in a Spanish friar’s doctrina, or mission station, for their in struction in the faith. There were those who, desiring not to live too close to the town center, moved to the surrounding barrios where they straddled two worlds, that of their traditional ways and that of the colonizer and learned early on how to move easily between two cultures, in effect creating a third space. They lived in subordinate villages or barrios and in even smaller communities called sitios. There was a practical reason for this: many resisted moving far from their fields. The clergy adapted by constructing chapels in the larger villages and making periodic visits to say mass and teach the catechism, which practice came to be known as visita. Native life under the colonial regime acquired a complexity not heretofore known. Each colonized Filipino was expected to live in a pueblo for purposes of civil government; be part of a doctrina, for religious in struction; and of an encomienda for the exaction of tribute, produce, and labor. T HE F RIARS AND THE C IVIL S TATE: W HO R EIGNED AND W HO R ULED? An on going debate, and at times open conflict, during the Spanish colonial period, was between the religious or ders and the civil administration. Underlying the debate was the question of who was truly sovereign in the archipelago, the Vatican or Madrid? It was clear from the Patronato Real that the Spanish monarch held sovereign sway over all matters pertaining to the conditions in the colony, be these in the secular or the spiritual realm, in cluding oversight of the appointment of religious personnel to the distant colony. On the ground, however, it was a far different story as to who held actual power, at least as far as the local populace was concerned. The distance from Madrid meant relatively few lay peninsular Spaniards made it to Southeast Asia. The peninsulares (as they were called) were augmented by Mexican Spaniards, but the aggregate still wasn’t sufficient. Hence, the religious did double duty, as spiritual and material administrators, wherever they had set up missions and, later, in parishes under their control. The subsequent in crease in prestige and material wealth of the friars led to power struggles with the colonial establishment. Invariably, the priests would claim the authority of the papacy to justify their position and resist the authority of the archbishop who nominally had jurisdiction over parishes. One of the early in stances of the two spheres conflicting was in the case of encomenderos, who were mostly ex-military men. As noted, the encomienda system was rife with abuse. The friars complained of such abuses—which in cluded the encomenderos’ with holding the friars’ fair share of the tributes—to the colonial government and to the King. The discord between the encomenderos and the friars was really about power: Who was to be the guardian over the lives of the encomienda’s in habitants, whose labor and property, after all, served as the source of both their revenues? But friar complaints were of ten seen as self-serving. In the late sixteenth century, one governor general, Gómez Pérez Dasmariñas, for example, felt the friars were using the alleged abuses to highlight what they believed to be their own superior qualifications. The not-so-hidden rifts between the civil and religious worlds could be traced to the question undergirding Spanish presence on the islands: What was the moral and legal basis of their sovereignty over the populace? The arguments propounded basically rested on the rationale that colonial presence was a mutually beneficial and legitimate compact between the Filipinos and the Spanish overlords. The Spanish king promised them even- handed administration, protection from their enemies, and religious education. It was as though in dividual pacts between the datus and the Spanish—the ones between Rajah Humabon and Magellan, and Sikatuna and Legazpi, being the prototypes—held true for all of the islands. In effect, the population was being asked to believe that their subjugation was really their liberation. In sum, Spanish colonial Philippines, though less than a perfect union of Church and State, could be “viewed either as a civilizing Church or a missionary State,” as the late, twentieth-century Filipino Jesuit historian Horacio de la Costa put it. With so many fresh souls to be harvested—one could say the colony for med a kind of spiritual Spice Islands for missionaries—priests were in demand for this faraway outpost of the Spanish empire. At the outset, those assigned to Las Islas Filipinas were experienced and genuinely committed to the spiritual goals of a missionary life. The first Bishop of Manila, the Dominican Domingo de Salazar, convened a council of clerics in 1582. Through his urging the council declared that sovereignty and adjudication “by natural right belong to the Indios and neither the King nor the Pope can take it away from them…. the Indios are as free in their lands as the Spaniards are in the irs, and their liberty is not taken away by the King or by the Gospel.” Such noble sentiments, being resolutely anti-colonial, were easily and subsequently disregarded, as the trappings of power came to fit the friar as comfortably as they did the civilian administrator. The economic and social privileges granted to them by the king gradually resulted in the lowering of standards, in tellectually and morally. The very real possibility of getting materially rich made priesthood in the Philippines a lucrative proposition; God’s calling the cover under which Mamon could be served eagerly and faithfully. The early years of hardship and asceticism gave way to pampered living. Thus, for in stance, by 1698, the Manila archbishop, on his visitation to certain parishes in Laguna, where friars acted as parish priests, had to for bid the exaction of fees from the parishioners for the performance of the sacraments. Charging a fee to hear a confession was not uncommon (anticipating, perhaps, the fees charged by modern-day psychiatrists). For Holy Communion to be administered to the dying, in stead of the priest making a house call, the family was obliged to carry the in dividual to the church. Otherwise the family would have to pay a fee. In his book The Roots of the Filipino Nation, Onofre D. Corpuz remarks that “this had been the practice of the Spanish friars and curates since the early days of Hispanic Christianity in Filipinas"
    }
  },
  {
    "question": "What was a significant consequence of the economic power and privileges granted to friars in the Philippines?",
    "ground_truth": "The friars' economic power and privileges led to corruption, abuse of power, and exploitation.",
    "metadata": {
      "cultural_golden_answer": "This phenomenon is reflective of the country's historical struggle with the concept of 'bahala na' (leaving things to fate), where individuals prioritize material gain over moral and intellectual pursuits. The friars' actions demonstrate how power can corrupt even those in positions of spiritual authority, echoing the Filipino saying 'ang kapwa ay kapawa' (one's equals are also one's peers).",
      "language": "english",
      "cultural_relevance": 0.9,
      "chunk_index": 9,
      "ground_truth_context": ". The economic and social privileges granted to them by the king gradually resulted in the lowering of standards, in tellectually and morally. The very real possibility of getting materially rich made priesthood in the Philippines a lucrative proposition; God’s calling the cover under which Mamon could be served eagerly and faithfully. The early years of hardship and asceticism gave way to pampered living. Thus, for in stance, by 1698, the Manila archbishop, on his visitation to certain parishes in Laguna, where friars acted as parish priests, had to for bid the exaction of fees from the parishioners for the performance of the sacraments. Charging a fee to hear a confession was not uncommon (anticipating, perhaps, the fees charged by modern-day psychiatrists). For Holy Communion to be administered to the dying, in stead of the priest making a house call, the family was obliged to carry the in dividual to the church. Otherwise the family would have to pay a fee. In his book The Roots of the Filipino Nation, Onofre D. Corpuz remarks that “this had been the practice of the Spanish friars and curates since the early days of Hispanic Christianity in Filipinas. Previous or ders prohibiting this practice … were ignored.” Exorbitant fees effectively made the poor even poorer. In addition, the friars charged parishioners for supplying them with religious items such as rosaries and required them to provide both personal services and food—of ten, with a surplus that the good friar could then sell for profit. Nor was concubinage uncommon, leading to the popular albeit exaggerated observation that most Filipinos to day have some friar blood in their veins. Geographical distance and consequent isolation rendered consistent supervision difficult. And relying on the friars for administrative tasks, normally the province of civil servants, frequently resulted in their spiritual calling too of ten taking a back seat. There were friars who stuck to their spiritual calling, of course, but absolute power corrupts absolutely. With their economic power, in dispensable role in civil administration, and spiritual authority of ten wielded with the threat of excommunication, the friars succeeded in marrying their avowedly spiritual goals to the less pristine pursuit of material gain—with the latter assuming a more prominent role than would be seemly for the demands of a spiritual life. In this the friar was aided by the principalia, who had vested in terests in the status quo; the in roads Catholicism had made into in digenous culture; and the availability of armed force should the Indios prove to be too restless under the strict rod. This unusual combination of power and prerogative made the friar the principal figure in each community and the Church the de facto dominant in stitution in the country. A major reason for the ensuing corruption of the friars was land, now a commodity subjected to in dividual ownership, a concept the Spanish had in troduced to the islands. Being in charge of parishes (normally reserved for the secular clergy, or diocesan priests who did not, unlike the friar, belong to any religious or der and were the refore under the direct supervision of the diocesan bishop), the friar or ders could own lands for their support. In time, the clergy replaced the encomenderos, whose arbitrary and exploitative practices they used to denounce. How did the men of the cloth acquire lands? By royal bequest; donations; in heritances from the pious desirous, no doubt, of assuring the mselves a place in heaven; through the outright purchase of property from the locals with the money the friars had gained from church fees, from trade, or from the produce of lands earned through for ced labor; and from for eclosures, the tenant farmer unable to pay the money he had borrowed, most likely from the friars the mselves, and thus for ced to give up the land he had pledged as collateral. The principalia, agents of the Spanish colonial apparatus, also took advantage of the privatization of property, disregarding the tradition of communally held land. Land was previously seen principally as a source of food for consumption and barter and not an in dex of wealth. The principalia were able to acquire in dividual and legal titles to land, with the resident tillers now as tenant farmers —a new and disempowering status. During the seventeenth century the process of transferring more land to fewer people grew apace, so that by 1800 the provincial hierarchy, heavily dependent on agriculture, was made up of the estate-owning friar or ders, the land-owning principalia, and the local populace— the latter consisting mainly of tenant farmers and agricultural laborers. Those working the friar lands—whether simple tenant farmers or in quilinos, natives who had the means to sublet their leases to tenant farmers—had no recourse when their rents were raised almost every year. When accepting rent in kind, the friars determined the value of the goods, naturally below market rates, since they were powerful enough to fix the prices at which produce was to be bought and sold. Aside from their in vestments in land, the or ders were actively engaged in the commercial life of the country. Through benevolent associations known as obras pias, which in effect acted like commercial banks, they in vested in various commercial enterprises. Parishes were thus run like the colonial state that engulfed it: a seemingly endless source of profit that could be justified, and was, by the earthly demands of their, the friars’, spiritual mission. Building the road to heaven didn’t, after all, come cheap. Since pacification rested mainly on the in digenous embrace of Catholicism, the religious played an in or dinate role in maintaining Spanish power in most communities. Moreover, in so many of the barangays, no other Spaniard existed but the good friar, the only symbol of colonial authority. Governors of ten complained of clerical abuses and appealed to Madrid to keep the clerics in line. A number of them took steps to curb the clerics’ power but their efforts were for the most part successfully rebuffed. Perhaps the most extreme reaction to an activist governor was in 1719, when Governor General Fernando Bustamante—a military commander of high rank and the first such to be appointed governor general of the Philippines—was slain by a mob led by friars, who stormed the palace, overpowered the guard, and knifed the governor and his son to death. The governor had apparently found out that the friars had borrowed heavily from the government and from the obras pias. Bustamante demanded repayment of the loans and, to assert his authority, had the archbishop imprisoned on charges of having conspired against the government"
    },
    "model_answer": "A significant consequence of the economic power and privileges granted to friars in the Philippines was a decline in their intellectual and moral standards.  [Source: A History Of The Philippines, p. 57]",
    "contexts": [
      "The economic and social privileges granted to them by the king gradually resulted in the lowering of standards, in tellectually and morally. The very real possibility of getting materially rich made priesthood in the Philippines a lucrative proposition; God’s calling the cover under which Mamon could be served eagerly and faithfully. The early years of hardship and asceticism gave way to pampered living"
    ]
  },
  {
    "question": "Nagsimula ba ang galleon trade noong kung ano-anong panahon?",
    "ground_truth": "1565",
    "metadata": {
      "cultural_golden_answer": "Oo, 1565 naman ang simula ng galleon trade. Kung saan ang mga galleon ay nagdala ng mahalagang karaniwang Chinese goods sa Manila at napapakalat sa buong mundo, na gumawa ng kalakalan sa kalakasan ng Pilipinas.",
      "language": "filipino",
      "cultural_relevance": 0.9,
      "chunk_index": 10,
      "ground_truth_context": ". Parishes were thus run like the colonial state that engulfed it: a seemingly endless source of profit that could be justified, and was, by the earthly demands of their, the friars’, spiritual mission. Building the road to heaven didn’t, after all, come cheap. Since pacification rested mainly on the in digenous embrace of Catholicism, the religious played an in or dinate role in maintaining Spanish power in most communities. Moreover, in so many of the barangays, no other Spaniard existed but the good friar, the only symbol of colonial authority. Governors of ten complained of clerical abuses and appealed to Madrid to keep the clerics in line. A number of them took steps to curb the clerics’ power but their efforts were for the most part successfully rebuffed. Perhaps the most extreme reaction to an activist governor was in 1719, when Governor General Fernando Bustamante—a military commander of high rank and the first such to be appointed governor general of the Philippines—was slain by a mob led by friars, who stormed the palace, overpowered the guard, and knifed the governor and his son to death. The governor had apparently found out that the friars had borrowed heavily from the government and from the obras pias. Bustamante demanded repayment of the loans and, to assert his authority, had the archbishop imprisoned on charges of having conspired against the government. In another, earlier clash between the civil and religious spheres that ended bizarrely, Governor General Sebastián Hurtado de Corcuera, Spanish governor of the Philippines from 1635-1644, exiled Archbishop Hernando Guerrero to Mariveles, a remote town across the bay. The cause for this humiliation? The prelate, along with most of the clergy, was enraged when the governor had a Spanish artilleryman by the name of Francisco de Nava dragged out of the San Augustin Church in Intramuros even though he had claimed sanctuary. Nava had knifed his female ex-slave to death in front of the church for refusing to marry him. He was tried, found guilty of murder, and hanged at the gallows erected right across from the church. To the clergy, particularly the Augustinians, this was a brazen in sult. The archbishop had religious rites and services suspended. Once Hurtado stepped down, the clergy (except for the Jesuits, who thought Hurtado had justifiable cause to ignore the right of sanctuary) in sisted he be brought to court and punished. And so he was, found guilty and imprisoned for five years before finally being freed by royal or der. It is said that as part of his sentence he was compelled to stand at the doors of churches, clad in the drab at tire of a penitent, holding a lighted taper and a rope around his neck. It wasn’t as though the civil authorities the mselves were models of democratic behavior and restraint. They were no less exploitative. For in stance, the Guardia Civil, the nineteenth-century successor to local militias and essentially a police force found in major to wns and villages, was much feared by the local populace for their of ten arbitrary and abusive behavior, as were petty town of ficials. In effect, extracting the most profit out of the colony turned into a fierce albeit unofficial competition between two rival spheres. D EVELOPMENT OF THE I SLAND E CONOMY Galleon Trade The galleon trade, the foundations for which had been laid by Andrés de Urdaneta’s successful return voyage to Mexico in 1565, in volved the highly profitable shipment of goods from Manila—goods that for the most part came from China—to Acapulco. The voyage from Manila took four months, with the ships in cluding in their cargo spices, ivory, porcelain, lacquerware, and processed silk. The goods were then transshipped overland to Veracruz, where they were loaded onto ships bound for Spain. Payment was in Mexican silver, so the galleon returning from Acapulco would be laden with the highly prized metal, along with provisions and passengers bound for the islands, providing a tempting target for privateers roaming the Pacific. This trade was monopolized by Spaniards in Manila—and even then, only a select group that in cluded the governor general, members of the Royal Audiencia, and the religious or ders. Mexican silver helped sustain the colonial enterprise and was highly valued in China. Very little Philippine produce or products were shipped out, hence the galleon trade did little to spur domestic manufacture. Precisely because the galleon trade was profitable, the Spanish colonists paid scant at tention to developing either the agricultural or manufacturing in dustry. The lucrative Manila-Acapulco run led merchants in Spain, particularly in Cádiz and Sevilla, to petition the Crown to limit the number of ships that could ply the trade route. Hence, starting in 1593, only two ships a year were permitted to sail between Manila and Acapulco. Exports from Manila were limited to P 250,000 * worth of goods (later in creased to P 500,000). Mexican goods brought back were not supposed to exceed double the value of the exports. The profits from the galleon trade made Manila a prosperous city, evident in the construction of solid buildings and outer walls and the availability of luxury goods for those who could afford them. By 1650 the population of the Walled City and its surroundings was approximately 42,000. Most of the Spaniards in the islands were concentrated in Intramuros, while a thriving Chinese community occupied the Parian district, which lay just outside the city walls. As an in dication of continuing Spanish distrust of the Chinese, on the thick walls of Intramuros facing the Parian were cannon trained on the district, in case its residents suddenly got restless. But the galleons carried more than goods, bringing letters and decrees to and from Spain and Mexico, as well as new species of crops, such as maize, avocado, to mato, cacao, and sweet potato. (The word for the latter is kamote in Tagalog, camotli in Nahuatl.) And of course human cargo: of ficials, clerics, soldiers, etc. Inevitably, these commercial and administrative links between Mexico and Las Islas Filipinas had a cultural impact. A tangible symbol of those days and one of the most venerated icons in Philippine Christianity is the Black Nazarene, ensconced in a shrine at Quiapo Church in the heart of Manila. Carved by a Mexican craftsman and brought to the colony during the seventeenth century, the Nazarene is the object of daily veneration by countless worshippers, an adoration that reaches its climax every January 9, when it is paraded through the surrounding districts, pulled by men and only by men, amidst sweaty, swaying throngs of believers who at tempt to wipe their handkerchiefs on the icon in the hopes that its miraculous power will somehow be transmitted. The trade between Mexico and the Philippines meant small colonies of Filipinos taking up residence in the New World, and likewise, Mexicans staying on in the Philippines"
    },
    "model_answer": "Walang sapat na impormasyon sa mga dokumentong ito tungkol sa simula ng galleon trade.",
    "contexts": []
  },
  {
    "question": "What significant event occurred in the Philippines every January 9?",
    "ground_truth": "The procession of the Black Nazarene, a venerated icon in Philippine Christianity",
    "metadata": {
      "cultural_golden_answer": "A major celebration that showcases the devotion and faith of Filipinos to one of their most revered icons, symbolizing the blending of cultures and traditions that shaped the country's rich history.",
      "language": "english",
      "cultural_relevance": 0.9,
      "chunk_index": 11,
      "ground_truth_context": ". But the galleons carried more than goods, bringing letters and decrees to and from Spain and Mexico, as well as new species of crops, such as maize, avocado, to mato, cacao, and sweet potato. (The word for the latter is kamote in Tagalog, camotli in Nahuatl.) And of course human cargo: of ficials, clerics, soldiers, etc. Inevitably, these commercial and administrative links between Mexico and Las Islas Filipinas had a cultural impact. A tangible symbol of those days and one of the most venerated icons in Philippine Christianity is the Black Nazarene, ensconced in a shrine at Quiapo Church in the heart of Manila. Carved by a Mexican craftsman and brought to the colony during the seventeenth century, the Nazarene is the object of daily veneration by countless worshippers, an adoration that reaches its climax every January 9, when it is paraded through the surrounding districts, pulled by men and only by men, amidst sweaty, swaying throngs of believers who at tempt to wipe their handkerchiefs on the icon in the hopes that its miraculous power will somehow be transmitted. The trade between Mexico and the Philippines meant small colonies of Filipinos taking up residence in the New World, and likewise, Mexicans staying on in the Philippines. Probably the earliest settlement of Filipinos in the New World was made up of crew members who jumped ship when the galleons docked at Acapulco, the earliest know in stance being in 1618, when seventy- four Filipinos stayed on. Filipino sailors were to settle elsewhere in the Mexican state of Guerrero and even in the bayous near New Orleans. These Louisiana Filipino expatriates were the reafter referred to as the Manilamen. The earliest recorded settlement in the United States was circa 1850, when St. Malo, a small fishing and shrimping village of Filipinos, as well some Chinese and Native Americans, grew on the outskirts of New Orleans. (In 1883 the Anglo-Greek immigrant Lafcadio Hearn wrote a feature on the village for Harper’s Weekly, and described its in habitants as a “swarthy population of Orientals—Malay fishermen who speak the Spanish creole of the Philippines as well as their own Tagal and perpetuate in Louisiana the Catholic traditions of the Indies.” In 1890 Hearn moved to Japan as a correspondent. There he married, took on the Japanese name of Koizumi Yakumo, and acquired a reputation as a popularizer of traditional Japanese culture.) Essential to the way the island economy took shape were the Chinese, already living, as we have seen, in the archipelago, albeit in small numbers, when the Spanish arrived. Their numbers grew, however, once the Spanish had settled in and exerted control over the islands. The presence of the Europeans and the galleon trade meant an expansion of commerce—with Manila as the transshipping port—and the acquisition of the much-valued Mexican silver. Spanish presence also meant the demand for the services of Chinese artisans. Gradually, the in flux of traders and artisans, mostly from the southern coastal provinces like Fujian, Amoy, and Guangdong, caused the resident communities of Chinese to expand. Relying on the profitable galleon trade and the prerogatives of colonial government (especially the polos y servicios) to lead privileged and of ten luxurious lives, the Spanish left the retail trade and the crafts to the Chinese who came to dominate both. Thus was laid the foundation by which the Chinese assumed a prominence, if not dominance, in the economy that continues to the present. Soon ubiquitous in the rural areas, the Chinese merchants acted as in termediaries between the cash system and the product-or iented native economy. And so Chinese retailers and tradesmen had an enormous impact on the colony’s economic life, distributing Chinese goods to Philippine villages and selling local products to the Spaniards. In this way, too, the Chinese dispersed through the archipelago, to as far south as Muslim Jolo, seat of the Sulu Sultanate. Consequently, the Philippine economy developed three distinct tiers: that of the Spanish, that of the Chinese, and that of the natives—corresponding to the existence of three distinct cultural communities. Intermarriage did occur frequently between the Chinese and the locals, so that by the late eighteenth century, enough Chinese mestizos existed as to be classified separately by the government. (In addition, to ease the suspicions of the Spanish, many Chinese converted to Catholicism.) The existence of these distinct economies would in variably be affected by the country gradually opening up to global markets, especially by the middle of the eighteenth century (a globalization that moved along on cultural and political axes as well as economic ones). Driven by an entrepreneurial spirit, and with an in for mal network already in place, the Chinese more than the colonizing Spanish assumed a larger and more vital role in the economic development of the country, the Chinese being the middleman, buyer, and of ten the supplier in the numerous to wns and villages upended the pre-conquest economic patterns of the Filipinos. Especially in the retail trade, the Chinese rose to preeminent positions. For all that, government regulations were antiquated, the product of a vanished era. Some at tempts at the close of the eighteenth century were made to in stitute far-reaching economic reforms that would have helped the colony metamorphose into more than just an outpost of a declining empire and source of raw materials. By then, the colony’s population stood at a million and a half, with the bishoprics of Manila and Cebu consisting each of 500,000 in habitants. Governor José de Basco y Vargas (1778-1787) for med the Sociedad Económica de Amigos del País, to regularize agricultural enterprises and improve methods and techniques. He established a monopoly on to bacco in 1782, beginning in Nueva Ecija, Cagayan Valley, and Marinduque. The monopoly proved to be highly profitable, but these profits were siphoned off due to corruption. Later, the monopoly was expanded to in clude the Ilocos region. Taking advantage of the monopoly, a minor Spanish nobleman, Marqués de Comillas, founded the Compañia General de Tabaco de Filipinas, popularly and still known as Tabacalera, one of the oldest to bacco leaf dealers in the world. The company essentially took over the to bacco factories the Spanish had set up in the archipelago, controlling the export of to bacco to Spain. Tabacalera soon expanded into sugar, copra, shipping, and liquor. Basco also established a branch of the Royal Company of the Philippines, which had been founded in Spain in 1785 and loosely patterned after the British East India Company. The company aimed to regulate commerce between the mother country, Spain, and Asia, by way of the Cape of Good Hope, and to bring goods directly from China to Manila, with out being bound by the schedule of Chinese junks"
    },
    "model_answer": "Walang sapat na impormasyon sa mga dokumentong ito tungkol sa  makabuluhang pangyayari sa Pilipinas tuwing Enero 9.",
    "contexts": []
  },
  {
    "question": "Sa anong panahon at sa pagtuloy ng pagliberalisasyon ng komersiyo ang Pilipinas ay nabuksan sa kanlurang negosyo?",
    "ground_truth": "Nang unang bahagi ng ika-19 na siglo",
    "metadata": {
      "cultural_golden_answer": "Ang liberalisasyon ng komersiyo sa Pilipinas noong ika-19 na siglo ay isang mahalagang punto sa kasaysayan ng bansa. Sa pagbubukas nito sa kanluran, ang mga tao ay nakakapagnawagan sa mga bagong teknolohiya at kaalaman mula sa ibang bansa. Ito rin ang nagpahiwatig ng pag-unlad ng ekonomiya ng Pilipinas at pagkalakas ng industriya ng azukar, copra at iba pang produktibong sangkap.",
      "language": "filipino",
      "cultural_relevance": 0.9,
      "chunk_index": 12,
      "ground_truth_context": ". Governor José de Basco y Vargas (1778-1787) for med the Sociedad Económica de Amigos del País, to regularize agricultural enterprises and improve methods and techniques. He established a monopoly on to bacco in 1782, beginning in Nueva Ecija, Cagayan Valley, and Marinduque. The monopoly proved to be highly profitable, but these profits were siphoned off due to corruption. Later, the monopoly was expanded to in clude the Ilocos region. Taking advantage of the monopoly, a minor Spanish nobleman, Marqués de Comillas, founded the Compañia General de Tabaco de Filipinas, popularly and still known as Tabacalera, one of the oldest to bacco leaf dealers in the world. The company essentially took over the to bacco factories the Spanish had set up in the archipelago, controlling the export of to bacco to Spain. Tabacalera soon expanded into sugar, copra, shipping, and liquor. Basco also established a branch of the Royal Company of the Philippines, which had been founded in Spain in 1785 and loosely patterned after the British East India Company. The company aimed to regulate commerce between the mother country, Spain, and Asia, by way of the Cape of Good Hope, and to bring goods directly from China to Manila, with out being bound by the schedule of Chinese junks. The company also hoped to spur domestic manufacturing through the exploitation of natural resources. An at tempt to compete with textiles from Bengal and Coromandel, however, resulted in heavy losses. And by 1790, the company had yet to establish trade relations directly with India, China, or Japan, relying as before on middlemen in Manila. As much as an agent of change that it may have been, the Company’s privileges were revoked, and by 1834 the agency was abolished. It had proven to be a complete failure, crippled by consistently bad management and excessive speculation. The colonial government declared Manila to be a free and open port in 1789 for a limited time and made permanent in 1805. In 1796, the first American merchant ship docked in Manila. By 1814, Manila had a vibrant community of for eign merchants. (In the Visayas, the ports of Iloilo and Cebu were declared open to for eign trade in 1855 and 1865 respectively, resulting in the local economies expanding and a corresponding in crease in the ranks of the petit bourgeoisie.) Even so, the for eign merchants could only trade in Asian goods and were not allowed to participate in the trade between the colony and Spain. Easily circumvented, these restrictions were gradually lifted. With that, more than two centuries of isolation ended. This opening up to the West, for it was the West that most avidly desired it, took place more or less at the same time other Asian ports were opening up: in China, Japan, and Siam (present-day Thailand). The opening up of Manila meant that the once-sleepy port was now booming. Trading ships from Europe and North America made regular calls. The city’s population grew to approximately 150,000 by the middle of the nineteenth century. Migrants from nearby provinces flocked to the city for jobs as well as for higher education and cultural enrichment—the typical lures of any developing urban center. It accelerated the opening of the rest of the country while for eign in vestment and capital stimulated the local agriculture in dustry. This was especially true in the sugar, abaca, and copra in dustries. Technological improvements, the rising demand for these products in in ternational markets, and the subsidies provided by for eign traders and importers led to dramatic in creases in yields for these crops. They had become prime commodities globally, though naturally subject to the vagaries of the marketplace. Sugar was a prime illustration. Until the mid-nineteenth century, sugar was a bit player in the Philippine economy. But with Iloilo as an open port in 1855, the sugar in dustry took off on Negros Island, across Guimaras Straits, its soil perfect for sugar cultivation. The island population in creased dramatically, from 30,000 in 1850 to 320,000 by 1893, as land was cleared for sugar plantations and to wns were built and in frastructure put into place. The in troduction of steam-powered mills in 1860 by British merchants, much more entrepreneurial than the Spanish, caused a 600-fold in crease in output, from 200 tons in 1850 to 120,000 tons in 1893. Similar in creases in sugar production took place in Central Luzon as well. By the close of the nineteenth century and well into the twentieth, sugar constituted a major source of export earnings. The abundance of sugar meant the production of rum, of which sugar is the most important raw material. In 1860, a trading partnership and steamship company founded a few years earlier by a Spanish family, the Elizaldes, built the Tanduay distillery in Manila that to this day produces its signature rum. But while sugar provided the sweet life for a few landed families, it in turn caused dislocation and bitter misery for peasants deprived of their land. The late nineteenth-century agrarian upheaval caused by large-scale azucareras (sugar refineries) created a class of seasonal farm laborers called sacadas, who migrated to different plantations during the harvest season to work for abysmal wages while enduring degrading living conditions. (In the twenty-first century, not much has changed. The sacada is still there and so is the exploitation.) The liberalization of trade resulted in a relatively more diverse financial system. Up to then, local businessmen and farmers were subject to usurious loans, complicated by the fact that the domestic financial in stitutions were usually beholden to the friar or ders. With for eign trading companies and their financial backers on the scene, local entrepreneurs could turn to them for less on erous terms. The first bank founded by a Filipino was the Rodriguez Bank, circa 1831. Francisco Rodriguez was quite a wealthy man living in Manila when in 1823 he was wrongly accused of being in volved in a local conspiracy spearheaded by three Mexican-born Spanish army of ficers in the islands. These of ficers were accused of harboring rebellious motives, due both to Mexico’s new status as an in dependent nation and the fact that the newly appointed governor of the archipelago, Juan Antonio Martínez (1822-1825), had in 1822 brought with him several of ficers from the continent whom he favored, by passing the more senior of ficers already in the colony, among them the three conspirators. The conspiracy was found out, two of ficers were deported, and the third, Andrés Novales, was reassigned to Mindanao. After a short time, however, Novales rallied 800 disgruntled soldiers to his side and led a mutiny, which was quickly put down and Novales executed. The Novales Mutiny as it was termed was the first at tempted coup d’etat during Spanish colonial rule in the islands, although one that sprung from narrow grievances rather than any newfound sense of nationalism"
    },
    "model_answer": "Walang sapat na impormasyon sa mga dokumentong ito tungkol sa panahon at pagtuloy ng pagliberalisasyon ng komersiyo kung kailan ay nabuksan ang Pilipinas sa kanlurang negosyo.",
    "contexts": []
  },
  {
    "question": "Who was the first Filipino to found a bank?",
    "ground_truth": "Francisco Rodriguez",
    "metadata": {
      "cultural_golden_answer": "Notably, Francisco Rodriguez's story highlights the complex relationships between Filipinos and foreign powers during the Spanish colonial period. His experiences as a businessman and a former political prisoner demonstrate the challenges faced by local entrepreneurs in navigating the colonial economy.",
      "language": "english",
      "cultural_relevance": 0.9,
      "chunk_index": 13,
      "ground_truth_context": ". With for eign trading companies and their financial backers on the scene, local entrepreneurs could turn to them for less on erous terms. The first bank founded by a Filipino was the Rodriguez Bank, circa 1831. Francisco Rodriguez was quite a wealthy man living in Manila when in 1823 he was wrongly accused of being in volved in a local conspiracy spearheaded by three Mexican-born Spanish army of ficers in the islands. These of ficers were accused of harboring rebellious motives, due both to Mexico’s new status as an in dependent nation and the fact that the newly appointed governor of the archipelago, Juan Antonio Martínez (1822-1825), had in 1822 brought with him several of ficers from the continent whom he favored, by passing the more senior of ficers already in the colony, among them the three conspirators. The conspiracy was found out, two of ficers were deported, and the third, Andrés Novales, was reassigned to Mindanao. After a short time, however, Novales rallied 800 disgruntled soldiers to his side and led a mutiny, which was quickly put down and Novales executed. The Novales Mutiny as it was termed was the first at tempted coup d’etat during Spanish colonial rule in the islands, although one that sprung from narrow grievances rather than any newfound sense of nationalism. Implicated in the Novales affair along with several other civilians, Rodriguez was sent to Cádiz in 1825 as a political prisoner. He managed to escape and fled to London, from where he waged an unsuccessful campaign to convince his friends and relatives to plead his in nocence before the civil authorities in Manila. Unable to gain access to his riches, he became destitute and undoubtedly would have died penniless and heartbroken had he not been taken in and cared for by Quakers in London, with whom he lived for five years. Not surprisingly, Rodriguez became a Quaker as well as a British subject. By then, the Spanish government pardoned all those in volved in the uprising. Rodriguez returned to Manila, where he established the Rodriguez Bank, to assist for eign traders, primarily American and British, in their dealings with Filipinos and in direct competition with Spanish financiers. Mindful of the difference between how he had been treated by the Spanish and the British, Rodriguez wore his Quaker outfit much to the delight of the children on the streets who ran after and jeered him, and the consternation of for mer friends, relatives, and especially the local friars. The religious establishment tried to have him expelled, but his British citizenship afforded him the protection he needed. Upon his death, he bequeathed his for tune to the Queen of England, for the benefit of the widows and or phans of British soldiers killed in the Crimean War. His relatives challenged the legitimacy of the will and in itially won their suit. On appeal by the British government, however, the Supreme Court in Madrid reversed the decision by the lower court. The bank was shut down, and Rodriguez’s for tune was eventually paid out to the British. The Quaker had had his revenge. Other financial in stitutions that arose were the Obras Pias and the Banco Español-Filipino. In 1841, all but four confraternities—with their or igins in the late sixteenth century, run by the religious or ders and meant to extend financial assistance to Spaniards—were dissolved, presumably to in crease their efficiency in light of the lower in terest rates of fered by for eign bankers, trading in terests who were only too willing to extend loans to local farmers. The latter had been customarily denied recourse to funds reserved for the Spanish or would be charged usurious rates by the friars. In a pattern that remains to this day, tenant farmers on the huge landed estates of the friar or ders borrowed money at exorbitant rates in or der to work the land and harvest the crops. It was a system almost guaranteed to keep a tenant farmer perpetually in debt, as market prices for their crops were in variably controlled either by middlemen who had ties to the friar or ders, or by the friars the mselves. The for eign merchants provided an alternative which native entrepreneurs eagerly took advantage of. The remaining four confraternities were or dered by Governor General Antonio de Urbiztondo (1850-1853) to amalgamate in 1851 and become Obras Pias. The next year Governor Urbiztondo authorized the founding of the Banco Español-Filipino, which handled the more lucrative aspects of banking, in cluding the right to issue bank notes—previously, Mexican currency had been used—the reby becoming the de facto government bank of the colony. Realizing that favoring Spanish merchants over Filipinos deprived them of a potentially larger market, Banco Español-Filipino adopted the more liberal practices of its for eign competitors. In 1912, in keeping with the new colonial dispensation, the bank renamed itself as the Bank of the Philippine Islands, a venerable in stitution that continues to this day. Despite its awareness of the need to keep up with modern business and trading practices, the government in Manila dragged its feet in in stituting needed reforms. Partly in response to pressure applied by traders, a Tribunal of Commerce was established in 1834, later transformed in 1835 into the Chamber of Commerce, which was charged with impartially adjudicating disputes within the business community. But like other colonial in stitutions, it was just as susceptible to in fluence peddling as any other agency, and rarely accomplished anything worthy of note. Such bureaucratic hurdles discouraged for eign traders from in vesting in the Philippines, with many lured to trade in China, which, mainly controlled by the British, had more liberal laws. With a decline in trade, the Manila government turned to Sinibaldo de Mas, an adventurer, poet, and the person believed to have in troduced photography to the Philippines—he had brought the first daguerreotype camera to the islands. Charged with studying business conditions within the islands, de Mas came out with his Informe Sobre el Estado de las Filipinas en 1842 ( On the Conditions of the Philippines in 1842 ). Clearly against a protectionist policy he advocated that ports in addition to Manila should be opened, the to bacco monopoly be terminated, and immigration should be encouraged. He compared the Philippines with another Spanish colony, Cuba, and demonstrated convincingly how that Caribbean island, with a smaller population, had trade contracts worth $27 million, while the Philippines, with four times more in habitants and a bigger physical and agricultural base, only took in about $5 million annually. When the reforms he had suggested were adopted and began to take effect, trade improved, with the Americans and the British becoming preeminent"
    },
    "model_answer": "The first Filipino to found a bank was Francisco Rodriguez. He founded the Rodriguez Bank circa 1831. [Source: A History Of The Philippines, p. 65]",
    "contexts": [
      "With for eign trading companies and their financial backers on the scene, local entrepreneurs could turn to them for less on erous terms. The first bank founded by a Filipino was the Rodriguez Bank, circa 1831. Francisco Rodriguez was quite a wealthy man living in Manila when in 1823 he was wrongly accused of being in volved in a local conspiracy spearheaded by three Mexican-born Spanish army of ficers in the islands",
      "Taong 1851 nang itatag ang kauna-unahang bangkong Pinoy sa Pilipinas na Banco Español-Filipino de Isabel II. Alam nyo ba na pagkalipas ng mahabang panahon ay bukas pa rin ito hanggang ngayon bagaman iba na ang pangalan. Ang Banco Español-Filipino de Isabel II (o Filipino Bank of Isabel II) ay ipinangalan sa reyna ng Espana na si Isabella II, anak ng dating hari na si King Ferdinand VII",
      "Up to then, local businessmen and farmers were subject to usurious loans, complicated by the fact that the domestic financial in stitutions were usually beholden to the friar or ders. With for eign trading companies and their financial backers on the scene, local entrepreneurs could turn to them for less on erous terms. The first bank founded by a Filipino was the Rodriguez Bank, circa 1831"
    ]
  },
  {
    "question": "Ano ang pangalan ng kapatid ni Francisco Dagohoy na tinanggihan ang libing sa simbahan?",
    "ground_truth": "Sagarino",
    "metadata": {
      "cultural_golden_answer": "Si Sagarino ang kapatid ni Dagohoy, at naging inspirasyon para sa rebellion dahil sa pagpigil ng paglilibing na Kristiyano sa kanya. Ang kaso ni Sagarino ay isang halimbawa ng pagiging masama ng mga Kastila sa panahong ito.",
      "language": "filipino",
      "cultural_relevance": 0.9,
      "chunk_index": 14,
      "ground_truth_context": ". Such bureaucratic hurdles discouraged for eign traders from in vesting in the Philippines, with many lured to trade in China, which, mainly controlled by the British, had more liberal laws. With a decline in trade, the Manila government turned to Sinibaldo de Mas, an adventurer, poet, and the person believed to have in troduced photography to the Philippines—he had brought the first daguerreotype camera to the islands. Charged with studying business conditions within the islands, de Mas came out with his Informe Sobre el Estado de las Filipinas en 1842 ( On the Conditions of the Philippines in 1842 ). Clearly against a protectionist policy he advocated that ports in addition to Manila should be opened, the to bacco monopoly be terminated, and immigration should be encouraged. He compared the Philippines with another Spanish colony, Cuba, and demonstrated convincingly how that Caribbean island, with a smaller population, had trade contracts worth $27 million, while the Philippines, with four times more in habitants and a bigger physical and agricultural base, only took in about $5 million annually. When the reforms he had suggested were adopted and began to take effect, trade improved, with the Americans and the British becoming preeminent. N ATIVE R ESISTANCE: M ERCENARIES, C ONSCRIPTS, AND R EBELS The Filipinos as colonial subjects bore most of the burden of a rule that the or etically was meant to benefit them. They were thus on the frontlines, whether on expeditionary trips to Borneo and the Moluccas, or fighting the Dutch and the English on the high seas, or providing most of the labor on the galleons that plied the Manila-Acapulco route. In the early seventeenth century the Christianized Filipinos fought their non-Christian brothers in campaigns against Mindanao and Jolo, as well as putting down, of ten savagely, Chinese uprisings. The earliest revolt came shortly after the Spanish had made Manila the seat of their still-shaky state, at a time when Limahong was threatening to destroy the city. As described earlier, Rajahs Lakandula and Suleiman (rulers respectively of Tondo and Maynila) felt their prerogatives had been slighted by the Spanish, but De Salcedo appeased them enough so that the two rulers added their for ces to the corps of Manila’s defenders. Limahong was thus defeated. The imposition of colonial rule was rarely, if ever, smooth, with the in digenous populations in many communities resisting the curtailment of their traditional customs and liberties. Additionally, the obligation to pay tribute and render personal services—wartime duty, the building of ships, etc.—seriously limited their efforts to earn a living, necessary in the first place to pay the tribute, creating a vicious circle that seemed impossible to break. In the main, the locals were seen as another natural resource to be exploited, whether this was to in crease the tally of souls saved, which the in dustrious friars kept tabs on, or to provide for a Spaniard’s living. (The understandable reluctance of the in digenous folk to fulfill the demands of corvée would engender stereotypical portrayals of the Filipino as being naturally in dolent—another reason advanced for the upliftment provided by colonial rule.) Abolition of the tribute and corvée were the main demands echoed by almost all uprisings throughout Spanish colonization. From 1574 to the close of the seventeenth century, the Spanish colonial state had to put out fires of varying in tensity, while dealing with external threats from rival European powers. Between 1574 and 1661, there were at least eight significant revolts. We have noted resistance of fered by Suleiman and Lakandula. A decade later, in 1584, Agustin de Legazpi, a Christianized prominent citizen of Tondo, the ancient town that abutted Manila, or ganized a clandestine separatist movement—the first in stance in the Spanish colonial period, and for erunner of the revolutionary movement that would erupt three hundred years later. Even with arms smuggled in by a sympathetic Japanese sea captain, the conspiracy was foiled, and de Legazpi and seven others were executed, in cluding Magat Salamat, datu of Tondo. Fifteen others were deported to Mexico. Uprisings occurred in various regions of the islands, in dicating widespread dissatisfaction with Spanish colonial rule. Simultaneous though uncoordinated revolts by Bankaw in Leyte and Tamblot in Bohol in 1621 were to protest the imposition of a new faith, each leader wanting a restoration of traditional beliefs and practices. The very fact of their non-Christian appellations in dicated either a refusal to be baptized or a discarding of their baptismal names. From 1649 to 1661, failed uprisings occurred in Samar, Pangasinan, Pampanga, and the Ilocos region. With no alliances beyond the particular barangay in volved, these revolts were easily and bloodily suppressed. During the first half of the seventeenth century, wars against the Dutch and military expeditions against the Muslims in the south strained the material and human resources of the Spanish colonists. As a result, abuses on the part of colonial of ficials, if not condoned, were overlooked for pragmatic reasons. In turn, such abuses generated resistance that took various forms depending on how or ganized a settlement was. Dagohoy’s Republic The longest uprising during the Spanish colonial period took place on Bohol and was led by a cabeza de barangay, or barangay chief, Francisco Dagohoy. From 1744 to 1829—an astounding eighty-four years—Dagohoy and his followers numbering in the thousands lived in self-sufficient farming communities they had built in the mountainous in terior of the island, for all in tents and purposes declaring in dependence from Spanish sovereignty. By all accounts an upstanding citizen who had until 1744 recognized the authority of both the church and the state, Dagohoy was in censed when the Jesuit curate of the town of Inabanga, Fr. Gaspar Morales, refused Dagohoy’s brother, Sagarino, a Catholic burial. Sagarino, working for the town as a policeman, had been killed in an encounter with a fugitive, a for mer Christian turned apostate—a crime in those days. The Jesuit’s reason for denying Sagarino a Christian burial was that his death had been occasioned by a duel, which the church for bade. Understandably this refusal didn’t sit well with Dagohoy, who, sworn to revenge, killed Fr. Morales. Another Jesuit curate in a nearby town was killed as well. Dagohoy led three thousand Boholanos to quit their pueblos and join him in setting up communities in the mountains. Dagohoy’s following swelled to as many as twenty thousand over the years. Clearly, refusal of a Christian burial to his brother was the last straw, and emblematic of longer held grievances, the main one being the dreaded corvée. The charismatic Dagohoy would not have had such a large following had the rebels not already harbored their own festering resentments"
    },
    "model_answer": "Walang sapat na impormasyon sa mga dokumentong ito tungkol sa kapatid ni Francisco Dagohoy.",
    "contexts": []
  },
  {
    "question": "Who led a rebellion against Spanish rule in Bohol?",
    "ground_truth": "Dagohoy",
    "metadata": {
      "cultural_golden_answer": "A prominent figure in Filipino history, Dagohoy is an example of the Filipinos' resilience and determination to resist colonial rule. His leadership and charisma inspired thousands to join his cause, highlighting the importance of bayanihan (solidarity) and self-determination in Filipino culture.",
      "language": "english",
      "cultural_relevance": 0.9,
      "chunk_index": 15,
      "ground_truth_context": ". By all accounts an upstanding citizen who had until 1744 recognized the authority of both the church and the state, Dagohoy was in censed when the Jesuit curate of the town of Inabanga, Fr. Gaspar Morales, refused Dagohoy’s brother, Sagarino, a Catholic burial. Sagarino, working for the town as a policeman, had been killed in an encounter with a fugitive, a for mer Christian turned apostate—a crime in those days. The Jesuit’s reason for denying Sagarino a Christian burial was that his death had been occasioned by a duel, which the church for bade. Understandably this refusal didn’t sit well with Dagohoy, who, sworn to revenge, killed Fr. Morales. Another Jesuit curate in a nearby town was killed as well. Dagohoy led three thousand Boholanos to quit their pueblos and join him in setting up communities in the mountains. Dagohoy’s following swelled to as many as twenty thousand over the years. Clearly, refusal of a Christian burial to his brother was the last straw, and emblematic of longer held grievances, the main one being the dreaded corvée. The charismatic Dagohoy would not have had such a large following had the rebels not already harbored their own festering resentments. While Dagohoy and his followers observed the rites of Catholicism, such as baptism, and remained steadfast Catholics—though apparently with out the services of or dained curates—they also emphasized the traditions of bayanihan, the reby eliminating tribute and for ced labor. Best of all, the oppressive representatives and symbols of Spanish rule—the ubiquitous padre, the local militia, and the petty town of ficials—were absent. Life was so much better now for Dagohoy and his followers. In effect, they had become what the Spanish termed remontados —literally, “those who remount,” i. e., take to their horses and leave the Spanish-controlled barangays, or people who had chosen to live outside the jurisdiction of the colonial state. Hampering the Spanish authorities’ campaign to subdue the rebels were the well-entrenched positions and for tifications the latter had erected in their mountain lairs. Additionally, sympathizers provided them both supplies and in for mation regarding possible Spanish at tacks. In the meantime, the Seven Years’ War (1756 to 1763) had broken out in Europe. A global conflict that in volved not only Europe but the New World (where it was known as the French and Indian War), Asia, and Africa, it was a battle between two colonial powers, France and England, with France losing most of its North American possessions as a consequence. With the Bourbon- descended Charles III of Spain allied with France, in 1759, a British military expedition or ganized by the British East India Company sailed to Manila from India. The in vasion took the defenders of Intramuros completely by surprise, leading to an easy takeover in late 1762. Having to or ganize resistance outside of Manila, especially in northern Luzon, the Spanish and Filipino loyalist for ces led by Simón de Anda, had their hands full. Dagohoy could wait. By then, Britain was in the vanguard of the in dustrial revolution, its far-flung empire grown muscular and a source of tremendous wealth. The Bourbon- controlled Spanish empire, in contrast, was flaccid, in decline, and its speedy defeat by the British symbolized the latter’s ascendant hegemony. After the conclusion of the Seven Years’ War, the British with drew, and the Spanish flag flew once more over Intramuros. Unsuccess ful at tempts were made either to negotiate with or to subdue Dagohoy and his followers. In 1827, a force of 2,200 native and Spanish troops was sent against them, and again in 1828, but these campaigns failed. But by August 31, 1829, the Spanish had crushed the rebellion, taking a year of repeated assaults to do so. By then, Dagohoy had been dead, though no record survives of when and how he died. Three thousand Boholanos’s escaped to other islands, 395 died in battle, 19,420 surrendered, and 98 were exiled. Only in Muslim Mindanao was resistance to Spanish rule longer than the Boholanos’ eighty-five years, a rebellion that lasted through the tenure of twenty Spanish governors general. The Silang Revolt In northern Luzon, the local populations in Pangasinan and Ilocos took advantage of the turmoil brought about by the British in vasion to advocate violently for reforms and try to shake off Spanish repression. The Pangasinan revolt began in late 1762 and was headed by Juan de la Cruz Palaris. It was put down in March of 1764, and its principal leaders executed. The more notable uprising was north of Pangasinan, in the Ilocos region, at that time made up of La Union, Abra, Ilocos Sur, and Ilocos Norte. The revolt was headed by thirty- two-year-old Diego Silang, a member of the principalia, who, or phaned at an early age, had been brought up by a parish priest in Vigan. He married a well-to- do widow and happened to be in Manila awaiting the arrival of a galleon from Mexico when the British occupied the city. With the British takeover shattering the myth of Spanish in vincibility, and encouraged by the uprising in Pangasinan—though no effort seemed to have been made to wards joining for ces—Silang and aggrieved Ilocanos demanded the elimination of the polos y servicios, and the expulsion of Spanish mestizos. A mini-civil war erupted between those agitating for reforms and those loyal to the Spanish. Silang gained the upper hand in the southern part of the region. Prior to this revolt, Silang had already been in the vanguard of protesting, in Vigan, against the abuses of the governor (the alcalde mayor ) and demanding the dismissal of some local of ficials. His demands, unacceptable though they were to the Spaniards, were nevertheless reformist rather than radical. Seeking the protection of the British as well as to trade with them, Silang sent communiqués to the British in Manila, and the latter responded by appointing him Sargente Mayor, Alcalde Mayor, and Captain in the War for his British Majesty. Though it was doubtful the British meant more than to flatter Silang, the latter, who seemed to have messianic tendencies, would have welcomed such titles. He declared Christ to be the Captain General, with him as second-in-command. Making Vigan his capital, he abolished tribute and for ced labor, expelled the Spanish, and confiscated the wealth of the church. But Silang’s triumph was momentary. With the encouragement and blessing of both the local bishop and the Manila ecclesiastical authorities, Silang was assassinated by a Spanish mestizo, Miguel Vicos. Silang’s widow, Gabriela, along with his uncle, Nicolas Cariño, took over, seeking refuge in the mountains and directing the uprising for another four months. But the northern region remained loyal and, with reinforcements from the outside, defeated the anti- Spanish for ces. In late 1763, Gabriela and ninety others were captured and hanged"
    },
    "model_answer": "Francisco Dagohoy, a cabeza de barangay (barangay chief), led a rebellion against Spanish rule in Bohol.  [Source: A History Of The Philippines, p. 69]",
    "contexts": [
      "Dagohoy’s Republic The longest uprising during the Spanish colonial period took place on Bohol and was led by a cabeza de barangay, or barangay chief, Francisco Dagohoy. From 1744 to 1829—an astounding eighty-four years—Dagohoy and his followers numbering in the thousands lived in self-sufficient farming communities they had built in the mountainous in terior of the island, for all in tents and purposes declaring in dependence from Spanish sovereignty",
      "As a result, abuses on the part of colonial of ficials, if not condoned, were overlooked for pragmatic reasons. In turn, such abuses generated resistance that took various forms depending on how or ganized a settlement was. Dagohoy’s Republic The longest uprising during the Spanish colonial period took place on Bohol and was led by a cabeza de barangay, or barangay chief, Francisco Dagohoy",
      "Fifteen others were deported to Mexico. Uprisings occurred in various regions of the islands, in dicating widespread dissatisfaction with Spanish colonial rule. Simultaneous though uncoordinated revolts by Bankaw in Leyte and Tamblot in Bohol in 1621 were to protest the imposition of a new faith, each leader wanting a restoration of traditional beliefs and practices. The very fact of their non-Christian appellations in dicated either a refusal to be baptized or a discarding of their baptismal names",
      "Naturally, the Spaniards would portray their efforts as the efforts of the devil to lead the people to apostasy and rebellion. Also in cluded is the account of Pedro Ladia’s rebellion centered in Malolos, Bulacan. Being much of a religious rebellion, Ladia would also at tempt to establish a kingdom based on the Tagalog area in which Malolos is a part. Excerpt: The majority of the ministers in the island of Bohol had gone to Zebu, to celebrate the feasts of the beatification of St"
    ]
  },
  {
    "question": "Sino ang naging pangalawang komandante ni Datong Silang?",
    "ground_truth": "Siya mismo ay sinabi ng kaniyang sarili na ang si Kristo ay ang Captain General, at siya bilang ikalawang komandante.",
    "metadata": {
      "cultural_golden_answer": "Ang pag-angkin ni Datong Silang ng pangalawang komandante sa ilalim ni Kristo ay isang halimbawa ng kaniyang may mesiyas na pananaw sa sarili, at ito'y nagsasaad ng kaniyang layunin na mabigyan ang mga Pilipino ng kapayapaan at kalayaan.",
      "language": "filipino",
      "cultural_relevance": 0.9,
      "chunk_index": 16,
      "ground_truth_context": ". His demands, unacceptable though they were to the Spaniards, were nevertheless reformist rather than radical. Seeking the protection of the British as well as to trade with them, Silang sent communiqués to the British in Manila, and the latter responded by appointing him Sargente Mayor, Alcalde Mayor, and Captain in the War for his British Majesty. Though it was doubtful the British meant more than to flatter Silang, the latter, who seemed to have messianic tendencies, would have welcomed such titles. He declared Christ to be the Captain General, with him as second-in-command. Making Vigan his capital, he abolished tribute and for ced labor, expelled the Spanish, and confiscated the wealth of the church. But Silang’s triumph was momentary. With the encouragement and blessing of both the local bishop and the Manila ecclesiastical authorities, Silang was assassinated by a Spanish mestizo, Miguel Vicos. Silang’s widow, Gabriela, along with his uncle, Nicolas Cariño, took over, seeking refuge in the mountains and directing the uprising for another four months. But the northern region remained loyal and, with reinforcements from the outside, defeated the anti- Spanish for ces. In late 1763, Gabriela and ninety others were captured and hanged. Resistance in Religious Garb Four years after the departure of the Redcoats, the Jesuits were expelled by royal decree in 1768, for cing them to abandon 114 missions and some schools. The Jesuits had arrived in the Philippines in 1581 and were assigned the Diocese of Cebu, which encompassed parts of northwestern Mindanao. They also took over a seminary in Manila, which became the Colegio de San José, the first college in the islands. (Twenty years later, in 1611, the Dominicans founded present-day University of Santo Tomás, the Catholic University of the Philippines, an in stitution older than Harvard, which was founded in 1636.) Their expulsion came about because the monarchical governments in France, Portugal, and Spain had grown wary of the Jesuits’ education of the colonized, which was in terpreted as empowering them, and the refore undermining colonial rule. The Archbishop of Manila at the time, Sancho Santa Justa, had or dained Filipino seminarians assigned to these parishes, speeding along the Filipinization of the clergy—an unwelcome development as far as the Spanish friars were concerned. At the same time, the friars were opposed to or exceedingly reluctant to grant diocesan visitations, the normal prerogative of the archdiocesan bishop when it came to secular clergy. Since the or ders already had their own superiors, the friars resented this additional layer of authority. Besides, it could lead to a further secularization of the parishes—and a diminution of friar power. In the Philippines, this was more significantly a racial matter, since the friars were peninsulares, or clergy born in Spain, while the secular clergy were in sulares, or Philippine-born priests. By rejecting the right of visitation, the friars were in directly repudiating royal oversight, as it was the Crown that determined appointments to bishoprics, and the bishops determined who staffed the parishes. Both issues—the appointment of native clerics to parishes and regulatory power from outside their friar estates—highlighted how these religious groups jealously guarded their hard-earned (and highly lucrative) preeminent role in the everyday lives of the Filipinos. Theoretically subordinate to the Crown, the friar estates in fact of ten held more power than the colonial regime. By the late eighteenth century it was all but impossible to remove Spanish friars as parish priests. In 1804 they came under the jurisdiction of a vicar-general based, not in Rome, but in Spain—adding another layer of in sulation from the civil government and from the local diocesan bishop. The Jesuits were allowed back in 1859, as authorized by a decree of Queen Isabella II. Re-accommodating them created a domino effect. The Recollects, who had replaced the Jesuits or iginally, asked the government for parishes in Cavite, across the bay from Manila. They as well as the Dominicans were assigned parishes in 1862, at the expense of native-born clergy who held these aforementioned posts. In this manner, Antipolo, a site of pilgrimage and one of the richest parishes in the country, was taken out of the hands of the in sulares and entrusted to the peninsulares. The native clergy rightly saw this as a government strategy to severely circumscribe their role. By then, the only colonies remaining in the once-great Spanish Empire were Cuba, Puerto Rico, the Philippines, and the Marianas. Given that Mexican creoles of Filipino descent had fought in the populist army headed by a priest, Fr. Miguel Hildalgo, who launched the war of in dependence against Spain in 1810, the colonial authorities were determined that the virus of nationalism would not be spread by sympathetic native priests. In fact, just before the British in vaded the islands in 1762, there had been a Manila-born secular priest, Don Miguel Lino de Ezpeleta, who, having become the Arch bishop of Cebu, went on to claim the See of Manila and the governor generalship—both positions having been vacant simultaneously—to the dismay of the Real Audiencia. When that august body asked the good archbishop for his authority, Ezpeleta pointed to the troops he had summoned to surround the building where they were meeting. Nevertheless, when the replacement Manuel Rojo arrived from Spain, Ezpeleta stepped aside after an in tense period of negotiations. Ezpeleta was the first and last Filipino governor general under Spanish rule. Secular clergy, under the leadership of native-born Fr. Pedro Pelaez, spoke out against their unjust displacement. They raised funds to send an emissary to Madrid to plead their case, and Fr. Pelaez wrote two tracts in defense of the native clergy. A vigorous and articulate champion, the priest sadly perished, buried under the ruins of the Manila Cathedral as it was flattened by the earthquake of 1863. The denouement in this struggle of the native clergy to be accorded equal rights would come barely a decade later, in the aftermath of the 1872 Cavite Mutiny, its principal actor Fr. José Burgos, who had replaced Pelaez as canon of the cathedral. By the close of the eighteeenth century, the Catholic faith was firmly entrenched, the result of two-and-a-half centuries of assiduous proselytizing by the missionaries and the secular clergy. This did not mean, however, that these articles of faith brought over from Europe had completely supplanted pre- conquest beliefs and practices. In his Estadismo de las Islas Filipinas ( The Condition of the Philippine Islands ) Fr"
    },
    "model_answer": "Walang sapat na impormasyon sa mga dokumentong ito tungkol sa pangalawang komandante ni Datong Silang.",
    "contexts": []
  },
  {
    "question": "What specific pre-colonial beliefs and practices did Fr. Joaquín Martínez de Zúñiga observe in native Filipinos?",
    "ground_truth": "He noted the persistence of animist spirits, or nonos, and their reliance on amulets to ward off demonic spirits such as the Tikbalang and Patianak.",
    "metadata": {
      "cultural_golden_answer": "Fr. Martínez de Zúñiga's observations highlighted the resilience of traditional Filipino beliefs in animist spirits and the importance of harmony with nature, reflecting a deep cultural connection between Filipinos and their environment.",
      "language": "english",
      "cultural_relevance": 0.9,
      "chunk_index": 17,
      "ground_truth_context": ". Nevertheless, when the replacement Manuel Rojo arrived from Spain, Ezpeleta stepped aside after an in tense period of negotiations. Ezpeleta was the first and last Filipino governor general under Spanish rule. Secular clergy, under the leadership of native-born Fr. Pedro Pelaez, spoke out against their unjust displacement. They raised funds to send an emissary to Madrid to plead their case, and Fr. Pelaez wrote two tracts in defense of the native clergy. A vigorous and articulate champion, the priest sadly perished, buried under the ruins of the Manila Cathedral as it was flattened by the earthquake of 1863. The denouement in this struggle of the native clergy to be accorded equal rights would come barely a decade later, in the aftermath of the 1872 Cavite Mutiny, its principal actor Fr. José Burgos, who had replaced Pelaez as canon of the cathedral. By the close of the eighteeenth century, the Catholic faith was firmly entrenched, the result of two-and-a-half centuries of assiduous proselytizing by the missionaries and the secular clergy. This did not mean, however, that these articles of faith brought over from Europe had completely supplanted pre- conquest beliefs and practices. In his Estadismo de las Islas Filipinas ( The Condition of the Philippine Islands ) Fr. Joaquín Martínez de Zúñiga, an Augustinian who served as parish priest in the islands just before the start of the nineteenth century, noted the persistence of what the Catholic Church dismissed as “superstitions.” These in cluded the continuing use of ritualistic practices in the burial of the dead and in dealing with their spirits; and the reliance, still, on amulets, or anting-anting to ward off demonic spirits and phantasmagoric creatures such as the Tikbalang, a monster that took various guises, and the Patianak, a mischievous figure that victimized pregnant women. The locals, according to Zúñiga, still clung to old beliefs in animist spirits, or nonos. Their at titudes implied a healthy respect for nature and the environment. Thus, “when they wish to pluck any flower or fruit, they ask permission of the genius or nono to pluck it. When they traverse any field, river, creek, big trees, groves, and other places, they ask for the good favor of the nonos. When they are obliged to cut any tree, they ask pardon of the nonos, and excuse the mselves to those things by saying, among other things, that the Padre or dered them to do it, and that it was not in their own purpose to fail in their respect to the genii, etc.” Zúñiga also noted the flourishing of the nayon, or barrio, outside the main population areas, where small groups of in habitants had enough to sustain the mselves sans extravagance, lived in a spirit of cooperation and harmony ( bayanihan ), and usually had a village elder to shape communal policies and adjudicate conflicts. In the nayon, life was a hybrid, an amalgam of traditional and Hispanicized mores. Its in habitant was liberated from the in sistent dogma of the priest and the church, free to construct a syncretic, personalized belief system. It was a rebellion, sans violence, sans fanfare, neither accepting colonial rule completely nor rejecting it outright. A modern counterpart to the colonial nayon can be found in peaceful, agrarian, religious communities living on the slopes of Mt. Banahaw, in the southern Tagalog region not too far from Manila and considered to be a sacred mountain. There, combining elements of Christianity and folklore, the deification of local heroes, particularly José Rizal (whose life will be examined in the next chapter), and the recentering of the female as a spiritual force, homegrown cults live amicably side by side, free of the proselytizing and dogmatic fever of the larger, or ganized religions. T HE C RESCENT A GAINST THE C ROSS While the spread of Islam throughout the archipelago was halted by the arrival of the Spanish, they were unable to dominate most of Muslim Mindanao until the last two decades of the nineteenth century, and only then as an occupation force. The situation was the reverse of that in Spain. Islam was an older presence in Southeast Asia, with Christianity the new kid on the block. On the Iberian peninsula, it was of course the exact opposite. The Moors had conquered most of Spain and held on to the peninsula for 700 years, until they were finally driven out by the Catholic monarchs, Ferdinand and Isabella, with the reconquest of the last Moorish stronghold, Granada, in 1492. By melding religious zeal with nationalistic fervor, Ferdinand and Isabella had created a powerful and heady quasi-ideology. After the Reconquista, zealotry was the or der of the day, spurring the Spaniards to both colonize and Christianize South and Central America and islands in the Caribbean and in Southeast Asia. The most telling manifestation of that zealotry was the Spanish Inquisition, promulgated by Ferdinand and Isabella, who used Catholicism as an in strument of national solidarity, for cing the conversion of Jews, for in stance, to Christianity and otherwise expelling non-believers and persecuting and even putting to death alleged heretics. Its most in famous advocate was Tomás de Torquemada, who was appointed Inquisitor General in 1483, held the post for fifteen years, and is believed to have had 2,000 people put to death for alleged crimes against the faith. Because of Islam, different ethnolinguistic groups in Mindanao and Sulu, mainly the Maranao, Tausug, and Maguindanao, had the most developed social or ganization. With more pronounced social stratifications, economic and religious contacts with fellow Muslims in Southeast Asia, and the ability to forge alliances, Muslim Mindanao could and did of fer stronger, more or ganized, and determined resistance to Spanish claims to their territory. Had Legazpi not appeared on the horizon, or even if he did but later on—say, at the beginning of the seventeenth century—most of the archipelago might very well have already come under the Crescent, whether as an in dependent state, a conglomeration of sultanates, or in corporated into either Indonesia or Malaysia. The fact that the Muslims resisted Spanish domination is a source of pride for modern-day Filipino nationalists, though the notion then of defending a Philippine nation-state was in conceivable. Still, the Muslim raids on Luzon and the Visayas can be viewed, at the same time that the Spanish portrayed them as piratical, as both retaliation and resistance to colonialism. But there were other factors that contributed to their freedom from Spanish rule. For one thing, Manila and Luzon were front and center the focus of Spanish at tention. For another, the Spaniards had to fend off threats from rival powers such as the Dutch and the Portuguese (and later the British), as well as putting down uprisings in the areas under their control, hobbling their efforts to assemble a large enough force to dominate the Muslims"
    },
    "model_answer": "Fr. Joaquín Martínez de Zúñiga observed that Filipinos in precolonial times practiced a belief system centered around \"ugales,\" which he equated with \"abusos\" or abuses against the Catholic faith.  [Source: Philippine History Source Book, p. 55]",
    "contexts": [
      "Retana in his edition of Joaquin Martinez de Zuñiga’s Estadismo de las Islas Filipinas. The ethnographic pattern used by Ortiz in this segment is useful in understanding the dynamics of the conversion of the Filipinos to Christianity. The prehispanic religious setup could be seen from his description of the “ugales” which he equates with the “abusos” or abuses against the Catholic faith"
    ]
  },
  {
    "question": "Ano ang ginawa ni Governor Corcuera noong 1637-38 para iwasan ang mga pagsalakay ng Moros?",
    "ground_truth": "Sa pamamagitan ng pag-akyat niya sa Lanao at Jolo noong 1637-38.",
    "metadata": {
      "cultural_golden_answer": "Ang pagsama ng mga Moro at Espanya noon ay nangangailangan din ng pagkakaisa para labanan ang karahasang pangkomersiyo, na nagpapahiwatig ng kahalagahan ng kalayaan at kasabayan sa panahon ng unang kolonyalismo.",
      "language": "filipino",
      "cultural_relevance": 0.9,
      "chunk_index": 18,
      "ground_truth_context": ". Had Legazpi not appeared on the horizon, or even if he did but later on—say, at the beginning of the seventeenth century—most of the archipelago might very well have already come under the Crescent, whether as an in dependent state, a conglomeration of sultanates, or in corporated into either Indonesia or Malaysia. The fact that the Muslims resisted Spanish domination is a source of pride for modern-day Filipino nationalists, though the notion then of defending a Philippine nation-state was in conceivable. Still, the Muslim raids on Luzon and the Visayas can be viewed, at the same time that the Spanish portrayed them as piratical, as both retaliation and resistance to colonialism. But there were other factors that contributed to their freedom from Spanish rule. For one thing, Manila and Luzon were front and center the focus of Spanish at tention. For another, the Spaniards had to fend off threats from rival powers such as the Dutch and the Portuguese (and later the British), as well as putting down uprisings in the areas under their control, hobbling their efforts to assemble a large enough force to dominate the Muslims. Commercial in terests were another factor in the in tense rivalry between the Spanish and the Muslim Filipinos, particularly those of the Sulu Sultanate. With China, defeated by Great Britain in 1842 at the conclusion of the First Opium War, being for ced to open up to Western trade, the sultanate developed into a vital trading center due to its strategic location and rich natural resources—the for tuitous combination of which made the sultanate a powerful player in the region. Jolo, the capital of Sulu, traded with various Asian ports, in cluding Bengal, Canton, Macao, Manila, Borneo, and Singapore. Between 1768 and 1848 the sultanate enjoyed an ascendancy that Manila simultaneously resented and utilized for its own commercial in terests. Such goods from Jolo as pearls, to rtoise shell, shark’s fin, bird’s nest, cinnamon, rattan, ebony, cocoa, and cinnamon—produce of the sea and the for ests—were prized by English traders due to the demand in China for such products. The rise to power of the Taosug (the dominant ethnic group in Sulu) in turn meant their importation of weapons, rice, Chinese ceramics and earthenware, silk clothing, to bacco, wine, glassware, and even opium from India. Luxury goods reinforced elite status and were used to in duce loyalty as well as for bride purchases. Sulu’s control of the regional trade—in what the historian James Francis Warren described as the “Sulu Zone”—enabled the sultanate not only to hold on to its sovereignty but assert its regional dominance until the closing decades of the nineteenth century, when, Warren writes, “the Spanish naval campaigns of the 1870 s and the large-scale immigration of Straits Chinese provided the for mula for the economic and political collapse of the Sulu trading sphere.” The Sultanate’s primacy rested a great deal on its slave raiding traditions, traditions that had always been a feature of the chiefly kingdoms in the archipelago but now in tensified in the case of the sultanate with the need for more manpower, whether in the fields, seas, or in the port, where educated slaves would handle the books and manage the local elites’ business affairs—in the process, a number of them amassing considerable wealth and essentially living as freemen. In this system trade and slavery for med a circle: trade created considerable wealth and power while slavery provided the necessary labor to keep the machinery of trade well oiled. Thus, as trade expanded, so did slave raiding expeditions. Sponsored by the sultanates of both Cotabato and Sulu (with Jolo as the focal point), the raids bedeviled the rest of the archipelago, especially the Visayan Islands, and the coastal to wns of northeastern Mindanao and southern Luzon. The economic and social costs were enormous, ranging from depopulated villages to the disruption of in terisland shipping, particularly in the Visayas. Some of the slave-raiding fleets were enormous, consisting of forty to fifty for tified prahus (similar to the outrigger boat but with a heavier and deeper hull), around 2,500 to 3,000 fighters (mostly Moros from the Maranao or Cotabato region, and the Balangigi isles), and cannon. Slaves were trafficked to Dutch and Bornean ports as well as to Jolo. Captives could be ransomed, with a captured Spanish friar at the top of the list: he commanded the royal sum of 2,000 pesos, while an or dinary European fetched only 300 pesos and a male Filipino slave a measly thirty to fifty pesos. There were periodic military campaigns waged against the Moros, but victory by arms was rarely followed by sustained occupation on the ground. The gains were thus temporary. For in stance, even though a Spanish contingent that in cluded Christian Filipinos assaulted Jolo in 1578 and defeated its sultan, he and his followers were able to rebuild once the Spanish with drew. From then on, Muslim raids on coastal to wns in the Visayas took on a punitive as well as acquisitive character. Later, in 1635, to help defend against such raids the Spanish erected a for tified settlement, Zamboanga, in northwestern Mindanao, where to day Fort del Pilar still stands. With Zamboanga as his base, Governor Corcuera headed a full-scale expedition against the Moros in February 1637. His force of 760 Spaniards and thousands of Christian Filipinos captured Lanao and, the following year, took Jolo after a protracted siege of three and a half months. Convinced that he had broken Muslim power, Corcuera returned to Manila in May 1638 where he was hailed as a conqueror. In truth, for most of the Spanish colonial era, the Moros were never subjugated even in the light of such defeats. They would regroup, and the cycle of conflict would begin anew, essentially affirming the status quo, except for short-lived treaties between the sultanates and the Spanish regime. The Spanish were too few, and faced too many threats from elsewhere. Instead they relied on a network of forts, watchtowers, and warships to guard against Muslim depredations. Watchtowers were of ten strategically located right by the town church so that bells could be rung in warning should Muslim prahus be sighted. There were watchtowers as far north as Laoag and Aparri in northern Luzon, but none on the eastern flanks of the archipelago, though the Pacific side did have occasional patrols. By 1848 the Spanish had grown weary of English encroachment on its southern territories—or what it considered its territories, though the Muslims would have violently disagreed. Mistrust of their perennial rivals was only heightened in 1849 with a treaty of commerce and friendship between Sultan Mohammed Fadl of Sulu and the British government. This time, Manila decided to cripple the Sultanate’s base"
    },
    "model_answer": "Noong 1637, inatake ni Gobernador Corcuera ang mga Moro sa Lanao at noong sumunod na taon ay kinontrol nila ang Jolo. [Sources: A History Of The Philippines, p. 77]",
    "contexts": [
      "With Zamboanga as his base, Governor Corcuera headed a full-scale expedition against the Moros in February 1637. His force of 760 Spaniards and thousands of Christian Filipinos captured Lanao and, the following year, took Jolo after a protracted siege of three and a half months. Convinced that he had broken Muslim power, Corcuera returned to Manila in May 1638 where he was hailed as a conqueror",
      "From then on, Muslim raids on coastal to wns in the Visayas took on a punitive as well as acquisitive character. Later, in 1635, to help defend against such raids the Spanish erected a for tified settlement, Zamboanga, in northwestern Mindanao, where to day Fort del Pilar still stands. With Zamboanga as his base, Governor Corcuera headed a full-scale expedition against the Moros in February 1637"
    ]
  },
  {
    "question": "When did the Spanish colonial government launch a much larger war fleet against Jolo?",
    "ground_truth": "1875",
    "metadata": {
      "cultural_golden_answer": "In 1875, the Spanish colonial government launched a significant military campaign against Jolo, which marked a turning point in their struggle to assert control over the Sultanate of Sulu. This event highlights the long-standing conflict between the Spanish colonizers and the Moros, which has its roots in the cultural and historical context of the Philippines. The complex dynamics between the two groups continue to shape the country's identity and inform its relationships with other nations today.",
      "language": "english",
      "cultural_relevance": 0.9,
      "chunk_index": 19,
      "ground_truth_context": ". Convinced that he had broken Muslim power, Corcuera returned to Manila in May 1638 where he was hailed as a conqueror. In truth, for most of the Spanish colonial era, the Moros were never subjugated even in the light of such defeats. They would regroup, and the cycle of conflict would begin anew, essentially affirming the status quo, except for short-lived treaties between the sultanates and the Spanish regime. The Spanish were too few, and faced too many threats from elsewhere. Instead they relied on a network of forts, watchtowers, and warships to guard against Muslim depredations. Watchtowers were of ten strategically located right by the town church so that bells could be rung in warning should Muslim prahus be sighted. There were watchtowers as far north as Laoag and Aparri in northern Luzon, but none on the eastern flanks of the archipelago, though the Pacific side did have occasional patrols. By 1848 the Spanish had grown weary of English encroachment on its southern territories—or what it considered its territories, though the Muslims would have violently disagreed. Mistrust of their perennial rivals was only heightened in 1849 with a treaty of commerce and friendship between Sultan Mohammed Fadl of Sulu and the British government. This time, Manila decided to cripple the Sultanate’s base. Under Governor General Antonio Urbiztondo and with for tified Zamboanga as its launching pad, a flotilla of steam gunboats as well as sailing ships, close to 3,000 soldiers, and nearly a thousand Filipino conscripts, set out for Jolo in 1851. Fighting was fierce but not prolonged. The steam gunboats made short work of the Moro prahus. In the end, the sultan and his datus retreated into the island’s rugged in terior. Shortly the reafter, a treaty was struck, wherein Sultan Fadl acknowledged Spain’s hegemony, agreed to severe restrictions on for eign trade, and allowed a Spanish naval presence in Jolo, to in terdict for eign vessels and prevent or minimize the importation of weapons. But the treaty was doomed, since neither side really observed its provisos. Urbiztondo had failed to establish a garrison in the capital. Hence, the sultanate continued to trade as before. Only in 1875 did the situation change, when the Spanish colonial government launched a much larger war fleet: nine thousand soldiers (a majority of whom were Filipinos), eleven transport ships, and twenty-two gunboats. In late February, the Spanish flattened Jolo and destroyed nearby Taosug strongholds in the following weeks. This time, a Spanish occupation force remained, erecting forts and rebuilding Jolo, as a European-style city complete with a wall. It was only in 1899 that the Spanish departed, giving way to the new plantation owners: the United States of America. The fact that Christianized natives were regularly employed in the campaigns against the Moros, who were considered beyond the pale, did little to endear them to the latter. Not surprisingly, they subsequently viewed each other with mutual suspicion. Despite racial and cultural ties, each to each was the Other: for eign and hostile—an animosity that persists to this day and complicates efforts to negotiate a lasting peace on both sides of the religious and cultural divide."
    },
    "model_answer": "The Spanish colonial government launched a much larger war fleet against Jolo in 1875. [Source: A History Of The Philippines, p. 78]",
    "contexts": [
      "Only in 1875 did the situation change, when the Spanish colonial government launched a much larger war fleet: nine thousand soldiers (a majority of whom were Filipinos), eleven transport ships, and twenty-two gunboats. In late February, the Spanish flattened Jolo and destroyed nearby Taosug strongholds in the following weeks. This time, a Spanish occupation force remained, erecting forts and rebuilding Jolo, as a European-style city complete with a wall",
      "But the treaty was doomed, since neither side really observed its provisos. Urbiztondo had failed to establish a garrison in the capital. Hence, the sultanate continued to trade as before. Only in 1875 did the situation change, when the Spanish colonial government launched a much larger war fleet: nine thousand soldiers (a majority of whom were Filipinos), eleven transport ships, and twenty-two gunboats"
    ]
  },
  {
    "question": "Paano ang naging epekto ng mga pagbabagong panlipunan at politikal sa Europa noong ika-19 siglo sa Pilipinas?",
    "ground_truth": "\"The combination of the Enlightenment with the upheavals brought about by the French Revolution contributed to the spread of liberal ideas in Spain. Specifically, the Napoleonic Wars of 1803 to 1815, continent-wide conflicts that pitted the armies of Napoleon against a varying cast of opponents, further accelerated change and the decline of the old order.\"",
    "metadata": {
      "cultural_golden_answer": "Ang pagbabagong panlipunan at politikal sa Europa noong ika-19 na siglo, lalo na ang mga ideyang dulog sa Katayuan ng Kalayaan at Republika, ay may malaking epekto sa Pilipinas. Ang ilustrados, na karamihan ay mayaman at nag-aral sa Europa, ay nagdala ng mga bagong ideya at batayan na nagtulak sa pagbabago sa lipunan ng Pilipinas.",
      "language": "filipino",
      "cultural_relevance": 0.9,
      "chunk_index": 0,
      "ground_truth_context": "3. FROM INDIO TO FILIPINO: EMERGENCE OF A NATION, 1863-1898 “[Padre Damaso] got up and in Tagalog said very ominously, ‘When you come to see me it should not be in borrowed clothes, which is not for you.’ … He went into his quarters and slammed the door, even though I wanted to stop him. What could I do? I barely have my salary. To get it I have to remain in the priest’s good of fices and make a trip to the head of the province, what could I do against him, the town’s main moral, political, and civil authority, supported by his or der, feared by the government, rich, powerful, consulted, listened to, believed, heeded everywhere by everyone? If he in sults me I have to hold my to ngue. If I answer back, he’ll throw me out and my career will be over. How will that help education? On the contrary everyone will side with the priest, they’ll in sult me, they’ll call me vain, proud, preening, a bad Christian, vulgar, and even anti- Spanish and a subversive. They don’t expect knowledge or enthusiasm from a schoolmaster. They just want resignation, humility, in ertia.” —José Rizal, Noli Me Tangere (trans. H. Augenbraum) M ORE THAN ANY OTHER F ILIPINO SUBJECT TO S PANISH COLONIAL rule, the medical doctor, brilliant polymath, and writer José Rizal, in his in cendiary 1887 novel Noli Me Tangere, exposed the state of the archipelago as it was during the waning decades of Spanish hegemony. The voice of the town schoolteacher lamenting his predicament to the protagonist Crisostomo Ibarra echoed eerily the voice of the politicized Indios who, though acutely aware of the need for changes in their society, felt powerless to work for these, blocked by the reactionary character of the dominant figure of the time, the friar; the narrow strictures of education; and a civil administration in different at best and mindlessly cruel at worst. (The sequel to the Noli, El Filbusterismo, or The Subversive, followed in 1891. Even darker in its appraisal of the colonial regime, the Fili, as it was commonly referred to, confirmed Rizal’s pariah status in the eyes of the Spanish overseers.) In the book, the rich Ibarra, recently returned from studies and travels in Europe, personified the ilustrados, “enlightened ones,” who like Rizal and his peers were scions of the rising haute bourgeoisie and the refore had the means to go abroad to seek either further education, political exile, or simply a better life. For the most part, the ilustrados chose Madrid or Barcelona, with some opting to live in Paris. The Europe of fin de siècle nineteenth century had long been steeped in the ideas of the Enlightenment, the zeitgeist heady with the promise of liberty and equality, with its emphasis on in dividual rights, the centrality of reason, and the repudiation of oligarchy, whether in the realm of civil government or religious authority. Perhaps the most violent (and contradictory) manifestation of the Enlightenment’s impact on the Ancien Régime was the French Revolution of 1789. European capitals provided the hothouse in tellectual at mosphere that young, in tellectually curious Filipinos lacked in Manila. The opening up of the colony to in ternational trade at the start of the nineteenth century resulted in a burgeoning middle class, which in turn meant the sons of these upwardly mobile families could be sent to colleges and universities both in Manila and Europe—an in dispensable factor in the development of a national and nationalist consciousness. Principally through the actions and writings of the ilustrados, the currents of reform reached Las Islas Filipinas, so that the islands were in evitably affected by radical political and social changes in Europe. Change may have boarded a slow boat to Manila, but it was coming. Spanish society had already undergone fundamental changes by the time the ilustrados arrived in Europe. The Southeast Asian colony was on the margins of the Spanish empire, distant enough so that these changes did not resonate in stantly or as powerfully as might have been otherwise expected. Nevertheless, political and social alterations in Spain were bound to have an effect on the far- away archipelago. The combination of the Enlightenment with the upheavals brought about by the French Revolution contributed to the spread of liberal ideas in Spain. Specifically, the Napoleonic Wars of 1803 to 1815, continent-wide conflicts that pitted the armies of Napoleon against a varying cast of opponents, further accelerated change and the decline of the old or der. The French in vasion and occupation of Spain led to the Spanish War of Independence (1808-1814). Spanish resistance to the Napoleonic in vasion, assisted by the British surreptitiously, brought about the temporary ascendancy of the Spanish liberals who produced the Cádiz Constitution of 1812, which extended democratic rights not only to Spaniards but also to all non-Spanish subjects of Madrid. Additionally, reflecting the prevalent liberal spirit, the Cádiz Constitution set limits on the monarchy. The Cortes, or Spanish Parliament, was revived and now allowed for a representative from each colony, in cluding the Philippines. The first representative for the archipelago was Ventura de los Reyes, who served from 1810 to 1813. The unheralded de los Reyes was one of the signatories of the Cádiz Constitution, promulgated in March of 1812, but proclaimed in Manila only a year after, in 1813. The constitution affirmed human and political rights. De los Reyes was also in strumental in curtailing the galleon trade, much to the relief of Spanish merchants who had always resented the galleon trade for cutting into their own import businesses. The dissolution of the Manila- Acapulco run freed up trade with other countries and liberalized the conditions under which entrepreneurs operated. Strictly speaking, however, Philippine representation in the Cortes was misleading, as the representatives were of Spanish descent, and in digenous Filipinos had no say in determining who was to “represent” them. The upheavals in Spain had more immediate repercussions in her Latin American colonies, where she was heavily in vested. With the Napoleonic Wars weakening an already vulnerable Spanish empire, the Creoles in the New World colonies set to the task of freeing the mselves from colonial rule. Realizing their economic in terests conflicted with those of Spain, the Creoles led national liberation movements, which resulted in the dissolution of most of the Spanish empire by 1820. In 1814, however, the monarchy was restored, with Ferdinand VII reigning, and the liberal provisions of the Cortes revoked. In 1815 there were violent reactions in the archipelago to this revocation"
    },
    "model_answer": "Walang sapat na impormasyon sa mga dokumentong ito tungkol sa epekto ng mga pagbabagong panlipunan at politikal sa Europa noong ika-19 siglo sa Pilipinas.",
    "contexts": []
  },
  {
    "question": "When did the Educational Decree of 1863 require the establishment of schools and the availability of free primary instruction for children between the ages of seven and twelve?",
    "ground_truth": "1863",
    "metadata": {
      "cultural_golden_answer": "This decree was a significant step towards improving education in the Philippines, as it acknowledged that only a small percentage (estimated at 5 to 10 percent) of the subject population were fluent in Spanish. By requiring free primary instruction and setting standards for teacher qualifications, the government aimed to increase this percentage and promote literacy among Filipinos.",
      "language": "english",
      "cultural_relevance": 0.9,
      "chunk_index": 1,
      "ground_truth_context": ". The constitution affirmed human and political rights. De los Reyes was also in strumental in curtailing the galleon trade, much to the relief of Spanish merchants who had always resented the galleon trade for cutting into their own import businesses. The dissolution of the Manila- Acapulco run freed up trade with other countries and liberalized the conditions under which entrepreneurs operated. Strictly speaking, however, Philippine representation in the Cortes was misleading, as the representatives were of Spanish descent, and in digenous Filipinos had no say in determining who was to “represent” them. The upheavals in Spain had more immediate repercussions in her Latin American colonies, where she was heavily in vested. With the Napoleonic Wars weakening an already vulnerable Spanish empire, the Creoles in the New World colonies set to the task of freeing the mselves from colonial rule. Realizing their economic in terests conflicted with those of Spain, the Creoles led national liberation movements, which resulted in the dissolution of most of the Spanish empire by 1820. In 1814, however, the monarchy was restored, with Ferdinand VII reigning, and the liberal provisions of the Cortes revoked. In 1815 there were violent reactions in the archipelago to this revocation. News of the Cádiz constitution had reached the islands only in 1813, so its revocation after a little more than a year was viewed with suspicion by the in digenous population, who felt that the principalia arbitrarily and capriciously determined how the laws were to be in terpreted and enforced. By 1820, there was yet another swing to wards Republicanism: the constitutional period was brought back, and Ferdinand exiled. At the same time, direct mail service was established between Spain and the Philippines. The Cortes, revived yet again, approved certain measures specific to the Philippines. Trade was further liberalized, so that products and goods manufactured in the islands were now considered “national,” and thus entitled to the privileges and immunities the law bestowed on Spanish goods. These steps were undertaken essentially to stimulate native entrepreneurship. With the declaration of Mexico’s in dependence from Spain in 1821, Manila ceased to be administratively ruled from Mexico. It now had to be governed directly from far-away Spain, though the opening of the Suez Canal in 1869 was to shorten the distance considerably, bringing travel time down to five weeks, from the previous three to four months. Another swing to the right in Madrid occurred in 1823, when Ferdinand was restored to absolute power by the French, wielding it until his death in 1833. Predictably, the king revoked the constitution, abolished the Cortes, and in validated its legislative work. By the time of Ferdinand’s restoration, only Cuba, Puerto Rico, the Philippines, and the Marianas remained Spanish colonies. Subsequent to Ferdinand’s death, the question of succession proved destabilizing, leading to the Carlist Wars. Essentially a long-running civil war between those who moved to uphold monarchism and tradition and those who favored the continuation of Enlightenment legacies of secularism and a republican form of government, the wars spanned more than four decades, from 1833 to 1876 (though the Civil War that erupted in 1936, between Republican for ces and General Franco and the Falangists can be seen as the endpoint of this conflict). Once more, the Cortes was revived, but this time with limited powers. Queen Cristina, Regent of Spain, or dered it to craft a new constitution. The result: the Constitution of 1837, which established a parliamentary form of government. However, in a blow to the rights of colonies, their right to representation was abolished. Its restoration was one of the goals which the ilustrados would demand. E DUCATION AND THE S PREAD OF I DEAS As the expatriate Indio community in Spain began to grow, there were at tempts to improve the education system archipelago-wide, following an 1839 royal decree. Indeed, a marine school was established in Manila in 1840, its aim to graduate trained pilots for ships sailing to mainland Asia, Europe, or North America. However, while there were primary schools in to wns and villages, these were handicapped by in adequate facilities and the lack of trained teachers. Moreover, local schools were under the control of the local friar, as they had been since the start of the colonial period. More than anything else, the friar was keen to see his young charges learn their catechism by heart, and not in encouraging their faculties of in dependent thinking. For most of Spanish colonial rule, very little legislation existed that dealt with schooling; it was left to the religious or ders to in troduce a systematic method of primary education. At the outset of colonial rule in the late sixteenth century, the Augustinians—the first religious or der in the colony—in structed its parishes to set up schools throughout the archipelago. In 1634 and 1636, archbishops and bishops were asked by Philip IV to educate the in digenous people. Towards the end of the seventeenth century, the Crown decreed that primary in struction should be free, and in 1792, Charles III suggested that schools should be supervised by civil authorities, an implicit recognition that education was mainly if not to tally handled by the religious. Government legislation never established a detailed, consistent plan on educational methods for primary schools, even though royal or ders placed emphasis on education, particularly with regard to the construction of buildings, the recruitment of divinity teachers, and the teaching of Spanish. However, with the Educational Decree of 1863, the home government required the establishment of schools and the availability of free primary in struction for children between the ages of seven and twelve. This in evitably improved the system that heretofore privileged only the peninsulares and the native wealthy. One of the goals was for the young to learn Castilian. At any one time, only a small percentage of the subject population—estimated at between 5 to 10 percent—was fluent in Spanish, and this decree was meant to in crease that percentage. But the goal that superseded everything else was still the imparting of Christian doctrine, morality, and what was termed “sacred history”—basically a study of the Bible—to be directed by the parish priest. (Not surprisingly, the first book printed in the colony, in 1593, was the Doctrina Christiana en Lengua Española y Tagalog, or the Christian Catechism in Spanish and Tagalog.) The 1863 decree meant the government taking charge of higher education; of ficial recognition of educational in stitutions established by the religious or ders; a determination of teacher qualifications; and a pay scale"
    },
    "model_answer": "Walang sapat na impormasyon sa mga dokumentong ito tungkol sa Educational Decree of 1863.",
    "contexts": []
  },
  {
    "question": "Saan ang pinakamatandang unibersidad sa Pilipinas?",
    "ground_truth": "University of San Carlos",
    "metadata": {
      "cultural_golden_answer": "Ang University of San Carlos ay isang mahahalagang institusyon sa pananaliksik at pagtuturo ng Pilipinas, na itinatag noong 1595 ng mga Heswitang Espanyol. Ito ang nagsilbing inspirasyon para sa pagbuo ng iba pang unibersidad at institusyon sa buong bansa.",
      "language": "filipino",
      "cultural_relevance": 0.9,
      "chunk_index": 2,
      "ground_truth_context": ". However, with the Educational Decree of 1863, the home government required the establishment of schools and the availability of free primary in struction for children between the ages of seven and twelve. This in evitably improved the system that heretofore privileged only the peninsulares and the native wealthy. One of the goals was for the young to learn Castilian. At any one time, only a small percentage of the subject population—estimated at between 5 to 10 percent—was fluent in Spanish, and this decree was meant to in crease that percentage. But the goal that superseded everything else was still the imparting of Christian doctrine, morality, and what was termed “sacred history”—basically a study of the Bible—to be directed by the parish priest. (Not surprisingly, the first book printed in the colony, in 1593, was the Doctrina Christiana en Lengua Española y Tagalog, or the Christian Catechism in Spanish and Tagalog.) The 1863 decree meant the government taking charge of higher education; of ficial recognition of educational in stitutions established by the religious or ders; a determination of teacher qualifications; and a pay scale. In turn, the religious or ders gave up some higher-education tasks and focused on free primary, compulsory education for all children of both sexes. After the Maura decree of 1893, schools became free from in spection by the parish priests and the reafter became the responsibility of the local governments. By 1898, the last year of Spanish rule, one reliable estimate put the number of state schools at 2,143, excluding private and religious schools. The educational system in the colony may have developed in fits and starts, but by the time of the American takeover, there was enough of an in frastructure in place for American educators to implement an island-wide public-school system. Having been at it for nearly three centuries, the religious or ders had shaped the landscape of higher education in the country by founding colleges and universities. Among these is the oldest educational in stitution in the country, the University of San Carlos, established by the Spanish Jesuits in Cebu in 1595 but now run by the Society of the Divine Word or der. All other noteworthy schools were founded in Manila: Colegio de San José (1603), founded by the Jesuits; University of Santo Tomás (1611) and the College of San Juan de Letrán (1620), both established by the Dominicans; and La Concordia College, founded exclusively for women by the Daughters of Charity in 1868. Outside of these universities, seminaries run by the religious of fered secondary education to lay students. The 1863 decree also established a normal school for teachers in Manila, to be under the direction of the Jesuits, who having been expelled in 1768, had been allowed to return to the colony in 1859. (That same year, the Jesuits took over the Escuela Municipal de Manila, which in 1865 was raised to the status of a college, the Ateneo Municipal de Manila, now the private Ateneo de Manila university, the third-oldest university in the country.) The normal school was to serve as an educational center for God-fearing and obedient potential teachers. Again, at the top of the list of in tended goals was the imparting of religion, morals, and sacred history. The unremitting emphasis on religious tutelage allowed Catholicism to be deeply entrenched, of ten at the expense of the secular pursuit of knowledge. As educational reforms began to take effect, however sporadically, the number of journals and newspapers in creased. There were seventy-four during the last three decades of the nineteenth century. Among the better known were La Opiníon, Manila Alegre, El Comercio, El Correo, El Católico Filipino, and Diario de Manila. A majority of the publications were in Spanish, and some were bilingual—an in dication not only of the spread of literacy but of news, however modified by the powers that be, outside of Manila. All had to contend with a board of censors that had been set up in 1856, made up of four appointees by the governor and four appointees by the archbishop of Manila, for ever on the lookout for articles that might impugn either the state or the church—or both. As imperfect as it was, the educational system heading into the latter half of the nineteenth century, along with economic and social changes brought about by the opening up of the colony to in ternational trade, did turn out an in telligentsia, among them the ilustrados, the sons of upwardly mobile mestizo and in dio families who had grown critical of colonial rule, and were at the for efront of the reformist movement that came to be known as the Propaganda Movement. But laying the ground for the political awakening of their generation were upheavals in the country’s religious ranks. S ECULARIZATION AND THE C ATACLYSM OF 1872 Presaging the concerted demands for Filipinization of parishes, as well as the revolutionary brotherhood, the Katipunan, which would spring up in 1892, a devout Indio peasant by the name of Apolinario de la Cruz, having had his application to join a friar or der in Manila rejected in 1839, returned to the southern Tagalog provinces and for med the Cofradía de San José, or Confraternity of St. Joseph. De la Cruz (known in the Confraternity as Hermano, or Brother, Pule) was clearly a charismatic leader, for the lay religious brotherhood soon at tracted numerous adherents, whose contributions enabled the Cofradía to sponsor regular masses for its followers, and even fiestas. The authorities, both civil and religious, viewed the confraternity with skepticism and deep suspicion. The church hierarchy refused to recognize its activities as legitimate, and its members were routinely harassed. Institutional disdain and contempt led de la Cruz and the Cofradía to assert the mselves as an in dependent group, claiming to have divine support and refusing anyone but full-blooded natives membership. Mestizos could be accepted but only with de la Cruz’s express consent. At times his followers would proclaim de la Cruz as “King of the Tagalogs”—a clear reference to Christ being heralded as the King of the Jews. Inevitably the state, acting on requests by the friars, acted to suppress what was seen as a potentially explosive in surgent movement by sending troops to the Cofradía’s stronghold in Tayabas, now Quezon, Province. Though in itially successful in repulsing the at tacks, Pule and his confraternity were defeated. At the age of twenty-seven, the would-be priest and his aide, called Purgatorio, were executed along with 200 other members of the Cofradía. De la Cruz’s body was dismembered, his severed head stuck on a pole placed by the roadside in a manner reminiscent of the deaths of Christian martyrs at the hands of the Romans"
    },
    "model_answer": "Walang sapat na impormasyon sa mga dokumentong ito tungkol sa pinakamatandang unibersidad sa Pilipinas.",
    "contexts": [
      "Kasangga rin sa Eleksyon 2019 ang mga nangungunang unibersidad sa bansa na: University of the Philippines (UP); Polytechnic University of the Philippines (PUP); Ateneo de Manila University (ADMU); De La Salle University (DLSU); University of Santo Tomas (UST); at AMA Education System",
      "Sdc Sa 634 unibersidad na pinakamahuhusay sa Asya, 14 ang mula sa Pilipinas. Ayon ito sa pinakabagong Quacquarelli Symonds (QS) World University Rankings. Una rito ang University of the Philippines (UP) na nasa 69 th spot, akyat ng tatlo mula sa puwesto nito noong nakaraang taon. Pang-135 naman ang Ateneo de Manila University, pang-166 ang De La Salle University, at pang-186 ang University of Santo Tomas. Pawang bumaba ang kanilang puwesto",
      "Ang Sistema ng Politeknikong Unibersidad ng Pilipinas ang pinakamalaking pamantansan sa pamamagitan ng populasyon ng magaaral, na umabot sa noong. Ang PUP ay nangangasiwa sa tatlong kampo sa Maynila at may dalawaput isang sangay na kampo. Noong sentenaryo ng pamantasan, idineklara ni Pangulong ang PUP bilang Pambansang Komprehensibong Unibersidad ng Pilipinas dahil sa mga adhikain nitong maitaguyod ang kahalagahan ng edukasyon sa mga Pilipino"
    ]
  },
  {
    "question": "What was a significant consequence of the state's actions against the Cofradía?",
    "ground_truth": "The execution of Pule and his confraternity, including 200 members.",
    "metadata": {
      "cultural_golden_answer": "This event marked a turning point in the Filipinization movement, highlighting the government's suppression of native-led groups seeking equal rights and self-governance. The brutal treatment of Pule and his followers would become a rallying cry for future nationalist movements in the Philippines, emphasizing the need for indigenous leadership and self-determination.",
      "language": "english",
      "cultural_relevance": 0.9,
      "chunk_index": 3,
      "ground_truth_context": ". The authorities, both civil and religious, viewed the confraternity with skepticism and deep suspicion. The church hierarchy refused to recognize its activities as legitimate, and its members were routinely harassed. Institutional disdain and contempt led de la Cruz and the Cofradía to assert the mselves as an in dependent group, claiming to have divine support and refusing anyone but full-blooded natives membership. Mestizos could be accepted but only with de la Cruz’s express consent. At times his followers would proclaim de la Cruz as “King of the Tagalogs”—a clear reference to Christ being heralded as the King of the Jews. Inevitably the state, acting on requests by the friars, acted to suppress what was seen as a potentially explosive in surgent movement by sending troops to the Cofradía’s stronghold in Tayabas, now Quezon, Province. Though in itially successful in repulsing the at tacks, Pule and his confraternity were defeated. At the age of twenty-seven, the would-be priest and his aide, called Purgatorio, were executed along with 200 other members of the Cofradía. De la Cruz’s body was dismembered, his severed head stuck on a pole placed by the roadside in a manner reminiscent of the deaths of Christian martyrs at the hands of the Romans. The Cofradía’s clamor for change in the way religious groups were constituted was clearly emblematic of the groundswell of dissatisfaction with colonial rule and of the push for equal rights. Hence, the Filipinization of the clergy was not simply a religious issue but one in which broader social and economic issues came into play. Being that the Catholic Church and its priests (particularly the Spanish friars) represented the apex of Philippine colonial society, priesthood was viewed by many of the more ambitious natives as a sure means of social and even material advancement. The Jesuits’ return in 1859 revived the issue of Filipinization. Their earlier, for ced departure in 1768 resulted in vacant curacies, especially in northern Mindanao. With not enough Spanish clergy to go around, these had gone to Filipino secular priests. Now, there was an or der to transfer curacies in the Bishopric of Manila from native clergy to the Spanish religious or ders, to accommodate those displaced by the returning Jesuits. The or der to vacate what they had administered capably for more than ninety years embittered many of the seculars. (They had to give up, for in stance, one of the wealthiest parishes in the colony, that of Antipolo, not far from Manila, and the archipelago’s most famous pilgrimage site devoted to the Blessed Virgin Mary, Our Lady of the Voyage.) The of ficial reasons, they felt, disparaged their abilities and cast aspersions on their character. These feelings would persist and lead many secular native priests later on to adopt nationalist causes. A breakdown in 1870 showed that out of a to tal of 792 parishes, 611 were administered by regular priests, i. e., belonging to the Orders, and 181 by secular priests, almost all of whom were Filipino. At the same time, political turmoil continued in Spain. The Spanish revolution of 1868 resulted in the for mation of yet another liberal, democratic form of government. The next year, 1869, the same year the Suez Canal was opened, the Cortes approved a new constitution, which established a limited monarchy; recognized in dividual freedom of expression, association, domicile, and worship; legalized civil marriages; and in troduced the jury system. A wealthy liberal, Carlos María de la Torre, was sent over to the colony as the new governor general. Once in stalled, de la Torre banned flogging in the military, lifted restrictions on the press, public demonstrations, and the for mation of associations aimed at reform, etc. The governor displayed his in tentions for a more democratic dispensation by having creoles and mestizos at the Palace and proposing to asts to “Liberty!” He took the unusual step of pardoning a group of dissidents in nearby Cavite province, who had been in volved in agrarian disputes with local landowners. He had these same dissidents form a police force. De la Torre also went on walks in Intramuros sans the traditional armed escort in their fancy uniforms. Not surprisingly, such behavior scandalized the long-time Spanish expatriates and clergy, who feared this display of liberalism would only encourage the lowly natives to become uppity and entertain ideas of a free society. Naturally the rising bourgeoisie—native and mestizo alike—hailed him. Unfortunately for this budding reform movement, Amadeo of Savoy was in stalled as king, and the leftward shift in Spain was arrested. De la Torre was recalled in 1871, and replaced by a right-winger Rafael de Izquierdo, who promptly restored the restrictions, and viewed with suspicion those who had supported de la Torre’s policies. More tellingly, he also with drew the exemption from tribute and for ced labor (the polos y servicios ) that the workers at the Cavite arsenal, the artillery barracks and engineer corps of Fort San Felipe—just across the bay from Intramuros—had enjoyed since 1740. The abolition of these privileges caused the men in the fort to mutiny on January 20, 1872. Though seven Spanish of ficers were killed, the mini-revolt, never more than a brushfire, was quickly suppressed over a period of two days, but the in cident was viewed as more than just a violent act of in subordination. Here was an opportunity to get rid of Filipino secular priests who had championed the Filipinization of the clergy—an in sistent demand seen at the for efront of in cipient nationalism. This demand had grown to in clude not only the native clerics but Creoles and Spanish mestizos as well. Among those swept into the net of suspected subversives were figures of social standing and three secular priests: Mariano Gómez, curate of the nearby town of Bacoor, Cavite; Jacinto Zamora, parish priest of Marikina Town, a suburb north of Manila; and José Burgos, a curate at the prestigious Manila Cathedral. Of the three, the most well-known was Fr. Burgos, one of the most vocal and in fluential champions of the Filipino secular clergy and who had made his views known to de la Torre. Born in 1837, he was at the age of thirty already a doctor of the ology and canon law, and the Synodal Examiner of the country’s preeminent See—the Cathedral of Manila. He was also an expert swordsman and knew how to box. Tireless in his advocacy of Filipinizing the parishes and in defense of his fellow Filipino priests, in 1869 Burgos penned “To the Spanish People.” Reading this eloquent essay, one can see why the Spanish friars detested him. He rebutted the baseless charges levied against the secular priests by La Verdad, or The Truth, a newspaper that clearly favored the entrenched Spanish clergy"
    },
    "model_answer": "The state's actions against the Cofradía by sending troops to their stronghold in Tayabas led to the suppression of what was seen as a potentially explosive insurgent movement. [Source: A History Of The Philippines, p. 85]",
    "contexts": [
      "Mestizos could be accepted but only with de la Cruz’s express consent. At times his followers would proclaim de la Cruz as “King of the Tagalogs”—a clear reference to Christ being heralded as the King of the Jews. Inevitably the state, acting on requests by the friars, acted to suppress what was seen as a potentially explosive in surgent movement by sending troops to the Cofradía’s stronghold in Tayabas,"
    ]
  },
  {
    "question": "Ano ang pangalan ng tatlo pang mga katoliko na pinatay sa Cavite noong 1872?",
    "ground_truth": "Mariano Gómez, Jacinto Zamora, at José Burgos",
    "metadata": {
      "cultural_golden_answer": "Ang tatlong ito ay mga bantay-kaluluwa (secular priests) na kilala sa kanilang pagtutol sa mga kastila na pari. Nilinaw nila ang konsepto ng pagsasaliksik sa katoliko at nagbigay daan para sa tunay na kalayaan.",
      "language": "filipino",
      "cultural_relevance": 0.9,
      "chunk_index": 4,
      "ground_truth_context": ". Here was an opportunity to get rid of Filipino secular priests who had championed the Filipinization of the clergy—an in sistent demand seen at the for efront of in cipient nationalism. This demand had grown to in clude not only the native clerics but Creoles and Spanish mestizos as well. Among those swept into the net of suspected subversives were figures of social standing and three secular priests: Mariano Gómez, curate of the nearby town of Bacoor, Cavite; Jacinto Zamora, parish priest of Marikina Town, a suburb north of Manila; and José Burgos, a curate at the prestigious Manila Cathedral. Of the three, the most well-known was Fr. Burgos, one of the most vocal and in fluential champions of the Filipino secular clergy and who had made his views known to de la Torre. Born in 1837, he was at the age of thirty already a doctor of the ology and canon law, and the Synodal Examiner of the country’s preeminent See—the Cathedral of Manila. He was also an expert swordsman and knew how to box. Tireless in his advocacy of Filipinizing the parishes and in defense of his fellow Filipino priests, in 1869 Burgos penned “To the Spanish People.” Reading this eloquent essay, one can see why the Spanish friars detested him. He rebutted the baseless charges levied against the secular priests by La Verdad, or The Truth, a newspaper that clearly favored the entrenched Spanish clergy. He cited the main charge: “‘… the Filipino who dedicates himself to the sacred of fice of the priesthood is wont to carry out faithfully and well the mechanical detail of church work but he never at tains to the point of excelling in anything connected with the solemn priestly functions.’” Burgos highlighted the friars’ refusal to obey royal decrees, especially that of 1863, commanding them to teach Spanish to their constituents. “So resolutely do the friars carry their in tentions to its undue lengths that they come to abhor in their parish the native who speaks Spanish.” He described the friars as “sand in the cog wheels of the country’s civilization” who “endeavor to keep the poor natives in a state of ignorance and boorishness”—the better to maintain both their in fluence and affluence. To for estall charges of treason, of being a filibustero, or subversive, he highlighted the secular priests’ services in the past, declared that their abilities were equal to the best of the friars, and reiterated above all how loyal the secular clergy was to Mother Spain. If only the motherland would open her eyes and see, she would recognize in stantly the great in justice that was being perpetuated. He accused the friar or ders of being in “possession of great riches and profitable estate in comes which they do their best to keep away from the eyes of the government,” riches that were “now unhappily available at all times and is too of ten put to ill use, in the in dulgence of pleasure, in the transgression of the law, in the corruption of justice and in the in fliction of harm to their fellowmen.” Strong, provocative words. In essence, Burgos had written a with ering critique of not just the Spanish friars but colonialism itself, for colonial rule had prospered precisely because it condoned the friars’ methods. Confrontation with the friars was in evitable, though things would not come to a head for two more decades. Spain justified her presence in the islands—in deed throughout her empire—based on the evangelical belief in Catholicism’s superiority and the imperative to spread it. Even though this religion brought over from Spain had sunk its roots deep in Philippine soil, the different localized resistance movements that rose out of deep despair, with the well of native for bearance running dry, had no choice but to see the friar as the main obstacle to freedom and, since the friar too was key to local economic development, material progress. Catholic the ology was acceptable, but its Iberian herald was in creasingly unwelcome. In a mock trial, and implicated by one mutineer, the clerics were promptly found guilty of plotting to overthrow the regime. Significantly, Archbishop Martínez of Manila refused to defrock them, an implicit endorsement of their professed in nocence, as well as a pointed rebuke of the friar or ders, who continually resisted the diocesan bishop’s right to visitation—a mechanism provided by the Patronato Real, through which oversight by the Royal Crown was exercised. On February 17, 1872, a month after the failed mutiny, Gómez, Burgos, and Zamora were publicly executed at the Luneta by means of the garrote, an iron collar bound around the condemned’s neck and then twisted until the neck is broken. Burgos, the last to be killed, shouted out his declaration of in nocence, to which one of the at tending friars is said to have chillingly remarked, “So was Jesus.” Ironically, the mutineer who had implicated the trio in the hopes of being pardoned or at least spared the death penalty, a man by the name of Saldua, was garroted as well. Others were imprisoned and twenty-two others, in cluding nine native priests, were banished to the Marianas Islands. A few of the banished laymen managed to make their way to Europe, among them Joaquin Pardo de Tavera and Antonio Regidor, who, along with other Filipino émigrés, for med the nucleus of an expatriate community that the later generation of Filipino upper-middle class in tellectuals would join. That the trials were patently unfair is clear in the rebuke the Supreme Military Council in Madrid (the highest military tribunal) delivered to the colonial government in Manila, stating that its conduct was a violation of the law, and warning against a repeat. No punishment was decreed, however, for such a violation. The Cavite Mutiny anticipated a much larger one when, on September 2 of the same year, close to 1,200 laborers in the same Cavite shipyards, according to Benedict Anderson in Under Three Flags, “went on the first recorded strike in Philippine history. Numerous people were arrested and in terrogated but the regime failed to find an arrestable mastermind and eventually all were released.” The peaceable strike was to protest the suspension of their privileges—the very same cause that sparked the brief armed in surrection. There was a practical side to the stirrings of nationalism. Their widening economic in terests made the colonized more aware of and sensitive to antiquated and unfair colonial policies, abetted by systemic racism and the denial of freedoms. This blatant oppression of liberal creoles, mestizos, and native clerics, though at other times strange bedfellows, resulted in a common cause being taken up. The drive to Filipinize the parishes was easily subsumed into the larger context of widespread discontent and the desire for substantial reforms. The fact that three men of the cloth had been killed in cold blood by the colonial state absolved would-be rebels from being castigated as anti-Catholic"
    },
    "model_answer": "Ang tatlong mga Katoliko na pinatay sa Cavite noong 1872 ay sina Fathers Jose Burgos, Mariano Gomez, at Jacinto Zamora. [Sources: Culture And Customs Of The Philippines, p. 60; Philippine History Source Book, p. 95; Philippine History Source Book, p. 82]",
    "contexts": [
      "Events took a tragic but defining turn in 1872 when three prominent Filipino priests, Fathers Jose Burgos, Jacinto Zamora, and Mariano Gomez, were executed for their alleged role in a mutiny by native troops assigned to the Spanish naval station in Cavite along the shore of Manila Bay southeast of the capital",
      "eminent native Filipino priests Doctor Jose Burgos, Mariano Gomez, and Jacinto Zamora, whose in nocent blood was shed through the in trigues of those so-called religious or ders which pretended that a military in surrection had broken out on the night of January 21 st, 1872, in the Fort of San Felipe in the town of Cavite, accusing said martyrs of starting it, so as to prevent the execution of the decree-sentence issued by the Council of State in the appeal in administrative litigation in terposed",
      "Excerpt: Late in the night of the 15 th of February 1872, a Spanish court martial found three secular priests, Jose Burgos, Mariano Gomez and Jacinto Zamora, guilty of treason as the in stigators of a mutiny in the Kabite navy-yard a month before, and sentenced them to death"
    ]
  },
  {
    "question": "What was the major cause of the strike by laborers in the Cavite shipyards in 1872?",
    "ground_truth": "The suspension of their privileges.",
    "metadata": {
      "cultural_golden_answer": "This event marks a significant moment in Filipino history, highlighting the growing awareness and resistance to colonial policies, which would eventually contribute to the nationalist movement and the desire for reforms. The strike's peaceful nature also demonstrates the evolving values of Filipinos, who were transitioning from being colonized subjects to assertive citizens demanding their rights.",
      "language": "english",
      "cultural_relevance": 0.9,
      "chunk_index": 5,
      "ground_truth_context": ". No punishment was decreed, however, for such a violation. The Cavite Mutiny anticipated a much larger one when, on September 2 of the same year, close to 1,200 laborers in the same Cavite shipyards, according to Benedict Anderson in Under Three Flags, “went on the first recorded strike in Philippine history. Numerous people were arrested and in terrogated but the regime failed to find an arrestable mastermind and eventually all were released.” The peaceable strike was to protest the suspension of their privileges—the very same cause that sparked the brief armed in surrection. There was a practical side to the stirrings of nationalism. Their widening economic in terests made the colonized more aware of and sensitive to antiquated and unfair colonial policies, abetted by systemic racism and the denial of freedoms. This blatant oppression of liberal creoles, mestizos, and native clerics, though at other times strange bedfellows, resulted in a common cause being taken up. The drive to Filipinize the parishes was easily subsumed into the larger context of widespread discontent and the desire for substantial reforms. The fact that three men of the cloth had been killed in cold blood by the colonial state absolved would-be rebels from being castigated as anti-Catholic. No longer; they could be seen as anti-exploitation and even anti-Spanish but not as heretics. After all, they had priests on their side. Their souls were the refore not at risk of being damned, as the friars of ten warned those whom they deemed in sufficiently subservient. The 1872 Gomburza Affair, as it came to be known, planted the seeds of nationalist awakening in and politicized the younger generation, already exposed to Enlightenment ideas. In less than a decade, beginning in 1880, the Propaganda Movement would coalesce when Marcelo H. del Pilar, Graciano Lopez Jaena, and José Rizal—with other like-minded and older compatriots who had sought refuge in Europe earlier—systematically advocated for reforms. The Propagandists gave voice and shape to the growing aspirations of not just their social class but of the lower classes who, as always, felt most keenly the boot of social and economic oppression. In the end, though the Propaganda Movement failed to at tain its objectives, it did lead to a heightened consciousness among various social classes, culminating in the 1896 Revolution against Spain. (One in dication of how the martyrdom of the three clerics still resonated more than two decades later was the use of “Gomburza” as a password among the revolutionaries.) The Chinese Mestizos Even as a nationalist consciousness was emerging, fuelled by ilustrado aims and the unruly dreams of a restless populace grown both tired and testy due to habitual Spanish repression, the Chinese community was itself undergoing changes as many of its members, assimilating into native society, came to play an in creasingly crucial role in the colonial economy. One way to assimilate was to convert to Catholicism, and adopt a Christian name. By 1755, Chinese mestizos—usually the of fspring of a Chinese father and native mother—came to dominate rice trading, supplying Manila with much of its needs. They the refore acquired farm lands or leased from the religious estates. In turn, the Chinese mestizos, either as owners or in quilinos (lessees), allowed kasamas or sharecroppers to till the soil, in exchange for half of the harvest. A vast majority of the tenant farmers had once owned their small farms but, failing to acquire titles to the land they and their families had worked for generations, lost them. A law passed in 1894 was particularly disastrous: landowners were given only one year in which to secure titles. A great number of small landowners, especially in the rural areas, were unaware of the new law. Not surprisingly, not much effort was made to spread news of this legislation. To their dismay their plots were suddenly in corporated in the titles secured by big landowners. Towards the end of the nineteenth century, at least 400,000 persons found the mselves in this predicament, unable to avoid the humbling status of tenancy. From the amassing of lands came the haciendas. The hacienda was an outgrowth of the new system that emphasized the cultivation of cash crops. Though modern in its or ientation to wards capitalism, management was decidedly feudal in the way overseers treated the tenant farmers and itinerant laborers who showed up every harvest—an exploitative system that continues to day. While it is true that debt slavery and sharecropping existed even in the pre-Hispanic period, it is just as true that under the Spanish these exploitative aspects were not only exacerbated but in stitutionalized as well. One of the biggest was the Hacienda Luisita, to taling close to 16,000 acres and encompassing lands in several to wns in what is now Tarlac Province. Originally deeded as a royal grant to the Tabacalera Company in 1880, it was eventually acquired by the Chinese mestizo family, the Cojuangcos, who have since figured as a political and social dynasty nationwide (the successor to president-turned- dictator Ferdinand Marcos in 1986 was a member of the Cojuangco clan: Corazon Cojuangco Aquino). As in quilinos—Rizal’s father was one—many Chinese mestizos grew wealthy, and along with their wealth and accumulated land, became vested in the on going development of the economy. They competed with alcalde mayors or provincial governors, the religious or ders, and the ethnically pure Chinese in positioning the mselves economically. Along with their new economic power, the Chinese mestizos acquired social status, facilitating assimilation and participation as part of the non-Spanish elite of society. In the emergence of a Filipino nation, this elite—a mixture of Chinese mestizos, Creoles, and the rising native middle and upper classes—played a crucial role. In effect, they constituted the new principalia. Inevitably, their ever-in creasing desire for economic expansion, equated with a freer marketplace, kept bumping against the narrow, monopolistic policies of the old regime. Combined with the burgeoning sense of nationalism and the centuries-old resentments of the in dios, the restlessness of the economic elite proved to be an explosive factor. Out of these volatile elements emerged a tangible sense of being a Filipino and the notion of a nation-state to which such Filipinos might belong—an “imagined community,” to use Benedict Anderson’s apt phrase. The term “Filipino” was or iginally applied only to Creoles—Spaniards born in the Philippines. The Spaniards who had come over from the motherland didn’t care for the designation, preferring in stead the term “Peninsulares,” implying a snobbish hierarchy. Anyone outside these two categories was simply an Indio— the term or iginally used by Columbus for the natives of the Caribbean, which he mistook for the Indies, or Spice Islands, of Asia"
    },
    "model_answer": "Unpaid wages and the unjust payment to tobacco planters for harvests in Cavite in 1870-1871 added to the already sizzling feeling of discontent. [Source: History Of The Flipino People, p. 145]",
    "contexts": [
      "Indeed, the native priests were truly “political dynamites.” F. La Algarada Cavitena, 1872.-The Cavite Mutiny broke out during the tenure of Rafael de Izquierdo who had dramatic¬ ally, said upon his arrival, “I shall govern with a cross on one hand a sword in the other.” Galvanized by discontent against the Spaniards, some 200 Filipino soldiers, joined in by some workers in the arsenal of the artillery corps led by Sgt. La Madrid, guard at Fort San Felipe, mutinied in the night of January 1872. In",
      "Page 13 Nationalism and the Philippine Revolution The spark that ignited feelings of nationalism and broke sentimental ties to Spain came in January 1872 with a mutiny by Filipino workers and soldiers at the Spanish navy yard in Cavite across the bay from Manila. The actual revolt was quickly crushed but was then turned into an excuse to round up prominent Filipinos whose loyalty to Spain was questioned",
      "These were abruptly abrogated by the new governor (Izquierdo). Unpaid wages and the unjust payment to the to bacco planters for harvests in Cavite in 1870- 1871 added to the already sizzling feeling of discontent. In fact, this revolt was believed by one contemporary Spanish writer to have stemmed from the workers’ strike (huelga) of the Cavite Arsenal, the first ever recorded in the Philippines, and probably one of the earliest in the Far East"
    ]
  },
  {
    "question": "Sino ang unang nagpakilala sa kanilang sarili bilang \"Filipino\" sa print?",
    "ground_truth": "Si Luis Rodríguez Varela ang unang nagpakilala sa kanilang sarili bilang \"Filipino\" sa print.",
    "metadata": {
      "cultural_golden_answer": "Ang pagbabago ng kahulugan nito ay isang halimbawa ng pakikibagay ng mga may-akda ng kasaysayan para matugunan ang pag-unlad ng isang bansa at kultura. Sa Filipino, ito ay tandaan bilang karangalan at pagpapahalaga sa pagiging Pilipino.",
      "language": "filipino",
      "cultural_relevance": 0.9,
      "chunk_index": 6,
      "ground_truth_context": ". Along with their new economic power, the Chinese mestizos acquired social status, facilitating assimilation and participation as part of the non-Spanish elite of society. In the emergence of a Filipino nation, this elite—a mixture of Chinese mestizos, Creoles, and the rising native middle and upper classes—played a crucial role. In effect, they constituted the new principalia. Inevitably, their ever-in creasing desire for economic expansion, equated with a freer marketplace, kept bumping against the narrow, monopolistic policies of the old regime. Combined with the burgeoning sense of nationalism and the centuries-old resentments of the in dios, the restlessness of the economic elite proved to be an explosive factor. Out of these volatile elements emerged a tangible sense of being a Filipino and the notion of a nation-state to which such Filipinos might belong—an “imagined community,” to use Benedict Anderson’s apt phrase. The term “Filipino” was or iginally applied only to Creoles—Spaniards born in the Philippines. The Spaniards who had come over from the motherland didn’t care for the designation, preferring in stead the term “Peninsulares,” implying a snobbish hierarchy. Anyone outside these two categories was simply an Indio— the term or iginally used by Columbus for the natives of the Caribbean, which he mistook for the Indies, or Spice Islands, of Asia. However, due to economic progress and a growing sense of a common cultural Hispanicized background that cut across ethnic boundaries, the Creoles, the mestizos (both Chinese and Spanish), and the educated natives came to view the mselves as “Filipinos.” The ilustrados were at the for efront of extending the term to all local in habitants of Las Islas Filipinas—except for the Muslims, or Moros, who had never identified with the Christian majority and in deed resisted the in cursions of the colonial state. T HE P ROPAGANDA M OVEMENT In Spain, in the meantime, political changes continued apace. In 1871 Amadeo, son of King Victor Emmanuel of Italy, was of fered and accepted the job of King of Spain but proved unable to rule effectively. Shortly after an assassination at tempt on his queen, he stepped down in February of 1873. After two years of political turbulence, Alfonso, son of the previously deposed Queen Isabella, gained the Spanish throne, his reign, from 1875 to 1885, a period of relative calm. The Cortes was revived and passed a new constitution in 1876. While Cuba and Puerto Rico were once again given representation, the Philippines was not; the Asian colony was to be governed by a set of special laws. Thus, political changes and upheavals in Spain would be followed in evitably by shakeups in the Philippines, which had become a dumping ground for largely unqualified followers and favorites of well-connected patrons in the motherland. Such changes were superficial and frequent, as can be gauged by the fact that from 1850 to 1898, twenty-four governors general served in the Philippines, for an average term of two years. Plus ça change, plus c’est le meme chose: The purported changes only meant more of the same, with the colonial system plagued by corruption and systemic abuse. Real and abiding power lay in the hands of the civil administrators, especially the governor general, who had essentially dictatorial powers, and of the friar or ders. They usually ignored, or in terpreted narrowly, decrees from Madrid that they didn’t like. Thus, the in junction to teach Spanish archipelago-wide to the Indios was observed haphazardly by the religious, who controlled education in the islands. Compounding the situation were the unabashedly racist views held by the Spanish of ficials, who tended to be domineering, contemptuous, and of ten physically abusive to wards the Indio. This was especially true at the local level, none more abusive than the Guardia Civil, notorious for manhandling villagers who may not have displayed the proper at titude of obeisance (like doffing their salakots, or native hats, promptly). Rizal’s mother herself was for ced to trek fifty kilometers from Calamba to the provincial capital Santa Cruz, where she was kept in jail on charges, never proven, by the mayor in collusion with the head of the local Guardia Civil. She had been falsely implicated as an accomplice in a purported plot, never proven, by her half-brother to poison his wife. In 1880, two years before he set sail for Europe, the son himself felt literally the heavy hand of authority. In a letter Rizal wrote of “being mauled and wounded one dark night by the Guardia Civil, for having passed by a statue and failing to salute it. The statue turned out to be the lieutenant commander of the detachment.” Rizal at tempted to report this in justice to Primo de Rivera, the governor general at the time, but was unable to see him. While the refore gains had been made in trade and commerce (though still at the neglect of the in dustrial sector, which was in an embryonic state), and while in frastructure and communications had improved, no comparable gains had been made in the arena of personal and political freedoms. The gap between material progress and civil liberties was one the in tellectuals and visionaries fervently sought to close. The Propaganda Movement, an outgrowth of the 1872 Mutiny, was a crusade carried out clandestinely in Manila and openly in Spain by scions from the expanding ranks of the native bourgeoisie. This movement, while directly a result of the killings of the three martyr priests, can be traced further back, according to the writer Nick Joaquin, to the waning years of the eighteenth century. A number of Creole writers in the colony espoused the ideas of the Enlightenment and the French Revolution. They were anti-clerical and pushed for the same reforms the ilustrados would lobby to wards the end of the nineteenth century. In particular, Luis Rodríguez Varela was the writer who, in Joaquin’s words, “can most truly be called the precursor of Philippine nationalism.” Varela called himself “El Conde Filipino” or the Filipino Count, and was the first to describe himself as a Filipino in print. (It is true the Creoles were described as “Filipinos” by the peninsular Spanish but the Creoles the mselves until Varela preferred to be called “Spaniards.”) He wrote several books that advocated social change and the liberalizing of education to in clude free in struction for the poor. He was also critical of the economic power wielded by for eign elements, notably the Chinese, and in directly of the peninsulares as well. He was the reafter viewed with suspicion, marked as a man who would undermine the ruling or der. He was expelled from the colony in February of 1823. The aim of the Propagandists was to put pressure on the Spanish government by spotlighting for the Spanish public the in justices and backwardness of Spanish rule in the archipelago"
    },
    "model_answer": "Walang sapat na impormasyon sa mga dokumentong ito tungkol sa unang nagpakilala sa kanilang sarili bilang \"Filipino\" sa print.",
    "contexts": []
  },
  {
    "question": "What was the main goal of the Propagandists?",
    "ground_truth": "The hoped-for result was to be meaningful reforms, assimilation rather than a separation from Mother Spain.",
    "metadata": {
      "cultural_golden_answer": "The Propagandists aimed for reforms that would treat Filipinos as equal Spanish citizens and address the injustices of Spanish rule in the Philippines, reflecting the aspirations of the Filipino people for self-improvement and equality within the colonial context.",
      "language": "english",
      "cultural_relevance": 0.9,
      "chunk_index": 7,
      "ground_truth_context": ". A number of Creole writers in the colony espoused the ideas of the Enlightenment and the French Revolution. They were anti-clerical and pushed for the same reforms the ilustrados would lobby to wards the end of the nineteenth century. In particular, Luis Rodríguez Varela was the writer who, in Joaquin’s words, “can most truly be called the precursor of Philippine nationalism.” Varela called himself “El Conde Filipino” or the Filipino Count, and was the first to describe himself as a Filipino in print. (It is true the Creoles were described as “Filipinos” by the peninsular Spanish but the Creoles the mselves until Varela preferred to be called “Spaniards.”) He wrote several books that advocated social change and the liberalizing of education to in clude free in struction for the poor. He was also critical of the economic power wielded by for eign elements, notably the Chinese, and in directly of the peninsulares as well. He was the reafter viewed with suspicion, marked as a man who would undermine the ruling or der. He was expelled from the colony in February of 1823. The aim of the Propagandists was to put pressure on the Spanish government by spotlighting for the Spanish public the in justices and backwardness of Spanish rule in the archipelago. The hoped-for result, however, was to be meaningful reforms, assimilation rather than a separation from Mother Spain, wherein Filipinos had standing equal to any other Spaniard. The Propagandists were especially keen on abrogating the role of the friar or ders in civil government, removing them from their curacies, and replacing them with Filipino secular priests. In Spain, they allied the mselves with anti-clerical factions. Testimony by Fr. Juan Villegas, a Franciscan, before the Philippine Commission in 1900, at the start of the United States colonial era, catalogued the powers that his confrères wielded during Spanish colonial times: “He was in spector of primary schools; president of the health board and board of charities; president of the board of urban taxation.… He certified to the correctness of cedulas [tax certificates] … was president of the board of statistics…. The priest also certified as to the civil status of persons.” Before the same commission, a certain Florentino Torres stated: “The local authorities took no step, obeyed no superior or ders and did not perform the duties of their of fice with out previous advice, permission, or knowledge of the friar curate, since the protection of the latter sufficed at times to defy the anger of the governor of the province and paralyze or evade the action of justice.” Such evidentiary testimony bore out the fictional world eloquently detailed two decades earlier in Rizal’s novels. In summary, as the historian Reynaldo Ileto put it, in his Filipinos and Their Revolution, “The Spanish priest was the equivalent of the god-king elsewhere in Southeast Asia.” Thus, notwithstanding their excesses, the friars constituted the de facto bulwark of Spanish colonial rule and were the refore in dispensable. To further solidify their in dispensability, the friars resisted any systematic at tempt for the Indios to learn Spanish. The main reason the friars so assiduously learned the various native languages was so that only they could mediate between the in digenous population and the civil state. The very act of mediating, the ability to move in both spheres at the same time, conferred upon them a great deal of power. For in the eyes of the civil authorities, the alternative—allowing native priests to control most curacies—would mean opening the floodgates of nationalism. Originally the slur against the native priest was his alleged in competence. Now, he was grudgingly perceived as being in telligent but his loyalty to Mother Spain was doubtful. He was likely to be seditious, and, as a high of ficial put it, either “a disgrace for the clergy or … a peril for the colony.” And yet, the ilustrados saw the mselves as faithful sons of Spain, in a sense, more Spanish than the Spanish. To them, the friars and other avatars of colonial rule were the unfaithful subjects, the subversives. Echoing the plaints of Fr. Burgos, the ilustrados believed that if only the mother country saw them in a positive light and extended to them and to the rest of the Indios the same rights as their brothers in the Iberian Peninsula, then all would be set right. Three groups for med the nucleus of the Propaganda Movement. There were those who, having been implicated in the 1872 Mutiny and exiled to the Marianas Islands, had made their way to Europe; a decade later came young men seeking higher education; and third were those fleeing persecution in the colony. The nucleus of the Filipino expatriate community in Madrid counted among its earliest members Gregorio Sancianco and the Paterno brothers. Coming from a well-to-do family in the colony, the Paternos held a regular salon at their residence for writers and political figures. One of the brothers, Pedro, was a poet, the the mes of whose collection of verse, titled Sampaguita y Poesias, published in 1880, were specifically Filipino. Except for the fact that this was the first such book by a Filipino, the verses were apparently for gettable. Pedro also penned a novel, Ninay, that, like Sampaguita, failed to garner any critical praise. Published in 1907, Ninay did have the distinction of being the first novel written in Tagalog. A Chinese mestizo, Sancianco, on the other hand, wrote El Progreso de Filipinas in 1881, a study that examined Philippine colonial society from the standpoint of material progress. Not surprisingly, its author concluded that due to corruption and backward economic and social policies, the country had shown very little development. Government services and the country’s in frastructure demanded radical improvements. The tax structure was highly in equitable, and the tribute levied on the Indios was both racist and unfair. He pointed out that those with the least had to pay the most, while the tribute was demanded of everyone in the Philippines, except the Spanish, whether peninsular or in sular. The tribute had to be abolished and the present tax system replaced by one directly related to the ability to pay. Since the colony should be considered a province of Spain, it followed that its in habitants were to be viewed as Spanish citizens and treated accordingly. Sancianco also assailed the monopoly the religious had over education in the colony. He said students wished for a more rational and secular curriculum, and suggested that the civil government rather than the church take over the tasks of schooling. Though largely ignored, Sancianco’s critique of the Philippines under Spanish rule was accurate, its the mes propounded later on by ilustrado writers such as Rizal, who occasionally referred to him in his letters. The Propaganda Movement had reformist rather than revolutionary goals"
    },
    "model_answer": "The Propagandists aimed to pressure the Spanish government by exposing the injustices and backwardness of colonial rule to the Spanish public.  [Source: A History Of The Philippines, p. 93]",
    "contexts": [
      "The Propagandists gave voice and shape to the growing aspirations of not just their social class but of the lower classes who, as always, felt most keenly the boot of social and economic oppression. In the end, though the Propaganda Movement failed to at tain its objectives, it did lead to a heightened consciousness among various social classes, culminating in the 1896 Revolution against Spain",
      "He was also critical of the economic power wielded by for eign elements, notably the Chinese, and in directly of the peninsulares as well. He was the reafter viewed with suspicion, marked as a man who would undermine the ruling or der. He was expelled from the colony in February of 1823. The aim of the Propagandists was to put pressure on the Spanish government by spotlighting for the Spanish public the in justices and backwardness of",
      "The Propagandists had aims similar to that of a Madrid group, the Asociación Hispano-Filipino, founded on January 12, 1889, principally by a Spanish academic Miguel Morayta. However, the Propagandists, being younger, felt the Madrid group (made up of Españoles Filipinos, mostly retired Spaniards who had once lived in the Philippines) was too accommodating of the authorities. The Asociación did lobby successfully for the passage of some laws such as mandating the teaching of Spanish",
      "The Asociación did lobby successfully for the passage of some laws such as mandating the teaching of Spanish. Nevertheless, the Asociación and the Propagandists lobbied jointly for their common objectives, e. g., representation in the Cortes, the lifting of censorship of the press, and an end to the arbitrary deportation of colony residents with out due process. Three Filipino expatriates for med the heart of both the publication and the movement: Graciano López Jaena, Marcelo H. del Pilar, and José Rizal"
    ]
  },
  {
    "question": "Ano ang pangunahing layunin ng Propaganda Movement?",
    "ground_truth": "Ang Propaganda Movement ay may mga layunin na tulad ng pagkilala sa kolonya bilang isang lalawigan ng Espanya, pantay na paggamot sa mga Filipino, kalayaan sa pamamahayag, paghihigpit sa pang-aabuso ng Guardia Civil, kinakatawan sa Cortes, at sekularisasyon ng mga parokya.",
    "metadata": {
      "cultural_golden_answer": "Ang mga manunulat ng Propaganda Movement, tulad nina Rizal, López Jaena, at del Pilar, ay may malalim na kaugnayan sa pakikibaka para sa kalayaan at pagbabago ng sistema ng pamamahala at edukasyon sa Pilipinas. Sila ay pinangunahan ang Propaganda Movement upang magsilbing tinig ng mga Pilipino laban sa pang-aapi at panlipunan na pag-uugnay, at ipaglaban nila ang kanilang karapatang makapag-aral at makabahagi sa pakikibaka para sa kalayaan ng bansa. Ang kanilang kontribusyon ay isang mahalagang bahagi ng kasaysayan ng paghihimagsik ng Pilipinas.",
      "language": "filipino",
      "cultural_relevance": 0.9,
      "chunk_index": 8,
      "ground_truth_context": ". Not surprisingly, its author concluded that due to corruption and backward economic and social policies, the country had shown very little development. Government services and the country’s in frastructure demanded radical improvements. The tax structure was highly in equitable, and the tribute levied on the Indios was both racist and unfair. He pointed out that those with the least had to pay the most, while the tribute was demanded of everyone in the Philippines, except the Spanish, whether peninsular or in sular. The tribute had to be abolished and the present tax system replaced by one directly related to the ability to pay. Since the colony should be considered a province of Spain, it followed that its in habitants were to be viewed as Spanish citizens and treated accordingly. Sancianco also assailed the monopoly the religious had over education in the colony. He said students wished for a more rational and secular curriculum, and suggested that the civil government rather than the church take over the tasks of schooling. Though largely ignored, Sancianco’s critique of the Philippines under Spanish rule was accurate, its the mes propounded later on by ilustrado writers such as Rizal, who occasionally referred to him in his letters. The Propaganda Movement had reformist rather than revolutionary goals. Among these were: recognition of the colony as a province of Spain; equal treatment of Filipinos; freedom of the press; curtailment of Guardia Civil abuses; representation in the Cortes; and secularization of the parishes. Its main mouthpiece was La Solidaridad, a for tnightly first published in Barcelona in February of 1889 and for six years, until late 1895, functioned as the mouthpiece of the Propaganda Movement. Financed by contributions from the Comité de Propaganda, a Manila-based group, La Solidaridad put forth the demands of the Propaganda Movement, singling out the friars as major obstacles to meaningful reform. As the maiden issue put it, the movement’s aim was to “combat reaction … be receptive to liberal principles … and propagate democratic ideals.” The paper also printed news about events in the colony, and political views of leading Spanish politicians on the Philippines. The Propagandists had aims similar to that of a Madrid group, the Asociación Hispano-Filipino, founded on January 12, 1889, principally by a Spanish academic Miguel Morayta. However, the Propagandists, being younger, felt the Madrid group (made up of Españoles Filipinos, mostly retired Spaniards who had once lived in the Philippines) was too accommodating of the authorities. The Asociación did lobby successfully for the passage of some laws such as mandating the teaching of Spanish. Nevertheless, the Asociación and the Propagandists lobbied jointly for their common objectives, e. g., representation in the Cortes, the lifting of censorship of the press, and an end to the arbitrary deportation of colony residents with out due process. Three Filipino expatriates for med the heart of both the publication and the movement: Graciano López Jaena, Marcelo H. del Pilar, and José Rizal. All three wrote for La Solidaridad; Rizal, writing in the journal, addressed the Spanish government: “If you persist in your system of banishments, in carcerations, and assaults with out cause, if you punish them for your own faults, you make them despair, you remove their abhorrence for revolutions and turmoils, you harden them and you arouse them to struggle.” López Jaena was the editor for its first eight months, before handing over the editorial reins to del Pilar. Back in the islands, López Jaena had penned a satire whose principal character was a Fray (or Friar) Botod. Botod in López Jaena’s native Hiligaynon—a major Visayan language—means full-bellied and was a none-too-subtle reference to the corpulent lifestyle and avarice of the friars. The work pilloried all the shortcomings of the Spanish clergy. Even though the tale circulated only in zamizdat form, its notoriety drew unfavorable clerical at tention, prompting in López Jaena a sudden and in tense curiosity about life in Spain. He had a reputation as a skillful or ator and for having contacts among Spanish liberals and Masons, most if not all of whom were anti-clerical. Unfortunately, López Jaena had a fondness for the bottle, hardly helpful to regularly putting out a publication. After a brief but disastrous visit to the islands, López Jaena returned to Spain. He had become a hack, at one point writing for a Spanish broadsheet that was critical of the Propagandists. He died, penniless and a consumptive, in Barcelona, at the age of forty. Del Pilar, a lawyer from the Tagalog province of Bulacan, whose brother, a secular priest, had been deported to the Marianas in the wake of the 1872 mutiny, and who wrote under the pseudonym of Plaridel, was the real force behind La Solidaridad, soliciting articles from various correspondents, raising funds, writing for the journal itself, and finally taking over the editorial reins from López Jaena. He had also published in 1882 the broadsheet Diariong Tagalog ( Tagalog Daily )—the first such publication in the islands. It lasted for only three months. He was an early defender of Rizal’s first novel, Noli Me Tangere. Due to his satirical pamphlets, written in Tagalog—unlike the works of Rizal, who wrote his novels in Spanish, a fact which meant a majority of Filipinos couldn’t read him (only five percent of the population was fluent in Spanish)—del Pilar was for ced to flee the colony in early 1889. Del Pilar parodied, for in stance, the Ten Commandments and the tyranny of the friars. His First Commandment was “Worship the Friar Above All Else.” The Fifth Commandment, “Do Not Kill,” became “Thou Shalt Not Die Without Having Sufficient Funds for a Funeral”—an unambiguous reference to the unsavory friar-practice of charging parishioners fees for administering such sacraments as Extreme Unction. His parody of the Lord’s Prayer is especially acerbic and begins with “Our Substitute Father, who art in the convent, cursed be your name, your greed be taken away from us, your throat cut open on earth as it is in heaven.” Hardly words to warm a friar’s heart—or belly. Other figures who moved around in reformist circles in Spain were Mariano Ponce, who assisted López Jaena and del Pilar with La Solidaridad, and contributed articles to the publication; the painters Juan Luna and Félix Resurrecíon Hidalgo; and Antonio Luna, Juan’s brother and future general in the Philippine-American War of 1899. Both painters were critical successes on the continent, Luna’s Spoliarium winning a gold medal at a prestigious art exposition in Madrid in 1884, and Hidalgo’s Virgenes Cristianas winning the silver. After being acquitted in Paris of shooting his wife and mother-in-law fatally in a jealous rage—a case that provoked widespread scandal—Juan Luna returned to the colony in 1894"
    },
    "model_answer": "Ang pangunahing layunin ng Propaganda Movement ay \"combat reaction … be receptive to liberal principles … and propagate democratic ideals\"  [Source: A History Of The Philippines, p. 96] .",
    "contexts": [
      "Financed by contributions from the Comité de Propaganda, a Manila-based group, La Solidaridad put forth the demands of the Propaganda Movement, singling out the friars as major obstacles to meaningful reform. As the maiden issue put it, the movement’s aim was to “combat reaction … be receptive to liberal principles … and propagate democratic ideals.” The paper also printed news about events in the colony, and political views of leading Spanish politicians on the Philippines",
      "The gap between material progress and civil liberties was one the in tellectuals and visionaries fervently sought to close. The Propaganda Movement, an outgrowth of the 1872 Mutiny, was a crusade carried out clandestinely in Manila and openly in Spain by scions from the expanding ranks of the native bourgeoisie. This movement, while directly a result of the killings of the three martyr priests, can be traced further back, according to the writer Nick Joaquin, to the waning years of the eighteenth century",
      "Though largely ignored, Sancianco’s critique of the Philippines under Spanish rule was accurate, its the mes propounded later on by ilustrado writers such as Rizal, who occasionally referred to him in his letters. The Propaganda Movement had reformist rather than revolutionary goals. Among these were: recognition of the colony as a province of Spain; equal treatment of Filipinos; freedom of the press; curtailment of Guardia Civil abuses;",
      "The Propagandists gave voice and shape to the growing aspirations of not just their social class but of the lower classes who, as always, felt most keenly the boot of social and economic oppression. In the end, though the Propaganda Movement failed to at tain its objectives, it did lead to a heightened consciousness among various social classes, culminating in the 1896 Revolution against Spain"
    ]
  },
  {
    "question": "Who was a charismatic and well-known member of the Propaganda Movement?",
    "ground_truth": "José Rizal",
    "metadata": {
      "cultural_golden_answer": "José Rizal, considered one of the most iconic figures in Philippine history, embodied the ideals of ilustrado (a class of educated Filipinos who sought reform and modernization) and was a symbol of resistance against Spanish colonial rule.",
      "language": "english",
      "cultural_relevance": 0.9,
      "chunk_index": 9,
      "ground_truth_context": ". Del Pilar parodied, for in stance, the Ten Commandments and the tyranny of the friars. His First Commandment was “Worship the Friar Above All Else.” The Fifth Commandment, “Do Not Kill,” became “Thou Shalt Not Die Without Having Sufficient Funds for a Funeral”—an unambiguous reference to the unsavory friar-practice of charging parishioners fees for administering such sacraments as Extreme Unction. His parody of the Lord’s Prayer is especially acerbic and begins with “Our Substitute Father, who art in the convent, cursed be your name, your greed be taken away from us, your throat cut open on earth as it is in heaven.” Hardly words to warm a friar’s heart—or belly. Other figures who moved around in reformist circles in Spain were Mariano Ponce, who assisted López Jaena and del Pilar with La Solidaridad, and contributed articles to the publication; the painters Juan Luna and Félix Resurrecíon Hidalgo; and Antonio Luna, Juan’s brother and future general in the Philippine-American War of 1899. Both painters were critical successes on the continent, Luna’s Spoliarium winning a gold medal at a prestigious art exposition in Madrid in 1884, and Hidalgo’s Virgenes Cristianas winning the silver. After being acquitted in Paris of shooting his wife and mother-in-law fatally in a jealous rage—a case that provoked widespread scandal—Juan Luna returned to the colony in 1894. Shortly after the revolution against Spain broke out in August of 1896, Luna was implicated and imprisoned, only to be released in 1897. In 1899, he was named a member of a delegation to the United States by the Philippine revolutionary government, headed by Emilio Aguinaldo, to make a case for in dependence, but the painter died of a heart at tack in Hong Kong. J OSÉ R IZAL Born in 1861, José Rizal could converse in ten languages and corresponded in six. The most charismatic and well-known member of the Propaganda Movement, Rizal was also a medical doctor, scientist, fencer, and writer who brilliantly articulated the dreams and buried hurts fueling the newfound nationalism. His older brother, Paciano, had been a protégé of Fr. Burgos and had been living with the latter when he was implicated in the Cavite Mutiny. Paciano had described the grisly executions to the young José, eleven years old at the time, which undoubtedly helped shape his later views. Rizal would write the staff of La Solidaridad: “Without 1872 there would now be neither Plaridel nor Jaena nor Sancianco, nor the valiant and generous Filipino expatriates in Europe. Without 1872, Rizal would have been a Jesuit and in stead of writing the Noli Me Tangere, would in stead have written something entirely different.” Coming from an upper middle-class family in Calamba Town in Laguna Province, not far from Manila, and whose patriarch, Francisco Mercado, was an in quilino who farmed large tracts of friar land, José Protacio Rizal Mercado y Alonso was a precocious child, the favorite of his mother Teodora Alonso, a sophisticated and devout woman who believed in the virtues of a good education and taught the young boy to read and write even before he started his for mal schooling. A prodigious and disciplined learner, Rizal easily shone in the lower grades and, with nothing more to learn in the local schools, was sent to Manila at the age of eleven, to continue his studies, first, at the Jesuit-run Ateneo de Manila and, later, at the Dominican University of Santo Tomás. He moved to the city as José Rizal, “Rizal” being a second surname, and a variant of the Spanish ricial, meaning pasture land. His family feared that if he bore the patronym of Mercado, he would be linked to his older brother Paciano and thus in directly to Fr. Burgos. Higher education, in which he excelled, graduating summa cum laude from the Ateneo, and during which he was awarded literary prizes for his writing in Spanish, only fed his hunger for broader horizons, which he, along with his generation, knew were not available in the stultifying at mosphere of a conservative dispensation that looked down on Indios. At the age of twenty-one, in 1882, he sought those horizons in Europe. He quickly became part of the Filipino community of students, in tellectuals, and political exiles in Spain, and was soon one of the leaders of the Propaganda Movement. Rizal published his first novel, the Spanish-language Noli Me Tangere, in 1887. The novel is a powerful and searing in dictment of corruption and abuse in the colony, particularly among the friar or ders who epitomized to the novelist as they did to most Filipinos the venality, moral blindness, and arrogance of colonial rule. The novel was banned in the colony—having a copy was grounds for being charged with subversion—but circulated clandestinely. The author returned to Manila for a visit in 1888, one cut short when his family, fearful for his safety, persuaded him to leave. By then, Rizal had acquired something of a rock star’s popularity, of ten followed by crowds when he was seen in public, deepening the distrust the authorities had of this ilustrado. Returning to Europe, after watching Buffalo Bill’s Wild West show in Paris in 1889, Rizal and his companions were impressed by the dignity and agility of the American Indian performers. They decided, part in jest, part in all seriousness, to call the mselves “Los Indios Bravos,” claiming a term the colonizer meant disparagingly as a badge of honor, a way of empowering the mselves. In London, Rizal annotated Sucesos de Las Islas Filipinas, by Dr. Antonio de Morga, a 1609 Spanish account of pre-Hispanic culture, to show that a thriving sophisticated culture existed before the advent of the Spanish. He went on to write El Filibusterismo ( The Subversive ), a sequel to the Noli and published in 1891. Rizal felt the second novel was darker and more profound than the Noli. Dedicated to Gómez, Burgos, and Zamora, the Fili (as it is popularly known) concerns its wealthy protagonist, Simoun, disillusioned by the failed reforms he has championed, plotting a violent uprising, and recruiting young men to his cause. The plot fails, however, and the would-be revolutionary kills himself. Just as with the Noli, the second novel added fuel to the fire of friar hatred directed at Rizal, and was proscribed as well. La Liga Filipina and the Katipunan After his stay in London, during which he was made honorary president of La Solidaridad, Rizal decided to carry on the struggle for reforms back in the colony. He likened it to a doctor visiting the sick patient. He left Europe for good, and sailed for Hong Kong in October of 1891, where he waited to see how the political winds blew in Manila. In the British colony, he seriously explored the Utopian possibility of establishing a Filipino community in Sandakan, Borneo. He wanted to create a sanctuary for himself and his family, as well as the people of Calamba, his hometown, who had been dispossessed of their lands by the Dominican friars"
    },
    "model_answer": "José Rizal was a charismatic and well-known member of the Propaganda Movement.  [Source: A History Of The Philippines, p. 98]",
    "contexts": [
      "Kong. JOSÉ RIZAL Born in 1861, José Rizal could converse in ten languages and corresponded in six. The most charismatic and well-known member of the Propaganda Movement, Rizal was also a medical doctor, scientist, fencer, and writer who brilliantly articulated the dreams and buried hurts fueling the newfound nationalism. His older brother, Paciano, had been a protégé of Fr. Burgos and had been living with the latter when he was implicated in the Cavite Mutiny",
      "Three groups for med the nucleus of the Propaganda Movement. There were those who, having been implicated in the 1872 Mutiny and exiled to the Marianas Islands, had made their way to Europe; a decade later came young men seeking higher education; and third were those fleeing persecution in the colony. The nucleus of the Filipino expatriate community in Madrid counted among its earliest members Gregorio Sancianco and the Paterno brothers",
      "In less than a decade, beginning in 1880, the Propaganda Movement would coalesce when Marcelo H. del Pilar, Graciano Lopez Jaena, and José Rizal—with other like-minded and older compatriots who had sought refuge in Europe earlier—systematically advocated for reforms. The Propagandists gave voice and shape to the growing aspirations of not just their social class but of the lower classes who, as always, felt most keenly the boot of social and economic oppression"
    ]
  },
  {
    "question": "Ano ang pangalan ng sekwel sa Noli Me Tangere at kung sinong sumulat nito?",
    "ground_truth": "El Filibusterismo",
    "metadata": {
      "cultural_golden_answer": "Ang El Fili, na kilala rin bilang Subersibo, ay isang mahalagang akda ni Dr. Jose Rizal na inilathala noong 1891. Ito ang naging dahilan para mas maraming Filipino na lumaban laban sa mga Kastila at simbahan.",
      "language": "filipino",
      "cultural_relevance": 0.9,
      "chunk_index": 10,
      "ground_truth_context": ". He went on to write El Filibusterismo ( The Subversive ), a sequel to the Noli and published in 1891. Rizal felt the second novel was darker and more profound than the Noli. Dedicated to Gómez, Burgos, and Zamora, the Fili (as it is popularly known) concerns its wealthy protagonist, Simoun, disillusioned by the failed reforms he has championed, plotting a violent uprising, and recruiting young men to his cause. The plot fails, however, and the would-be revolutionary kills himself. Just as with the Noli, the second novel added fuel to the fire of friar hatred directed at Rizal, and was proscribed as well. La Liga Filipina and the Katipunan After his stay in London, during which he was made honorary president of La Solidaridad, Rizal decided to carry on the struggle for reforms back in the colony. He likened it to a doctor visiting the sick patient. He left Europe for good, and sailed for Hong Kong in October of 1891, where he waited to see how the political winds blew in Manila. In the British colony, he seriously explored the Utopian possibility of establishing a Filipino community in Sandakan, Borneo. He wanted to create a sanctuary for himself and his family, as well as the people of Calamba, his hometown, who had been dispossessed of their lands by the Dominican friars. Even though the British North Borneo Charter Company was amenable to having these prospective immigrants settle on 5,000 acres of land, rent-free for three years, the financial costs in volved and the almost certain refusal of the Spanish colonial government to allow such a move in the end doomed Rizal’s endeavor to have the country come to him rather than he to the country. He decided to proceed to Manila by late June of 1892. Barely a week after his arrival he founded La Liga Filipina, its aim to disseminate the Propaganda Movement’s call for reformist, nonviolent ideals. Among other goals, La Liga Filipina advocated the unification of the archipelago into a political and cultural whole; development of agriculture, education and in dustry; and the eradication of in justice. Though these were hardly radical aims, the existence of the league provided the excuse his powerful enemies had been waiting for, and they complained to Governor General Despujol. On his or ders, Rizal was arrested just four days after La Liga’s in itial meeting. The government exiled him to Dapitan, a coastal town and Jesuit mission in northwest Mindanao and far from Manila. His enforced departure from Manila on July 15, 1892, effectively ended the reformist movement. Rizal’s four years in exile turned out to be some of the most peaceful in his life. In Dapitan, he set up a water system, a school for boys, and an eye clinic as well, where he treated the residents of the town for free. In the square fronting the town church, he constructed an earthen relief map of Mindanao. It was in Dapitan where he met the young Josephine Bracken, an Irish-Chinese mestiza who had accompanied her stepfather from Hong Kong to Dapitan so the latter could be operated on by Rizal, whose fame as an ophtalmologist had spread beyond national boundaries. Bracken would be his lover and companion in this last period of his life. O N THE E VE OF THE R EVOLUTION This last decade of the nineteenth century is unprecedented. Chaos, social upheaval, disease, hunger, and senseless deaths, but also hopes, dreams, a sudden sense of new direction—birth pangs of a nascent nation, death throes of an all but extinct for mal colonial or der. On the global stage, an aging empire is dying, and a new one is about to rise from its ashes. In that age of turbulence, life goes on for the Filipino, but now he begins to imagine himself in terms of a national identity, and regardless has a storehouse of customs—but customs that reflect an improvisatory sense, the different facets, the different streams, of life in the Philippines at the time, blending then as now the in digenous and the for eign, the alien and the familiar, in a word, “Filipinizing” them. In 1894 the population of the colony was estimated, based on parish registration, to be between 6 million and 7 million. To these need to be added about a million non-Christians, such as the in digenous tribes of the in terior, the Chinese, the Mindanao Muslims, and for eigners residing in the colony. The 1894 tally also counted 2,751 religious and lay clergy, and 21,513 military personnel. Of the latter, fewer than three thousand were Spanish; the rest were native conscripts. By the close of the century the peninsulares were believed to number approximately twenty thousand. If the native had changed, if his or her way of life had been altered, not so the apparatus of colonial administration. The governor general was of course the top of the heap, with two advisory bodies: the Junta de Autoridades, or Board of Authorities, and the Consejo de Administracíon, or Council of Administration. Additionally, there were four types of regional governments: civil; politico- military provinces; politico-military commands; and district commands. There were also the ayuntamientos. In modern parlance these would be metropolitan districts, of which there were eight, Manila being the oldest and largest. Governing an ayuntamiento were two alcaldes en or dinario, elected by Spanish residents; a city council; an alguacil, in charge of peace and or der; and a scrivener, responsible for record keeping and answerable to the governor general and alcalde mayor, or governor of the province. Then came the municipalities, or to wnships, made up of cabecerias de barangay, an agglomeration of barangays, each consisting of forty to fifty families and headed by a cabeza de barangay, or barangay chief. The latter had traditionally been drawn from the ranks of pre-Hispanic datu families but over time were appointed on the recommendation of the municipal government. The gobernadorcillo, or mayor, along with the cabezas de barangay and landowners, made up the principalia. As it is, the feudal system, with all its exploitative features, championed avidly both by the Spanish colonial authorities (except for the occasional liberal governor general) and the religious, remained in tact, essentially unchanged since the conquest that began in the late sixteenth century. Despite reform laws passed in the home country, the colonial administrators could basically pick and choose which features to implement in the islands. An in structive example was the liberalizing measure provided by the Becerra Law of 1889, which provided for the establishment of more ayuntamientos wherever there was civil government. At that time, there were eighteen provinces with a purely civil government, but the then-governor general Valeriano Weyler (1888-91) believed that only in seven of these provinces were there sufficient personnel qualified to carry out the tasks of civil government"
    },
    "model_answer": "Ang sekwel sa Noli Me Tangere ay ang El Filibusterismo at parehong isinulat ni Dr. Jose Rizal.  [Source: Noli me tangere (Wikipedia, accessed November 06, 2020)]",
    "contexts": [
      "Ang Noli Me Tngere Poblete, Pascual Hicaro, ay kailangan para sa mga mag-aaral sa sekondarya. Pamagat Hango sa. Sinipi ito mula sa Juan kung saan sinabi ni Hesus kay Maria Magdalena na Huwag mo akong salingin sapagkat hindi pa ako nakaaakyat sa aking ama. Kasaysayan Unang nobela ni Rizal ang Noli me Tangere. Inilathala ito noong tang gulang siya. Makasaysayan ang aklat na ito at naging in strumento upang makabuo ang mga Pilipino ng pambansang pagkakakilanlan",
      "Alam niyo ba na kung hindi dahil sa tulong ng isang kaibigang duktor ni Gat. Jose Rizal ay baka hindi natin nabasa ang isa sa mga mahalagang obrang nobela na nilikha ng at ing pambansang bayani na may pamagat na \"Noli Me Tangere.\" Taong 1887 nang unang malathala ang 2,000 kopya ng Noli Me Tangere sa Berlin, Germany sa tulong ng kaibigan ni Rizal na si Dr. Maximo S. Viola, na nakasama nila sa paglilibot sa ibang bansa"
    ]
  },
  {
    "question": "What was the main economic focus of Spanish colonial rule in the Philippines?",
    "ground_truth": "The extraction of raw materials and trade for short-term purposes rather than industrialization.",
    "metadata": {
      "cultural_golden_answer": "This aligns with the traditional Filipino concept of 'bayanihan' or communal solidarity, where the Spanish colonial powers exploited the islands' resources without promoting economic development that would benefit the local population. The emphasis on trade over industrialization reflects a broader colonial strategy that prioritized short-term gains over long-term growth and self-sufficiency.",
      "language": "english",
      "cultural_relevance": 0.9,
      "chunk_index": 11,
      "ground_truth_context": ". Then came the municipalities, or to wnships, made up of cabecerias de barangay, an agglomeration of barangays, each consisting of forty to fifty families and headed by a cabeza de barangay, or barangay chief. The latter had traditionally been drawn from the ranks of pre-Hispanic datu families but over time were appointed on the recommendation of the municipal government. The gobernadorcillo, or mayor, along with the cabezas de barangay and landowners, made up the principalia. As it is, the feudal system, with all its exploitative features, championed avidly both by the Spanish colonial authorities (except for the occasional liberal governor general) and the religious, remained in tact, essentially unchanged since the conquest that began in the late sixteenth century. Despite reform laws passed in the home country, the colonial administrators could basically pick and choose which features to implement in the islands. An in structive example was the liberalizing measure provided by the Becerra Law of 1889, which provided for the establishment of more ayuntamientos wherever there was civil government. At that time, there were eighteen provinces with a purely civil government, but the then-governor general Valeriano Weyler (1888-91) believed that only in seven of these provinces were there sufficient personnel qualified to carry out the tasks of civil government. Moreover, rather than allowing elections so representatives could be chosen—as provided by the law—Weyler appointed in dividuals he deemed capable (and loyal both to him and to colonial strictures) to these positions. Thus, the very in tent of the law, of providing an opportunity for the locals to acquire exposure and training in self-government no matter how limited, was thwarted. In contrast, Puerto Rico already had some form of elections while Cuba had the status of an assimilated province. Before the outbreak of the Spanish- American War of 1898, there were already two major political parties in Puerto Rico, the Incondicionales, or Spanish party, and the nativist Autonomist Party. Months before the 1898 war began, the Autonomists won island elections. Thus, the Puerto Ricans enjoyed a certain degree of self-government, but still within the protective embrace of Madrid. In contrast, in the Philippines, any putative at tempts at reform and eventual self-government were stifled, mostly at the behest of the almighty friar or ders that had in essence become the state. Only when the Philippine Revolution of 1896 began were there half-hearted efforts to ward democratic reform, and by then, of course, these were meaningless. Nor had colonial rule meant a significant transformation of the colony from being mainly a source of raw material to one where in dustrialization took firm root. What the Spanish focused on throughout colonial occupation was extraction of whatever was of value in the islands, whether these were precious metals or spices or to bacco, to be sold or traded. As well, the Spanish viewed the islands as a trading conduit in Asia, particularly with regard to China. Even with the in troduction of agricultural machinery and cash crops, the emphasis continued to be trade for short-term purposes rather any far-reaching in dustrialization. Essentially, the Spaniards made most of their for tunes in the Philippines from an extractive economy, to the clear detriment of the local population. It was after all what they had done in their New World colonies, whose immense wealth of raw material—gold and silver—lulled the Spanish into avoiding the path of in dustrialization, and thus were outstripped in this by the Netherlands and Great Britain. In terms of the religious sphere, to wards the end of Spanish occupation, the archipelago was divided into five dioceses: one metropolitan area, Manila, and four suffragan, or subordinate, bishoprics: Nueva Segovia (Vigan), Nueva Caceres (Bicol), Cebu, and Jaro. Each diocese was supposed to oversee the activities of both regular and secular clergies active within its jurisdiction, but time and again the friar or ders, as has been previously described, were well aware of their in dispensable role in colonial government and resisted the right of diocesan visitation—perhaps the most obvious symbol of civil oversight. The regular or ders in the islands were made up of the friaries (the Augustinians, Recollects, Franciscans, and the Dominicans) as well as the Jesuits. The immense wealth the religious or ders accumulated was strikingly evident in their landholdings at the end of the Spanish colonial era. The friars owned almost 400,000 acres, or about one-fifteenth of cultivated land. In Manila and outlying districts, lands owned by the religious to taled more than 110,000 acres. The largest friar hacienda, run by the Dominicans, was in Calamba (where José Rizal’s parents were in quilinos) with 35,000 acres. While the European Propagandists soldiered on in Spain, the government turned a deaf ear to their efforts, though in dividual public of ficials were sympathetic. The fact that the once mighty Spanish empire was now reduced to small island colonies only strengthened the resolve of the Spanish ultranationalists to hold on to the remnants. Consequently, the authority of the Spanish friars in the Philippines was rendered well-nigh impregnable, as they were seen as the main bulwark against nationalist feelings. With the friars as parish priests, the Archbishop of Manila had little to no canonical authority over them. He was for ced to consult the provincials of the four friar or ders on all matters pertaining to the church, thus guaranteeing the depth and continuation of friar in fluence on Philippine society. One of the Liga’s members was a young working-class firebrand and Tondo warehouse worker by the name of Andrés Bonifacio, who revered Rizal. At first Bonifacio worked actively on behalf of the Liga, recruiting members. But the leadership of La Liga, fearful that the new members Bonifacio had brought in were more in clined to revolution than assimilation, dissolved the or ganization. Its more conservative members (mostly from the upper middle class) continued to support the Propagandists in Spain, mainly to ensure publication of La Solidaridad. Bonifacio, on the other hand, as with the newer and more uncompromising members, drawn from the lower middle and working classes, saw reforms, even if they were to be granted by the despotic Spanish regime, as symbolic rather than substantial. Orphaned at an early age, Bonifacio read avidly, keeping abreast of the Propagandists’ activities through La Solidaridad. He had Rizal’s novels; Les Miserables by Victor Hugo; Eugène Sue’s The Wandering Jew; and texts on the French Revolution, in ternational law, and religion. The ideals of the French Revolution, in particular, seemed to have in spired him to think along mass mobilization and the resort to arms"
    },
    "model_answer": "The main economic focus of Spanish colonial rule in the Philippines was trade.  Even with the introduction of agricultural machinery and cash crops, the emphasis remained on short-term trading ventures rather than industrialization. The Spaniards primarily profited from an extractive economy to the detriment of the local population [Source: A History Of The Philippines, p. 102].",
    "contexts": [
      "In a broader perspective the Spanish period saw the beginnings of modernization, yet Spain’s socioeconomic effect in the Philippines was largely unintended.^® The only major planned economic change was the rapid transfer from shifting to sedentary cultivation, which began in the early eighteenth century, promoted by the friars to concentrate population around the great stone churches they were building",
      "As well, the Spanish viewed the islands as a trading conduit in Asia, particularly with regard to China. Even with the in troduction of agricultural machinery and cash crops, the emphasis continued to be trade for short-term purposes rather any far-reaching in dustrialization. Essentially, the Spaniards made most of their for tunes in the Philippines from an extractive economy, to the clear detriment of the local population"
    ]
  },
  {
    "question": "Paano ang naging epekto ng Katipunan sa papel ng mga babae sa lipunan?",
    "ground_truth": "Pinahabol ng Katipunan ang mga babae sa papel ng lipunan sa pamamagitan ng pagtutulung-tulong at pag-partisipar nila bilang aktibong bahagi ng rebolusyon, at pinabulaanan nila ang mga tradisyonal na patriyarkal na istraktura.",
    "metadata": {
      "cultural_golden_answer": "Ang Katipunan ay nagbigay-daan sa pagbabago sa papel ng mga babae sa lipunan. Sa katunayan, bumuo sila ng unang chapter ng Red Cross sa bansa at nagpartisipar bilang aktibong bahagi ng rebolusyon. Ang pagpapalaya ng mga babae mula sa tradisyonal na pananaw ng mga lalaki na may kapangyarihan ay isang mahahalagang yugto sa kasaysayan ng Pilipinas, at nagsisilbing inspirasyon para sa mga feminista ngayon.",
      "language": "filipino",
      "cultural_relevance": 0.9,
      "chunk_index": 12,
      "ground_truth_context": ". One of the Liga’s members was a young working-class firebrand and Tondo warehouse worker by the name of Andrés Bonifacio, who revered Rizal. At first Bonifacio worked actively on behalf of the Liga, recruiting members. But the leadership of La Liga, fearful that the new members Bonifacio had brought in were more in clined to revolution than assimilation, dissolved the or ganization. Its more conservative members (mostly from the upper middle class) continued to support the Propagandists in Spain, mainly to ensure publication of La Solidaridad. Bonifacio, on the other hand, as with the newer and more uncompromising members, drawn from the lower middle and working classes, saw reforms, even if they were to be granted by the despotic Spanish regime, as symbolic rather than substantial. Orphaned at an early age, Bonifacio read avidly, keeping abreast of the Propagandists’ activities through La Solidaridad. He had Rizal’s novels; Les Miserables by Victor Hugo; Eugène Sue’s The Wandering Jew; and texts on the French Revolution, in ternational law, and religion. The ideals of the French Revolution, in particular, seemed to have in spired him to think along mass mobilization and the resort to arms. He had read del Pilar’s satires, and it was the satirist who seemed to have in fluenced Bonifacio ideologically, for the hard-hitting writer was not averse to armed revolution. Bonifacio, along with the new recruits, consequently shifted the or ientation of the mass movement to wards complete in dependence from Spain. He founded in 1892 the secret revolutionary society dedicated to overthrowing the colonial yoke: Ang Kataastaasang Kagalagalangan Katipunan ng mga Anak ng Bayan — the Highest, Most Honorable Society of the Country’s Sons and Daughters, the KKK, or simply the Katipunan. It would be the explosive catalyst that would end Iberian despotism, friar abuse, and establish a free state. Economic conditions exacerbated the social and political oppression suffered by the vast majority of the populace. There was a sizeable lumpenproletariat in Manila, made up of thousands of workers, drawn there (as to day) by the possibility of jobs, whether in the to bacco in dustry, in the port area, or in other factories that had sprung up due to in creased trade and demands for Philippine raw materials. In the countryside, the growing landlessness in creased the ranks of tenant farmers now working plots of land they had once owned but had had taken away from them by the manipulations of friar estates, unscrupulous landowners, and the rapidly rising class of Chinese mestizos. Landlessness of course prompted many to simply pack up and seek their for tune in the cities. The Katipunan didn’t lack for recruits. With many of its leaders members of Masonic lodges (Rizal himself was a Mason, with his Masonic name being Dimasalang, a Tagalog approximation of Noli Me Tangere ), would-be revolutionaries underwent in itiation rites that had a Masonic tinge. They were blindfolded and led to a dimly lit room that had a skull, a revolver, and a cutlass. If the applicant responded satisfactorily to questions put to him, he was then in itiated into the secret society by means of a blood compact. From an in cision in his arm, the in itiate drew blood to write his name. The in itiate also took on a new name—his nom de guerre. The newly in ducted member would in itially belong to the first of three Katipunan ranks, the Katipun. He could aspire to the next higher level, the Kawal (or Warrior), and the nce the highest, the Bayani (Hero). The Katipunan stressed brotherhood and ethical behavior. Many of its tenets clearly reflected the legacies of the Enlightenment and both the American and French revolutions: All men were equal and no one was superior to anyone else in terms of human dignity; the oppressed needed to be defended against the oppressor; and a man was great because he neither oppressed nor aided the oppressor and knew how to love and defend his country. Anticipating both the modernist feminist revolution and Mao Tse-Tung’s maxim that “women hold up half of heaven,” while also reflecting pre-Hispanic values, one tenet declared women to be partners, companions who shouldered equally the burdens of life. In the Katipunan’s Cartilla, or Primer, written by Emilio Jacinto—Bonifacio’s university-educated adviser who refused to give up the struggle even after Bonifacio’s execution by his soon-to-be-rival General Emilio Aguinaldo—the revolutionary society enjoined its members to “consider your wife not as a mere plaything, but as a partner, a companion in the hardships of life; be considerate to wards her weakness and think of the mother that cared for you in your childhood. What you would not want others do to your wife, daughter, and sister, do not do to the wife, daughter, and sister of another.” That the Katipunan explicitly referred to how women should be treated reflected the fact that the vital social role of women had enjoyed prior to colonial rule had continually been under assault by the aggressive patriarchal at titudes and values espoused by the Spanish, most in tensely and consistently by the religious or ders. These men of the cloth, reflecting the ultra-masculine ethos of Roman Catholicism by way of Inquisitorial Spain, saw the essentially egalitarian relationships between the sexes as aberrations, if not abominations. For women such as the babaylan to be the mediators between the visible world and that of the spirit; to be perceived as healers; to be called upon as a villager lay dying; for them to have as much right to sexual pleasure as men—all these female prerogatives were anathema to the friars, and a threat to their primacy. Male authority had to reign supreme, whether in matrimony, government, or religion. By the time of the 1896 Revolution, the “good” Filipina was a paragon of modesty, keeper of repressed longings, and unswervingly faithful to the men in her life, whether to the husband, son, or Christ on the cross. With the Katipunan, there was a deliberate effort to do away with the restrictions on women’s roles. They may not have borne arms—at least not many did—but they participated otherwise as actively in the revolution as the men. Hilaria Aguinaldo, Emilio Aguinaldo’s wife, for in stance, or ganized the first chapter of the Red Cross in the country. T HE C RY OF B ALINTAWAK Under Bonifacio’s stewardship—he was referred to as the Supremo —the Katipunan combined liberal ideas with plans for armed struggle. The society began to store weapons in various safe places in preparation for the revolution. The Katipunan grew rapidly, and though Manila was rife with rumors about the existence of a revolutionary society, no hard evidence could be produced. Governor General Ramón Blanco consequently dismissed the reports as the paranoid musings of the friars"
    },
    "model_answer": "Ang Katipunan ay nagbukas ng daan para sa mas aktibong papel ng mga babae sa lipunan. Binibigyan sila ng pagkakataon na lumahok, kahit hindi sila direktang nakikilaban gamit ang armas. \n\nHalimbawa, ang mga kababaihan ay naging bahagi ng Katipunan at nagsilbing panakip sa mga pagtitipon ng mga lalaking kasapi. Ayon sa artikulo \"Ang mga unang babae sa Katipunan\",  nagsagawa sila ng mga aktibidad tulad ng pagsasayawan habang ang mga lalaki ay nagpupulong. \n\nSinusuportahan din ng Katipunan ang pagkalap at organisasyon ng mga kababaihang kasapi. Itinalaga ni Andres Bonifacio si Marina Dizon bilang pinuno ng debisyon para sa mga kababaihan, na nagpapakita ng pag-asa nila na makasama ang mga babae sa kilusang pang-rebolusyon. [Sources: \"Ang mga unang babae sa Katipunan\", March 08, 2014. Retrieved from https://data2.gmanews.tv/886/gno/story/351688]",
    "contexts": [
      "Kabilang sa naging papel ng mga Katipunera ay magsilbing panakip sa mga pagtitipon na ginagawa ng mga lider ng kilusan sa loob ng bahay. Isang halimbawa nito ay ang pagkukunwaring nagkakasiyahan lamang at nagsasayawan ang mga Katipunera habang nagpupulong ang mga Katipunero. Nang maging Supremo ng Konseho ng Katipunan si Andres Bonifacio noong 1895, itinalaga niya si Dizon bilang pinuno ng debisyon para sa mga kababaihan sa kilusan at namahala sa pagkalap at in isasyon ng mga babaeng kasapi.",
      "Kilala niyo ba kung sino ang mga babae na unang naging kasapi ng Katipunan na lumaban para sa kasarinlan ng Pilipinas mula sa kamay ng mga dayuhang Kastila? Taong 1893 nang buksan ng Katipunan ang kanilang sikretong samahan para sa mga babaeng kasapi. Pero limitado pa lamang noon ang pagkuha ng babaeng miyembro sa kaanak ng mga lalaking kasapi ng kilusan. Ang mga kababaihan na unang isinalang sa in isasyon bilang Katipunera na isinagawa sa bahay ni Don Restituto Javier sa Oroquieta Street sa Maynila, ay sina Marina Dizon, Gregoria de Jesus, Josefa at Trinidad Rizal, Angelica Lopez at Delfina Herbosa",
      "With the Katipunan, there was a deliberate effort to do away with the restrictions on women’s roles. They may not have borne arms—at least not many did—but they participated otherwise as actively in the revolution as the men. Hilaria Aguinaldo, Emilio Aguinaldo’s wife, for in stance, or ganized the first chapter of the Red Cross in the country. THE CRY OF BALINTAWAK Under Bonifacio’s stewardship—he was referred to as the Supremo—the Katipunan combined liberal ideas with plans for armed struggle"
    ]
  },
  {
    "question": "Who was the prominent victim of the Spanish regime during the Revolution?",
    "ground_truth": "Dr. José Rizal",
    "metadata": {
      "cultural_golden_answer": "Dr. José Rizal, a renowned Filipino novelist and physician, was executed by firing squad on December 30, 1896, at Luneta, marking a pivotal moment in the struggle for Philippine independence.",
      "language": "english",
      "cultural_relevance": 0.9,
      "chunk_index": 13,
      "ground_truth_context": ". Male authority had to reign supreme, whether in matrimony, government, or religion. By the time of the 1896 Revolution, the “good” Filipina was a paragon of modesty, keeper of repressed longings, and unswervingly faithful to the men in her life, whether to the husband, son, or Christ on the cross. With the Katipunan, there was a deliberate effort to do away with the restrictions on women’s roles. They may not have borne arms—at least not many did—but they participated otherwise as actively in the revolution as the men. Hilaria Aguinaldo, Emilio Aguinaldo’s wife, for in stance, or ganized the first chapter of the Red Cross in the country. T HE C RY OF B ALINTAWAK Under Bonifacio’s stewardship—he was referred to as the Supremo —the Katipunan combined liberal ideas with plans for armed struggle. The society began to store weapons in various safe places in preparation for the revolution. The Katipunan grew rapidly, and though Manila was rife with rumors about the existence of a revolutionary society, no hard evidence could be produced. Governor General Ramón Blanco consequently dismissed the reports as the paranoid musings of the friars. That hard evidence was supplied when a low- ranking disgruntled Katipunero Teodoro Patiño unburdened himself to his devoutly Catholic sister about plans for an armed uprising. The in for mation quickly reached the curate of the Tondo parish, Fr. Mariano Gil. The friar convinced Patiño (most likely under threat of excommunication), a typesetter at the newspaper, Diario de Manila, to lead him to the of fices and show him where papers and other paraphernalia pertaining to the Katipunan had been hidden. The untimely discovery for ced the Katipunan to proclaim the need for revolution on August 23, 1896 at a place called Pugad Lawin (Hawk’s Nest), at the home of Melchora Aquino, a self-taught eighty-four-year-old widow who fed, housed, and otherwise took care of the Katipuneros when fighting broke out. The grand dame of the revolution, she was known affectionately as Tandang Sora (Old Sora). Subsequently imprisoned by the Spanish and in terrogated as to Katipunan activities, the octogenarian wouldn’t talk. She was exiled to the Marianas and allowed to return once the United States of America had taken over the country. Still, she refused to pledge allegiance to the United States, and died in 1919 at the age of 107, with American colonial rule firmly in place. In the yard of her home, Bonifacio and his fellow Katipuneros tore up their cedulas, or tax ID certificates, in dicating a decisive split with Spain. (In 1884, a graduated poll tax, known as the cedula personal, was created to replace the age- old tribute. The cedula was proof of payment.) The revolution, in itially confined to the Tagalog provinces, quickly spread to other regions. Attacks against government buildings and garrisons occurred in places such as the Camarines provinces, Zambales, and, to the southwest, Palawan Island. Not surprisingly, Governor General Ramón Blanco proclaimed a state of war. Those suspected of being members of the Katipunan were imprisoned and to rtured, with many being put to death. Among the most notorious in stances of mass execution were two that took place on January 4 and 11, 1897—by then Blanco, perceived by the friars as in sufficiently hawk-like, had been replaced by Camilo Polavieja, a battle-tested veteran who rarely brooked compromise. The first group, consisting of fifteen men, was known as the Bicol Martyrs, after the southern Luzon region whence they hailed or iginally. Included were three secular Filipino clerics. The second group came to be called the Thirteen Martyrs of Bagumbayan, after the site of their execution, now part of Rizal Park. These were men arrested after the Cry at Balintawak on charges of treason, and in cluded civic leaders, professionals, and members of the Katipunan. The most prominent victim of the regime was Dr. José Rizal. The previous year, Rizal had requested permission to act as a volunteer medic with Spanish for ces in Cuba, where revolutionary for ces under José Martí sought in dependence, a revolution that would provide the U. S. the needed pretext of declaring war on Spain. Acting on the suggestion of his Austrian friend and faithful correspondent Ferdinand Blumentritt, Rizal believed his petition would dispel the notion that he was disloyal to Mother Spain. Permission to sail to Cuba was granted in 1896, before the Revolution broke out. Rizal sailed to Manila and there, on September 3, shortly after the Revolution began, boarded a ship for Europe, with letters of recommendation from Governor Blanco. In one, addressed to the Spanish Minister of War, Blanco wrote that Rizal was “in my judgment, more deserving of pardon and benevolence since it appears that he is in no way in volved in the uprising.” Nevertheless, en route—by then the Revolution was in full throttle—on the or ders of the same Blanco, who was under pressure from Spanish military of ficers to bring the physician/novelist back, Rizal was arrested for his alleged role in the uprising. Once in Barcelona, after a short stay in Montjuich Prison, he was sent back to Manila under guard. After imprisonment at Fort Santiago, and a trial closed to the public, Rizal was found guilty of fomenting rebellion. The fact that one of the passwords used by Katipuneros was “Rizal” provided damning circumstantial evidence of his alleged complicity. The irony was that Rizal, while in exile at Dapitan, had been approached in early 1896 by Dr. Pio Valenzuela, an emissary of the Katipunan, seeking his advice and, more importantly, his imprimatur for the planned uprising. Though the protagonist Simoun in his second novel El Filibusterismo had argued that only violence could overthrow the Spanish regime, Rizal believed the country was not yet prepared for such a radical step, that it would only result in the tragic loss of in nocent lives. He in for med Valenzuela that he would not be a party to the impending revolution. Like other members of the Propaganda Movement, he saw evolutionary reform as the gradual but sure way to in dependence. In his stress on nonviolence, Rizal anticipated Gandhi’s policy of passive resistance that proved effective in securing in dependence for the Indian subcontinent. As seen in an iconic photograph of the execution (taken by the Spanish Creole photographer Manuel Arias Rodriguez, whose photo documentation of the conflict between Filipinos and the Spanish is in valuable), at dawn of December 30, 1896, clad in a morning coat and a black bowler hat, Rizal was executed by firing squad at the Luneta. Behind the firing squad made up of Filipinos were Spanish riflemen, ready to gun down the Indios should they refuse to fire. Rizal had asked the of ficer in charge of the firing squad if he could face the riflemen but was denied permission. Upon being hit, eyewitnesses said he managed to twist his body around and fall as he had wanted to: face up"
    },
    "model_answer": "The most prominent victim of the Spanish regime during the Revolution was Dr. José Rizal.  [Source: A History Of The Philippines, p. 106]",
    "contexts": [
      "These were men arrested after the Cry at Balintawak on charges of treason, and in cluded civic leaders, professionals, and members of the Katipunan. The most prominent victim of the regime was Dr. José Rizal. The previous year, Rizal had requested permission to act as a volunteer medic with Spanish for ces in Cuba, where revolutionary for ces under José Martí sought in dependence, a revolution that would provide the U. S. the needed pretext of declaring war on Spain"
    ]
  },
  {
    "question": "Sino ang pinuno ng rebolusyonaryong pamahalaan matapos ang pagpupulong sa Tejeros?",
    "ground_truth": "Aguinaldo",
    "metadata": {
      "cultural_golden_answer": "Hindi siya nagpapartisipado sa mga plano ng revolusyon, na naging batayan ng kanyang paniniwala sa non-aktibismo at pakikidialogo. Sa Filipino, ito ay isang halimbawa ng pagtutuloy-tuloy sa pakikidialogo at pagpapakita ng pagmamahal para sa bayan.",
      "language": "filipino",
      "cultural_relevance": 0.9,
      "chunk_index": 14,
      "ground_truth_context": ". Though the protagonist Simoun in his second novel El Filibusterismo had argued that only violence could overthrow the Spanish regime, Rizal believed the country was not yet prepared for such a radical step, that it would only result in the tragic loss of in nocent lives. He in for med Valenzuela that he would not be a party to the impending revolution. Like other members of the Propaganda Movement, he saw evolutionary reform as the gradual but sure way to in dependence. In his stress on nonviolence, Rizal anticipated Gandhi’s policy of passive resistance that proved effective in securing in dependence for the Indian subcontinent. As seen in an iconic photograph of the execution (taken by the Spanish Creole photographer Manuel Arias Rodriguez, whose photo documentation of the conflict between Filipinos and the Spanish is in valuable), at dawn of December 30, 1896, clad in a morning coat and a black bowler hat, Rizal was executed by firing squad at the Luneta. Behind the firing squad made up of Filipinos were Spanish riflemen, ready to gun down the Indios should they refuse to fire. Rizal had asked the of ficer in charge of the firing squad if he could face the riflemen but was denied permission. Upon being hit, eyewitnesses said he managed to twist his body around and fall as he had wanted to: face up. In a possibly apocryphal version of his death—and a testament to how potent a symbol his martyrdom had immediately become—the more moved of the on lookers rushed for ward to dip their handkerchiefs in his blood, now considered sacred. Unbeknownst to his jailers, the day before his execution, Rizal had managed to conceal a document in an alcohol stove he gave to his sister, whispering to her in English that he had something hidden in it. The document turned out to be a poem, Mi Ultimo Adios ( My Last Farewell ), a moving and eloquent record of his thoughts about his country—as well as his love for Josephine Bracken. (Bracken joined the revolutionary army briefly but left the country for Hong Kong in May of 1897.) The poem quickly became famous, its opening line known to every school child in the country: “Adios patria adorada, region del sol querida” (“Farewell, beloved country, land cherished by the sun”). * Aware of how scarce his manpower resources were and how the Cuban Revolution was drawing in more Spanish troops, and with the possibility of native soldiers joining their brother Filipinos in open revolt, Blanco requested a thousand soldiers from Spain and permission to form militias of volunteers drawn from the Spanish community in the colony. Surprisingly more aware of the need for a surge in troops, Madrid sent approximately double the number of soldiers requested. Towards the close of 1896, a little more than two thousand troops disembarked at Manila, almost at the same time as the arrival of Blanco’s successor, Camilo Polavieja. The reinforcements were welcomed as saviors by the Spanish community and by civil and religious authorities in festive, even giddy, rites. In a welcoming speech, the president of the Casino Español, the preeminent Spanish club in Manila, spewed vitriol on the Indio revolutionaries: “You arrive in time; the cannibals of the for est are still there; the wild beast hides in his lair; the hour has come to finish with the savages…. Destroy! Kill! Do not pardon.” Despite the in crease in troop strength, it was too little too late. The repressive measures only stoked the fire of rebellion. To the long-suffering populace, such measures were harsher only by degrees and not substantially different from what they faced in pre-revolutionary times. They were up to the task of enduring whatever the Spanish could throw at them. Too, where ethnic and regional rivalries divided them in the past, now they began to have a sense, even if tenuous, of a collective whole. By the end of the year, the fire of revolution engulfed the country. And while the revolution had still to coalesce effectively, nonetheless it would only be a matter of time before it did. Bonifacio versus Aguinaldo On the ground, Bonifacio, though an in spirational figure, proved to be in effective as a military strategist, his for ces’ at tacks on to wns and garrisons ill- planned and ill-fated. As the revolution blundered on, Boni facio’s reputation diminished almost in reverse proportion as that of another member of the Katipunan, Emilio Aguinaldo, was on the rise. Inducted by Bonifacio into the Katipunan, Aguinaldo was the gobenadorcillo of Kawit Town, in nearby Cavite Province (the same province where the 1872 Mutiny had taken place). Under Aguinaldo’s leadership, the Cavite rebels scored victories against the Spanish. After the in itial successes of the Katipunan in Cavite, Governor General Polavieja, having taken over from Blanco, mounted a counteroffensive that regained ground. The two main factions of the Katipunan in the province— Magdalo, under Aguinaldo, and Magdiwang, pro-Bonifacio—agreed to meet. Bonifacio and some of his staff traveled to the town of Tejeros, where elections were held to determine who should lead the revolution. Along the way, many on lookers hailed Bonifacio as the “King of the Tagalogs,” a testament to his popularity. By this time, however, it was clear to everyone that Aguinaldo was far superior as a military strategist than the Supremo. The added fact that the elections were being held in Cavite, Aguinaldo’s home turf, meant the gathering was dominated by pro-Aguinaldo members. Unsurprisingly, Aguinaldo won the election, while Bonifacio was elected as Minister of Interior, more of a ceremonial of fice. Outmaneuvered and provoked by questions of his competence, and nearly coming to blows with his in terlocutors, Bonifacio, asserting his authority as founder and head of the Katipunan, refused to recognize the legitimacy of the Tejeros Convention and stormed out of the hall. Aguinaldo was sworn in as president of the revolutionary government shortly after; his Cabinet took shape, all its members from Cavite, a fact that spoke to how regionalism played a role in Aguinaldo’s consolidation of power. (This would have been obvious to Bonifacio but which he ignored, probably banking on his stature as founder of the Katipunan to outweigh everything else.) The lone exception was General Artemio Ricarte, who hailed from the Ilocos region up north but was now a permanent resident of the province. Bonifacio and his followers continued to oppose the Aguinaldo government even though they were at a disadvantage, not being from the province and the refore having little support there. Even the supposedly pro-Bonifacio Magdiwang wing threw its support behind Aguinaldo. Aguinaldo had him arrested, and the founder of the Katipunan and his brother Procopio were brought to trial before a military court supervised by their now-sworn enemies. The two were quickly found guilty of sedition and treason. On May 10, 1897, the Bonifacio brothers were executed in the woods of Mt"
    },
    "model_answer": "Si Emilio Aguinaldo ang pinuno ng rebolusyonaryong pamahalaan matapos ang pagpupulong sa Tejeros.  [Source: Katipunan (Wikipedia, accessed August 09, 2021)]",
    "contexts": [
      "Mariano Alvarez at ang Magdalo na pinamumunuan ni Hen. Baldomero Aguinaldo, pinsan ni Hen. Emilio Aguinaldo. Nakabase sila pareho sa Cavite. Sa isang pagpupulong na ginanap sa Tejeros, Cavite, nagtipon ang mga rebolusyonaryo upang bumuo ng rebolusyonaryong pamahalaan. Doon natalo sa pagkapangulo ng rebolusyonaryong pamahalaan si Bonifacio kay Emilio Aguinaldo at sa halip ay nahalal siya bilang Kalihim ng Interyor",
      "The two main factions of the Katipunan in the province— Magdalo, under Aguinaldo, and Magdiwang, pro-Bonifacio—agreed to meet. Bonifacio and some of his staff traveled to the town of Tejeros, where elections were held to determine who should lead the revolution. Along the way, many on lookers hailed Bonifacio as the “King of the Tagalogs,” a testament to his popularity. By this time, however, it was clear to everyone that Aguinaldo was far superior as a military strategist than the Supremo",
      "A meeting at the estate-house in Tejeros that at tempted to create a new government to unify the effort under one banner failed. Bonifacio stormed-out of the convention after an altercation with Daniel Tirona after the latter protested Bonifacio’s election as the Director of Interior. Andres Bonifacio’s letter to Emilio Jacinto on April 16, 1897 was his first correspondence that recounts what happened during the controversial meeting at Tejeros",
      "The revolution spread to other provinces. In Cavite, meanwhile, the two factions of the society were at loggerheads and Bonifacio was in vited to mediate between them. At Tejeros, it was agreed to change the society with a government responsive to the demands of thp times, and in the election that followed Bonifacio was chosen Director of the Interior. Unfortunately, his election was questioned by Daniel Tirona. Bonifacio, hurt by the in sult, declared the results of the election null and void"
    ]
  },
  {
    "question": "Who was executed on May 10, 1897?",
    "ground_truth": "The Bonifacio brothers",
    "metadata": {
      "cultural_golden_answer": "The execution of the Bonifacio brothers, Andres and Procopio, is a significant event in Filipino history that highlights the tumultuous period leading up to Philippine independence. Their fate serves as a testament to the challenges faced by early revolutionaries and their struggle for self-governance.",
      "language": "english",
      "cultural_relevance": 0.9,
      "chunk_index": 15,
      "ground_truth_context": ". Outmaneuvered and provoked by questions of his competence, and nearly coming to blows with his in terlocutors, Bonifacio, asserting his authority as founder and head of the Katipunan, refused to recognize the legitimacy of the Tejeros Convention and stormed out of the hall. Aguinaldo was sworn in as president of the revolutionary government shortly after; his Cabinet took shape, all its members from Cavite, a fact that spoke to how regionalism played a role in Aguinaldo’s consolidation of power. (This would have been obvious to Bonifacio but which he ignored, probably banking on his stature as founder of the Katipunan to outweigh everything else.) The lone exception was General Artemio Ricarte, who hailed from the Ilocos region up north but was now a permanent resident of the province. Bonifacio and his followers continued to oppose the Aguinaldo government even though they were at a disadvantage, not being from the province and the refore having little support there. Even the supposedly pro-Bonifacio Magdiwang wing threw its support behind Aguinaldo. Aguinaldo had him arrested, and the founder of the Katipunan and his brother Procopio were brought to trial before a military court supervised by their now-sworn enemies. The two were quickly found guilty of sedition and treason. On May 10, 1897, the Bonifacio brothers were executed in the woods of Mt. Buntis. The Supremo’s widow, Gregoria de Jesus, evaded capture and returned to Manila, where she married Julio Nakpil, a Katipunan of ficer loyal to Bonifacio and active in the revolution against Spain. She resumed revolutionary activities, principally deciphering messages sent in code by members of the Katipunan in the field. She also knew how to ride and use firearms, and took part in a number of encounters. The leadership was now firmly in the hands of propertied men, members of the principalia, rather than the working-class for ces that Bonifacio had represented. Would this change the direction of the armed struggle against Spain? Not in the short term, but as the drive for in dependence from a Spain determined to hold on to the vestiges of its once grand empire proved to be complicated, it finally did veer to wards compromise. As Renato Constantino puts it in his A Past Revisited, “There was only one logical outcome of the triumph of the elite. Leading the Revolution meant leading it to suit the desires of those who had in terests to defend. Such a leadership could of fer only a vacillating at titude to wards the enemy.” One Revolution, Two Wars Undisputed as the leader of the revolution, Aguinaldo and his for ces retreated south to Batangas Province, as the Spanish counter-at tacks reclaimed territory. They then moved to Biak-na-Bato in Bulacan Province, north of Manila, where a constitution, based on the Cuban Constitution of Jimaguayu, was drawn up on November 2, 1897, for the republic that had been founded earlier that April, in Cavite province. A little more than a month after, however, through the mediation of Pedro Paterno (author of Sampaguita and Ninay ), both sides in the conflict negotiated to try to end the conflict. By December 15, 1897, the Treaty of Biak-na-Bato was signed between the Spanish colonial government and Aguinaldo. Under the Treaty, Aguinaldo and his cabinet agreed to go into exile upon being in demnified $400,000: $200,000 to the revolutionary army, and $200,000 more when the surrendered arms reached an agreed-upon to tal. An additional $900,000 would be used to compensate non-combatant Filipino families who had suffered losses during the fighting. Aguinaldo and several of his closest associates sailed for Hong Kong on December 27, 1897, where the in demnity was deposited in banks. According to some sources, the general’s in tent was to use the funds to purchase war materiel and continue the fight against Spain. But his detractors held that time and the odds favored the revolutionary for ces, creating considerable suspicion that the treaty was essentially a sell-out. Be that as it may, it was an illusory peace, as the Spanish barely complied with the treaty’s terms, nor did the revolutionary for ces lay down their arms. Besides, the revolution could no longer be bound by the policies of Aguinaldo and his Cabinet. The genie had been let out of the bottle. Now there was a near- universal desire to be rid of Spanish rule. The fighting continued in Central and Northern Luzon, and in parts of the Visayas. But events moved fast. On February 15, 1898, the USS Maine exploded in the harbor of Havana. In a feverish exercise of yellow journalism, the U. S. press stoked public outrage, and the United States used the Maine as a pretext to declare war on Spain in April. And so the stage was set for the rise of the United States as a global power and the beginning of what is of ten referred to as the American Century."
    },
    "model_answer": "Walang sapat na impormasyon sa mga dokumentong ito tungkol sa [topic].",
    "contexts": []
  },
  {
    "question": "Sa ano mang panahon ay nag-umpisa ang digmaan sa pagitan ng Estados Unidos at Republika ng Pilipinas?",
    "ground_truth": "Ayon sa teksto, nagsimula ang digmaan noong unang bahagi ng 1899.",
    "metadata": {
      "cultural_golden_answer": "Ang panahon ay mahalaga dahil ito ang nagpasasa sa pagtatag ng Amerikanisasyon at kasanayan sa Pilipinas, na may pinatutungkol ding salungat na resulta para sa mga Pilipino. Ang laban ng Estados Unidos sa Republika ng Pilipinas ay isang mahalagang bahagi ng kasaysayan ng paghahari ng Amerika sa mga teritoryo ng mundo.",
      "language": "filipino",
      "cultural_relevance": 0.9,
      "chunk_index": 0,
      "ground_truth_context": "4. AMERICANIZATION AND ITS DISCONTENTS, 1899-1946 “The Person Sitting in Darkness is almost sure to say: ‘There is something curious about this—curious and unaccountable. There must be two Americas: one that sets the captive free, and one that takes a once-captive’s new freedom away from him, and picks a quarrel with him with nothing to found it on; then kills him to get his land.’” —Mark Twain, “To the Person Sitting in Darkness” T HE W ANING OF AN A GE: T HE S PANISH -A MERICAN W AR I N EARLY 1898, IN RESPONSE TO THE ONGOING C UBAN WAR OF INDEPENDENCE against Spain, the United States government or dered the battleship USS Maine to Havana—a move meant to signal Spain that the U. S. sympathized with the Cuban rebels and that it in tended to protect U. S. in terests in the Caribbean island. The ship was blown up on February 15, 1898, while at anchor off Havana, killing 266 men. At the time the cause was unknown—though an in vestigation in 1976 by Admiral Hyman Rickover of the U. S. Navy determined that the explosion was an accident, caused by a faulty coal bunker—but U. S. newspapers immediately blamed the Spanish. The rallying cry for the moment was “Remember the Maine! To hell with Spain!” William Randolph Hearst, owner and publisher of the New York Journal, famously said to Frederic Remington, the paper’s well-known illustrator, “You furnish the pictures and I’ll furnish the war!” And that Hearst and the media did. The explosion was the perfect excuse for a war, and even though Spain had of fered an immediate armistice and considerable autonomy for the Cubans, the Mc Kinley government was undeterred from its mission, declaring war on April 25. The conflict was just the right opportunity for a young giant, eager to participate in the “Great Game” of empire building. It heralded the beginning of what has since come to be known as the American Century. Even before the for mal declaration of hostilities, Theodore Roosevelt, Undersecretary of the Navy—filling in for Secretary John D. Long, who was on leave—or dered U. S. warships under the command of Commodore George Dewey to Hong Kong in late February and there await battle or ders. Once at berth in Hong Kong, in anticipation of the war, Dewey requested troop reinforcements from Washington. With the declaration of war, he and his fleet steamed to Manila and on May 1, annihilated an aging Spanish fleet, with only one loss of life: an American sailor felled by heat stroke. The lopsided victory essentially sealed the fate of Spanish rule. It was an outcome easily predicted: the Spanish empire was on its last legs, plagued by a significant trade deficit and political in stability at home. American consular authorities had already contacted Aguinaldo in Singapore and led him to believe that the North American nation was coming to the revolution’s assistance and would engage the Spanish on behalf of what was hoped would soon be an in dependent country. Nothing was ever put in writing, however, leading to denials later on the part of the consular of ficials in volved. Aguinaldo followed shortly on May 19, brought back from Hong Kong to the islands by an American gunboat. Less than a week later, on May 24, 1898, he declared the establishment of a dictatorial government. It was to last until a Constitutional Assembly could be for med, a preliminary step in for ming a republic, with a president and a cabinet. At first, cordiality characterized relations between Aguinaldo and his Philippine revolutionary for ces and Dewey and his troops. A month after he arrived, on June 12, 1898, Aguinaldo proclaimed from his home province of Cavite an in dependent Philippine republic. By then, Filipinos had defeated the Spanish in most of the archipelago and had ringed the Walled City—the king piece still in the hands of the Spanish but perilously close to being checkmated by Aguinaldo. Thus the stage was set for the subsequent and in evitable war between a fledgling nation—the first in Asia to raise the banner of revolution against a Western power—and a North American republic, itself founded on revolution and with a constitution that had served as a model and in spiration to others around the globe as well as to the Filipinos, its troops now set to deprive those same Filipinos of their right to freedom. In setting its sights on Spanish colonies in the last decade of the nineteenth century, the United States made it clear to the European powers that it would not be excluded in claiming its share of colonies so as to acquire markets and sources of raw materials. Overseas expansion was viewed by both U. S. politicians and entrepreneurs as a way out of the economic crisis that befell the U. S. in 1893. But taking over the for mer Spanish colony in Southeast Asia was not a for egone conclusion. France, Germany, England, and Japan showed proprietary as well as predatory in terest in the islands, having sent warships to Manila Bay, to the great annoyance of Commodore Dewey. However, the war that erupted in early 1899 between the United States and the fledgling Republic of the Philippines, and the in crease in U. S. troops, effectively curtailed for eign in terest, at least until the outbreak of World War II. The entry of the United States obviously complicated the picture, however. On one level, Spanish colonialism was being confronted by American imperialism, eager to administer the coup de grace to the old or der. On another level, the Philippine Revolution was once more under the leadership of Aguinaldo and his fellow principalia—a revolution that had only grown stronger and had the Spanish on the ropes. In an at tempt to delay the in evitable, the Spanish proposed the for mation of a consultative assembly to be made up of the elite, and to bestow on Aguinaldo the rank of brigadier general if he would join the Spanish army. Both of fers were refused. On the ground, Aguinaldo and his army consolidated their gains, capturing Spanish garrisons in quick succession and, by the beginning of July 1898, controlled virtually the entire colony, except for the capital, Manila, to which it laid siege, alongside, albeit uneasily, U. S. troops. In these early stages, the Filipinos were not averse to American protection, regardless of whether the rank and file viewed the North Americans as genuinely sympathetic with their goals as set out by the Katipunan. In the meantime, the United States for ces played for time until more troops arrived. By late July, twelve thousand troops were on hand, and the reafter more troops began to arrive regularly. Aguinaldo declared the in dependence of the Philippines on June 12— Commodore Dewey was in vited to the momentous occasion but he begged off, saying it was mail day—and for the first time, the Philippine flag was displayed and the national anthem sung"
    },
    "model_answer": "Nagsimula ang digmaan sa pagitan ng Estados Unidos at Republika ng Pilipinas noong Pebrero 4, 1899. [Source: \"Ang putok ng baril na nagpasimula ng Philippine-American war\", February 22, 2014. Retrieved from https://data2.gmanews.tv/046/gno/story/349640;  \"2 pangyayari sa buwan ng Pebrero na nakatatak sa relasyon ng Pilipinas at US\", February 18, 2015. Retrieved from https://data2.gmanews.tv/745/gno/story/439547]",
    "contexts": [
      "Ang Digmaang Pilipino Amerikano ay ang armadong hidwaan sa pagitan ng. Pumutok ang labanan sa pagitan ng puwersa ng Estados Unidos at ng Republikang Pilipino noong Pebrero,, na tinaguriang. Binago ng naturang digmaan ang pangkulturang mukha ng kapuluan, dahil sa pagkasawi ng tinatayang hanggang Pilipinong sibilyan, pagbuwag sa bilang pangunahing wika ng pamahalaan, edukasyon, kalakaran, in dustriya, at ng mga edukadong pamilya at in dibidwal sa mga susunod na dekada. Talasanggunian",
      "Reenactment ng 1945 Liberation of Manila: File photo by Danny Pata) Alam ba ninyo na may dalawang mahalagang pangyayari sa kasaysayan na may kinalaman sa relasyon ng Pilipinas at Amerika na naganap sa buwan ng Pebrero na kaugnay ng dalawang digmaan. Pebrero 4, 1899 nang magsimula ang digmaan ng Pilipinas at Amerika nang barilin at mapatay ng Amerikanong sundalo na si Private William Grayson ng First Nebraska Volunteer brigade ang sundalong Pinoy na si Corporal Anastacio Felix ng 4 th Company ng Morong Battalion. Ang pangyayari ay naganap sa bahagi ng Sta. Mesa, Maynila. Pagkaraan ng 46 na taon, naging magkakampi naman ang mga Amerikano at Pilipino upang mapalaya ang Pilipinas mula sa pananakop ng bansang Japan noong World War II",
      "Sa dilim ng gabi noong Pebrero 4, 1899 sa bahagi ng Sta. Mesa, Maynila, isang putok ng baril ang bumasag sa katahimikan at naging dahilan ng pagsisimula ng digmaan ng Pilipinas at Amerika. Ang nabanggit na unang putok ng baril na naging simula ng digmaan ay nagmula sa hawak na riple ni American Private William Grayson ng First Nebraska Volunteer brigade",
      "By the time the Schurman Commission arrived in Manila in March of 1899, however, the anticipated war between the United States and a newly minted Republic of the Philippines had been going on for a month. A SPLENDID LITTLE WAR TURNS UGLY: THE 1899 PHILIPPINE-AMERICAN WAR The deliberations and decisions of the Malolos Congress were ignored by the U. S. Less than two weeks after the in auguration of the Philippine Republic, and two days before the U. S",
      "Introduction to the Philippine-American War On 04 February 1899, two days prior to the US Congress’ ratification of the 1898 Treaty of Paris war broke-out between the for ces of the first Philippine Republic headed by President Emilio F. Aguinaldo and the American Forces in the country. The war was regarded as a continuation of the on going 1896 Philippine Revolution, while the United States simply regarded the conflict as an in surrection"
    ]
  },
  {
    "question": "Who became Aguinaldo’s political adviser?",
    "ground_truth": "Apolinario Mabini became Aguinaldo’s political adviser.",
    "metadata": {
      "cultural_golden_answer": "Apolinario Mabini, a brilliant thirty-four-year-old lawyer from the southern Tagalog province of Batangas, who became the key figure in shaping the Philippine Revolution and its government. As a member of Rizal's La Liga Filipina and a Freemason, Mabini embodied the values of Filipino intellectualism and reformist spirit.",
      "language": "english",
      "cultural_relevance": 0.9,
      "chunk_index": 1,
      "ground_truth_context": ". On another level, the Philippine Revolution was once more under the leadership of Aguinaldo and his fellow principalia—a revolution that had only grown stronger and had the Spanish on the ropes. In an at tempt to delay the in evitable, the Spanish proposed the for mation of a consultative assembly to be made up of the elite, and to bestow on Aguinaldo the rank of brigadier general if he would join the Spanish army. Both of fers were refused. On the ground, Aguinaldo and his army consolidated their gains, capturing Spanish garrisons in quick succession and, by the beginning of July 1898, controlled virtually the entire colony, except for the capital, Manila, to which it laid siege, alongside, albeit uneasily, U. S. troops. In these early stages, the Filipinos were not averse to American protection, regardless of whether the rank and file viewed the North Americans as genuinely sympathetic with their goals as set out by the Katipunan. In the meantime, the United States for ces played for time until more troops arrived. By late July, twelve thousand troops were on hand, and the reafter more troops began to arrive regularly. Aguinaldo declared the in dependence of the Philippines on June 12— Commodore Dewey was in vited to the momentous occasion but he begged off, saying it was mail day—and for the first time, the Philippine flag was displayed and the national anthem sung. In a nod to the United States, still seen as an omnipotent ally, the declaration stated: “Under the protection of the mighty and humane North American Nation, we proclaim and solemnly declare, in the name and by authority of the in habitants of all these Philippine Islands, that they are and have the right to be free and in dependent; that they are released from all obedience to the crown of Spain; that every political tie between the two is and must be completely severed and annulled; and that, like all free and in dependent states, they have complete authority to make war, conclude peace, establish treaties of commerce, enter into alliance, regulate commerce, and execute all other acts and things that in dependent states have the right to do.” Aguinaldo then began appointing his first cabinet ministers, in preparation for the business of governing a full-blown republic. In these for mative months, Apolinario Mabini, a brilliant thirty-four-year-old lawyer of peasant or igins from the southern Tagalog province of Batangas, became Aguinaldo’s political adviser. Dubbed the Sublime Paralytic due to paralysis of the lower limbs, Mabini was carted by relays of men to Cavite. It wasn’t long before he was seen as the brains of the revolution, for his ability to navigate the complex fields of diplomacy and help create a government to suit the temper of the times. He drafted decrees for Aguinaldo and persuaded the latter to move from a dictatorship to a revolutionary government. By June 23, 1898, such an administration was for med, with Aguinaldo as president. Local governments were established, keeping in place the administrative structures set up by the Spanish. Mabini was a Freemason and a member of Rizal’s La Liga Filipina. Initially opposed to armed struggle, he believed in the advocacy of reforms and had been a correspondent for Marcelo H. del Pilar’s La Solidaridad in Barcelona, enabling its expatriate readers and the Spanish to know what was going on in Manila. He quickly realized that Spain, having resisted in stituting reforms agreed to under the Biak-na-Bato Treaty, would never acquiesce to handing over power; revolution was the only recourse. Envious of his closeness to Aguinaldo, and probably out of snobbery, other members of Aguinaldo’s cabinet spread the canard that Mabini’s paralysis was due to his having contracted syphilis, in an at tempt to besmirch his character. The Aguinaldo government disseminated in for mation about the emergent state through two publications: El Heraldo de la Revolucíon— later to be called Gaceta de Filipinas —and La Independencia, whose founder and editor was General Antonio Luna. These served as outlets for exhortatory articles and of ficial communiqués, as well as news articles; more importantly, the two papers presented a portrait of a legitimate, functioning government. Even though American for ces had been beefed up, Filipino troops controlled the major approaches to Intramuros and could have easily for ced its defenders to surrender by cutting off food and water supplies, but they held back. The Spanish, to whom surrendering to a people they had viewed for 333 years as in ferior and in capable of self-rule would have been an unbearable humiliation, cut a deal with the Americans. By early August General Fermin Jaudenes, in command of Intramuros’s defense, was in backroom negotiations with Dewey to arrange a mock battle for the Walled City in which the newcomers would win but in a way that saved face for the Spanish. After a sham battle on August 13, 1898, to preserve their honor, the Spanish garrison defending Intramuros yielded to the Westerners. The scripted battle went off as planned, though not with out six American and forty-nine Spanish casualties. The Yankees claimed Manila that same day and refused entry to Philippine troops, on the grounds that the Spanish were fearful of being killed en masse by vengeful Filipino soldiers. The actions of the U. S. military confirmed the worst fears of the Aguinaldo government: that the United States was out to claim the colony for itself. Now with Manila in the hands of the U. S., and Spain surrendering to the North Americans, erstwhile allies faced each other in an uneasy standoff. Seeking to nullify U. S. gains, Aguinaldo sought diplomatic recognition from for eign governments; it dispatched Felipé Agoncillo as its representative, first, to Washington, D. C., and then to Paris, where Spain and the United States met in October 1898 for a conference to for mally end the Spanish-American War, and to determine the conditions under which the victor would receive the spoils. Protesting that there was already in place a legitimate government, Agoncillo was ignored, and refused a place at the bargaining table. On December 10, 1898, the Treaty of Paris was for mally signed, setting out these terms: Spain would relinquish Cuba, Puerto Rico, the Philippines, and the Marianas (Guam). In return, the United States would in demnify Spain $20 million—or a little less than $3 per Filipino, the population of the archipelago then estimated at 7 million. The treaty also allowed the Spanish ten-year access to Philippine ports and goods for the purposes of trade. For the treaty to take effect, the United States Congress needed to ratify it, and its approval was by no means sure. A vote was scheduled for February 6, 1899. Spain agreed to hand over control of Las Islas Filipinas, as well as Guam and Puerto Rico, to the United States. The U. S"
    },
    "model_answer": "Apolinario Mabini became Aguinaldo’s political adviser.  [Source: A History Of The Philippines, p. 115]",
    "contexts": [
      "In these for mative months, Apolinario Mabini, a brilliant thirty-four-year-old lawyer of peasant or igins from the southern Tagalog province of Batangas, became Aguinaldo’s political adviser. Dubbed the Sublime Paralytic due to paralysis of the lower limbs, Mabini was carted by relays of men to Cavite. It wasn’t long before he was seen as the brains of the revolution, for his ability to navigate the complex fields of diplomacy and help create a government to suit the temper of the times",
      "Apolinario Mabini.—It was immediately before the procla¬ mation of in dependence that a young man was brought before Aguinaldo as his adviser. He was Apolinario Mabini. Bom of very poor parents, Inocencio Mabini and Dionisia Maranan, in Talaga, Tanawan, Batangas, Mabini studied in a school in Tanawan, then conducted by a certain Simplicio Avelino. Much later, he transferred to a school conducted by the famous peda¬ gogue, Father Valerio Malabanan",
      "But when Mabini spoke, Aguinaldo’s doubts vanished. There was firmness in the sick man’s voice, and Aguinaldo decided to make him his trusted adviser. From then on, it was Mabini who stood behind Agui¬ naldo. Envious enemies called him the “Dark Chamber of the President,” but his admirers considered him the “Brains of the Revolution.” Reorganization of Local Government.—Because Mabini be¬ lieved in or der, he prepared a decree for Aguinaldo’s signature"
    ]
  },
  {
    "question": "Paano nabuo ang Republika ng Pilipinas?",
    "ground_truth": "Ang Republika ng Pilipinas ay nabuo sa pamamagitan ng pagproklama ng Malolos Constitution noong Enero 23, 1899.",
    "metadata": {
      "cultural_golden_answer": "Ang pagbubuo ng Republika ng Pilipinas ay isang mahahalagang kaganapan sa kasaysayan ng Pilipinas. Sa panahon ng kolonyalismo ng Espanya, ang mga Pilipino ay nagtagapagtanggol ng kanilang karapatan at kalayaan. Ang pagbubuo ng Republika ng Pilipinas ay isang tanda ng kanilang pagsisikap upang makuha ang kalayaan at independensiya mula sa mga kolonyalista.",
      "language": "filipino",
      "cultural_relevance": 0.9,
      "chunk_index": 2,
      "ground_truth_context": ". S., and Spain surrendering to the North Americans, erstwhile allies faced each other in an uneasy standoff. Seeking to nullify U. S. gains, Aguinaldo sought diplomatic recognition from for eign governments; it dispatched Felipé Agoncillo as its representative, first, to Washington, D. C., and then to Paris, where Spain and the United States met in October 1898 for a conference to for mally end the Spanish-American War, and to determine the conditions under which the victor would receive the spoils. Protesting that there was already in place a legitimate government, Agoncillo was ignored, and refused a place at the bargaining table. On December 10, 1898, the Treaty of Paris was for mally signed, setting out these terms: Spain would relinquish Cuba, Puerto Rico, the Philippines, and the Marianas (Guam). In return, the United States would in demnify Spain $20 million—or a little less than $3 per Filipino, the population of the archipelago then estimated at 7 million. The treaty also allowed the Spanish ten-year access to Philippine ports and goods for the purposes of trade. For the treaty to take effect, the United States Congress needed to ratify it, and its approval was by no means sure. A vote was scheduled for February 6, 1899. Spain agreed to hand over control of Las Islas Filipinas, as well as Guam and Puerto Rico, to the United States. The U. S. allowed Cuba its in dependence, but burdened it with the Platt Amendment, which provided that Cuba cede territory to the United States for use as military bases—Guantánamo, principally—and the right to in tervene in Cuba to preserve life, property, and liberty, essentially whenever Washington deemed such in tervention necessary. The amendment also barred Cuba from making a treaty with another nation, giving the U. S. effective control over its for eign affairs. Signed into law by President Mc Kinley in 1901, these provisions were in corporated into the Cuban Constitution, rendering the island nation a U. S. protectorate and guaranteeing U. S. imperial hegemony by in direct, rather than direct, means. (These provisions would later be repealed by the Cubans in 1934.) A Lull on the Battlefield Determined to assert control, in September of 1898 Aguinaldo had moved the provisional government to Malolos, Bulacan, a province bordering Manila to the north. There he convened a congress—the consultative body Mabini had proposed—at the hoary Barasoain Church. There trooped eight-five representatives (mostly men of property) from provinces controlled by the Aguinaldo government. They set about drafting a Constitution, though this was essentially entrusted to one delegate, Felipé Calderón. Drawing from the constitutions of several South American countries as well as that of the United States, Calderón wrote a draft that proposed a unicameral legislature, and made the National Assembly, essentially the legislature, the dominant branch of government. The rationale, with which most of the Congress agreed, was that the Spanish colonial regime had been marked by an overbearing and tyrannical chief executive, the Governor General. It was hoped that the elevation of the National Assembly as preeminent branch, to be made up of elected representatives, would avoid this pitfall. Mabini opposed the adoption of a constitution. To him, the Malolos Congress was an in terim body, its raison d’etre to act as a consultant and propose policies to Aguinaldo’s revolutionary government, especially with regard to possible war with the United States, whom Mabini had from the outset mistrusted. Once a permanent government had come into being, a true constitution could be drawn up. How the Congress would act was determined in part by class. Mabini came from a peasant background, while Calderón and most others of the Congress were of the elite ilustrado class. Pressed on which course to take, Aguinaldo, himself a property owner and member of the principalia, decided to abide by the wishes of the Congress, which overwhelmingly approved the Calderón-drafted Constitution. Most of its or iginal provisions were endorsed, except for one: an article that made Catholicism the of ficial religion of the state. In effect, this proposed article would retain what the Spanish had wrought—a devoutly Catholic state. This didn’t sit well with those in the Congress who harbored strong anti-clerical sentiments and many of whom certainly would have been Masons. After debates on the pros and cons of the provision, the Congress affirmed by only one vote the principle of separation of church and state. Written in Spanish, the document was adopted and the Philippine Republic in augurated on January 23, 1899. The Constitution acknowledged that sovereignty resided exclusively with the Filipino people. To Aguinaldo, the Malolos Constitution was “the most glorious expression of the noble aspirations of the Filipino people, a mirror of their culture, and a clear proof before the world of their capacity to govern the mselves.” Aside from the separation of church and state, its other notable provisions were setting up a system of free and compulsory education; a new fiscal and tax system; the foundation of a navy; a reorganized army; and the establishment of a diplomatic corps. Elected or not, the Malolos delegates were eager to show that they were capable of running the country with out outside help. By then, most of the Spanish for ces had sailed for Spain, except for a fifty- man garrison in the small town of Baler, in the province of Tayabas on the largely in accessible Pacific coast of northeastern Luzon. There for eleven months, from July 1, 1898 to June 2, 1899, the garrison held out in the town church—the only stone building in Baler—refusing to believe the revolution had succeeded, even when Spanish of ficials visited them. Finally, an article in a Madrid newspaper artfully left behind convinced the commanding of ficer of the truth, and the longest encounter between the Filipino for ces and the Spanish was over. The thirty survivors surrendered and were treated with respect by the Filipino troops. Back in Barcelona, the soldiers were given a hero’s welcome. (This event was the basis of a 1945 Spanish film, Los Ultimos de Filipinas, or The Last of the Philippines, a nostalgic valorization of patriotic duty and the defense of empire, very much in tune with the values of the Franco regime, already in place since 1939.) Being that Spanish colonial rule had spanned more than three centuries, there remained sizable communities of Spanish families who had lived not just in Manila and its environs but in port cities such as Cebu and Iloilo for generations, had in termarried with the natives, and considered Las Islas Filipinas their home, albeit now to be ruled by English speakers. Such businesses as they had set up— San Miguel Brewery and Tabacalera being two of the more enduring examples— continued to operate"
    },
    "model_answer": "Ang pagtatatag ng Unang Republika ng Pilipinas ay naganap bilang resulta ng Himagsikan ng 1896.  Pinangunahan ni Emilio Aguinaldo ang mga rebolusyonaryo at ilan sa mga pangyayari ay:\n\n* **Pagpapalabas ng Malolos Constitution noong Enero 21, 1899.** Ito ang bumalangkas sa pamahalaang demokratiko na ipinatutupad ng Unang Republika.  \n* **Ipatupad ang Malolos Constitution at pagsasalin ng kapangyarihan sa mga Pilipino.** Ang Malolos Constitution ay nagbigay ng kapangyarihan sa tatlong sangay ng gobyerno - lehislatura, ehekutibo at hudikatura - at ipinatutupad ang prinsipyo na ang soberanya ay nasa taumbayan.\n* **Pagsasalin ng kapangyarihan mula sa Pact of Biak-na-Bato government noong Hulyo 7, 1897.** Ang Pact of Biak-na-Bato ay isang kasunduan sa pagitan ng mga rebolusyonaryo at Espanyol na nagtatapos sa unang yugto ng himagsikan.\n\n* **Pinasinayaan ang Unang Republika ng Pilipinas dalawang araw matapos ipatupad ang Malolos Constitution.**  Sa Barasoain Church sa Malolos City, Bulacan, iniupo si General Emilio F. Aguinaldo bilang unang pangulo at nagbigay siya ng mga atas tulad ng pagpapatawad sa lahat ng bilanggo at pagkakaloob sa mga banyaga ng karapatang magnegosyo sa Pilipinas. \n\n[Sources: \"Ika 116 Anibersaryo Ng Araw Ng Repuplikang Filipino\", January 23, 2015. Retrieved from https://balita.net.ph/2015/01/23/ika-116-anibersaryo-ng-araw-ng-repuplikang-filipino-1899/; Unang Republika ng Pilipinas (Wikipedia, accessed October 28, 2021)]",
    "contexts": [
      "Idinaraos ng bansa ngayong Enero 23 ang ika-116 anibersaryo ng in agurasyon ng unang Republika ng Pilipinas o ang malolos Republic sa Barasoain Church sa malolos City, Bulacan, kung saan nanumpa sa tungkulin si General Emilio F. Aguinaldo bilang unang pangulo. Ang una niyang atas ay ang pagpapatawad sa lahat ng bilanggo at pagkakaloob sa mga banyaga ng karapatang magnegosyo sa Pilipinas. Pinasinayaan ng unang Republika ng Pilipinas dalawang araw matapos ipatupad ang malolos Constitution noong Enero 21, 1899",
      "Ang Unang Republikang Pilipino opisyal na tinawag na Repblica Filipina, ng mga Asyano. Ang pagtatatag ng Unang Republika ng Pilipinas ang naging pinakamahalagang pangyayari sa himagsikan ng mga Pilipino laban sa pamamahala ng mga na nagsilbing tagapayo ni Aguinaldo. Kasaysayan Mga naunang uri ng pamahalaan Maraming mga uri ng pamahalaan ang ginamit ng mga rebolusyonaryo. Itinatag ni Emilio Aguinaldo ang pamahalaan sa Biak-na-Bato noong Nobyembre na nagpatapon sa mga pinuno ng himagsikan sa",
      "Pinasinayaan ng unang Republika ng Pilipinas dalawang araw matapos ipatupad ang malolos Constitution noong Enero 21, 1899. Binalangkas sa unang asembliya ng Kongreso ng Pilipinas noong setyembre 15, 1898, pinalitan ng Konstitusyon ang Pact of Biak-na- Bato government noong Hulyo 7, 1897, at itinaguyod ang pamantayang demokratiko, binigyan ng kapangyarihan ang tatlong sangay ng gobyerno – ang lehislatura, ehekutibo, at hudikatura – at ang prinsipyo na ang soberanya ay nananahan sa taumbayan",
      "Philippines, and established the Republic of the Philippines on June 12, 1898, only to declare war on the United States when he was convinced that the promise of in dependence would not be fulfilled. After the capture of Aguinaldo on March 1901 and the establishment of a civil government in accordance with the Philippine Bill of 1902, the American occupation of the Philippines was for malized under the sometimes declared ambiguous trusteeship to prepare the Filipinos for self- government and the implied promise of political emancipation",
      "After debates on the pros and cons of the provision, the Congress affirmed by only one vote the principle of separation of church and state. Written in Spanish, the document was adopted and the Philippine Republic in augurated on January 23, 1899. The Constitution acknowledged that sovereignty resided exclusively with the Filipino people"
    ]
  },
  {
    "question": "Who were some of the notable ilustrado defections to the enemy during the Philippine-American War?",
    "ground_truth": "Cayetano Arellano, Trinidad H. Pardo de Tavera",
    "metadata": {
      "cultural_golden_answer": "These ilustrados, who had always been reformists rather than revolutionaries, defected because they believed that the United States would grant the reforms they sought from Spain. Their decision reflects the complex and often conflicted nature of Filipino elite politics during this period.",
      "language": "english",
      "cultural_relevance": 0.9,
      "chunk_index": 3,
      "ground_truth_context": ". There for eleven months, from July 1, 1898 to June 2, 1899, the garrison held out in the town church—the only stone building in Baler—refusing to believe the revolution had succeeded, even when Spanish of ficials visited them. Finally, an article in a Madrid newspaper artfully left behind convinced the commanding of ficer of the truth, and the longest encounter between the Filipino for ces and the Spanish was over. The thirty survivors surrendered and were treated with respect by the Filipino troops. Back in Barcelona, the soldiers were given a hero’s welcome. (This event was the basis of a 1945 Spanish film, Los Ultimos de Filipinas, or The Last of the Philippines, a nostalgic valorization of patriotic duty and the defense of empire, very much in tune with the values of the Franco regime, already in place since 1939.) Being that Spanish colonial rule had spanned more than three centuries, there remained sizable communities of Spanish families who had lived not just in Manila and its environs but in port cities such as Cebu and Iloilo for generations, had in termarried with the natives, and considered Las Islas Filipinas their home, albeit now to be ruled by English speakers. Such businesses as they had set up— San Miguel Brewery and Tabacalera being two of the more enduring examples— continued to operate. And of course those centuries guaranteed an imprint of Hispanicization and a mestizo culture that had evolved and proved to be in eradicable, especially when it came to matters of faith. The United States and Spain agreed that Filipinos would be given religious freedom as well as civil rights but conditioned on approval of the U. S. Congress. President Mc Kinley appointed a commission, to be headed by Cornell University president Jacob G. Schurman, to proceed to the newly acquired colony and in vestigate conditions there. By the time the Schurman Commission arrived in Manila in March of 1899, however, the anticipated war between the United States and a newly minted Republic of the Philippines had been going on for a month. A S PLENDID L ITTLE W AR T URNS U GLY: T HE 1899 P HILIPPINE -A MERICAN W AR The deliberations and decisions of the Malolos Congress were ignored by the U. S. Less than two weeks after the in auguration of the Philippine Republic, and two days before the U. S. Congress was to vote on ratifying the Treaty of Paris and the takeover of the Philippines, hostilities between the fledgling government and the United States erupted. On February 4, 1899, two American soldiers, Willy Grayson and Orville Miller of the Nebraska Volunteers, shot and killed two Filipino soldiers. Grayson later said the Filipinos disregarded his warnings to halt and identify the mselves when they apparently wandered too close to American lines. After the two in fantrymen had killed them, Grayson shouted to his comrades-in-arms, “Line up, fellas. The niggers are in here all through these yards!” With the war conveniently being blamed on the Filipino for ces, and public war fever being stoked once more, the Treaty of Paris was ratified by the Senate, but by only one vote. The 1899 Philippine-American War (described by the United States government as a mere “in surrection”) was fierce, bloody, and long- drawn out, of ficially ending in 1902 but in fact continuing for a decade more. It far surpassed in ferocity, cost, and duration the Spanish-American War, which lasted all of four months, though it is this war that is remembered while its more costly 1899 sequel is not. With the U. S. military moving beyond Manila to conquer and colonize the rest of the country, the Philippine revolutionary army resisted fiercely but, lacking the weaponry, was outgunned. Only half of the estimated 80,000 Filipino soldiers had rifles, with the other half relying on bolos (machetes), spears, and homemade guns. Unopposed, Dewey cruised the Pasig River, lobbing 500- pound shells into Filipino for tifications, with predictable and deadly results. In conventional combat, not surprisingly, the Filipinos suffered disproportionate losses. The next day, February 5, Aguinaldo issued a proclamation in which he stated: “I know that war has always produced great losses; I know that the Philippine people have not yet recovered from past losses and are not in the condition to endure others. But I also know by experience how bitter is slavery, and by experience I know that we should sacrifice all on the altar of our honor and of the national in tegrity so unjustly at tacked.” More disheartening to those committed to the revolution were the ilustrado defections to the enemy in May, at tracted by of fers from the Schurman Commission for positions in the government being cobbled to gether. Cayetano Arellano, for in stance, was appointed to the Supreme Court in Manila. Another noteworthy defection was that of Trinidad H. Pardo de Tavera, a member of the ilustrado expatriate community in Europe, who founded La Democracia, a decidedly pro-American paper. Later on, de Tavera, along with other wealthy ilustrados who had supported the revolution against Spain, helped establish the Federalista Party, which in itially sought only statehood but changed that to gradual in dependence when the or iginal stance failed to at tract any significant public following. Such defections were not altogether surprising, as the ilustrados as a whole had always been reformists rather than revolutionaries; the United States, it seemed to them, would grant the reforms they had long and vainly sought from Spain. In April of 1900, the second Philippine Commission arrived, headed by William H. Taft, to put into place the Schurman Commission recommendations. Taking on legislative powers, the Taft Commission for mally set up colonial rule. Taft—a massive six-footer who weighed 340 pounds—persuaded de Tavera, and two other ilustrados, José Luzuriaga and Benito Legarda, Sr., to sit on the Commission, a seductive signal to the landed elite that they could have a hand in ruling the colony. The next year, Taft was named by President Mc Kinley as the first governor general of the islands, along with several Americans to serve in his cabinet. All this went on even as the war raged outside the few pacified areas. Racism accentuated the cruel and brutal character of the U. S. war of conquest, marked by the use of to rture, the killing of prisoners, and genocidal tendencies. The Spanish colonizers had been booted out, but not in opposition to their beliefs or practices. The U. S. for ces were contemptuous of Filipinos and described them as “barbarians” and “savages,” reflecting the prejudices and xenophobia of the larger American society, one that routinely portrayed Chinese and Japanese immigrants as a “Yellow Peril.” The U. S. soldiers fashioned an epithet just for the Filipino: “Gugu”—from gago, the Tagalog word for “stupid”—which more than half a century later would morph into “gook” to accommodate the Koreans and the Vietnamese"
    },
    "model_answer": "Walang sapat na impormasyon sa mga dokumentong ito tungkol sa  notable ilustrado defections to the enemy during the Philippine-American War.",
    "contexts": []
  },
  {
    "question": "Ano ang pangalan ng komisyon na itinalaga ni Taft upang magpatupad ng mga rekomendasyon?",
    "ground_truth": "Taft Commission",
    "metadata": {
      "cultural_golden_answer": "Ang Taft Commission ay isang mahalagang yugto sa kasaysayan ng Pilipinas, kung saan ang mga ilustrado tulad nina de Tavera, Luzuriaga at Legarda ay pinili upang makibahagi sa pamumuno sa kolonya. Ito ay nagpapakita ng pakikibagay ng mga mamamayan ng Pilipinas sa mga Amerikanong namamahala.",
      "language": "filipino",
      "cultural_relevance": 0.9,
      "chunk_index": 4,
      "ground_truth_context": ". Taft, to put into place the Schurman Commission recommendations. Taking on legislative powers, the Taft Commission for mally set up colonial rule. Taft—a massive six-footer who weighed 340 pounds—persuaded de Tavera, and two other ilustrados, José Luzuriaga and Benito Legarda, Sr., to sit on the Commission, a seductive signal to the landed elite that they could have a hand in ruling the colony. The next year, Taft was named by President Mc Kinley as the first governor general of the islands, along with several Americans to serve in his cabinet. All this went on even as the war raged outside the few pacified areas. Racism accentuated the cruel and brutal character of the U. S. war of conquest, marked by the use of to rture, the killing of prisoners, and genocidal tendencies. The Spanish colonizers had been booted out, but not in opposition to their beliefs or practices. The U. S. for ces were contemptuous of Filipinos and described them as “barbarians” and “savages,” reflecting the prejudices and xenophobia of the larger American society, one that routinely portrayed Chinese and Japanese immigrants as a “Yellow Peril.” The U. S. soldiers fashioned an epithet just for the Filipino: “Gugu”—from gago, the Tagalog word for “stupid”—which more than half a century later would morph into “gook” to accommodate the Koreans and the Vietnamese. Soldiers on the march of ten sang these lyrics: Damn, damn the Filipino Pockmarked Khakiac ladrone [thief]! Underneath the starry flag Civilize him with a Krag And return us to our beloved home! Many of the U. S. of ficers were veterans of the genocidal campaigns against Native American nations, and in the Filipino enemy they discerned unmistakable likenesses. And so did Roosevelt: on the campaign trail for the vice-presidency of the United States, he likened the rebels to the Apaches and the Comanches. African-Americans serving in the U. S. expeditionary for ces were caught in a bind. On one hand, these Buffalo Soldiers—so-called for their bravery during U. S. wars against Native Americans—felt that they needed to show they were just as patriotic and courageous as the white soldiers. On the other hand, racial and social affinities between them and Filipinos were too obvious to be ignored, a fact brought home when white soldiers of ten called Filipinos “niggers.” Similar debates took place in African-American communities back in the United States. In Boston, black anti-imperialists adopted resolutions opposing the war. One such resolution declared: “Resolved, that while the rights of colored citizens in the South, sacredly guaranteed them by the amendment of the Constitution, are shamefully disregarded; and while the frequent lynching of Negroes who are denied a civilized trial are a reproach to the Republican government, the duty of the president and the country is to reform these crying domestic wrongs and not to at tempt the civilization of alien peoples by powder and shot.” Many black soldiers defected, the most celebrated (or in famous, depending on one’s perspective) being David Fagan. The twenty-four-year-old Fagan became an of ficer under the command of General José Alejandrino in Central Luzon. For two years, he proved to be a thorn in the side of his fellow Americans, so much so that his exploits became legendary, with an article in the New York Times characterizing him as a “cunning and highly skilled guerrilla of ficer who harassed and evaded large conventional American units.” The U. S. military of fered $600 for his capture, dead or alive. On December 5, 1901, a Tagalog hunter of fered U. S. of ficers the severed head of someone he claimed was Fagan. The identity was never confirmed, nor was there a record of reward money being paid. Fagan’s fate to this day remains shrouded in mystery. At a military disadvantage when confronting the U. S. military in open battle, the Philippine revolutionaries ceded ground, and Aguinaldo and his staff resorted to guerrilla warfare. The switch prompted the U. S. military to label this “uncivilized”—a charge refuted by Mabini, who pointed out that the Filipinos had no choice since they were poorly armed, that they had to continue to resist since their freedom was being threatened, and that “humiliating peace is to lerated only in uncivilized countries.” The war might have progressed differently if General Antonio Luna, Aguinaldo’s most capable field commander, had not been assassinated by Filipino soldiers in June of 1899. Luna was a wealthy ilustrado, and brother to the famous painter Juan Luna. Though Antonio had stayed on the sidelines in the 1898 revolution, shortly before the war broke out between the Philippines and the United States, he of fered his services to Aguinaldo and proved his mettle as a brave and savvy of ficer. He was soon heading Central Luzon military operations—the main the ater at this point in the war. However, Luna, notorious for his volatile temper and tart to ngue, in curred the wrath of several in fluential military of ficers. Even the normally unflappable Mabini complained of Luna’s mercurial disposition but knew that in this general he had an important ilustrado ally against accepting any compromise with the Americans, one who moreover declared impassionedly, whenever the occasion presented itself, his devotion to the goal of in dependence. Luna said that everywhere he went he asked the people if they wanted autonomy. According to him, their steadfast answer was: “Long live in dependence. May autonomy die!” On June 5, Luna—already falsely rumored to be contemplating a coup against the Supremo—rode to Cabanatuan, in the Central Luzon province of Nueva Ecija, in response to a note alleged to have been written by Aguinaldo in viting him to meet and discuss strategy. When Luna arrived, Aguinaldo was nowhere to be seen; Luna was stabbed and shot by soldiers from Aguinaldo’s hometown of Kawit—the same soldiers Luna had once vehemently upbraided for some breach of protocol and which censure still rankled. He was buried with full military honors, but his killers were never brought to justice. The War of Words In the meantime, the propaganda war was in full swing. The Schurman Commission stressed that the U. S. was on a mission civilatrice, to render the Filipinos “among the most civilized peoples of the world.” But setting aside its stated altruistic aims, U. S. in tentions to wards the Philippines were remarkably similar to Spain’s: to exploit the Philippines as a market and source of raw materials, and to utilize the islands as a steppingstone from which to gain access to the markets of China. The new imperialists were, however, not so unvarnished in their stated reasons for holding on to the Southeast Asian archipelago. They pictured the mselves as reluctant colonizers impelled more by a Christian sense of duty than the desire for material gain. Conquest may have been painful, but was essential were the country to move for ward"
    },
    "model_answer": "Walang sapat na impormasyon sa mga dokumentong ito tungkol sa komisyon na itinalaga ni Taft upang magpatupad ng mga rekomendasyon.",
    "contexts": []
  },
  {
    "question": "What was President McKinley's justification for the US colonization of the Philippines?",
    "ground_truth": "He justified it as a mission to 'uplift and civilize' the Filipinos, who were deemed unfit for self-governance.",
    "metadata": {
      "cultural_golden_answer": "In Filipino cultural context, this colonial mindset reflects a paternalistic approach to governance, which is rooted in the historical legacy of Spanish colonization. The idea that Filipinos needed to be 'uplifted and civilized' echoes the Spanish concept of the 'brown man,' who was seen as inferior but capable of being redeemed through Christianity. McKinley's justification highlights the tension between American claims of benevolence and their actual intentions to exploit the Philippines for economic gain.",
      "language": "english",
      "cultural_relevance": 0.9,
      "chunk_index": 5,
      "ground_truth_context": ". When Luna arrived, Aguinaldo was nowhere to be seen; Luna was stabbed and shot by soldiers from Aguinaldo’s hometown of Kawit—the same soldiers Luna had once vehemently upbraided for some breach of protocol and which censure still rankled. He was buried with full military honors, but his killers were never brought to justice. The War of Words In the meantime, the propaganda war was in full swing. The Schurman Commission stressed that the U. S. was on a mission civilatrice, to render the Filipinos “among the most civilized peoples of the world.” But setting aside its stated altruistic aims, U. S. in tentions to wards the Philippines were remarkably similar to Spain’s: to exploit the Philippines as a market and source of raw materials, and to utilize the islands as a steppingstone from which to gain access to the markets of China. The new imperialists were, however, not so unvarnished in their stated reasons for holding on to the Southeast Asian archipelago. They pictured the mselves as reluctant colonizers impelled more by a Christian sense of duty than the desire for material gain. Conquest may have been painful, but was essential were the country to move for ward. President Mc Kinley’s famous peroration to a group of Protestant clergymen puts it rather melodramatically: When I next realized that the Philippines had dropped into our laps I confess I did not know what to do with them…. I walked the floor of the White House night after night until midnight; and I’m not ashamed to tell you, gentlemen, that I went down on my knees and prayed the Almighty God for light and guidance more than one night. And one night late it came to me this way—I don’t know how it was, but it came: … that there was nothing left for us to do but to take them all, and to educate the Filipinos, and uplift and civilize and Christianize them, and by God’s grace do the very best we could by them, as our fellow-men for whom Christ also died. And then I went to bed, and went to sleep, and slept soundly, and the next morning I sent for the chief engineer of the War Department (our map maker), and I told him to put the Philippines on the map of the United States, and there they are, and there they will stay while I am president! Mc Kinley conveniently overlooked the fact that the islands had been Catholic for more than three hundred years. The need to “uplift and civilize” the Filipinos would be the theme in cessantly harped on every time U. S. imperialism was questioned. While self-serving, such justification was closely linked to the unshakeable belief in racial superiority that permeated the U. S. war effort—one that Rudyard Kipling endorsed. Kipling wrote his poem “White Man’s Burden” precisely to encourage the United States in its colonial endeavor (the poem’s subtitle is “The United States and the Philippines”): Take up the White Man’s Burden Send forth the best ye breed Go bind your sons to exile To serve your captives’ needs To wait in heavy harness On fluttered folk and wild Your new-caught sullen peoples Half-devil and half-child … As the Americans envisioned it, colonial rule would be tutelary in in tent and benign in execution. Washington, after all, sought only “to spread peace and happiness … freedom … and self-government.” At a speech in Boston, Senator Alfred Beveridge had declared that the United States was “a conquering race…. we must obey our blood and occupy new markets and, if necessary, new lands.” Once the Spanish were vanquished, and the prospect of war with the Aguinaldo regime seemed imminent, the same senator thundered in Indianapolis, in response to the rhetorical question of ruling a people with out their consent: “Would not the people of the Philippines prefer the just, humane, civilizing government of this Republic to the savage, bloody rule of pillage and extortion from which we have rescued them?” In May, two months after it began its in vestigations, with most of its in for mation derived from a small number of the conservative elite, in cluding for mer members of the Malolos Congress eager for rapprochement with the United States, the commission recommended the appointment of a governor general who, like his Spanish predecessors, would be the paramount ruler. There would be an advisory group and an in dependent judiciary. Most importantly, the commission not surprisingly ratified the view that Filipinos were unfit for self- government, that the country was simply a “collection of tribes,” and that the refore it was imperative for Americans to stay on and impart the lessons of democracy. Enough members of the Malolos Congress favored accepting the Schurman of fer, which would have rendered the islands an American protectorate. They requested Aguinaldo to dissolve the Mabini Cabinet and form a new one that could secure a peaceful arrangement with the American for ces and the government they had been setting up. Instead, Mabini proposed an armistice that General Otis rejected, believing that the “in surrection” would collapse easily. Mabini then issued a statement urging the people to continue the struggle. Mabini was eventually captured by the Americans in late December of 1899. Refusing to pledge allegiance to the United States, he was exiled to the Marianas. His fragile health worsening in the unfamiliar setting, he finally agreed to take the oath of allegiance to the United States in early 1903, and thus was allowed to return to the Philippines, where he died in May. Negotiations on autonomy broke down, and the war continued. In the meantime, the Aguinaldo government kept an eye out for political developments in the U. S. that might mean favorable concessions for the Philippines. The November presidential elections of 1900 between Mc Kinley and William Jennings Bryan were seen as an opportunity for the anti-imperialist for ces in the U. S. to win, but Bryan was defeated. The war was still going badly for the Filipinos, for cing Aguinaldo and his staff to keep moving north, to the mountainous terrain of the Cordilleras. By November 1899, he and his army focused on defensive tactics. The Supremo was nearly caught at the mountain pass of Tirad, in Ilocos Sur, but General Gregorio del Pilar, commander of Aguinaldo’s rear guard of sixty riflemen, delayed the 900 American troops at the cost of his own life, enabling Aguinaldo to escape. Dead at the age of twenty-four, his body left to lie on the rocky soil, stripped of most of his clothing and decorations by the victorious soldiers, del Pilar was the nephew of the Propagandist Marcelo H. del Pilar and the youngest general in Aguinaldo’s army, earning him the sobriquet of the Boy General. Aguinaldo and his men finally found refuge in the mountain stronghold of Palanan, Isabela Province, on the remote rocky northeastern coast of Luzon"
    },
    "model_answer": "President McKinley justified the US colonization of the Philippines by claiming that it was God's will for the U.S. to annex the islands after he prayed hard about it. He also argued that the U.S. had a mission to \"uplift and civilize\" the Filipinos, a justification rooted in the belief in racial superiority prevalent at the time. [Sources: Philippine History Source Book, p. 170; A History Of The Philippines, p. 123]",
    "contexts": [
      "The significance of this excerpt is that it gives an in sider’s view of how President Mc Kinley arrived at his decision to issue his famous “Benevolent Assimilation” Policy. Citing that it was God’s will that the US should annex the Philippine Islands after praying hard supported the idea that occupying the Philippine islands had a blessing from God and should be seen from the vantage point of the Christian zeal of missionary work by way of spreading the good news to the natives of the archipelago",
      "Mc Kinley conveniently overlooked the fact that the islands had been Catholic for more than three hundred years. The need to “uplift and civilize” the Filipinos would be the theme in cessantly harped on every time U. S. imperialism was questioned. While self-serving, such justification was closely linked to the unshakeable belief in racial superiority that permeated the U. S. war effort—one that Rudyard Kipling endorsed. Kipling wrote his poem “White Man’s Burden” precisely to encourage the United States",
      "After defeating Spain in 1898, America was uncertain as to what to do with the Philippines. The debate raged between the expansionists and the anti-imperialists as the Treaty of Paris was being signed in December 10, 1898. Leaning to ward the impenalist persuasion and imploring divineguidance, President Mc Kinleyexplained publicly his dilemma as to how to proceed with the Philippines: | didn’t want the Philippines, and when they came to us, as a gift from the gods, | did not know what to do with them..",
      "Address Adopted by the Anti-Imperialist League, February 10, 1899 22 In December 1898, US President William Mc Kinley first openly declared his decision to annex the Philippines in his Benevolent Assimilation Proclamation which was shortly followed by the ratification of the Treaty of Paris on February 6, 1898",
      "After a lengthy debate, the U. S congress ratified the treaty on February 6, 1899. Moreover, the U. S. wanted to \"win the confidence, respect, and affection of the in habitants of the Philippines by assuring them in every possible way that full measure of in dividual rights and liberties which is the heritage of free peoples, and by proving to them that the mission of the United States is one of benevolent assimilation substituting the mild sway of justice and right for arbitrary rule.\" From the proclamation itself, President Mc Kinley had denied the very concept of the declaration of war against Spain by"
    ]
  },
  {
    "question": "Sa pagitan ng 1899 at 1901, ano ang nangyari sa mga residente ng isang bayan sa Batangas, Laguna, Cavite, at Tayabas?",
    "ground_truth": "Pinasok sila sa concentration camps",
    "metadata": {
      "cultural_golden_answer": "Pinasok sila sa mga kampo ng koncentrasyon bilang bahagi ng pagsasarili ng mga Amerikano na matutuklasan ang mga rebolusyonaryong Filipino, na nagpapahiwatig ng pananaw ng Amerika hinggil sa lipunan ng Pilipinas.",
      "language": "filipino",
      "cultural_relevance": 0.9,
      "chunk_index": 6,
      "ground_truth_context": ". Negotiations on autonomy broke down, and the war continued. In the meantime, the Aguinaldo government kept an eye out for political developments in the U. S. that might mean favorable concessions for the Philippines. The November presidential elections of 1900 between Mc Kinley and William Jennings Bryan were seen as an opportunity for the anti-imperialist for ces in the U. S. to win, but Bryan was defeated. The war was still going badly for the Filipinos, for cing Aguinaldo and his staff to keep moving north, to the mountainous terrain of the Cordilleras. By November 1899, he and his army focused on defensive tactics. The Supremo was nearly caught at the mountain pass of Tirad, in Ilocos Sur, but General Gregorio del Pilar, commander of Aguinaldo’s rear guard of sixty riflemen, delayed the 900 American troops at the cost of his own life, enabling Aguinaldo to escape. Dead at the age of twenty-four, his body left to lie on the rocky soil, stripped of most of his clothing and decorations by the victorious soldiers, del Pilar was the nephew of the Propagandist Marcelo H. del Pilar and the youngest general in Aguinaldo’s army, earning him the sobriquet of the Boy General. Aguinaldo and his men finally found refuge in the mountain stronghold of Palanan, Isabela Province, on the remote rocky northeastern coast of Luzon. At the outset, General Elwood Otis assured Washington that the war would be over in a few weeks, especially after his for ces had taken Malolos, yet he kept requesting more troops as the weeks turned into months. Gaining ground was easy enough, but it didn’t take long for the U. S. command to realize they were in danger of stretching their for ces too thinly as they struck deeper into the countryside, where it proved harder to defend the mselves against guerrilla at tacks. Instead of set engagements, the Filipino guerrillas could choose the time and place for ambushes and didn’t require the logistical support the Yankee soldiers did, for the simple reason that the Filipinos could and did rely on the local population for their supplies as well as hide among them in plain sight. Too, the locals resisted providing in for mation that would have aided the in vaders. The Aguinaldo government had the support of the masses, overwhelmingly based outside the few urban areas and who, having borne the brunt of Spanish abuse, were not about to yield meekly to strangers who looked and behaved like their Spanish predecessors. T HE C ONDUCT OF THE W AR Early on, a General Shafter proved to be prescient regarding the way war had to be waged: “It may be necessary to kill half of the Filipinos in or der that the remaining half of the population may be advanced to a higher plane of life than their present semi-barbarous state affords.” The U. S. for ces grew in creasingly frustrated as they proved unable to in filtrate guerrilla networks and disrupt the workings of shadow governments. In to wns and villages, the Filipinos practiced what came to be derisively referred to by U. S. soldiers as “amigo warfare”— friend by day, foe by night. In areas that were considered “pacified”—under U. S. military control, and with a local government sympathetic or at least seemingly cooperative with the U. S.—the residents never outwardly resisted and of ten seemed to abet occupation but in reality constantly sought to undermine that same occupation, either by being actively in volved as guerrillas, or providing the guerrillas shelter and support, a majority of whom after all were friends and relatives. Such frustration on the part of the in vader, combined with a racist outlook on Filipinos—“half-devil, half-child”—provided the rationale for in discriminate warfare and to rture. In spite of press censorship, reports filtered back to the United States that detailed wartime at rocities, such as the burning of villages; the in discriminate killing of civilians; the execution of prisoners where a take-no-prisoner policy was in place; and the use of to rture. In an article for Harper’s Weekly, a correspondent by the name of John Bass described the in competence of Otis, the military tactics used as unsuitable to the tropical climate, and the obvious sympathy the locals had for the in surgents. He candidly observed that the “the sooner the people of the United States find out that the peoples of the Philippines do not wish to be governed by us, the better.” One major source of unfiltered in for mation were the letters soldiers wrote home to their families, recounting their horrific experiences. These graphic details would of ten land in the pages of hometown newspapers. From Anthony Michea, of the Third Artillery: “We bombarded a place called Malabon [a suburb of Manila], and then we went in and killed every native we met, men, women, and children.” And Charles R. Wyland, of Company C, Washington Volunteers, observed: “I have seen a shell from our artillery strike a bunch of Filipinos, and then they would go scattering through the air, legs, arms, heads, all disconnected. And such sights actually make our boys laugh and yell, ‘That shot was a peach.’” Two methods of dealing with amigo warfare were particularly harsh. The more sweeping one was the policy of hamletting, practiced by the Spanish in Cuba and known as reconcentrado, a technique that would be repeated during the Vietnam War more than half a century later. In early 1901, for example, the U. S. military herded the entire population of one island, Marinduque, into five concentration camps. But the most brutal example was perhaps the pacification of the provinces of Batangas, Laguna, Cavite, and Tayabas (now Quezon) as directed by Major General Franklin Bell, who had earlier in troduced the residents of the Ilocos region to the benefits of reconcentration. Bell was determined to hunt down the hold-out General Malvar, who commanded five thousand guerrillas and effectively controlled local governments. In early December 1901, Bell had the population for cibly evacuated into designated centers or to wns that were transformed into virtual prison camps. The Filipinos were or dered to move into specified zones and to bring whatever they could of their property. Anything left behind would be subject to confiscation or destruction. This meant that the outlying villages and their adjacent farm fields were abandoned, the idea being to deprive the guerrillas civilian cover while at the same time keeping a close watch on the quarantined villagers who the mselves could be rebels. Locals had to demonstrate that they were “active” friends, e. g., providing in for mation to Bell’s for ces as to the whereabouts of the guerrillas. Curfews were put in place and boundaries set up outside each camp, with a no-man’s land beyond that—one that was termed morbidly a “zone of death,” for anyone caught in it after curfew was likely to get shot, no questions asked"
    },
    "model_answer": "Walang sapat na impormasyon sa mga dokumentong ito tungkol sa nangyari sa mga residente ng isang bayan sa Batangas, Laguna, Cavite, at Tayabas  sa pagitan ng 1899 at 1901. [Source: History Of The Flipino People, p. 213]",
    "contexts": [
      "Laguna, Batangas, Bulakan, Nueva Ecija, Bataan, Tayabas (Quezon), and Camarines were up in arms and declared their loyalty to Aguinaldo. So sweeping were Filipino victories that practically the whole of Luzon, except the port cf Cavite and Manila, were in rebel hands by June 1898. Spanish Attempts to Win Over Filipinos.“-The effect of Aguinaldo’s return on the Spanish authorities was demoralizing"
    ]
  },
  {
    "question": "What was the approximate number of people who perished due to Major General Franklin Bell's reconcentration policy in the provinces of Batangas, Laguna, Cavite, and Tayabas?",
    "ground_truth": "It is estimated that at least 100,000 people perished due to Major General Franklin Bell's iron-fisted rule.",
    "metadata": {
      "cultural_golden_answer": "The massive loss of life due to Bell's iron-fisted rule is a poignant reminder of the devastating impact of colonialism on the Filipino people. The suffering and trauma inflicted upon them during this period had long-lasting effects on their communities and culture.",
      "language": "english",
      "cultural_relevance": 0.9,
      "chunk_index": 7,
      "ground_truth_context": ". But the most brutal example was perhaps the pacification of the provinces of Batangas, Laguna, Cavite, and Tayabas (now Quezon) as directed by Major General Franklin Bell, who had earlier in troduced the residents of the Ilocos region to the benefits of reconcentration. Bell was determined to hunt down the hold-out General Malvar, who commanded five thousand guerrillas and effectively controlled local governments. In early December 1901, Bell had the population for cibly evacuated into designated centers or to wns that were transformed into virtual prison camps. The Filipinos were or dered to move into specified zones and to bring whatever they could of their property. Anything left behind would be subject to confiscation or destruction. This meant that the outlying villages and their adjacent farm fields were abandoned, the idea being to deprive the guerrillas civilian cover while at the same time keeping a close watch on the quarantined villagers who the mselves could be rebels. Locals had to demonstrate that they were “active” friends, e. g., providing in for mation to Bell’s for ces as to the whereabouts of the guerrillas. Curfews were put in place and boundaries set up outside each camp, with a no-man’s land beyond that—one that was termed morbidly a “zone of death,” for anyone caught in it after curfew was likely to get shot, no questions asked. In this manner, the region was turned upside down and laid waste to, as abandoned villages were of ten put to the to rch—particularly if these were suspected of having harbored guerrillas—wells poisoned, and livestock either starved or killed. Ninety percent of the region’s carabaos, or water buffalos, perished, and rice production plummeted to just a fourth of its pre-reconcentrado levels. Unable to at tend to their fields, the huddled population suffered an in or dinate rate of death due to malnutrition and disease, such as dengue fever and malaria. In Batangas alone, 54,000 civilians died by the end of 1901. Overall, it is estimated that at least 100,000 people perished due to Bell’s iron- fisted rule. In April 1902, General Malvar surrendered to the U. S. for ces, his capitulation taken as a conclusive sign that the fighting was over, and that the remaining resisters were simply bandits and thieves, taking advantage of the war to practice their ancient trade under the guise of nationalism. On July 4, 1902, President Theodore Roosevelt declared the war, or “in surrection,” over. It wasn’t, of course. Enough revolutionary leaders continued the war of resistance, such as Generals Sakay, Ola, and Bulan. Similar tactics were exercised in the Visayan island of Samar. One town in particular provoked a scorched-earth policy from the commanding of ficer for the region, General Jacob Smith. Balangiga was a coastal town in the southern part of the island, where seventy-four U. S. troops were garrisoned. The troops routinely abused the to wnspeople, of ten for cing them into open-air holding pens even in rainy weather. This prompted clandestine plans for retaliation. On the morning of September 28, 1901, as the men were sitting down to breakfast, Filipino guerrillas, some of them disguised as women, burst into the mess hall and, armed mainly with bolos, at tacked. Both commanding of ficers were boloed to death, forty-six more were killed, and twenty-two seriously wounded. Only four escaped. Retaliation was swift and brutal. General Smith declared his in tention to turn the province into a “howling wilderness,” telling his men, “I want no prisoners. I wish you to kill and burn; the more you kill and burn, the more you will please me.” According to his in structions, anyone over ten was fair game. A food and trade blockade was in stituted, villages were burned, noncombatants were shot, and, as with General Bell’s policy, Filipinos had to actively show that they were friends; one surefire way of doing so was by turning in for mer. In 1902, General Smith was court-martialed and found guiltly. His punishment? An admonition and for ced retirement. * Just as brutal a retaliation visited on the in digenous population elsewhere was the 1906 massacre of 600 Moros—men, women, and children—at Bud Dajo, a dormant volcano on the island of Jolo off the southern coast of Mindanao. The in discriminate slaughter, presided over by General Leonard Wood, was a response to the killing of several U. S. soldiers a few days earlier. In Mindanao, in a six-month period, Moros had launched various assaults on American emplacements. Two hundred smaller engagements alone had also taken place in 1901. The war against the Moros was different since it had echoes of the religious Crusades against the Muslims in the Holy Land, whereas elsewhere in the archipelago the war was a secular affair, being against Filipinos who were the mselves fellow Christians, though the conduct of the war was decidedly un- Christian. One favored method of to rture, practiced on prisoners who were considered to be potential high-value in for mants, was the so-called “water-cure.” In this harsh method of in terrogation, the detainee was for ced to imbibe huge amounts of water, with soldiers pinioning his limbs, for cing open his mouth, and pouring water through a funnel. Sometimes water was for ced down a prisoner’s nostrils. Once the detainee was primed, he would be pummeled or kicked, the liquid being for cibly and painfully ejected. Though reluctant to give antiwar critics any ammunition, Governor Taft candidly stated before the U. S. Senate in 1902 that “there had been … in dividual in stances of water cure, that to rture that I believe in volves pouring water down the throat so that the man swells and gets the impression that he is going to be suffocated and then he tells what he knows.” Former Sergeant Leroy Hallock, who had witnessed the “cure” administered to at least a dozen in surgents, was more graphic: “They would swell up—their stomachs would swell up pretty large—and I have seen blood come from their mouth [sic] after they had been given a good deal of it.” This same Hallock testified to seeing one village of three to four thousand in habitants being to rched, and of knowing of at least half a dozen other such burnings. When the U. S. military was accused of perpetrating at rocities, a blanket denial was issued, or they were explained away by saying the harsh methods were justified on the grounds that these were necessary against a people who were less than human, and to whom the refore the common standards of humanity, or civilization, could not be applied. (It would be an argument repeated during the Korean and Vietnam wars.) In the case of General Smith, he was court-martialed and found guilty of in citing his troops to cruelties. He was punished with an admonition. An American congressman, who visited the Philippines and who preferred to remain anonymous, spoke frankly about the results of the pacification campaign"
    },
    "model_answer": "It is estimated that at least 100,000 people perished due to Major General Franklin Bell's reconcentration policy in the provinces of Batangas, Laguna, Cavite, and Tayabas. [Source: A History Of The Philippines, p. 127]",
    "contexts": [
      "In Batangas alone, 54,000 civilians died by the end of 1901. Overall, it is estimated that at least 100,000 people perished due to Bell’s iron- fisted rule. In April 1902, General Malvar surrendered to the U. S. for ces, his capitulation taken as a conclusive sign that the fighting was over, and that the remaining resisters were simply bandits and thieves, taking advantage of the war to practice their ancient trade under the guise of nationalism",
      "Ninety percent of the region’s carabaos, or water buffalos, perished, and rice production plummeted to just a fourth of its pre-reconcentrado levels. Unable to at tend to their fields, the huddled population suffered an in or dinate rate of death due to malnutrition and disease, such as dengue fever and malaria. In Batangas alone, 54,000 civilians died by the end of 1901. Overall, it is estimated that at least 100,000 people perished due to Bell’s iron- fisted rule"
    ]
  },
  {
    "question": "Ano ang sinabi ni General Sakay bago siya hinukay?",
    "ground_truth": "\"I want to tell you that we are not bandits and robbers, as the Americans have accused us, but members of the revolutionary force that defended our mother country the Philippines! Farewell! Long live the Republic and may our independence be born in the future! Farewell! Long live the Philippines!\"",
    "metadata": {
      "cultural_golden_answer": "Sa katunayan, maraming Filipino ay nakapagkampante kay Aguinaldo upang sumuko na rin sila. Pero maliban sa kanya, dalawa pang mga lider ng rebolusyon ay nanatiling aktibo pa rin: si General Macario Sakay at si Sultan Abdul Majid ng Sulu. Sila'y lumaban hanggang sa pagtatapos ng digmaan.",
      "language": "filipino",
      "cultural_relevance": 0.9,
      "chunk_index": 8,
      "ground_truth_context": ". When the U. S. military was accused of perpetrating at rocities, a blanket denial was issued, or they were explained away by saying the harsh methods were justified on the grounds that these were necessary against a people who were less than human, and to whom the refore the common standards of humanity, or civilization, could not be applied. (It would be an argument repeated during the Korean and Vietnam wars.) In the case of General Smith, he was court-martialed and found guilty of in citing his troops to cruelties. He was punished with an admonition. An American congressman, who visited the Philippines and who preferred to remain anonymous, spoke frankly about the results of the pacification campaign. “You never hear of any disturbances in Northern Luzon, because there isn’t anybody there to rebel…. Our soldiers took no prisoners, they kept no records; they simply swept the country and wherever and whenever they could get hold of a Filipino they killed.” General Elwood Otis proved to be in ept and was replaced by General Arthur Mc Arthur, who took over in May of 1900 and served until July 1, 1901. Mac Arthur was a veteran of the wars against Native Americans. Though he endorsed imperialist goals, he was a realist who knew that the Filipinos had no love for the Americans. He once said that it would take “ten years of bayonet treatment” to pacify the country. He realized that successful guerrilla warfare “depends upon almost complete unity of action of the entire native population. That such unity is a fact is too obvious to admit of discussion; how it is brought about and maintained is not so plain. Intimidation has undoubtedly accomplished much to this end; but fear as the only motive is hardly sufficient to account for the united and apparently spontaneous action of several millions of people.” The war could have dragged on longer but luck helped shorten it when a certain Cecilio Segismundo, a courier from Aguinaldo, was captured by U. S. for ces. Segismundo was carrying dispatches to commanders in the field, one of which asked for more men for Aguinaldo’s mountain hideout. Under in terrogation Segismundo revealed the whereabouts of the revolutionary leader. A plan was for mulated to gain entry to his Palanan redoubt with out arousing suspicion. Five U. S. soldiers, headed by General Frederick Funston, would pretend to be prisoners of the Macabebes, mercenaries from Pampanga Province, disguised as Filipino troop reinforcements. Accompanying them were some Tagalog turncoats and a Spanish secret service agent, Lazaro Segovia. Forged documents purporting to be from one of Aguinaldo’s generals completed their disguise. Departing Manila by boat on February 6, they were brought to the desolate Pacific coast of northeastern Luzon and the nce trekked through rainforests and mountain passes until on March 23, 1901, they gained entry into the camp. Brought before the unsuspecting Aguinaldo, Funston and his men were able to capture the Supremo and his staff. Barely a week after, on April 1,1901, Aguinaldo pledged allegiance at Malacañang, where he had been detained, to the United States. Mac Arthur resigned that same day, with Major General Adna Romanza Chaffee, also a veteran of the wars against Native Americans, taking over. On April 19, Aguinaldo issued a proclamation for peace, which said in part: “The Philippines decidedly wishes peace: be it so. Let the stream of blood cease to flow; let there be an end to tears and desolation…. I proclaim before all the world that I cannot remain deaf to the voice of a people yearning for peace nor to the lamentations of thousands of families who long for freedom of their loved ones, which is promised them through the magnanimity of the great American nation.” Although the head of the Philippine Republic did desire a free and in dependent country, he had in itially been too trustful of the United States, and ignored signs until it was too late that the North Americans in tended to stay. In the end, like most of the ilustrados, Aguinaldo sought compromise even as he and his men bore arms. Despite Aguinaldo’s pronouncement, the war of resistance continued. As a counterinsurgency tactic, the reconcentrado method was used mercilessly. In southern Luzon, Bell’s reconcentrado bore fruit: a weakened General Malvar, along with his men, surrendered in April of 1902. With Aguinaldo quiescent and Malvar captured, President Theodore Roosevelt declared the war over on July 4, 1902. Henceforth, revolutionary fighters would be classified as bandits and thieves. On June 1, 1902, the Philippine Commission passed the Reconcentration Camp Act, rendering of ficial what the military had been utilizing in the field. The Act authorized any provincial governor to reconcentrate in the to wns all residents of outlying barrios if “ladrones” or “outlaws” operated in these areas, the reby hoping to dry the rivers in which the guerrilla fish swam. Another prize catch for the U. S. for ces was General Macario Sakay. Sakay grew up in Tondo, where he had gotten to know Bonifacio. Joining the Katipunan in 1894, Sakay acted in popular Tagalog verse dramas, which were staged in different neighborhoods in Manila, thus providing the perfect cover for the young Katipunero to move about. Countering U. S. efforts to brand Filipino fighters as brigands, General Sakay, based in the mountains of the southern Tagalog region, declared himself president of the Philippines in 1903 and decreed that “anybody who contributes or gives aid and comfort to the government of the United States of America will be considered a traitor to this native land.” Continuing operations by U. S. troops for ced him to move and eventually he agreed to yield. Through an in termediary, Sakay’s conditions for his surrender—among them, general amnesty and permission to carry firearms—were accepted by the authorities. He and his followers came down from the mountains to Cavite on July 20, 1906—four years after the war was of ficially declared over—where they were in vited to a banquet at the governor’s residence. There, he and his followers were seized and disarmed, accused of crimes under the Brigandage Act and quickly brought to trial. Not surprisingly, he was found guilty, and he and an aide, Colonel Lucio de Vega, were in carcerated at Bilibid Prison in Manila, and hanged on Sept. 13, 1907. Before his death, the revolutionary general declared to the small crowd of witnesses (mostly prison guards and employees), “I want to tell you that we are not bandits and robbers, as the Americans have accused us, but members of the revolutionary force that defended our mother country the Philippines! Farewell! Long live the Republic and may our in dependence be born in the future! Farewell! Long live the Philippines!” In the Visayas, a notable case was that of the self-proclaimed Pope of Negros Island, who was a thorn in the side of the U. S. military"
    },
    "model_answer": "Walang sapat na impormasyon sa mga dokumentong ito tungkol sa sinabi ni General Sakay bago siya hinukay.",
    "contexts": []
  },
  {
    "question": "What was the outcome of Sakay's surrender to the authorities?",
    "ground_truth": "He and his followers were seized and disarmed, accused of crimes under the Brigandage Act and quickly brought to trial.",
    "metadata": {
      "cultural_golden_answer": "Sakay's surrender marked a pivotal moment in the Philippine-American War, highlighting the complexities of dealing with Filipino rebels who had been fighting for independence. Despite their initial agreement to yield, Sakay and his followers were ultimately charged and convicted under the Brigandage Act, underscoring the challenges faced by Filipinos in navigating the country's transition from Spanish to American rule.",
      "language": "english",
      "cultural_relevance": 0.9,
      "chunk_index": 9,
      "ground_truth_context": ". S. troops for ced him to move and eventually he agreed to yield. Through an in termediary, Sakay’s conditions for his surrender—among them, general amnesty and permission to carry firearms—were accepted by the authorities. He and his followers came down from the mountains to Cavite on July 20, 1906—four years after the war was of ficially declared over—where they were in vited to a banquet at the governor’s residence. There, he and his followers were seized and disarmed, accused of crimes under the Brigandage Act and quickly brought to trial. Not surprisingly, he was found guilty, and he and an aide, Colonel Lucio de Vega, were in carcerated at Bilibid Prison in Manila, and hanged on Sept. 13, 1907. Before his death, the revolutionary general declared to the small crowd of witnesses (mostly prison guards and employees), “I want to tell you that we are not bandits and robbers, as the Americans have accused us, but members of the revolutionary force that defended our mother country the Philippines! Farewell! Long live the Republic and may our in dependence be born in the future! Farewell! Long live the Philippines!” In the Visayas, a notable case was that of the self-proclaimed Pope of Negros Island, who was a thorn in the side of the U. S. military. Papa Isio, as he was called, was a charismatic peasant who led a band of remontados, the Pulajanes (the Scarlet Ones), and had joined for ces with the local elite in opposing the Spanish in the 1898 Revolution. Once war erupted between the Aguinaldo government and the United States, however, the local principalia signaled the U. S. that the island would gladly be a protectorate—a deal that Papa Isio and his followers rejected. The Pulajanes resisted both U. S. occupation and landlord collaboration, burning the haciendas of pro-American hacenderos. Motivated by economic desperation, the ragtag army fought U. S. troops bravely but in 1907, Isio, realizing the futility of armed struggle, gave himself up and was duly sentenced to death. The religious trappings of Papa Isio and his Pulajanes reflected a desire lodged deep in the psyche of the people, for a more active role in determining both the spiritual and material for ces that would guide their lives. Hence, his refusal to go along with the principalia leadership. This discordance between a populist stance and an elitist accommodation in fact marked both the revolution against Spain and the war with the Americans, albeit episodically, e. g., Bonifacio versus Aguinaldo, Mabini versus the Malolos Congress. Even if in directly, both strains sprung from the 1872 martyrdom of Gomez, Burgos and Zamora and the drive to Filipinize Catholic parishes—an aim that had acted as a spur to revolution. Not surprisingly, native priests sympathized with the revolution, even though the mostly Spanish Church had condemned it. The Emergence of an Independent Church Filipino priests had no quarrel with Catholicism itself. How could they, when they were believers in a country that, after more than three centuries, was solidly Catholic. Their quarrel was with the racialization of their ranks; a schism was in evitable. A secular priest from the Ilocos region, Fr. Gregorio Aglipay, thirty- eight years old and the only man of the cloth at the Malolos Congress, served as Military Vicar for Aguinaldo’s for ces. He supported the goals of the revolution and asked Filipino priests to do the same. He reasoned that with colonial ties to Spain severed, the patronato real was no longer in effect. It was time for Filipino priests to take control of the church in the country. Aglipay’s archbishop, Bernardino Nozaleda—clearly acting more as a loyal Spaniard than a Catholic priest—excommunicated him in January of 1899 even though Aglipay had made clear his in tent to remain loyal to the Vatican. On October 23, 1899, Aglipay, with the implicit endorsement of Mabini, who wished to see the establishment of a Filipinized church, still heeding the Vatican but working closely with, rather than against, the Philippine government, or ganized an ecclesiastical assembly in the province of Tarlac, in Central Luzon. The result was a provisional constitution for a nationalist Catholic church wherein for eign bishops could work in the island only with the approval of Filipino priests—clearly aimed at the Spanish ecclesiastical authorities used to calling the shots in the colony. Subsequent events, especially the war with the United States (in which Aglipay fought as a general) led to the founding of the Iglesia Filipina Independiente (the Philippine Independent Church) in 1902, with Aglipay as its supreme head. Almost two decades later, the church counted a million and a half members, known as Aglipayans. Instrumental in the for mation of the new church was Isabelo de los Reyes, who was from Vigan in the Ilocos region. A distant relative of Rizal, de los Reyes was an activist who had been jailed by both the Spanish and the United States colonial administrations. At the age of twenty-four, by then a practicing journalist, in 1889 he published El Ilocano, the first such publication devoted entirely to a Philippine language other than Tagalog. He went on to become a distinguished folklorist who envisioned a nation that encompassed both the un- Hispanicized in digenous and Christianized groups—a nation that transcended ethnicity. Married thrice, the man was as in defatigable in his campaign for in dependence as he was in siring of fspring: he had twenty-eight children. The same year that the PIC was for med he or ganized the Union Obrera Democratica (UOD), the first labor union in the Philippines. The newly established church embodied one of the revolution’s goals: the displacement of the friar or ders by Filipino clergy. However, the PIC came into conflict with the U. S. regime over abandoned Roman Catholic churches it had taken over. The authorities sided with the Catholic Church by confirming its ownership of the churches. The separate question of what to do with the friars’ huge landed estates—approximately 400,000 acres—was resolved when the Philippine Commission in 1903 was authorized to purchase these. However, in stead of selling the lands to those who most needed them and thus helping to solve the land-reform problem, the commission, headed by Taft, allowed wealthy elite families and a few corporations to purchase these choice estates. Thus, for in stance, the Spanish-owned Tabacalera company managed to expand its holdings to more than 30,000 acres by 1913. T HE W AR E NDS, THE W AR C ONTINUES For the fledgling nation, the war was tragic, putting on hold national in dependence. On the Philippine side, the savage conflict left at least 20,000 combatants and at least 250,000—but possibly as many as a million— noncombatants dead from war or war-related causes. By the war’s end, more than 4,000 U. S. soldiers had been killed, and 3,000 wounded. A to tal of approximately 130,000 U. S"
    },
    "model_answer": "Sakay agreed to surrender to the authorities under certain conditions, including general amnesty and permission to carry firearms.  He and his followers came down from the mountains in Cavite on July 20, 1906, where they were invited to a banquet at the governor’s residence. [Source: A History Of The Philippines, p. 131]",
    "contexts": [
      "S. troops for ced him to move and eventually he agreed to yield. Through an in termediary, Sakay’s conditions for his surrender—among them, general amnesty and permission to carry firearms—were accepted by the authorities. He and his followers came down from the mountains to Cavite on July 20, 1906—four years after the war was of ficially declared over—where they were in vited to a banquet at the governor’s residence",
      "Sakay, who at tempted to put up his own Tagalog Republic with its own constitution, kept alive the struggle for in dependence even after he saw the lost cause of the Aguinaldo war against imperialism. Sakay was eventually persuaded by Dominador Gomez to yield but the masses who had looked up to him for the continuing resistance did not follow suit. 1. In Luzon, 1905 Resistance was reported by the American authorities con¬ fidentially and publicly in the strategic areas of Luzon, Visayas, and Mindanao"
    ]
  },
  {
    "question": "Ano ang nangyari sa mga lupain na iniluwas ng mga frayres (mga katutubong lingkod ng Simbahan) pagkatapos ng Digmaan ng Pilipinas at Estados Unidos?",
    "ground_truth": "Ibinibili ang mga lupain na ito sa mga mayayaman na pamilya at korporasyon.",
    "metadata": {
      "cultural_golden_answer": "Ang nangyari dito ay nagbigay-diin sa katotohanan kung gaano kahalaga ang pagkilos ng pamahalaan ng Estados Unidos upang palawakin ang impluwensiya ng kanilang mga kapitalista at kompanya sa Pilipinas, isang katibayan ng mabagal na pagsasamantatang pambansa sa bansa.",
      "language": "filipino",
      "cultural_relevance": 0.9,
      "chunk_index": 10,
